aiter/configs/a8w8_blockscale_tuned_gemm.csv
gfx,cu_num,M,N,K,libtype,kernelId,splitK,us,kernelName,tflops,bw,errRatio
gfx1201,48,1,4096,4096,ck,7,0,41.3272,a8w8_blockscale_1x128x128_256x16x128x256_16x16_16x16_1x2_16x16x1_16x16x1_1x16x1x16_8_1x2_intrawave_v1,0.81,406.26,0.0
gfx1201,48,16,1536,4096,ck,7,0,22.2258,a8w8_blockscale_1x128x128_256x16x128x256_16x16_16x16_1x2_16x16x1_16x16x1_1x16x1x16_8_1x2_intrawave_v1,9.06,288.23,0.0
gfx1201,48,16,16384,1024,ck,7,0,53.1412,a8w8_blockscale_1x128x128_256x16x128x256_16x16_16x16_1x2_16x16x1_16x16x1_1x16x1x16_8_1x2_intrawave_v1,10.1,325.88,0.0
gfx1201,48,16,2048,4096,ck,7,0,25.1369,a8w8_blockscale_1x128x128_256x16x128x256_16x16_16x16_1x2_16x16x1_16x16x1_1x16x1x16_8_1x2_intrawave_v1,10.68,338.93,0.0
gfx1201,48,16,4096,1024,ck,5,0,7.7058,a8w8_blockscale_1x128x128_256x16x128x128_8x16_16x16_1x2_16x16x1_8x32x1_1x16x1x16_8_1x2_intrawave_v1,17.42,563.44,0.0
gfx1201,48,16,4096,4096,ck,5,0,47.8926,a8w8_blockscale_1x128x128_256x16x128x128_8x16_16x16_1x2_16x16x1_8x32x1_1x16x1x16_8_1x2_intrawave_v1,11.21,354.41,0.0
gfx1201,48,4096,4096,4096,ck,4,0,1876.9005,a8w8_blockscale_1x128x128_256x16x256x128_8x16_16x16_1x4_16x16x1_8x32x1_1x16x1x16_8_1x2_intrawave_v1,73.23,35.76,0.0
gfx1201,48,512,4096,4096,ck,4,0,259.767,a8w8_blockscale_1x128x128_256x16x256x128_8x16_16x16_1x4_16x16x1_8x32x1_1x16x1x16_8_1x2_intrawave_v1,66.14,88.81,0.0
gfx1201,48,64,1536,4096,ck,5,0,27.3724,a8w8_blockscale_1x128x128_256x16x128x128_8x16_16x16_1x2_16x16x1_8x32x1_1x16x1x16_8_1x2_intrawave_v1,29.42,246.61,0.0
gfx1201,48,64,16384,1024,ck,4,0,64.4703,a8w8_blockscale_1x128x128_256x16x256x128_8x16_16x16_1x4_16x16x1_8x32x1_1x16x1x16_8_1x2_intrawave_v1,33.31,293.78,0.0
gfx1201,48,64,2048,4096,ck,5,0,30.6434,a8w8_blockscale_1x128x128_256x16x128x128_8x16_16x16_1x2_16x16x1_8x32x1_1x16x1x16_8_1x2_intrawave_v1,35.04,290.86,0.0
gfx1201,48,64,4096,1024,ck,5,0,15.6923,a8w8_blockscale_1x128x128_256x16x128x128_8x16_16x16_1x2_16x16x1_8x32x1_1x16x1x16_8_1x2_intrawave_v1,34.21,304.87,0.0
gfx1201,48,64,4096,4096,ck,4,0,58.426,a8w8_blockscale_1x128x128_256x16x256x128_8x16_16x16_1x4_16x16x1_8x32x1_1x16x1x16_8_1x2_intrawave_v1,36.76,300.61,0.0
gfx1201,48,8192,16384,1024,ck,4,0,4641.1589,a8w8_blockscale_1x128x128_256x16x256x128_8x16_16x16_1x4_16x16x1_8x32x1_1x16x1x16_8_1x2_intrawave_v1,59.23,63.26,0.0
gfx1201,48,8192,2048,4096,ck,4,0,1828.3064,a8w8_blockscale_1x128x128_256x16x256x128_8x16_16x16_1x4_16x16x1_8x32x1_1x16x1x16_8_1x2_intrawave_v1,75.17,41.29,0.0
gfx1201,48,8192,4096,1024,ck,4,0,1162.1324,a8w8_blockscale_1x128x128_256x16x256x128_8x16_16x16_1x4_16x16x1_8x32x1_1x16x1x16_8_1x2_intrawave_v1,59.13,68.57,0.0
gfx1201,48,8192,4096,4096,ck,4,0,3663.3979,a8w8_blockscale_1x128x128_256x16x256x128_8x16_16x16_1x4_16x16x1_8x32x1_1x16x1x16_8_1x2_intrawave_v1,75.03,32.06,0.0
gfx950,256,1,2048,3072,ck,8,2,4.8294,a8w8_blockscale_1x128x128_256x16x64x256_16x16_16x16_1x1_16x16x1_16x16x1_1x16x1x16_4_1x1_intrawave_v1,2.61,1304.22,0.0
gfx950,256,1,3072,3072,ck,8,2,5.2904,a8w8_blockscale_1x128x128_256x16x64x256_16x16_16x16_1x1_16x16x1_16x16x1_1x16x1x16_4_1x1_intrawave_v1,3.57,1785.57,0.0
gfx950,256,1,3072,6144,ck,7,3,6.5486,a8w8_blockscale_1x128x128_256x16x128x256_16x16_16x16_1x2_16x16x1_16x16x1_1x16x1x16_8_1x2_intrawave_v1,5.76,2884.08,0.0007
gfx950,256,1,4096,3072,ck,13,2,8.1447,a8w8_blockscale_1x128x128_256x32x64x256_16x16_16x16_2x1_16x16x1_16x16x1_1x32x1x8_8_2x1_intrawave_v1,3.09,1546.3,0.0
gfx950,256,1,8192,3072,ck,7,2,7.5211,a8w8_blockscale_1x128x128_256x16x128x256_16x16_16x16_1x2_16x16x1_16x16x1_1x16x1x16_8_1x2_intrawave_v1,6.69,3348.62,0.0
gfx950,256,1000,2048,3072,ck,18,0,17.9979,a8w8_blockscale_1x128x128_256x64x64x256_16x16_32x32_1x1_16x16x1_16x16x1_1x32x1x8_8_1x1_intrawave_v1,699.13,747.83,0.0
gfx950,256,1000,3072,3072,ck,18,0,24.1966,a8w8_blockscale_1x128x128_256x64x64x256_16x16_32x32_1x1_16x16x1_16x16x1_1x32x1x8_8_1x1_intrawave_v1,780.04,770.9,0.0
gfx950,256,1000,3072,6144,ck,18,0,44.5727,a8w8_blockscale_1x128x128_256x64x64x256_16x16_32x32_1x1_16x16x1_16x16x1_1x32x1x8_8_1x1_intrawave_v1,846.9,699.14,0.0
gfx950,256,1000,4096,3072,ck,0,0,27.5534,a8w8_blockscale_1x128x128_256x128x128x128_16x16_32x32_2x2_8x32x1_8x32x1_1x32x1x8_8_1x1_intrawave_v3,913.35,865.48,0.0
gfx950,256,1000,8192,3072,ck,0,0,45.9347,a8w8_blockscale_1x128x128_256x128x128x128_16x16_32x32_2x2_8x32x1_8x32x1_1x32x1x8_8_1x1_intrawave_v3,1095.72,971.42,0.0
gfx950,256,10000,2048,3072,ck,0,0,104.9276,a8w8_blockscale_1x128x128_256x128x128x128_16x16_32x32_2x2_8x32x1_8x32x1_1x32x1x8_8_1x1_intrawave_v3,1199.2,743.1,0.0
gfx950,256,10000,3072,3072,ck,0,0,150.5725,a8w8_blockscale_1x128x128_256x128x128x128_16x16_32x32_2x2_8x32x1_8x32x1_1x32x1x8_8_1x1_intrawave_v3,1253.51,674.74,0.0
gfx950,256,10000,3072,6144,ck,0,0,279.1227,a8w8_blockscale_1x128x128_256x128x128x128_16x16_32x32_2x2_8x32x1_8x32x1_1x32x1x8_8_1x1_intrawave_v3,1352.41,507.86,0.0
gfx950,256,10000,4096,3072,ck,0,0,194.2372,a8w8_blockscale_1x128x128_256x128x128x128_16x16_32x32_2x2_8x32x1_8x32x1_1x32x1x8_8_1x1_intrawave_v3,1295.62,644.69,0.0
gfx950,256,10000,8192,3072,ck,0,0,357.4797,a8w8_blockscale_1x128x128_256x128x128x128_16x16_32x32_2x2_8x32x1_8x32x1_1x32x1x8_8_1x1_intrawave_v3,1407.96,614.65,0.0
gfx950,256,10001,2048,3072,ck,0,0,105.9487,a8w8_blockscale_1x128x128_256x128x128x128_16x16_32x32_2x2_8x32x1_8x32x1_1x32x1x8_8_1x1_intrawave_v3,1187.76,736.0,0.0
gfx950,256,10001,3072,3072,ck,0,0,153.9201,a8w8_blockscale_1x128x128_256x128x128x128_16x16_32x32_2x2_8x32x1_8x32x1_1x32x1x8_8_1x1_intrawave_v3,1226.37,660.12,0.0
gfx950,256,10001,3072,6144,ck,0,0,278.6637,a8w8_blockscale_1x128x128_256x128x128x128_16x16_32x32_2x2_8x32x1_8x32x1_1x32x1x8_8_1x1_intrawave_v3,1354.77,508.74,0.0
gfx950,256,10001,4096,3072,ck,0,0,192.9992,a8w8_blockscale_1x128x128_256x128x128x128_16x16_32x32_2x2_8x32x1_8x32x1_1x32x1x8_8_1x1_intrawave_v3,1304.06,648.88,0.0
gfx950,256,10001,8192,3072,ck,0,0,361.7173,a8w8_blockscale_1x128x128_256x128x128x128_16x16_32x32_2x2_8x32x1_8x32x1_1x32x1x8_8_1x1_intrawave_v3,1391.6,607.51,0.0
gfx950,256,10002,2048,3072,ck,0,0,105.825,a8w8_blockscale_1x128x128_256x128x128x128_16x16_32x32_2x2_8x32x1_8x32x1_1x32x1x8_8_1x1_intrawave_v3,1189.27,736.93,0.0
gfx950,256,10002,3072,3072,ck,0,0,152.5103,a8w8_blockscale_1x128x128_256x128x128x128_16x16_32x32_2x2_8x32x1_8x32x1_1x32x1x8_8_1x1_intrawave_v3,1237.83,666.29,0.0
gfx950,256,10002,3072,6144,ck,0,0,280.0595,a8w8_blockscale_1x128x128_256x128x128x128_16x16_32x32_2x2_8x32x1_8x32x1_1x32x1x8_8_1x1_intrawave_v3,1348.15,506.25,0.0
gfx950,256,10002,4096,3072,ck,0,0,192.4011,a8w8_blockscale_1x128x128_256x128x128x128_16x16_32x32_2x2_8x32x1_8x32x1_1x32x1x8_8_1x1_intrawave_v3,1308.25,650.96,0.0
gfx950,256,10002,8192,3072,ck,0,0,361.5884,a8w8_blockscale_1x128x128_256x128x128x128_16x16_32x32_2x2_8x32x1_8x32x1_1x32x1x8_8_1x1_intrawave_v3,1392.24,607.78,0.0
gfx950,256,10003,2048,3072,ck,0,0,106.3102,a8w8_blockscale_1x128x128_256x128x128x128_16x16_32x32_2x2_8x32x1_8x32x1_1x32x1x8_8_1x1_intrawave_v3,1183.96,733.64,0.0
gfx950,256,10003,3072,3072,ck,0,0,154.29,a8w8_blockscale_1x128x128_256x128x128x128_16x16_32x32_2x2_8x32x1_8x32x1_1x32x1x8_8_1x1_intrawave_v3,1223.67,658.66,0.0
gfx950,256,10003,3072,6144,ck,0,0,284.3124,a8w8_blockscale_1x128x128_256x128x128x128_16x16_32x32_2x2_8x32x1_8x32x1_1x32x1x8_8_1x1_intrawave_v3,1328.12,498.72,0.0
gfx950,256,10003,4096,3072,ck,0,0,193.3119,a8w8_blockscale_1x128x128_256x128x128x128_16x16_32x32_2x2_8x32x1_8x32x1_1x32x1x8_8_1x1_intrawave_v3,1302.22,647.95,0.0
gfx950,256,10003,8192,3072,ck,0,0,352.954,a8w8_blockscale_1x128x128_256x128x128x128_16x16_32x32_2x2_8x32x1_8x32x1_1x32x1x8_8_1x1_intrawave_v3,1426.44,622.7,0.0
gfx950,256,10004,3072,3072,ck,0,0,151.6889,a8w8_blockscale_1x128x128_256x128x128x128_16x16_32x32_2x2_8x32x1_8x32x1_1x32x1x8_8_1x1_intrawave_v3,1244.78,670.02,0.0
gfx950,256,10004,4096,3072,ck,0,0,191.0482,a8w8_blockscale_1x128x128_256x128x128x128_16x16_32x32_2x2_8x32x1_8x32x1_1x32x1x8_8_1x1_intrawave_v3,1317.78,655.69,0.0
gfx950,256,10005,2048,3072,ck,0,0,106.064,a8w8_blockscale_1x128x128_256x128x128x128_16x16_32x32_2x2_8x32x1_8x32x1_1x32x1x8_8_1x1_intrawave_v3,1186.94,735.47,0.0
gfx950,256,10006,2048,3072,ck,0,0,104.255,a8w8_blockscale_1x128x128_256x128x128x128_16x16_32x32_2x2_8x32x1_8x32x1_1x32x1x8_8_1x1_intrawave_v3,1207.66,748.3,0.0
gfx950,256,10006,3072,3072,ck,0,0,152.5093,a8w8_blockscale_1x128x128_256x128x128x128_16x16_32x32_2x2_8x32x1_8x32x1_1x32x1x8_8_1x1_intrawave_v3,1238.33,666.53,0.0
gfx950,256,10006,3072,6144,ck,0,0,279.2687,a8w8_blockscale_1x128x128_256x128x128x128_16x16_32x32_2x2_8x32x1_8x32x1_1x32x1x8_8_1x1_intrawave_v3,1352.51,507.86,0.0
gfx950,256,10006,4096,3072,ck,0,0,192.8315,a8w8_blockscale_1x128x128_256x128x128x128_16x16_32x32_2x2_8x32x1_8x32x1_1x32x1x8_8_1x1_intrawave_v3,1305.85,649.74,0.0
gfx950,256,10006,8192,3072,ck,0,0,359.0753,a8w8_blockscale_1x128x128_256x128x128x128_16x16_32x32_2x2_8x32x1_8x32x1_1x32x1x8_8_1x1_intrawave_v3,1402.54,612.25,0.0
gfx950,256,10007,3072,3072,ck,0,0,153.3378,a8w8_blockscale_1x128x128_256x128x128x128_16x16_32x32_2x2_8x32x1_8x32x1_1x32x1x8_8_1x1_intrawave_v3,1231.76,662.99,0.0
gfx950,256,10007,4096,3072,ck,0,0,193.9598,a8w8_blockscale_1x128x128_256x128x128x128_16x16_32x32_2x2_8x32x1_8x32x1_1x32x1x8_8_1x1_intrawave_v3,1298.38,646.02,0.0
gfx950,256,10008,2048,3072,ck,0,0,103.3482,a8w8_blockscale_1x128x128_256x128x128x128_16x16_32x32_2x2_8x32x1_8x32x1_1x32x1x8_8_1x1_intrawave_v3,1218.5,755.01,0.0
gfx950,256,10009,2048,3072,ck,0,0,106.307,a8w8_blockscale_1x128x128_256x128x128x128_16x16_32x32_2x2_8x32x1_8x32x1_1x32x1x8_8_1x1_intrawave_v3,1184.7,734.06,0.0
gfx950,256,10009,3072,3072,ck,0,0,152.8354,a8w8_blockscale_1x128x128_256x128x128x128_16x16_32x32_2x2_8x32x1_8x32x1_1x32x1x8_8_1x1_intrawave_v3,1236.06,665.29,0.0
gfx950,256,10009,4096,3072,ck,0,0,191.1693,a8w8_blockscale_1x128x128_256x128x128x128_16x16_32x32_2x2_8x32x1_8x32x1_1x32x1x8_8_1x1_intrawave_v3,1317.6,655.57,0.0
gfx950,256,1001,2048,3072,ck,18,0,18.1649,a8w8_blockscale_1x128x128_256x64x64x256_16x16_32x32_1x1_16x16x1_16x16x1_1x32x1x8_8_1x1_intrawave_v1,693.4,741.35,0.0
gfx950,256,1001,3072,3072,ck,18,0,24.1158,a8w8_blockscale_1x128x128_256x64x64x256_16x16_32x32_1x1_16x16x1_16x16x1_1x32x1x8_8_1x1_intrawave_v1,783.44,773.87,0.0
gfx950,256,1001,3072,6144,ck,18,0,44.4112,a8w8_blockscale_1x128x128_256x64x64x256_16x16_32x32_1x1_16x16x1_16x16x1_1x32x1x8_8_1x1_intrawave_v1,850.83,701.95,0.0
gfx950,256,1001,4096,3072,ck,0,0,27.4135,a8w8_blockscale_1x128x128_256x128x128x128_16x16_32x32_2x2_8x32x1_8x32x1_1x32x1x8_8_1x1_intrawave_v3,918.93,870.31,0.0
gfx950,256,1001,8192,3072,ck,0,0,45.581,a8w8_blockscale_1x128x128_256x128x128x128_16x16_32x32_2x2_8x32x1_8x32x1_1x32x1x8_8_1x1_intrawave_v3,1105.33,979.38,0.0
gfx950,256,10012,2048,3072,ck,0,0,106.9811,a8w8_blockscale_1x128x128_256x128x128x128_16x16_32x32_2x2_8x32x1_8x32x1_1x32x1x8_8_1x1_intrawave_v3,1177.59,729.64,0.0
gfx950,256,10012,3072,3072,ck,0,0,151.4367,a8w8_blockscale_1x128x128_256x128x128x128_16x16_32x32_2x2_8x32x1_8x32x1_1x32x1x8_8_1x1_intrawave_v3,1247.85,671.62,0.0
gfx950,256,10012,4096,3072,ck,0,0,191.2759,a8w8_blockscale_1x128x128_256x128x128x128_16x16_32x32_2x2_8x32x1_8x32x1_1x32x1x8_8_1x1_intrawave_v3,1317.26,655.38,0.0
gfx950,256,10014,2048,3072,ck,0,0,106.3208,a8w8_blockscale_1x128x128_256x128x128x128_16x16_32x32_2x2_8x32x1_8x32x1_1x32x1x8_8_1x1_intrawave_v3,1185.14,734.3,0.0
gfx950,256,10014,3072,3072,ck,0,0,152.858,a8w8_blockscale_1x128x128_256x128x128x128_16x16_32x32_2x2_8x32x1_8x32x1_1x32x1x8_8_1x1_intrawave_v3,1236.49,665.49,0.0
gfx950,256,10014,3072,6144,ck,0,0,282.9532,a8w8_blockscale_1x128x128_256x128x128x128_16x16_32x32_2x2_8x32x1_8x32x1_1x32x1x8_8_1x1_intrawave_v3,1335.97,501.59,0.0
gfx950,256,10014,4096,3072,ck,0,0,193.0151,a8w8_blockscale_1x128x128_256x128x128x128_16x16_32x32_2x2_8x32x1_8x32x1_1x32x1x8_8_1x1_intrawave_v3,1305.65,649.59,0.0
gfx950,256,10014,8192,3072,ck,0,0,352.9698,a8w8_blockscale_1x128x128_256x128x128x128_16x16_32x32_2x2_8x32x1_8x32x1_1x32x1x8_8_1x1_intrawave_v3,1427.94,623.28,0.0
gfx950,256,10015,3072,6144,ck,0,0,284.8402,a8w8_blockscale_1x128x128_256x128x128x128_16x16_32x32_2x2_8x32x1_8x32x1_1x32x1x8_8_1x1_intrawave_v3,1327.25,498.31,0.0
gfx950,256,10015,8192,3072,ck,0,0,359.5484,a8w8_blockscale_1x128x128_256x128x128x128_16x16_32x32_2x2_8x32x1_8x32x1_1x32x1x8_8_1x1_intrawave_v3,1401.96,611.93,0.0
gfx950,256,10016,2048,3072,ck,0,0,105.0169,a8w8_blockscale_1x128x128_256x128x128x128_16x16_32x32_2x2_8x32x1_8x32x1_1x32x1x8_8_1x1_intrawave_v3,1200.1,743.56,0.0
gfx950,256,10016,3072,6144,ck,0,0,284.3246,a8w8_blockscale_1x128x128_256x128x128x128_16x16_32x32_2x2_8x32x1_8x32x1_1x32x1x8_8_1x1_intrawave_v3,1329.79,499.26,0.0
gfx950,256,10016,8192,3072,ck,0,0,360.5896,a8w8_blockscale_1x128x128_256x128x128x128_16x16_32x32_2x2_8x32x1_8x32x1_1x32x1x8_8_1x1_intrawave_v3,1398.05,610.21,0.0
gfx950,256,10019,3072,6144,ck,0,0,284.707,a8w8_blockscale_1x128x128_256x128x128x128_16x16_32x32_2x2_8x32x1_8x32x1_1x32x1x8_8_1x1_intrawave_v3,1328.4,498.72,0.0
gfx950,256,10019,8192,3072,ck,0,0,360.9788,a8w8_blockscale_1x128x128_256x128x128x128_16x16_32x32_2x2_8x32x1_8x32x1_1x32x1x8_8_1x1_intrawave_v3,1396.96,609.72,0.0
gfx950,256,1002,2048,3072,ck,18,0,18.175,a8w8_blockscale_1x128x128_256x64x64x256_16x16_32x32_1x1_16x16x1_16x16x1_1x32x1x8_8_1x1_intrawave_v1,693.7,741.34,0.0
gfx950,256,1002,3072,3072,ck,18,0,24.3402,a8w8_blockscale_1x128x128_256x64x64x256_16x16_32x32_1x1_16x16x1_16x16x1_1x32x1x8_8_1x1_intrawave_v1,776.99,767.11,0.0
gfx950,256,1002,3072,6144,ck,18,0,44.781,a8w8_blockscale_1x128x128_256x64x64x256_16x16_32x32_1x1_16x16x1_16x16x1_1x32x1x8_8_1x1_intrawave_v1,844.65,696.43,0.0
gfx950,256,1002,4096,3072,ck,0,0,27.5803,a8w8_blockscale_1x128x128_256x128x128x128_16x16_32x32_2x2_8x32x1_8x32x1_1x32x1x8_8_1x1_intrawave_v3,914.28,865.45,0.0
gfx950,256,1002,8192,3072,ck,0,0,45.5797,a8w8_blockscale_1x128x128_256x128x128x128_16x16_32x32_2x2_8x32x1_8x32x1_1x32x1x8_8_1x1_intrawave_v3,1106.46,979.84,0.0
gfx950,256,10020,3072,6144,ck,0,0,278.9722,a8w8_blockscale_1x128x128_256x128x128x128_16x16_32x32_2x2_8x32x1_8x32x1_1x32x1x8_8_1x1_intrawave_v3,1355.84,509.01,0.0
gfx950,256,10020,8192,3072,ck,0,0,353.7501,a8w8_blockscale_1x128x128_256x128x128x128_16x16_32x32_2x2_8x32x1_8x32x1_1x32x1x8_8_1x1_intrawave_v3,1425.65,622.23,0.0
gfx950,256,10022,3072,6144,ck,0,0,279.0427,a8w8_blockscale_1x128x128_256x128x128x128_16x16_32x32_2x2_8x32x1_8x32x1_1x32x1x8_8_1x1_intrawave_v3,1355.77,508.97,0.0
gfx950,256,10022,8192,3072,ck,0,0,350.5273,a8w8_blockscale_1x128x128_256x128x128x128_16x16_32x32_2x2_8x32x1_8x32x1_1x32x1x8_8_1x1_intrawave_v3,1439.04,628.06,0.0
gfx950,256,10023,2048,3072,ck,0,0,103.2456,a8w8_blockscale_1x128x128_256x128x128x128_16x16_32x32_2x2_8x32x1_8x32x1_1x32x1x8_8_1x1_intrawave_v3,1221.54,756.8,0.0
gfx950,256,1003,2048,3072,ck,18,0,17.9553,a8w8_blockscale_1x128x128_256x64x64x256_16x16_32x32_1x1_16x16x1_16x16x1_1x32x1x8_8_1x1_intrawave_v1,702.89,750.81,0.0
gfx950,256,1003,3072,3072,ck,18,0,24.2228,a8w8_blockscale_1x128x128_256x64x64x256_16x16_32x32_1x1_16x16x1_16x16x1_1x32x1x8_8_1x1_intrawave_v1,781.54,771.21,0.0
gfx950,256,1003,3072,6144,ck,18,0,45.2432,a8w8_blockscale_1x128x128_256x64x64x256_16x16_32x32_1x1_16x16x1_16x16x1_1x32x1x8_8_1x1_intrawave_v1,836.85,689.59,0.0
gfx950,256,1003,4096,3072,ck,0,0,27.505,a8w8_blockscale_1x128x128_256x128x128x128_16x16_32x32_2x2_8x32x1_8x32x1_1x32x1x8_8_1x1_intrawave_v3,917.7,868.23,0.0
gfx950,256,1003,8192,3072,ck,0,0,45.116,a8w8_blockscale_1x128x128_256x128x128x128_16x16_32x32_2x2_8x32x1_8x32x1_1x32x1x8_8_1x1_intrawave_v3,1118.95,990.34,0.0
gfx950,256,10030,2048,3072,ck,0,0,103.9875,a8w8_blockscale_1x128x128_256x128x128x128_16x16_32x32_2x2_8x32x1_8x32x1_1x32x1x8_8_1x1_intrawave_v3,1213.67,751.88,0.0
gfx950,256,10030,3072,3072,ck,0,0,150.9397,a8w8_blockscale_1x128x128_256x128x128x128_16x16_32x32_2x2_8x32x1_8x32x1_1x32x1x8_8_1x1_intrawave_v3,1254.21,674.93,0.0
gfx950,256,10030,4096,3072,ck,0,0,193.4758,a8w8_blockscale_1x128x128_256x128x128x128_16x16_32x32_2x2_8x32x1_8x32x1_1x32x1x8_8_1x1_intrawave_v3,1304.62,648.97,0.0
gfx950,256,10031,2048,3072,ck,0,0,104.8592,a8w8_blockscale_1x128x128_256x128x128x128_16x16_32x32_2x2_8x32x1_8x32x1_1x32x1x8_8_1x1_intrawave_v3,1203.7,745.7,0.0
gfx950,256,10031,3072,3072,ck,0,0,154.1926,a8w8_blockscale_1x128x128_256x128x128x128_16x16_32x32_2x2_8x32x1_8x32x1_1x32x1x8_8_1x1_intrawave_v3,1227.87,660.75,0.0
gfx950,256,10031,3072,6144,ck,0,0,284.373,a8w8_blockscale_1x128x128_256x128x128x128_16x16_32x32_2x2_8x32x1_8x32x1_1x32x1x8_8_1x1_intrawave_v3,1331.55,499.82,0.0
gfx950,256,10031,4096,3072,ck,0,0,194.7697,a8w8_blockscale_1x128x128_256x128x128x128_16x16_32x32_2x2_8x32x1_8x32x1_1x32x1x8_8_1x1_intrawave_v3,1296.09,644.72,0.0
gfx950,256,10031,8192,3072,ck,0,0,361.1523,a8w8_blockscale_1x128x128_256x128x128x128_16x16_32x32_2x2_8x32x1_8x32x1_1x32x1x8_8_1x1_intrawave_v3,1397.96,610.07,0.0
gfx950,256,10035,3072,6144,ck,0,0,278.95,a8w8_blockscale_1x128x128_256x128x128x128_16x16_32x32_2x2_8x32x1_8x32x1_1x32x1x8_8_1x1_intrawave_v3,1357.98,509.71,0.0
gfx950,256,10035,8192,3072,ck,0,0,360.1827,a8w8_blockscale_1x128x128_256x128x128x128_16x16_32x32_2x2_8x32x1_8x32x1_1x32x1x8_8_1x1_intrawave_v3,1402.28,611.93,0.0
gfx950,256,10036,3072,6144,ck,0,0,283.5818,a8w8_blockscale_1x128x128_256x128x128x128_16x16_32x32_2x2_8x32x1_8x32x1_1x32x1x8_8_1x1_intrawave_v3,1335.93,501.43,0.0
gfx950,256,10036,8192,3072,ck,0,0,357.7617,a8w8_blockscale_1x128x128_256x128x128x128_16x16_32x32_2x2_8x32x1_8x32x1_1x32x1x8_8_1x1_intrawave_v3,1411.91,616.13,0.0
gfx950,256,10037,3072,6144,ck,0,0,284.746,a8w8_blockscale_1x128x128_256x128x128x128_16x16_32x32_2x2_8x32x1_8x32x1_1x32x1x8_8_1x1_intrawave_v3,1330.6,499.42,0.0
gfx950,256,10037,8192,3072,ck,0,0,361.9801,a8w8_blockscale_1x128x128_256x128x128x128_16x16_32x32_2x2_8x32x1_8x32x1_1x32x1x8_8_1x1_intrawave_v3,1395.6,609.0,0.0
gfx950,256,10038,3072,6144,ck,0,0,282.9357,a8w8_blockscale_1x128x128_256x128x128x128_16x16_32x32_2x2_8x32x1_8x32x1_1x32x1x8_8_1x1_intrawave_v3,1339.25,502.66,0.0
gfx950,256,10038,8192,3072,ck,0,0,358.0957,a8w8_blockscale_1x128x128_256x128x128x128_16x16_32x32_2x2_8x32x1_8x32x1_1x32x1x8_8_1x1_intrawave_v3,1410.88,615.66,0.0
gfx950,256,1004,2048,3072,ck,18,0,18.0739,a8w8_blockscale_1x128x128_256x64x64x256_16x16_32x32_1x1_16x16x1_16x16x1_1x32x1x8_8_1x1_intrawave_v1,698.98,746.28,0.0
gfx950,256,1004,3072,3072,ck,18,0,24.1508,a8w8_blockscale_1x128x128_256x64x64x256_16x16_32x32_1x1_16x16x1_16x16x1_1x32x1x8_8_1x1_intrawave_v1,784.65,773.89,0.0
gfx950,256,1004,3072,6144,ck,18,0,44.835,a8w8_blockscale_1x128x128_256x64x64x256_16x16_32x32_1x1_16x16x1_16x16x1_1x32x1x8_8_1x1_intrawave_v1,845.32,696.14,0.0
gfx950,256,1004,4096,3072,ck,0,0,27.4393,a8w8_blockscale_1x128x128_256x128x128x128_16x16_32x32_2x2_8x32x1_8x32x1_1x32x1x8_8_1x1_intrawave_v3,920.81,870.72,0.0
gfx950,256,1004,8192,3072,ck,0,0,45.6635,a8w8_blockscale_1x128x128_256x128x128x128_16x16_32x32_2x2_8x32x1_8x32x1_1x32x1x8_8_1x1_intrawave_v3,1106.64,978.89,0.0
gfx950,256,10041,3072,6144,ck,0,0,281.1094,a8w8_blockscale_1x128x128_256x128x128x128_16x16_32x32_2x2_8x32x1_8x32x1_1x32x1x8_8_1x1_intrawave_v3,1348.35,506.06,0.0
gfx950,256,10041,8192,3072,ck,0,0,346.9438,a8w8_blockscale_1x128x128_256x128x128x128_16x16_32x32_2x2_8x32x1_8x32x1_1x32x1x8_8_1x1_intrawave_v3,1456.66,635.62,0.0
gfx950,256,10042,3072,6144,ck,0,0,282.1338,a8w8_blockscale_1x128x128_256x128x128x128_16x16_32x32_2x2_8x32x1_8x32x1_1x32x1x8_8_1x1_intrawave_v3,1343.59,504.27,0.0
gfx950,256,10042,8192,3072,ck,0,0,357.25,a8w8_blockscale_1x128x128_256x128x128x128_16x16_32x32_2x2_8x32x1_8x32x1_1x32x1x8_8_1x1_intrawave_v3,1414.78,617.34,0.0
gfx950,256,10045,3072,6144,ck,0,0,279.1621,a8w8_blockscale_1x128x128_256x128x128x128_16x16_32x32_2x2_8x32x1_8x32x1_1x32x1x8_8_1x1_intrawave_v3,1358.3,509.77,0.0
gfx950,256,10045,8192,3072,ck,0,0,362.9599,a8w8_blockscale_1x128x128_256x128x128x128_16x16_32x32_2x2_8x32x1_8x32x1_1x32x1x8_8_1x1_intrawave_v3,1392.94,607.78,0.0
gfx950,256,10046,2048,3072,ck,0,0,105.7776,a8w8_blockscale_1x128x128_256x128x128x128_16x16_32x32_2x2_8x32x1_8x32x1_1x32x1x8_8_1x1_intrawave_v3,1195.03,740.24,0.0
gfx950,256,10046,3072,3072,ck,0,0,153.5751,a8w8_blockscale_1x128x128_256x128x128x128_16x16_32x32_2x2_8x32x1_8x32x1_1x32x1x8_8_1x1_intrawave_v3,1234.65,664.31,0.0
gfx950,256,10046,4096,3072,ck,0,0,190.2687,a8w8_blockscale_1x128x128_256x128x128x128_16x16_32x32_2x2_8x32x1_8x32x1_1x32x1x8_8_1x1_intrawave_v3,1328.73,660.86,0.0
gfx950,256,10049,3072,3072,ck,0,0,154.4888,a8w8_blockscale_1x128x128_256x128x128x128_16x16_32x32_2x2_8x32x1_8x32x1_1x32x1x8_8_1x1_intrawave_v3,1227.72,660.56,0.0
gfx950,256,10049,4096,3072,ck,0,0,191.9211,a8w8_blockscale_1x128x128_256x128x128x128_16x16_32x32_2x2_8x32x1_8x32x1_1x32x1x8_8_1x1_intrawave_v3,1317.68,655.35,0.0
gfx950,256,1005,2048,3072,ck,18,0,18.1443,a8w8_blockscale_1x128x128_256x64x64x256_16x16_32x32_1x1_16x16x1_16x16x1_1x32x1x8_8_1x1_intrawave_v1,696.96,743.78,0.0
gfx950,256,10053,2048,3072,ck,0,0,104.3277,a8w8_blockscale_1x128x128_256x128x128x128_16x16_32x32_2x2_8x32x1_8x32x1_1x32x1x8_8_1x1_intrawave_v3,1212.49,751.01,0.0
gfx950,256,10054,2048,3072,ck,0,0,104.8668,a8w8_blockscale_1x128x128_256x128x128x128_16x16_32x32_2x2_8x32x1_8x32x1_1x32x1x8_8_1x1_intrawave_v3,1206.37,747.22,0.0
gfx950,256,10054,3072,3072,ck,0,0,152.7286,a8w8_blockscale_1x128x128_256x128x128x128_16x16_32x32_2x2_8x32x1_8x32x1_1x32x1x8_8_1x1_intrawave_v3,1242.48,668.47,0.0
gfx950,256,10054,4096,3072,ck,0,0,192.3262,a8w8_blockscale_1x128x128_256x128x128x128_16x16_32x32_2x2_8x32x1_8x32x1_1x32x1x8_8_1x1_intrawave_v3,1315.56,654.26,0.0
gfx950,256,10055,3072,3072,ck,0,0,154.1423,a8w8_blockscale_1x128x128_256x128x128x128_16x16_32x32_2x2_8x32x1_8x32x1_1x32x1x8_8_1x1_intrawave_v3,1231.21,662.4,0.0
gfx950,256,10055,4096,3072,ck,0,0,194.6862,a8w8_blockscale_1x128x128_256x128x128x128_16x16_32x32_2x2_8x32x1_8x32x1_1x32x1x8_8_1x1_intrawave_v3,1299.74,646.39,0.0
gfx950,256,10056,3072,3072,ck,0,0,150.1241,a8w8_blockscale_1x128x128_256x128x128x128_16x16_32x32_2x2_8x32x1_8x32x1_1x32x1x8_8_1x1_intrawave_v3,1264.29,680.19,0.0
gfx950,256,10056,4096,3072,ck,0,0,192.8149,a8w8_blockscale_1x128x128_256x128x128x128_16x16_32x32_2x2_8x32x1_8x32x1_1x32x1x8_8_1x1_intrawave_v3,1312.49,652.72,0.0
gfx950,256,10058,3072,3072,ck,0,0,152.8362,a8w8_blockscale_1x128x128_256x128x128x128_16x16_32x32_2x2_8x32x1_8x32x1_1x32x1x8_8_1x1_intrawave_v3,1242.1,668.24,0.0
gfx950,256,10058,4096,3072,ck,0,0,190.0791,a8w8_blockscale_1x128x128_256x128x128x128_16x16_32x32_2x2_8x32x1_8x32x1_1x32x1x8_8_1x1_intrawave_v3,1331.64,662.23,0.0
gfx950,256,10060,2048,3072,ck,0,0,105.5551,a8w8_blockscale_1x128x128_256x128x128x128_16x16_32x32_2x2_8x32x1_8x32x1_1x32x1x8_8_1x1_intrawave_v3,1199.22,742.75,0.0
gfx950,256,10060,3072,3072,ck,0,0,153.8674,a8w8_blockscale_1x128x128_256x128x128x128_16x16_32x32_2x2_8x32x1_8x32x1_1x32x1x8_8_1x1_intrawave_v3,1234.02,663.88,0.0
gfx950,256,10060,4096,3072,ck,0,0,188.9598,a8w8_blockscale_1x128x128_256x128x128x128_16x16_32x32_2x2_8x32x1_8x32x1_1x32x1x8_8_1x1_intrawave_v3,1339.8,666.27,0.0
gfx950,256,10061,2048,3072,ck,0,0,105.5712,a8w8_blockscale_1x128x128_256x128x128x128_16x16_32x32_2x2_8x32x1_8x32x1_1x32x1x8_8_1x1_intrawave_v3,1199.16,742.71,0.0
gfx950,256,10062,3072,3072,ck,0,0,150.4603,a8w8_blockscale_1x128x128_256x128x128x128_16x16_32x32_2x2_8x32x1_8x32x1_1x32x1x8_8_1x1_intrawave_v3,1262.22,679.04,0.0
gfx950,256,10062,4096,3072,ck,0,0,193.3211,a8w8_blockscale_1x128x128_256x128x128x128_16x16_32x32_2x2_8x32x1_8x32x1_1x32x1x8_8_1x1_intrawave_v3,1309.83,651.36,0.0
gfx950,256,10063,2048,3072,ck,0,0,105.7209,a8w8_blockscale_1x128x128_256x128x128x128_16x16_32x32_2x2_8x32x1_8x32x1_1x32x1x8_8_1x1_intrawave_v3,1197.7,741.79,0.0
gfx950,256,10063,3072,3072,ck,0,0,154.0147,a8w8_blockscale_1x128x128_256x128x128x128_16x16_32x32_2x2_8x32x1_8x32x1_1x32x1x8_8_1x1_intrawave_v3,1233.21,663.43,0.0
gfx950,256,10063,4096,3072,ck,0,0,190.9888,a8w8_blockscale_1x128x128_256x128x128x128_16x16_32x32_2x2_8x32x1_8x32x1_1x32x1x8_8_1x1_intrawave_v3,1325.96,659.37,0.0
gfx950,256,1007,2048,3072,ck,18,0,18.029,a8w8_blockscale_1x128x128_256x64x64x256_16x16_32x32_1x1_16x16x1_16x16x1_1x32x1x8_8_1x1_intrawave_v1,702.81,749.33,0.0
gfx950,256,10076,3072,3072,ck,0,0,152.8258,a8w8_blockscale_1x128x128_256x128x128x128_16x16_32x32_2x2_8x32x1_8x32x1_1x32x1x8_8_1x1_intrawave_v3,1244.41,669.37,0.0
gfx950,256,10076,4096,3072,ck,0,0,193.1878,a8w8_blockscale_1x128x128_256x128x128x128_16x16_32x32_2x2_8x32x1_8x32x1_1x32x1x8_8_1x1_intrawave_v3,1312.56,652.62,0.0
gfx950,256,10083,3072,6144,ck,0,0,295.2878,a8w8_blockscale_1x128x128_256x128x128x128_16x16_32x32_2x2_8x32x1_8x32x1_1x32x1x8_8_1x1_intrawave_v3,1288.98,483.51,0.0
gfx950,256,10083,8192,3072,ck,0,0,376.3882,a8w8_blockscale_1x128x128_256x128x128x128_16x16_32x32_2x2_8x32x1_8x32x1_1x32x1x8_8_1x1_intrawave_v3,1348.33,588.06,0.0
gfx950,256,10086,2048,3072,ck,0,0,112.2144,a8w8_blockscale_1x128x128_256x128x128x128_16x16_32x32_2x2_8x32x1_8x32x1_1x32x1x8_8_1x1_intrawave_v3,1130.97,700.34,0.0
gfx950,256,10088,3072,6144,ck,0,0,298.5261,a8w8_blockscale_1x128x128_256x128x128x128_16x16_32x32_2x2_8x32x1_8x32x1_1x32x1x8_8_1x1_intrawave_v3,1275.63,478.47,0.0
gfx950,256,10088,8192,3072,ck,0,0,374.3573,a8w8_blockscale_1x128x128_256x128x128x128_16x16_32x32_2x2_8x32x1_8x32x1_1x32x1x8_8_1x1_intrawave_v3,1356.31,591.51,0.0
gfx950,256,10095,2048,3072,ck,0,0,113.1063,a8w8_blockscale_1x128x128_256x128x128x128_16x16_32x32_2x2_8x32x1_8x32x1_1x32x1x8_8_1x1_intrawave_v3,1123.05,695.38,0.0
gfx950,256,10095,3072,3072,ck,0,0,162.8795,a8w8_blockscale_1x128x128_256x128x128x128_16x16_32x32_2x2_8x32x1_8x32x1_1x32x1x8_8_1x1_intrawave_v3,1169.8,629.13,0.0
gfx950,256,10095,4096,3072,ck,0,0,204.6877,a8w8_blockscale_1x128x128_256x128x128x128_16x16_32x32_2x2_8x32x1_8x32x1_1x32x1x8_8_1x1_intrawave_v3,1241.15,617.0,0.0
gfx950,256,1010,3072,6144,ck,18,0,44.0794,a8w8_blockscale_1x128x128_256x64x64x256_16x16_32x32_1x1_16x16x1_16x16x1_1x32x1x8_8_1x1_intrawave_v1,864.94,709.75,0.0
gfx950,256,1010,8192,3072,ck,0,0,46.407,a8w8_blockscale_1x128x128_256x128x128x128_16x16_32x32_2x2_8x32x1_8x32x1_1x32x1x8_8_1x1_intrawave_v3,1095.42,965.72,0.0
gfx950,256,10108,3072,3072,ck,0,0,152.6444,a8w8_blockscale_1x128x128_256x128x128x128_16x16_32x32_2x2_8x32x1_8x32x1_1x32x1x8_8_1x1_intrawave_v3,1249.85,672.1,0.0
gfx950,256,10108,4096,3072,ck,0,0,194.8623,a8w8_blockscale_1x128x128_256x128x128x128_16x16_32x32_2x2_8x32x1_8x32x1_1x32x1x8_8_1x1_intrawave_v3,1305.41,648.87,0.0
gfx950,256,10109,3072,3072,ck,0,0,149.2348,a8w8_blockscale_1x128x128_256x128x128x128_16x16_32x32_2x2_8x32x1_8x32x1_1x32x1x8_8_1x1_intrawave_v3,1278.53,687.52,0.0
gfx950,256,10109,4096,3072,ck,0,0,191.0207,a8w8_blockscale_1x128x128_256x128x128x128_16x16_32x32_2x2_8x32x1_8x32x1_1x32x1x8_8_1x1_intrawave_v3,1331.8,661.97,0.0
gfx950,256,10112,2048,3072,ck,0,0,105.7855,a8w8_blockscale_1x128x128_256x128x128x128_16x16_32x32_2x2_8x32x1_8x32x1_1x32x1x8_8_1x1_intrawave_v3,1202.8,744.66,0.0
gfx950,256,10112,3072,3072,ck,0,0,152.986,a8w8_blockscale_1x128x128_256x128x128x128_16x16_32x32_2x2_8x32x1_8x32x1_1x32x1x8_8_1x1_intrawave_v3,1247.55,670.84,0.0
gfx950,256,10112,3072,6144,ck,0,0,282.8683,a8w8_blockscale_1x128x128_256x128x128x128_16x16_32x32_2x2_8x32x1_8x32x1_1x32x1x8_8_1x1_intrawave_v3,1349.45,506.0,0.0
gfx950,256,10112,4096,3072,ck,0,0,190.5788,a8w8_blockscale_1x128x128_256x128x128x128_16x16_32x32_2x2_8x32x1_8x32x1_1x32x1x8_8_1x1_intrawave_v3,1335.28,663.69,0.0
gfx950,256,10112,8192,3072,ck,0,0,338.7811,a8w8_blockscale_1x128x128_256x128x128x128_16x16_32x32_2x2_8x32x1_8x32x1_1x32x1x8_8_1x1_intrawave_v3,1502.31,655.01,0.0
gfx950,256,10120,3072,3072,ck,0,0,150.1213,a8w8_blockscale_1x128x128_256x128x128x128_16x16_32x32_2x2_8x32x1_8x32x1_1x32x1x8_8_1x1_intrawave_v3,1272.36,684.13,0.0
gfx950,256,10120,4096,3072,ck,0,0,195.4204,a8w8_blockscale_1x128x128_256x128x128x128_16x16_32x32_2x2_8x32x1_8x32x1_1x32x1x8_8_1x1_intrawave_v3,1303.23,647.7,0.0
gfx950,256,10122,2048,3072,ck,0,0,107.0713,a8w8_blockscale_1x128x128_256x128x128x128_16x16_32x32_2x2_8x32x1_8x32x1_1x32x1x8_8_1x1_intrawave_v3,1189.53,736.39,0.0
gfx950,256,10125,3072,3072,ck,0,0,150.209,a8w8_blockscale_1x128x128_256x128x128x128_16x16_32x32_2x2_8x32x1_8x32x1_1x32x1x8_8_1x1_intrawave_v3,1272.25,684.04,0.0
gfx950,256,10125,4096,3072,ck,0,0,196.6748,a8w8_blockscale_1x128x128_256x128x128x128_16x16_32x32_2x2_8x32x1_8x32x1_1x32x1x8_8_1x1_intrawave_v3,1295.56,643.86,0.0
gfx950,256,10126,2048,3072,ck,0,0,107.8182,a8w8_blockscale_1x128x128_256x128x128x128_16x16_32x32_2x2_8x32x1_8x32x1_1x32x1x8_8_1x1_intrawave_v3,1181.75,731.55,0.0
gfx950,256,10126,3072,3072,ck,0,0,153.0067,a8w8_blockscale_1x128x128_256x128x128x128_16x16_32x32_2x2_8x32x1_8x32x1_1x32x1x8_8_1x1_intrawave_v3,1249.11,671.59,0.0
gfx950,256,10126,4096,3072,ck,0,0,194.8542,a8w8_blockscale_1x128x128_256x128x128x128_16x16_32x32_2x2_8x32x1_8x32x1_1x32x1x8_8_1x1_intrawave_v3,1307.79,649.93,0.0
gfx950,256,10127,2048,3072,ck,0,0,107.5493,a8w8_blockscale_1x128x128_256x128x128x128_16x16_32x32_2x2_8x32x1_8x32x1_1x32x1x8_8_1x1_intrawave_v3,1184.83,733.45,0.0
gfx950,256,10127,3072,3072,ck,0,0,154.0498,a8w8_blockscale_1x128x128_256x128x128x128_16x16_32x32_2x2_8x32x1_8x32x1_1x32x1x8_8_1x1_intrawave_v3,1240.77,667.11,0.0
gfx950,256,10127,4096,3072,ck,0,0,193.2324,a8w8_blockscale_1x128x128_256x128x128x128_16x16_32x32_2x2_8x32x1_8x32x1_1x32x1x8_8_1x1_intrawave_v3,1318.9,655.45,0.0
gfx950,256,10128,3072,3072,ck,0,0,155.004,a8w8_blockscale_1x128x128_256x128x128x128_16x16_32x32_2x2_8x32x1_8x32x1_1x32x1x8_8_1x1_intrawave_v3,1233.26,663.06,0.0
gfx950,256,10128,4096,3072,ck,0,0,194.2611,a8w8_blockscale_1x128x128_256x128x128x128_16x16_32x32_2x2_8x32x1_8x32x1_1x32x1x8_8_1x1_intrawave_v3,1312.05,652.03,0.0
gfx950,256,1013,2048,3072,ck,18,0,18.0912,a8w8_blockscale_1x128x128_256x64x64x256_16x16_32x32_1x1_16x16x1_16x16x1_1x32x1x8_8_1x1_intrawave_v1,704.57,749.13,0.0
gfx950,256,10130,3072,3072,ck,0,0,149.5155,a8w8_blockscale_1x128x128_256x128x128x128_16x16_32x32_2x2_8x32x1_8x32x1_1x32x1x8_8_1x1_intrawave_v3,1278.78,687.52,0.0
gfx950,256,10130,4096,3072,ck,0,0,195.2221,a8w8_blockscale_1x128x128_256x128x128x128_16x16_32x32_2x2_8x32x1_8x32x1_1x32x1x8_8_1x1_intrawave_v3,1305.84,648.94,0.0
gfx950,256,10131,3072,3072,ck,0,0,150.2736,a8w8_blockscale_1x128x128_256x128x128x128_16x16_32x32_2x2_8x32x1_8x32x1_1x32x1x8_8_1x1_intrawave_v3,1272.45,684.12,0.0
gfx950,256,10131,4096,3072,ck,0,0,196.371,a8w8_blockscale_1x128x128_256x128x128x128_16x16_32x32_2x2_8x32x1_8x32x1_1x32x1x8_8_1x1_intrawave_v3,1298.33,645.2,0.0
gfx950,256,10132,3072,3072,ck,0,0,151.1651,a8w8_blockscale_1x128x128_256x128x128x128_16x16_32x32_2x2_8x32x1_8x32x1_1x32x1x8_8_1x1_intrawave_v3,1265.07,680.14,0.0
gfx950,256,10132,4096,3072,ck,0,0,194.5871,a8w8_blockscale_1x128x128_256x128x128x128_16x16_32x32_2x2_8x32x1_8x32x1_1x32x1x8_8_1x1_intrawave_v3,1310.37,651.17,0.0
gfx950,256,10133,3072,3072,ck,0,0,153.6826,a8w8_blockscale_1x128x128_256x128x128x128_16x16_32x32_2x2_8x32x1_8x32x1_1x32x1x8_8_1x1_intrawave_v3,1244.47,669.06,0.0
gfx950,256,10133,4096,3072,ck,0,0,191.3004,a8w8_blockscale_1x128x128_256x128x128x128_16x16_32x32_2x2_8x32x1_8x32x1_1x32x1x8_8_1x1_intrawave_v3,1333.01,662.42,0.0
gfx950,256,10134,3072,3072,ck,0,0,151.266,a8w8_blockscale_1x128x128_256x128x128x128_16x16_32x32_2x2_8x32x1_8x32x1_1x32x1x8_8_1x1_intrawave_v3,1264.48,679.81,0.0
gfx950,256,10134,4096,3072,ck,0,0,195.1014,a8w8_blockscale_1x128x128_256x128x128x128_16x16_32x32_2x2_8x32x1_8x32x1_1x32x1x8_8_1x1_intrawave_v3,1307.17,649.57,0.0
gfx950,256,10140,2048,3072,ck,0,0,107.0447,a8w8_blockscale_1x128x128_256x128x128x128_16x16_32x32_2x2_8x32x1_8x32x1_1x32x1x8_8_1x1_intrawave_v3,1191.94,737.78,0.0
gfx950,256,10140,3072,3072,ck,0,0,153.7707,a8w8_blockscale_1x128x128_256x128x128x128_16x16_32x32_2x2_8x32x1_8x32x1_1x32x1x8_8_1x1_intrawave_v3,1244.62,669.1,0.0
gfx950,256,10140,4096,3072,ck,0,0,194.8529,a8w8_blockscale_1x128x128_256x128x128x128_16x16_32x32_2x2_8x32x1_8x32x1_1x32x1x8_8_1x1_intrawave_v3,1309.61,650.75,0.0
gfx950,256,10141,3072,3072,ck,0,0,154.8213,a8w8_blockscale_1x128x128_256x128x128x128_16x16_32x32_2x2_8x32x1_8x32x1_1x32x1x8_8_1x1_intrawave_v3,1236.3,664.62,0.0
gfx950,256,10141,4096,3072,ck,0,0,188.2372,a8w8_blockscale_1x128x128_256x128x128x128_16x16_32x32_2x2_8x32x1_8x32x1_1x32x1x8_8_1x1_intrawave_v3,1355.77,673.68,0.0
gfx950,256,10142,3072,3072,ck,0,0,151.7088,a8w8_blockscale_1x128x128_256x128x128x128_16x16_32x32_2x2_8x32x1_8x32x1_1x32x1x8_8_1x1_intrawave_v3,1261.78,678.31,0.0
gfx950,256,10142,4096,3072,ck,0,0,194.4511,a8w8_blockscale_1x128x128_256x128x128x128_16x16_32x32_2x2_8x32x1_8x32x1_1x32x1x8_8_1x1_intrawave_v3,1312.58,652.21,0.0
gfx950,256,10143,3072,3072,ck,0,0,153.0678,a8w8_blockscale_1x128x128_256x128x128x128_16x16_32x32_2x2_8x32x1_8x32x1_1x32x1x8_8_1x1_intrawave_v3,1250.71,672.35,0.0
gfx950,256,10143,4096,3072,ck,0,0,192.5178,a8w8_blockscale_1x128x128_256x128x128x128_16x16_32x32_2x2_8x32x1_8x32x1_1x32x1x8_8_1x1_intrawave_v3,1325.89,658.82,0.0
gfx950,256,10146,3072,3072,ck,0,0,153.4544,a8w8_blockscale_1x128x128_256x128x128x128_16x16_32x32_2x2_8x32x1_8x32x1_1x32x1x8_8_1x1_intrawave_v3,1247.92,670.84,0.0
gfx950,256,10146,4096,3072,ck,0,0,192.15,a8w8_blockscale_1x128x128_256x128x128x128_16x16_32x32_2x2_8x32x1_8x32x1_1x32x1x8_8_1x1_intrawave_v3,1328.82,660.25,0.0
gfx950,256,10147,3072,3072,ck,0,0,154.7981,a8w8_blockscale_1x128x128_256x128x128x128_16x16_32x32_2x2_8x32x1_8x32x1_1x32x1x8_8_1x1_intrawave_v3,1237.21,665.07,0.0
gfx950,256,10147,4096,3072,ck,0,0,194.0056,a8w8_blockscale_1x128x128_256x128x128x128_16x16_32x32_2x2_8x32x1_8x32x1_1x32x1x8_8_1x1_intrawave_v3,1316.24,654.0,0.0
gfx950,256,10148,3072,3072,ck,0,0,149.0749,a8w8_blockscale_1x128x128_256x128x128x128_16x16_32x32_2x2_8x32x1_8x32x1_1x32x1x8_8_1x1_intrawave_v3,1284.84,690.67,0.0
gfx950,256,10148,4096,3072,ck,0,0,188.7839,a8w8_blockscale_1x128x128_256x128x128x128_16x16_32x32_2x2_8x32x1_8x32x1_1x32x1x8_8_1x1_intrawave_v3,1352.78,672.14,0.0
gfx950,256,10156,3072,3072,ck,0,0,148.1999,a8w8_blockscale_1x128x128_256x128x128x128_16x16_32x32_2x2_8x32x1_8x32x1_1x32x1x8_8_1x1_intrawave_v3,1293.44,695.24,0.0
gfx950,256,10156,4096,3072,ck,0,0,193.6883,a8w8_blockscale_1x128x128_256x128x128x128_16x16_32x32_2x2_8x32x1_8x32x1_1x32x1x8_8_1x1_intrawave_v3,1319.56,655.59,0.0
gfx950,256,10157,3072,3072,ck,0,0,148.2896,a8w8_blockscale_1x128x128_256x128x128x128_16x16_32x32_2x2_8x32x1_8x32x1_1x32x1x8_8_1x1_intrawave_v3,1292.79,694.88,0.0
gfx950,256,10157,4096,3072,ck,0,0,195.0497,a8w8_blockscale_1x128x128_256x128x128x128_16x16_32x32_2x2_8x32x1_8x32x1_1x32x1x8_8_1x1_intrawave_v3,1310.48,651.07,0.0
gfx950,256,10173,3072,3072,ck,0,0,154.44,a8w8_blockscale_1x128x128_256x128x128x128_16x16_32x32_2x2_8x32x1_8x32x1_1x32x1x8_8_1x1_intrawave_v3,1243.26,668.17,0.0
gfx950,256,10173,4096,3072,ck,0,0,195.0024,a8w8_blockscale_1x128x128_256x128x128x128_16x16_32x32_2x2_8x32x1_8x32x1_1x32x1x8_8_1x1_intrawave_v3,1312.87,652.15,0.0
gfx950,256,10174,3072,3072,ck,0,0,151.2671,a8w8_blockscale_1x128x128_256x128x128x128_16x16_32x32_2x2_8x32x1_8x32x1_1x32x1x8_8_1x1_intrawave_v3,1269.46,682.24,0.0
gfx950,256,10174,4096,3072,ck,0,0,194.7724,a8w8_blockscale_1x128x128_256x128x128x128_16x16_32x32_2x2_8x32x1_8x32x1_1x32x1x8_8_1x1_intrawave_v3,1314.55,652.98,0.0
gfx950,256,10175,3072,3072,ck,0,0,151.5862,a8w8_blockscale_1x128x128_256x128x128x128_16x16_32x32_2x2_8x32x1_8x32x1_1x32x1x8_8_1x1_intrawave_v3,1266.91,680.87,0.0
gfx950,256,10175,4096,3072,ck,0,0,194.2318,a8w8_blockscale_1x128x128_256x128x128x128_16x16_32x32_2x2_8x32x1_8x32x1_1x32x1x8_8_1x1_intrawave_v3,1318.33,654.86,0.0
gfx950,256,10176,3072,3072,ck,0,0,154.1586,a8w8_blockscale_1x128x128_256x128x128x128_16x16_32x32_2x2_8x32x1_8x32x1_1x32x1x8_8_1x1_intrawave_v3,1245.9,669.56,0.0
gfx950,256,10176,4096,3072,ck,0,0,191.9991,a8w8_blockscale_1x128x128_256x128x128x128_16x16_32x32_2x2_8x32x1_8x32x1_1x32x1x8_8_1x1_intrawave_v3,1333.79,662.53,0.0
gfx950,256,10177,3072,3072,ck,0,0,154.7456,a8w8_blockscale_1x128x128_256x128x128x128_16x16_32x32_2x2_8x32x1_8x32x1_1x32x1x8_8_1x1_intrawave_v3,1241.29,667.08,0.0
gfx950,256,10177,4096,3072,ck,0,0,195.7856,a8w8_blockscale_1x128x128_256x128x128x128_16x16_32x32_2x2_8x32x1_8x32x1_1x32x1x8_8_1x1_intrawave_v3,1308.13,649.78,0.0
gfx950,256,10178,3072,3072,ck,0,0,153.4664,a8w8_blockscale_1x128x128_256x128x128x128_16x16_32x32_2x2_8x32x1_8x32x1_1x32x1x8_8_1x1_intrawave_v3,1251.76,672.71,0.0
gfx950,256,10178,4096,3072,ck,0,0,190.7077,a8w8_blockscale_1x128x128_256x128x128x128_16x16_32x32_2x2_8x32x1_8x32x1_1x32x1x8_8_1x1_intrawave_v3,1343.09,667.14,0.0
gfx950,256,10179,3072,3072,ck,0,0,152.2013,a8w8_blockscale_1x128x128_256x128x128x128_16x16_32x32_2x2_8x32x1_8x32x1_1x32x1x8_8_1x1_intrawave_v3,1262.29,678.36,0.0
gfx950,256,10179,4096,3072,ck,0,0,193.929,a8w8_blockscale_1x128x128_256x128x128x128_16x16_32x32_2x2_8x32x1_8x32x1_1x32x1x8_8_1x1_intrawave_v3,1320.91,656.11,0.0
gfx950,256,10180,3072,3072,ck,0,0,151.5551,a8w8_blockscale_1x128x128_256x128x128x128_16x16_32x32_2x2_8x32x1_8x32x1_1x32x1x8_8_1x1_intrawave_v3,1267.8,681.31,0.0
gfx950,256,10180,4096,3072,ck,0,0,195.7705,a8w8_blockscale_1x128x128_256x128x128x128_16x16_32x32_2x2_8x32x1_8x32x1_1x32x1x8_8_1x1_intrawave_v3,1308.61,650.0,0.0
gfx950,256,10181,3072,3072,ck,0,0,149.8781,a8w8_blockscale_1x128x128_256x128x128x128_16x16_32x32_2x2_8x32x1_8x32x1_1x32x1x8_8_1x1_intrawave_v3,1282.11,689.0,0.0
gfx950,256,10181,4096,3072,ck,0,0,195.3153,a8w8_blockscale_1x128x128_256x128x128x128_16x16_32x32_2x2_8x32x1_8x32x1_1x32x1x8_8_1x1_intrawave_v3,1311.79,651.57,0.0
gfx950,256,10186,3072,3072,ck,0,0,151.2586,a8w8_blockscale_1x128x128_256x128x128x128_16x16_32x32_2x2_8x32x1_8x32x1_1x32x1x8_8_1x1_intrawave_v3,1271.03,683.01,0.0
gfx950,256,10186,4096,3072,ck,0,0,190.614,a8w8_blockscale_1x128x128_256x128x128x128_16x16_32x32_2x2_8x32x1_8x32x1_1x32x1x8_8_1x1_intrawave_v3,1344.81,667.94,0.0
gfx950,256,10196,3072,6144,ck,0,0,284.978,a8w8_blockscale_1x128x128_256x128x128x128_16x16_32x32_2x2_8x32x1_8x32x1_1x32x1x8_8_1x1_intrawave_v3,1350.58,505.87,0.0
gfx950,256,10196,8192,3072,ck,0,0,364.1477,a8w8_blockscale_1x128x128_256x128x128x128_16x16_32x32_2x2_8x32x1_8x32x1_1x32x1x8_8_1x1_intrawave_v3,1409.27,613.87,0.0
gfx950,256,10205,3072,3072,ck,0,0,152.6273,a8w8_blockscale_1x128x128_256x128x128x128_16x16_32x32_2x2_8x32x1_8x32x1_1x32x1x8_8_1x1_intrawave_v3,1261.98,678.03,0.0
gfx950,256,10205,4096,3072,ck,0,0,195.2859,a8w8_blockscale_1x128x128_256x128x128x128_16x16_32x32_2x2_8x32x1_8x32x1_1x32x1x8_8_1x1_intrawave_v3,1315.08,653.05,0.0
gfx950,256,10206,3072,3072,ck,0,0,153.8073,a8w8_blockscale_1x128x128_256x128x128x128_16x16_32x32_2x2_8x32x1_8x32x1_1x32x1x8_8_1x1_intrawave_v3,1252.42,672.89,0.0
gfx950,256,10206,4096,3072,ck,0,0,190.3172,a8w8_blockscale_1x128x128_256x128x128x128_16x16_32x32_2x2_8x32x1_8x32x1_1x32x1x8_8_1x1_intrawave_v3,1349.55,670.16,0.0
gfx950,256,10208,3072,3072,ck,0,0,153.2929,a8w8_blockscale_1x128x128_256x128x128x128_16x16_32x32_2x2_8x32x1_8x32x1_1x32x1x8_8_1x1_intrawave_v3,1256.87,675.27,0.0
gfx950,256,10208,4096,3072,ck,0,0,189.4575,a8w8_blockscale_1x128x128_256x128x128x128_16x16_32x32_2x2_8x32x1_8x32x1_1x32x1x8_8_1x1_intrawave_v3,1355.94,673.32,0.0
gfx950,256,1021,2048,3072,ck,18,0,18.0493,a8w8_blockscale_1x128x128_256x64x64x256_16x16_32x32_1x1_16x16x1_16x16x1_1x32x1x8_8_1x1_intrawave_v1,711.78,754.04,0.0
gfx950,256,1021,3072,3072,ck,18,0,24.6425,a8w8_blockscale_1x128x128_256x64x64x256_16x16_32x32_1x1_16x16x1_16x16x1_1x32x1x8_8_1x1_intrawave_v1,782.01,764.81,0.0
gfx950,256,1021,4096,3072,ck,0,0,27.6989,a8w8_blockscale_1x128x128_256x128x128x128_16x16_32x32_2x2_8x32x1_8x32x1_1x32x1x8_8_1x1_intrawave_v3,927.63,869.47,0.0
gfx950,256,10216,3072,6144,ck,0,0,282.8186,a8w8_blockscale_1x128x128_256x128x128x128_16x16_32x32_2x2_8x32x1_8x32x1_1x32x1x8_8_1x1_intrawave_v3,1363.56,510.6,0.0
gfx950,256,10216,8192,3072,ck,0,0,367.2291,a8w8_blockscale_1x128x128_256x128x128x128_16x16_32x32_2x2_8x32x1_8x32x1_1x32x1x8_8_1x1_intrawave_v3,1400.18,609.78,0.0
gfx950,256,10217,3072,6144,ck,0,0,284.3387,a8w8_blockscale_1x128x128_256x128x128x128_16x16_32x32_2x2_8x32x1_8x32x1_1x32x1x8_8_1x1_intrawave_v3,1356.41,507.92,0.0
gfx950,256,10217,8192,3072,ck,0,0,358.7909,a8w8_blockscale_1x128x128_256x128x128x128_16x16_32x32_2x2_8x32x1_8x32x1_1x32x1x8_8_1x1_intrawave_v3,1433.25,624.17,0.0
gfx950,256,10223,3072,3072,ck,0,0,155.7085,a8w8_blockscale_1x128x128_256x128x128x128_16x16_32x32_2x2_8x32x1_8x32x1_1x32x1x8_8_1x1_intrawave_v3,1239.19,665.68,0.0
gfx950,256,10223,4096,3072,ck,0,0,191.5837,a8w8_blockscale_1x128x128_256x128x128x128_16x16_32x32_2x2_8x32x1_8x32x1_1x32x1x8_8_1x1_intrawave_v3,1342.86,666.73,0.0
gfx950,256,10225,3072,3072,ck,0,0,153.0887,a8w8_blockscale_1x128x128_256x128x128x128_16x16_32x32_2x2_8x32x1_8x32x1_1x32x1x8_8_1x1_intrawave_v3,1260.64,677.19,0.0
gfx950,256,10225,3072,6144,ck,0,0,284.8821,a8w8_blockscale_1x128x128_256x128x128x128_16x16_32x32_2x2_8x32x1_8x32x1_1x32x1x8_8_1x1_intrawave_v3,1354.88,507.29,0.0
gfx950,256,10225,4096,3072,ck,0,0,194.3474,a8w8_blockscale_1x128x128_256x128x128x128_16x16_32x32_2x2_8x32x1_8x32x1_1x32x1x8_8_1x1_intrawave_v3,1324.02,657.37,0.0
gfx950,256,10225,8192,3072,ck,0,0,364.2316,a8w8_blockscale_1x128x128_256x128x128x128_16x16_32x32_2x2_8x32x1_8x32x1_1x32x1x8_8_1x1_intrawave_v3,1412.95,615.28,0.0
gfx950,256,10226,3072,3072,ck,0,0,153.6128,a8w8_blockscale_1x128x128_256x128x128x128_16x16_32x32_2x2_8x32x1_8x32x1_1x32x1x8_8_1x1_intrawave_v3,1256.47,674.94,0.0
gfx950,256,10226,4096,3072,ck,0,0,195.6565,a8w8_blockscale_1x128x128_256x128x128x128_16x16_32x32_2x2_8x32x1_8x32x1_1x32x1x8_8_1x1_intrawave_v3,1315.29,653.02,0.0
gfx950,256,10227,3072,6144,ck,0,0,283.1529,a8w8_blockscale_1x128x128_256x128x128x128_16x16_32x32_2x2_8x32x1_8x32x1_1x32x1x8_8_1x1_intrawave_v3,1363.42,510.48,0.0
gfx950,256,10227,8192,3072,ck,0,0,356.6152,a8w8_blockscale_1x128x128_256x128x128x128_16x16_32x32_2x2_8x32x1_8x32x1_1x32x1x8_8_1x1_intrawave_v3,1443.41,628.53,0.0
gfx950,256,1023,3072,3072,ck,18,0,24.5319,a8w8_blockscale_1x128x128_256x64x64x256_16x16_32x32_1x1_16x16x1_16x16x1_1x32x1x8_8_1x1_intrawave_v1,787.08,769.0,0.0
gfx950,256,1023,4096,3072,ck,0,0,27.8084,a8w8_blockscale_1x128x128_256x128x128x128_16x16_32x32_2x2_8x32x1_8x32x1_1x32x1x8_8_1x1_intrawave_v3,925.79,866.86,0.0
gfx950,256,10231,3072,3072,ck,0,0,150.3967,a8w8_blockscale_1x128x128_256x128x128x128_16x16_32x32_2x2_8x32x1_8x32x1_1x32x1x8_8_1x1_intrawave_v3,1283.96,689.68,0.0
gfx950,256,10231,4096,3072,ck,0,0,194.4083,a8w8_blockscale_1x128x128_256x128x128x128_16x16_32x32_2x2_8x32x1_8x32x1_1x32x1x8_8_1x1_intrawave_v3,1324.39,657.51,0.0
gfx950,256,10232,3072,3072,ck,0,0,151.8617,a8w8_blockscale_1x128x128_256x128x128x128_16x16_32x32_2x2_8x32x1_8x32x1_1x32x1x8_8_1x1_intrawave_v3,1271.7,683.09,0.0
gfx950,256,10232,4096,3072,ck,0,0,195.3454,a8w8_blockscale_1x128x128_256x128x128x128_16x16_32x32_2x2_8x32x1_8x32x1_1x32x1x8_8_1x1_intrawave_v3,1318.16,654.41,0.0
gfx950,256,10233,3072,3072,ck,0,0,151.2361,a8w8_blockscale_1x128x128_256x128x128x128_16x16_32x32_2x2_8x32x1_8x32x1_1x32x1x8_8_1x1_intrawave_v3,1277.09,685.98,0.0
gfx950,256,10233,4096,3072,ck,0,0,193.3171,a8w8_blockscale_1x128x128_256x128x128x128_16x16_32x32_2x2_8x32x1_8x32x1_1x32x1x8_8_1x1_intrawave_v3,1332.12,661.34,0.0
gfx950,256,10235,3072,3072,ck,0,0,153.0115,a8w8_blockscale_1x128x128_256x128x128x128_16x16_32x32_2x2_8x32x1_8x32x1_1x32x1x8_8_1x1_intrawave_v3,1262.51,678.14,0.0
gfx950,256,10235,4096,3072,ck,0,0,193.8091,a8w8_blockscale_1x128x128_256x128x128x128_16x16_32x32_2x2_8x32x1_8x32x1_1x32x1x8_8_1x1_intrawave_v3,1329.0,659.77,0.0
gfx950,256,10236,3072,3072,ck,0,0,154.1084,a8w8_blockscale_1x128x128_256x128x128x128_16x16_32x32_2x2_8x32x1_8x32x1_1x32x1x8_8_1x1_intrawave_v3,1253.65,673.37,0.0
gfx950,256,10236,4096,3072,ck,0,0,191.7906,a8w8_blockscale_1x128x128_256x128x128x128_16x16_32x32_2x2_8x32x1_8x32x1_1x32x1x8_8_1x1_intrawave_v3,1343.12,666.78,0.0
gfx950,256,10237,3072,3072,ck,0,0,152.9191,a8w8_blockscale_1x128x128_256x128x128x128_16x16_32x32_2x2_8x32x1_8x32x1_1x32x1x8_8_1x1_intrawave_v3,1263.52,678.67,0.0
gfx950,256,10237,3072,6144,ck,0,0,285.4159,a8w8_blockscale_1x128x128_256x128x128x128_16x16_32x32_2x2_8x32x1_8x32x1_1x32x1x8_8_1x1_intrawave_v3,1353.93,506.86,0.0
gfx950,256,10237,4096,3072,ck,0,0,195.3113,a8w8_blockscale_1x128x128_256x128x128x128_16x16_32x32_2x2_8x32x1_8x32x1_1x32x1x8_8_1x1_intrawave_v3,1319.04,654.81,0.0
gfx950,256,10237,8192,3072,ck,0,0,362.7756,a8w8_blockscale_1x128x128_256x128x128x128_16x16_32x32_2x2_8x32x1_8x32x1_1x32x1x8_8_1x1_intrawave_v3,1420.29,618.39,0.0
gfx950,256,10238,3072,3072,ck,0,0,151.6502,a8w8_blockscale_1x128x128_256x128x128x128_16x16_32x32_2x2_8x32x1_8x32x1_1x32x1x8_8_1x1_intrawave_v3,1274.22,684.41,0.0
gfx950,256,10238,4096,3072,ck,0,0,193.9277,a8w8_blockscale_1x128x128_256x128x128x128_16x16_32x32_2x2_8x32x1_8x32x1_1x32x1x8_8_1x1_intrawave_v3,1328.58,659.54,0.0
gfx950,256,1024,2048,3072,ck,18,0,17.8817,a8w8_blockscale_1x128x128_256x64x64x256_16x16_32x32_1x1_16x16x1_16x16x1_1x32x1x8_8_1x1_intrawave_v1,720.56,762.31,0.0
gfx950,256,1024,3072,3072,ck,18,0,24.4644,a8w8_blockscale_1x128x128_256x64x64x256_16x16_32x32_1x1_16x16x1_16x16x1_1x32x1x8_8_1x1_intrawave_v1,790.02,771.5,0.0
gfx950,256,1024,3072,6144,ck,18,0,44.3856,a8w8_blockscale_1x128x128_256x64x64x256_16x16_32x32_1x1_16x16x1_16x16x1_1x32x1x8_8_1x1_intrawave_v1,870.88,708.73,0.0
gfx950,256,1024,4096,3072,ck,0,0,27.3538,a8w8_blockscale_1x128x128_256x128x128x128_16x16_32x32_2x2_8x32x1_8x32x1_1x32x1x8_8_1x1_intrawave_v3,942.09,881.68,0.0
gfx950,256,1024,8192,3072,ck,0,0,46.0839,a8w8_blockscale_1x128x128_256x128x128x128_16x16_32x32_2x2_8x32x1_8x32x1_1x32x1x8_8_1x1_intrawave_v3,1118.39,978.41,0.0
gfx950,256,10240,2048,3072,ck,0,0,105.6922,a8w8_blockscale_1x128x128_256x128x128x128_16x16_32x32_2x2_8x32x1_8x32x1_1x32x1x8_8_1x1_intrawave_v3,1219.1,754.0,0.0
gfx950,256,10240,3072,3072,ck,0,0,152.806,a8w8_blockscale_1x128x128_256x128x128x128_16x16_32x32_2x2_8x32x1_8x32x1_1x32x1x8_8_1x1_intrawave_v3,1264.83,679.35,0.0
gfx950,256,10240,3072,6144,ck,0,0,276.0103,a8w8_blockscale_1x128x128_256x128x128x128_16x16_32x32_2x2_8x32x1_8x32x1_1x32x1x8_8_1x1_intrawave_v3,1400.48,524.27,0.0
gfx950,256,10240,4096,3072,ck,0,0,194.3191,a8w8_blockscale_1x128x128_256x128x128x128_16x16_32x32_2x2_8x32x1_8x32x1_1x32x1x8_8_1x1_intrawave_v3,1326.16,658.33,0.0
gfx950,256,10240,8192,3072,ck,0,0,362.0893,a8w8_blockscale_1x128x128_256x128x128x128_16x16_32x32_2x2_8x32x1_8x32x1_1x32x1x8_8_1x1_intrawave_v3,1423.39,619.72,0.0
gfx950,256,10242,3072,3072,ck,0,0,156.4722,a8w8_blockscale_1x128x128_256x128x128x128_16x16_32x32_2x2_8x32x1_8x32x1_1x32x1x8_8_1x1_intrawave_v3,1235.44,663.55,0.0
gfx950,256,10242,4096,3072,ck,0,0,205.1587,a8w8_blockscale_1x128x128_256x128x128x128_16x16_32x32_2x2_8x32x1_8x32x1_1x32x1x8_8_1x1_intrawave_v3,1256.34,623.66,0.0
gfx950,256,10243,3072,3072,ck,0,0,155.6173,a8w8_blockscale_1x128x128_256x128x128x128_16x16_32x32_2x2_8x32x1_8x32x1_1x32x1x8_8_1x1_intrawave_v3,1242.34,667.26,0.0
gfx950,256,10243,4096,3072,ck,0,0,205.3121,a8w8_blockscale_1x128x128_256x128x128x128_16x16_32x32_2x2_8x32x1_8x32x1_1x32x1x8_8_1x1_intrawave_v3,1255.52,623.25,0.0
gfx950,256,10244,2048,3072,ck,0,0,113.1386,a8w8_blockscale_1x128x128_256x128x128x128_16x16_32x32_2x2_8x32x1_8x32x1_1x32x1x8_8_1x1_intrawave_v3,1139.3,704.63,0.0
gfx950,256,10247,3072,3072,ck,0,0,156.5658,a8w8_blockscale_1x128x128_256x128x128x128_16x16_32x32_2x2_8x32x1_8x32x1_1x32x1x8_8_1x1_intrawave_v3,1235.3,663.45,0.0
gfx950,256,10247,4096,3072,ck,0,0,205.219,a8w8_blockscale_1x128x128_256x128x128x128_16x16_32x32_2x2_8x32x1_8x32x1_1x32x1x8_8_1x1_intrawave_v3,1256.58,623.75,0.0
gfx950,256,10248,2048,3072,ck,0,0,112.6382,a8w8_blockscale_1x128x128_256x128x128x128_16x16_32x32_2x2_8x32x1_8x32x1_1x32x1x8_8_1x1_intrawave_v3,1144.81,708.01,0.0
gfx950,256,10248,3072,3072,ck,0,0,152.7499,a8w8_blockscale_1x128x128_256x128x128x128_16x16_32x32_2x2_8x32x1_8x32x1_1x32x1x8_8_1x1_intrawave_v3,1266.28,680.08,0.0
gfx950,256,10248,4096,3072,ck,0,0,204.2622,a8w8_blockscale_1x128x128_256x128x128x128_16x16_32x32_2x2_8x32x1_8x32x1_1x32x1x8_8_1x1_intrawave_v3,1262.59,626.73,0.0
gfx950,256,10249,3072,3072,ck,0,0,153.4923,a8w8_blockscale_1x128x128_256x128x128x128_16x16_32x32_2x2_8x32x1_8x32x1_1x32x1x8_8_1x1_intrawave_v3,1260.28,676.85,0.0
gfx950,256,10249,4096,3072,ck,0,0,197.0018,a8w8_blockscale_1x128x128_256x128x128x128_16x16_32x32_2x2_8x32x1_8x32x1_1x32x1x8_8_1x1_intrawave_v3,1309.25,649.88,0.0
gfx950,256,1025,2048,3072,ck,18,0,22.4614,a8w8_blockscale_1x128x128_256x64x64x256_16x16_32x32_1x1_16x16x1_16x16x1_1x32x1x8_8_1x1_intrawave_v1,574.21,607.2,0.0
gfx950,256,10250,3072,3072,ck,0,0,155.857,a8w8_blockscale_1x128x128_256x128x128x128_16x16_32x32_2x2_8x32x1_8x32x1_1x32x1x8_8_1x1_intrawave_v3,1241.28,666.64,0.0
gfx950,256,10250,4096,3072,ck,0,0,201.4165,a8w8_blockscale_1x128x128_256x128x128x128_16x16_32x32_2x2_8x32x1_8x32x1_1x32x1x8_8_1x1_intrawave_v3,1280.68,635.69,0.0
gfx950,256,10251,3072,3072,ck,0,0,153.1228,a8w8_blockscale_1x128x128_256x128x128x128_16x16_32x32_2x2_8x32x1_8x32x1_1x32x1x8_8_1x1_intrawave_v3,1263.57,678.61,0.0
gfx950,256,10251,4096,3072,ck,0,0,195.7438,a8w8_blockscale_1x128x128_256x128x128x128_16x16_32x32_2x2_8x32x1_8x32x1_1x32x1x8_8_1x1_intrawave_v3,1317.92,654.17,0.0
gfx950,256,10252,3072,3072,ck,0,0,150.8535,a8w8_blockscale_1x128x128_256x128x128x128_16x16_32x32_2x2_8x32x1_8x32x1_1x32x1x8_8_1x1_intrawave_v3,1282.7,688.88,0.0
gfx950,256,10252,4096,3072,ck,0,0,201.0679,a8w8_blockscale_1x128x128_256x128x128x128_16x16_32x32_2x2_8x32x1_8x32x1_1x32x1x8_8_1x1_intrawave_v3,1283.15,636.91,0.0
gfx950,256,10253,3072,6144,ck,0,0,286.8021,a8w8_blockscale_1x128x128_256x128x128x128_16x16_32x32_2x2_8x32x1_8x32x1_1x32x1x8_8_1x1_intrawave_v3,1349.49,505.1,0.0
gfx950,256,10253,8192,3072,ck,0,0,369.1237,a8w8_blockscale_1x128x128_256x128x128x128_16x16_32x32_2x2_8x32x1_8x32x1_1x32x1x8_8_1x1_intrawave_v3,1398.04,608.6,0.0
gfx950,256,10254,3072,3072,ck,0,0,152.0929,a8w8_blockscale_1x128x128_256x128x128x128_16x16_32x32_2x2_8x32x1_8x32x1_1x32x1x8_8_1x1_intrawave_v3,1272.5,683.39,0.0
gfx950,256,10254,4096,3072,ck,0,0,201.2244,a8w8_blockscale_1x128x128_256x128x128x128_16x16_32x32_2x2_8x32x1_8x32x1_1x32x1x8_8_1x1_intrawave_v3,1282.4,636.52,0.0
gfx950,256,10255,2048,3072,ck,0,0,112.1419,a8w8_blockscale_1x128x128_256x128x128x128_16x16_32x32_2x2_8x32x1_8x32x1_1x32x1x8_8_1x1_intrawave_v3,1150.67,711.59,0.0
gfx950,256,10255,3072,3072,ck,0,0,153.393,a8w8_blockscale_1x128x128_256x128x128x128_16x16_32x32_2x2_8x32x1_8x32x1_1x32x1x8_8_1x1_intrawave_v3,1261.83,677.65,0.0
gfx950,256,10255,4096,3072,ck,0,0,200.8479,a8w8_blockscale_1x128x128_256x128x128x128_16x16_32x32_2x2_8x32x1_8x32x1_1x32x1x8_8_1x1_intrawave_v3,1284.93,637.77,0.0
gfx950,256,10256,3072,3072,ck,0,0,152.8695,a8w8_blockscale_1x128x128_256x128x128x128_16x16_32x32_2x2_8x32x1_8x32x1_1x32x1x8_8_1x1_intrawave_v3,1266.28,680.03,0.0
gfx950,256,10256,4096,3072,ck,0,0,203.9066,a8w8_blockscale_1x128x128_256x128x128x128_16x16_32x32_2x2_8x32x1_8x32x1_1x32x1x8_8_1x1_intrawave_v3,1265.78,628.26,0.0
gfx950,256,10258,3072,3072,ck,0,0,156.0827,a8w8_blockscale_1x128x128_256x128x128x128_16x16_32x32_2x2_8x32x1_8x32x1_1x32x1x8_8_1x1_intrawave_v3,1240.45,666.15,0.0
gfx950,256,10258,4096,3072,ck,0,0,201.4596,a8w8_blockscale_1x128x128_256x128x128x128_16x16_32x32_2x2_8x32x1_8x32x1_1x32x1x8_8_1x1_intrawave_v3,1281.4,636.0,0.0
gfx950,256,10259,3072,3072,ck,0,0,155.1534,a8w8_blockscale_1x128x128_256x128x128x128_16x16_32x32_2x2_8x32x1_8x32x1_1x32x1x8_8_1x1_intrawave_v3,1248.0,670.2,0.0
gfx950,256,10259,4096,3072,ck,0,0,205.389,a8w8_blockscale_1x128x128_256x128x128x128_16x16_32x32_2x2_8x32x1_8x32x1_1x32x1x8_8_1x1_intrawave_v3,1257.01,623.89,0.0
gfx950,256,10264,3072,6144,ck,0,0,287.0047,a8w8_blockscale_1x128x128_256x128x128x128_16x16_32x32_2x2_8x32x1_8x32x1_1x32x1x8_8_1x1_intrawave_v3,1349.99,505.21,0.0
gfx950,256,10264,8192,3072,ck,0,0,375.5123,a8w8_blockscale_1x128x128_256x128x128x128_16x16_32x32_2x2_8x32x1_8x32x1_1x32x1x8_8_1x1_intrawave_v3,1375.73,598.81,0.0
gfx950,256,10265,3072,6144,ck,0,0,286.4663,a8w8_blockscale_1x128x128_256x128x128x128_16x16_32x32_2x2_8x32x1_8x32x1_1x32x1x8_8_1x1_intrawave_v3,1352.66,506.21,0.0
gfx950,256,10265,8192,3072,ck,0,0,363.7954,a8w8_blockscale_1x128x128_256x128x128x128_16x16_32x32_2x2_8x32x1_8x32x1_1x32x1x8_8_1x1_intrawave_v3,1420.18,618.15,0.0
gfx950,256,10266,3072,3072,ck,0,0,154.8413,a8w8_blockscale_1x128x128_256x128x128x128_16x16_32x32_2x2_8x32x1_8x32x1_1x32x1x8_8_1x1_intrawave_v3,1251.37,671.97,0.0
gfx950,256,10266,4096,3072,ck,0,0,202.9645,a8w8_blockscale_1x128x128_256x128x128x128_16x16_32x32_2x2_8x32x1_8x32x1_1x32x1x8_8_1x1_intrawave_v3,1272.89,631.73,0.0
gfx950,256,10268,3072,3072,ck,0,0,152.8451,a8w8_blockscale_1x128x128_256x128x128x128_16x16_32x32_2x2_8x32x1_8x32x1_1x32x1x8_8_1x1_intrawave_v3,1267.96,680.87,0.0
gfx950,256,10268,4096,3072,ck,0,0,196.5313,a8w8_blockscale_1x128x128_256x128x128x128_16x16_32x32_2x2_8x32x1_8x32x1_1x32x1x8_8_1x1_intrawave_v3,1314.82,652.53,0.0
gfx950,256,10269,3072,6144,ck,0,0,286.4258,a8w8_blockscale_1x128x128_256x128x128x128_16x16_32x32_2x2_8x32x1_8x32x1_1x32x1x8_8_1x1_intrawave_v3,1353.38,506.45,0.0
gfx950,256,10269,8192,3072,ck,0,0,370.9263,a8w8_blockscale_1x128x128_256x128x128x128_16x16_32x32_2x2_8x32x1_8x32x1_1x32x1x8_8_1x1_intrawave_v3,1393.42,606.48,0.0
gfx950,256,10270,3072,6144,ck,0,0,285.6596,a8w8_blockscale_1x128x128_256x128x128x128_16x16_32x32_2x2_8x32x1_8x32x1_1x32x1x8_8_1x1_intrawave_v3,1357.14,507.85,0.0
gfx950,256,10270,8192,3072,ck,0,0,372.3276,a8w8_blockscale_1x128x128_256x128x128x128_16x16_32x32_2x2_8x32x1_8x32x1_1x32x1x8_8_1x1_intrawave_v3,1388.31,604.25,0.0
gfx950,256,10271,3072,6144,ck,0,0,282.2021,a8w8_blockscale_1x128x128_256x128x128x128_16x16_32x32_2x2_8x32x1_8x32x1_1x32x1x8_8_1x1_intrawave_v3,1373.9,514.12,0.0
gfx950,256,10271,8192,3072,ck,0,0,367.7935,a8w8_blockscale_1x128x128_256x128x128x128_16x16_32x32_2x2_8x32x1_8x32x1_1x32x1x8_8_1x1_intrawave_v3,1405.56,611.75,0.0
gfx950,256,10272,3072,3072,ck,0,0,154.4063,a8w8_blockscale_1x128x128_256x128x128x128_16x16_32x32_2x2_8x32x1_8x32x1_1x32x1x8_8_1x1_intrawave_v3,1255.63,674.22,0.0
gfx950,256,10272,3072,6144,ck,0,0,283.035,a8w8_blockscale_1x128x128_256x128x128x128_16x16_32x32_2x2_8x32x1_8x32x1_1x32x1x8_8_1x1_intrawave_v3,1369.99,512.65,0.0
gfx950,256,10272,4096,3072,ck,0,0,201.416,a8w8_blockscale_1x128x128_256x128x128x128_16x16_32x32_2x2_8x32x1_8x32x1_1x32x1x8_8_1x1_intrawave_v3,1283.43,636.92,0.0
gfx950,256,10272,8192,3072,ck,0,0,375.1879,a8w8_blockscale_1x128x128_256x128x128x128_16x16_32x32_2x2_8x32x1_8x32x1_1x32x1x8_8_1x1_intrawave_v3,1377.99,599.75,0.0
gfx950,256,10274,3072,3072,ck,0,0,154.1641,a8w8_blockscale_1x128x128_256x128x128x128_16x16_32x32_2x2_8x32x1_8x32x1_1x32x1x8_8_1x1_intrawave_v3,1257.85,675.4,0.0
gfx950,256,10274,4096,3072,ck,0,0,205.9142,a8w8_blockscale_1x128x128_256x128x128x128_16x16_32x32_2x2_8x32x1_8x32x1_1x32x1x8_8_1x1_intrawave_v3,1255.64,623.12,0.0
gfx950,256,10276,3072,3072,ck,0,0,154.4604,a8w8_blockscale_1x128x128_256x128x128x128_16x16_32x32_2x2_8x32x1_8x32x1_1x32x1x8_8_1x1_intrawave_v3,1255.68,674.22,0.0
gfx950,256,10276,4096,3072,ck,0,0,205.6865,a8w8_blockscale_1x128x128_256x128x128x128_16x16_32x32_2x2_8x32x1_8x32x1_1x32x1x8_8_1x1_intrawave_v3,1257.27,623.92,0.0
gfx950,256,10277,3072,3072,ck,0,0,155.6128,a8w8_blockscale_1x128x128_256x128x128x128_16x16_32x32_2x2_8x32x1_8x32x1_1x32x1x8_8_1x1_intrawave_v3,1246.5,669.29,0.0
gfx950,256,10277,4096,3072,ck,0,0,198.6764,a8w8_blockscale_1x128x128_256x128x128x128_16x16_32x32_2x2_8x32x1_8x32x1_1x32x1x8_8_1x1_intrawave_v3,1301.76,645.99,0.0
gfx950,256,10278,3072,3072,ck,0,0,153.3061,a8w8_blockscale_1x128x128_256x128x128x128_16x16_32x32_2x2_8x32x1_8x32x1_1x32x1x8_8_1x1_intrawave_v3,1265.38,679.42,0.0
gfx950,256,10278,4096,3072,ck,0,0,197.9675,a8w8_blockscale_1x128x128_256x128x128x128_16x16_32x32_2x2_8x32x1_8x32x1_1x32x1x8_8_1x1_intrawave_v3,1306.55,648.36,0.0
gfx950,256,10279,3072,3072,ck,0,0,153.5109,a8w8_blockscale_1x128x128_256x128x128x128_16x16_32x32_2x2_8x32x1_8x32x1_1x32x1x8_8_1x1_intrawave_v3,1263.82,678.57,0.0
gfx950,256,10279,4096,3072,ck,0,0,201.4438,a8w8_blockscale_1x128x128_256x128x128x128_16x16_32x32_2x2_8x32x1_8x32x1_1x32x1x8_8_1x1_intrawave_v3,1284.13,637.23,0.0
gfx950,256,1028,3072,6144,ck,0,0,46.4487,a8w8_blockscale_1x128x128_256x128x128x128_16x16_32x32_2x2_8x32x1_8x32x1_1x32x1x8_8_1x1_intrawave_v3,835.45,678.31,0.0
gfx950,256,1028,8192,3072,ck,0,0,60.1392,a8w8_blockscale_1x128x128_256x128x128x128_16x16_32x32_2x2_8x32x1_8x32x1_1x32x1x8_8_1x1_intrawave_v3,860.35,751.03,0.0
gfx950,256,10281,3072,3072,ck,0,0,152.24,a8w8_blockscale_1x128x128_256x128x128x128_16x16_32x32_2x2_8x32x1_8x32x1_1x32x1x8_8_1x1_intrawave_v3,1274.61,684.36,0.0
gfx950,256,10281,4096,3072,ck,0,0,204.5025,a8w8_blockscale_1x128x128_256x128x128x128_16x16_32x32_2x2_8x32x1_8x32x1_1x32x1x8_8_1x1_intrawave_v3,1265.17,627.81,0.0
gfx950,256,10282,3072,3072,ck,0,0,154.0646,a8w8_blockscale_1x128x128_256x128x128x128_16x16_32x32_2x2_8x32x1_8x32x1_1x32x1x8_8_1x1_intrawave_v3,1259.64,676.31,0.0
gfx950,256,10282,4096,3072,ck,0,0,203.8826,a8w8_blockscale_1x128x128_256x128x128x128_16x16_32x32_2x2_8x32x1_8x32x1_1x32x1x8_8_1x1_intrawave_v3,1269.14,629.77,0.0
gfx950,256,10283,3072,3072,ck,0,0,150.9169,a8w8_blockscale_1x128x128_256x128x128x128_16x16_32x32_2x2_8x32x1_8x32x1_1x32x1x8_8_1x1_intrawave_v3,1286.04,690.48,0.0
gfx950,256,10283,3072,6144,ck,0,0,286.3787,a8w8_blockscale_1x128x128_256x128x128x128_16x16_32x32_2x2_8x32x1_8x32x1_1x32x1x8_8_1x1_intrawave_v3,1355.44,507.13,0.0
gfx950,256,10283,4096,3072,ck,0,0,204.2522,a8w8_blockscale_1x128x128_256x128x128x128_16x16_32x32_2x2_8x32x1_8x32x1_1x32x1x8_8_1x1_intrawave_v3,1266.96,628.69,0.0
gfx950,256,10283,8192,3072,ck,0,0,371.2894,a8w8_blockscale_1x128x128_256x128x128x128_16x16_32x32_2x2_8x32x1_8x32x1_1x32x1x8_8_1x1_intrawave_v3,1393.95,606.62,0.0
gfx950,256,10284,3072,3072,ck,0,0,154.5955,a8w8_blockscale_1x128x128_256x128x128x128_16x16_32x32_2x2_8x32x1_8x32x1_1x32x1x8_8_1x1_intrawave_v3,1255.56,674.11,0.0
gfx950,256,10284,4096,3072,ck,0,0,204.0726,a8w8_blockscale_1x128x128_256x128x128x128_16x16_32x32_2x2_8x32x1_8x32x1_1x32x1x8_8_1x1_intrawave_v3,1268.2,629.3,0.0
gfx950,256,10285,3072,3072,ck,0,0,154.7098,a8w8_blockscale_1x128x128_256x128x128x128_16x16_32x32_2x2_8x32x1_8x32x1_1x32x1x8_8_1x1_intrawave_v3,1254.75,673.67,0.0
gfx950,256,10285,4096,3072,ck,0,0,204.0693,a8w8_blockscale_1x128x128_256x128x128x128_16x16_32x32_2x2_8x32x1_8x32x1_1x32x1x8_8_1x1_intrawave_v3,1268.35,629.36,0.0
gfx950,256,10286,3072,3072,ck,0,0,153.3993,a8w8_blockscale_1x128x128_256x128x128x128_16x16_32x32_2x2_8x32x1_8x32x1_1x32x1x8_8_1x1_intrawave_v3,1265.6,679.49,0.0
gfx950,256,10286,4096,3072,ck,0,0,198.2323,a8w8_blockscale_1x128x128_256x128x128x128_16x16_32x32_2x2_8x32x1_8x32x1_1x32x1x8_8_1x1_intrawave_v3,1305.82,647.95,0.0
gfx950,256,10287,3072,3072,ck,0,0,154.5135,a8w8_blockscale_1x128x128_256x128x128x128_16x16_32x32_2x2_8x32x1_8x32x1_1x32x1x8_8_1x1_intrawave_v3,1256.59,674.65,0.0
gfx950,256,10287,4096,3072,ck,0,0,205.8253,a8w8_blockscale_1x128x128_256x128x128x128_16x16_32x32_2x2_8x32x1_8x32x1_1x32x1x8_8_1x1_intrawave_v3,1257.77,624.1,0.0
gfx950,256,10288,3072,3072,ck,0,0,154.0884,a8w8_blockscale_1x128x128_256x128x128x128_16x16_32x32_2x2_8x32x1_8x32x1_1x32x1x8_8_1x1_intrawave_v3,1260.18,676.57,0.0
gfx950,256,10288,4096,3072,ck,0,0,202.099,a8w8_blockscale_1x128x128_256x128x128x128_16x16_32x32_2x2_8x32x1_8x32x1_1x32x1x8_8_1x1_intrawave_v3,1281.08,635.66,0.0
gfx950,256,1029,2048,3072,ck,18,0,22.5897,a8w8_blockscale_1x128x128_256x64x64x256_16x16_32x32_1x1_16x16x1_16x16x1_1x32x1x8_8_1x1_intrawave_v1,573.17,605.02,0.0
gfx950,256,1029,3072,6144,ck,0,0,46.2616,a8w8_blockscale_1x128x128_256x128x128x128_16x16_32x32_2x2_8x32x1_8x32x1_1x32x1x8_8_1x1_intrawave_v3,839.65,681.31,0.0
gfx950,256,1029,8192,3072,ck,0,0,60.2554,a8w8_blockscale_1x128x128_256x128x128x128_16x16_32x32_2x2_8x32x1_8x32x1_1x32x1x8_8_1x1_intrawave_v3,859.53,749.91,0.0
gfx950,256,10291,3072,3072,ck,0,0,153.3794,a8w8_blockscale_1x128x128_256x128x128x128_16x16_32x32_2x2_8x32x1_8x32x1_1x32x1x8_8_1x1_intrawave_v3,1266.38,679.88,0.0
gfx950,256,10291,4096,3072,ck,0,0,216.7893,a8w8_blockscale_1x128x128_256x128x128x128_16x16_32x32_2x2_8x32x1_8x32x1_1x32x1x8_8_1x1_intrawave_v3,1194.62,592.74,0.0
gfx950,256,10294,3072,3072,ck,0,0,164.0657,a8w8_blockscale_1x128x128_256x128x128x128_16x16_32x32_2x2_8x32x1_8x32x1_1x32x1x8_8_1x1_intrawave_v3,1184.24,635.76,0.0
gfx950,256,10294,4096,3072,ck,0,0,216.0766,a8w8_blockscale_1x128x128_256x128x128x128_16x16_32x32_2x2_8x32x1_8x32x1_1x32x1x8_8_1x1_intrawave_v3,1198.91,594.86,0.0
gfx950,256,10296,3072,3072,ck,0,0,164.9679,a8w8_blockscale_1x128x128_256x128x128x128_16x16_32x32_2x2_8x32x1_8x32x1_1x32x1x8_8_1x1_intrawave_v3,1177.99,632.4,0.0
gfx950,256,10296,4096,3072,ck,0,0,213.316,a8w8_blockscale_1x128x128_256x128x128x128_16x16_32x32_2x2_8x32x1_8x32x1_1x32x1x8_8_1x1_intrawave_v3,1214.66,602.66,0.0
gfx950,256,10297,3072,3072,ck,0,0,165.0741,a8w8_blockscale_1x128x128_256x128x128x128_16x16_32x32_2x2_8x32x1_8x32x1_1x32x1x8_8_1x1_intrawave_v3,1177.35,632.05,0.0
gfx950,256,10297,4096,3072,ck,0,0,215.1221,a8w8_blockscale_1x128x128_256x128x128x128_16x16_32x32_2x2_8x32x1_8x32x1_1x32x1x8_8_1x1_intrawave_v3,1204.58,597.65,0.0
gfx950,256,10298,3072,3072,ck,0,0,166.7876,a8w8_blockscale_1x128x128_256x128x128x128_16x16_32x32_2x2_8x32x1_8x32x1_1x32x1x8_8_1x1_intrawave_v3,1165.36,625.61,0.0
gfx950,256,10298,4096,3072,ck,0,0,202.6478,a8w8_blockscale_1x128x128_256x128x128x128_16x16_32x32_2x2_8x32x1_8x32x1_1x32x1x8_8_1x1_intrawave_v3,1278.86,634.5,0.0
gfx950,256,10299,3072,3072,ck,0,0,153.1488,a8w8_blockscale_1x128x128_256x128x128x128_16x16_32x32_2x2_8x32x1_8x32x1_1x32x1x8_8_1x1_intrawave_v3,1269.27,681.38,0.0
gfx950,256,10299,4096,3072,ck,0,0,203.6793,a8w8_blockscale_1x128x128_256x128x128x128_16x16_32x32_2x2_8x32x1_8x32x1_1x32x1x8_8_1x1_intrawave_v3,1272.5,631.34,0.0
gfx950,256,1030,2048,3072,ck,18,0,22.5738,a8w8_blockscale_1x128x128_256x64x64x256_16x16_32x32_1x1_16x16x1_16x16x1_1x32x1x8_8_1x1_intrawave_v1,574.13,605.77,0.0
gfx950,256,1030,3072,3072,ck,0,0,26.5742,a8w8_blockscale_1x128x128_256x128x128x128_16x16_32x32_2x2_8x32x1_8x32x1_1x32x1x8_8_1x1_intrawave_v3,731.56,712.33,0.0
gfx950,256,1030,4096,3072,ck,18,0,35.5428,a8w8_blockscale_1x128x128_256x64x64x256_16x16_32x32_1x1_16x16x1_16x16x1_1x32x1x8_8_1x1_intrawave_v1,729.28,680.44,0.0
gfx950,256,10300,3072,3072,ck,0,0,151.4541,a8w8_blockscale_1x128x128_256x128x128x128_16x16_32x32_2x2_8x32x1_8x32x1_1x32x1x8_8_1x1_intrawave_v3,1283.6,689.07,0.0
gfx950,256,10300,4096,3072,ck,0,0,197.8139,a8w8_blockscale_1x128x128_256x128x128x128_16x16_32x32_2x2_8x32x1_8x32x1_1x32x1x8_8_1x1_intrawave_v3,1310.36,650.12,0.0
gfx950,256,10301,3072,3072,ck,0,0,155.6938,a8w8_blockscale_1x128x128_256x128x128x128_16x16_32x32_2x2_8x32x1_8x32x1_1x32x1x8_8_1x1_intrawave_v3,1248.76,670.36,0.0
gfx950,256,10301,4096,3072,ck,0,0,198.9277,a8w8_blockscale_1x128x128_256x128x128x128_16x16_32x32_2x2_8x32x1_8x32x1_1x32x1x8_8_1x1_intrawave_v3,1303.15,646.53,0.0
gfx950,256,10302,3072,3072,ck,0,0,152.9371,a8w8_blockscale_1x128x128_256x128x128x128_16x16_32x32_2x2_8x32x1_8x32x1_1x32x1x8_8_1x1_intrawave_v3,1271.4,682.51,0.0
gfx950,256,10302,4096,3072,ck,0,0,199.7802,a8w8_blockscale_1x128x128_256x128x128x128_16x16_32x32_2x2_8x32x1_8x32x1_1x32x1x8_8_1x1_intrawave_v3,1297.72,643.83,0.0
gfx950,256,10303,3072,3072,ck,0,0,151.6134,a8w8_blockscale_1x128x128_256x128x128x128_16x16_32x32_2x2_8x32x1_8x32x1_1x32x1x8_8_1x1_intrawave_v3,1282.62,688.53,0.0
gfx950,256,10303,4096,3072,ck,0,0,197.3123,a8w8_blockscale_1x128x128_256x128x128x128_16x16_32x32_2x2_8x32x1_8x32x1_1x32x1x8_8_1x1_intrawave_v3,1314.08,651.94,0.0
gfx950,256,10304,3072,3072,ck,0,0,153.8452,a8w8_blockscale_1x128x128_256x128x128x128_16x16_32x32_2x2_8x32x1_8x32x1_1x32x1x8_8_1x1_intrawave_v3,1264.14,678.6,0.0
gfx950,256,10304,4096,3072,ck,0,0,202.7928,a8w8_blockscale_1x128x128_256x128x128x128_16x16_32x32_2x2_8x32x1_8x32x1_1x32x1x8_8_1x1_intrawave_v3,1278.69,634.38,0.0
gfx950,256,10305,3072,3072,ck,0,0,150.4801,a8w8_blockscale_1x128x128_256x128x128x128_16x16_32x32_2x2_8x32x1_8x32x1_1x32x1x8_8_1x1_intrawave_v3,1292.53,693.83,0.0
gfx950,256,10305,4096,3072,ck,0,0,202.3954,a8w8_blockscale_1x128x128_256x128x128x128_16x16_32x32_2x2_8x32x1_8x32x1_1x32x1x8_8_1x1_intrawave_v3,1281.32,635.68,0.0
gfx950,256,10309,3072,3072,ck,0,0,155.1114,a8w8_blockscale_1x128x128_256x128x128x128_16x16_32x32_2x2_8x32x1_8x32x1_1x32x1x8_8_1x1_intrawave_v3,1254.43,673.35,0.0
gfx950,256,10309,4096,3072,ck,0,0,200.8374,a8w8_blockscale_1x128x128_256x128x128x128_16x16_32x32_2x2_8x32x1_8x32x1_1x32x1x8_8_1x1_intrawave_v3,1291.76,640.83,0.0
gfx950,256,1031,2048,3072,ck,18,0,22.7414,a8w8_blockscale_1x128x128_256x64x64x256_16x16_32x32_1x1_16x16x1_16x16x1_1x32x1x8_8_1x1_intrawave_v1,570.46,601.62,0.0
gfx950,256,1031,3072,3072,ck,0,0,26.5728,a8w8_blockscale_1x128x128_256x128x128x128_16x16_32x32_2x2_8x32x1_8x32x1_1x32x1x8_8_1x1_intrawave_v3,732.31,712.72,0.0
gfx950,256,1031,3072,6144,ck,0,0,46.5757,a8w8_blockscale_1x128x128_256x128x128x128_16x16_32x32_2x2_8x32x1_8x32x1_1x32x1x8_8_1x1_intrawave_v3,835.61,677.25,0.0
gfx950,256,1031,4096,3072,ck,18,0,35.4684,a8w8_blockscale_1x128x128_256x64x64x256_16x16_32x32_1x1_16x16x1_16x16x1_1x32x1x8_8_1x1_intrawave_v1,731.52,682.19,0.0
gfx950,256,1031,8192,3072,ck,0,0,60.2029,a8w8_blockscale_1x128x128_256x128x128x128_16x16_32x32_2x2_8x32x1_8x32x1_1x32x1x8_8_1x1_intrawave_v3,861.95,751.21,0.0
gfx950,256,10310,3072,3072,ck,0,0,154.4223,a8w8_blockscale_1x128x128_256x128x128x128_16x16_32x32_2x2_8x32x1_8x32x1_1x32x1x8_8_1x1_intrawave_v3,1260.15,676.42,0.0
gfx950,256,10310,4096,3072,ck,0,0,202.9845,a8w8_blockscale_1x128x128_256x128x128x128_16x16_32x32_2x2_8x32x1_8x32x1_1x32x1x8_8_1x1_intrawave_v3,1278.22,634.11,0.0
gfx950,256,10311,3072,3072,ck,0,0,154.6156,a8w8_blockscale_1x128x128_256x128x128x128_16x16_32x32_2x2_8x32x1_8x32x1_1x32x1x8_8_1x1_intrawave_v3,1258.69,675.63,0.0
gfx950,256,10311,4096,3072,ck,0,0,203.1926,a8w8_blockscale_1x128x128_256x128x128x128_16x16_32x32_2x2_8x32x1_8x32x1_1x32x1x8_8_1x1_intrawave_v3,1277.04,633.52,0.0
gfx950,256,10312,3072,3072,ck,0,0,154.4894,a8w8_blockscale_1x128x128_256x128x128x128_16x16_32x32_2x2_8x32x1_8x32x1_1x32x1x8_8_1x1_intrawave_v3,1259.84,676.24,0.0
gfx950,256,10312,4096,3072,ck,0,0,205.0313,a8w8_blockscale_1x128x128_256x128x128x128_16x16_32x32_2x2_8x32x1_8x32x1_1x32x1x8_8_1x1_intrawave_v3,1265.71,627.89,0.0
gfx950,256,10316,3072,3072,ck,0,0,154.9891,a8w8_blockscale_1x128x128_256x128x128x128_16x16_32x32_2x2_8x32x1_8x32x1_1x32x1x8_8_1x1_intrawave_v3,1256.27,674.3,0.0
gfx950,256,10316,4096,3072,ck,0,0,200.6781,a8w8_blockscale_1x128x128_256x128x128x128_16x16_32x32_2x2_8x32x1_8x32x1_1x32x1x8_8_1x1_intrawave_v3,1293.67,641.74,0.0
gfx950,256,10318,3072,3072,ck,0,0,152.9114,a8w8_blockscale_1x128x128_256x128x128x128_16x16_32x32_2x2_8x32x1_8x32x1_1x32x1x8_8_1x1_intrawave_v3,1273.59,683.58,0.0
gfx950,256,10318,4096,3072,ck,0,0,198.2304,a8w8_blockscale_1x128x128_256x128x128x128_16x16_32x32_2x2_8x32x1_8x32x1_1x32x1x8_8_1x1_intrawave_v3,1309.89,649.77,0.0
gfx950,256,1032,2048,3072,ck,18,0,22.6189,a8w8_blockscale_1x128x128_256x64x64x256_16x16_32x32_1x1_16x16x1_16x16x1_1x32x1x8_8_1x1_intrawave_v1,574.1,605.19,0.0
gfx950,256,1032,3072,3072,ck,0,0,26.6175,a8w8_blockscale_1x128x128_256x128x128x128_16x16_32x32_2x2_8x32x1_8x32x1_1x32x1x8_8_1x1_intrawave_v3,731.79,711.87,0.0
gfx950,256,1032,4096,3072,ck,18,0,35.692,a8w8_blockscale_1x128x128_256x64x64x256_16x16_32x32_1x1_16x16x1_16x16x1_1x32x1x8_8_1x1_intrawave_v1,727.65,678.23,0.0
gfx950,256,10320,3072,3072,ck,0,0,153.5489,a8w8_blockscale_1x128x128_256x128x128x128_16x16_32x32_2x2_8x32x1_8x32x1_1x32x1x8_8_1x1_intrawave_v3,1268.54,680.87,0.0
gfx950,256,10320,4096,3072,ck,0,0,202.9849,a8w8_blockscale_1x128x128_256x128x128x128_16x16_32x32_2x2_8x32x1_8x32x1_1x32x1x8_8_1x1_intrawave_v3,1279.46,634.66,0.0
gfx950,256,10321,3072,3072,ck,0,0,154.0866,a8w8_blockscale_1x128x128_256x128x128x128_16x16_32x32_2x2_8x32x1_8x32x1_1x32x1x8_8_1x1_intrawave_v3,1264.24,678.55,0.0
gfx950,256,10321,4096,3072,ck,0,0,200.0872,a8w8_blockscale_1x128x128_256x128x128x128_16x16_32x32_2x2_8x32x1_8x32x1_1x32x1x8_8_1x1_intrawave_v3,1298.12,643.91,0.0
gfx950,256,10322,3072,3072,ck,0,0,156.0718,a8w8_blockscale_1x128x128_256x128x128x128_16x16_32x32_2x2_8x32x1_8x32x1_1x32x1x8_8_1x1_intrawave_v3,1248.28,669.98,0.0
gfx950,256,10322,4096,3072,ck,0,0,196.2361,a8w8_blockscale_1x128x128_256x128x128x128_16x16_32x32_2x2_8x32x1_8x32x1_1x32x1x8_8_1x1_intrawave_v3,1323.72,656.61,0.0
gfx950,256,10323,3072,3072,ck,0,0,152.7375,a8w8_blockscale_1x128x128_256x128x128x128_16x16_32x32_2x2_8x32x1_8x32x1_1x32x1x8_8_1x1_intrawave_v3,1275.65,684.66,0.0
gfx950,256,10323,4096,3072,ck,0,0,199.7875,a8w8_blockscale_1x128x128_256x128x128x128_16x16_32x32_2x2_8x32x1_8x32x1_1x32x1x8_8_1x1_intrawave_v3,1300.32,644.99,0.0
gfx950,256,10328,3072,3072,ck,0,0,153.8744,a8w8_blockscale_1x128x128_256x128x128x128_16x16_32x32_2x2_8x32x1_8x32x1_1x32x1x8_8_1x1_intrawave_v3,1266.84,679.91,0.0
gfx950,256,10328,4096,3072,ck,0,0,198.9799,a8w8_blockscale_1x128x128_256x128x128x128_16x16_32x32_2x2_8x32x1_8x32x1_1x32x1x8_8_1x1_intrawave_v3,1306.23,647.89,0.0
gfx950,256,10330,2048,3072,ck,0,0,113.3383,a8w8_blockscale_1x128x128_256x128x128x128_16x16_32x32_2x2_8x32x1_8x32x1_1x32x1x8_8_1x1_intrawave_v3,1146.85,708.82,0.0
gfx950,256,10331,3072,3072,ck,0,0,154.8857,a8w8_blockscale_1x128x128_256x128x128x128_16x16_32x32_2x2_8x32x1_8x32x1_1x32x1x8_8_1x1_intrawave_v3,1258.94,675.64,0.0
gfx950,256,10331,4096,3072,ck,0,0,198.5542,a8w8_blockscale_1x128x128_256x128x128x128_16x16_32x32_2x2_8x32x1_8x32x1_1x32x1x8_8_1x1_intrawave_v3,1309.41,649.45,0.0
gfx950,256,10332,2048,3072,ck,0,0,114.0949,a8w8_blockscale_1x128x128_256x128x128x128_16x16_32x32_2x2_8x32x1_8x32x1_1x32x1x8_8_1x1_intrawave_v3,1139.46,704.25,0.0
gfx950,256,10332,3072,3072,ck,0,0,154.6947,a8w8_blockscale_1x128x128_256x128x128x128_16x16_32x32_2x2_8x32x1_8x32x1_1x32x1x8_8_1x1_intrawave_v3,1260.61,676.54,0.0
gfx950,256,10332,4096,3072,ck,0,0,202.1746,a8w8_blockscale_1x128x128_256x128x128x128_16x16_32x32_2x2_8x32x1_8x32x1_1x32x1x8_8_1x1_intrawave_v3,1286.08,637.88,0.0
gfx950,256,10333,3072,3072,ck,0,0,155.9343,a8w8_blockscale_1x128x128_256x128x128x128_16x16_32x32_2x2_8x32x1_8x32x1_1x32x1x8_8_1x1_intrawave_v3,1250.71,671.22,0.0
gfx950,256,10333,4096,3072,ck,0,0,197.0044,a8w8_blockscale_1x128x128_256x128x128x128_16x16_32x32_2x2_8x32x1_8x32x1_1x32x1x8_8_1x1_intrawave_v3,1319.96,654.67,0.0
gfx950,256,10334,3072,3072,ck,0,0,156.4768,a8w8_blockscale_1x128x128_256x128x128x128_16x16_32x32_2x2_8x32x1_8x32x1_1x32x1x8_8_1x1_intrawave_v3,1246.5,668.95,0.0
gfx950,256,10334,4096,3072,ck,0,0,203.5722,a8w8_blockscale_1x128x128_256x128x128x128_16x16_32x32_2x2_8x32x1_8x32x1_1x32x1x8_8_1x1_intrawave_v3,1277.5,633.61,0.0
gfx950,256,10335,3072,3072,ck,0,0,151.382,a8w8_blockscale_1x128x128_256x128x128x128_16x16_32x32_2x2_8x32x1_8x32x1_1x32x1x8_8_1x1_intrawave_v3,1288.57,691.53,0.0
gfx950,256,10335,4096,3072,ck,0,0,201.9352,a8w8_blockscale_1x128x128_256x128x128x128_16x16_32x32_2x2_8x32x1_8x32x1_1x32x1x8_8_1x1_intrawave_v3,1287.98,638.8,0.0
gfx950,256,10336,3072,3072,ck,0,0,154.4737,a8w8_blockscale_1x128x128_256x128x128x128_16x16_32x32_2x2_8x32x1_8x32x1_1x32x1x8_8_1x1_intrawave_v3,1262.9,677.74,0.0
gfx950,256,10336,4096,3072,ck,0,0,197.612,a8w8_blockscale_1x128x128_256x128x128x128_16x16_32x32_2x2_8x32x1_8x32x1_1x32x1x8_8_1x1_intrawave_v3,1316.29,652.83,0.0
gfx950,256,10337,3072,3072,ck,0,0,154.9258,a8w8_blockscale_1x128x128_256x128x128x128_16x16_32x32_2x2_8x32x1_8x32x1_1x32x1x8_8_1x1_intrawave_v3,1259.34,675.83,0.0
gfx950,256,10337,4096,3072,ck,0,0,202.5383,a8w8_blockscale_1x128x128_256x128x128x128_16x16_32x32_2x2_8x32x1_8x32x1_1x32x1x8_8_1x1_intrawave_v3,1284.39,637.01,0.0
gfx950,256,10338,3072,3072,ck,0,0,154.0485,a8w8_blockscale_1x128x128_256x128x128x128_16x16_32x32_2x2_8x32x1_8x32x1_1x32x1x8_8_1x1_intrawave_v3,1266.63,679.74,0.0
gfx950,256,10338,4096,3072,ck,0,0,201.3875,a8w8_blockscale_1x128x128_256x128x128x128_16x16_32x32_2x2_8x32x1_8x32x1_1x32x1x8_8_1x1_intrawave_v3,1291.86,640.71,0.0
gfx950,256,10339,3072,3072,ck,0,0,152.9033,a8w8_blockscale_1x128x128_256x128x128x128_16x16_32x32_2x2_8x32x1_8x32x1_1x32x1x8_8_1x1_intrawave_v3,1276.25,684.89,0.0
gfx950,256,10339,4096,3072,ck,0,0,200.1835,a8w8_blockscale_1x128x128_256x128x128x128_16x16_32x32_2x2_8x32x1_8x32x1_1x32x1x8_8_1x1_intrawave_v3,1299.75,644.62,0.0
gfx950,256,1034,2048,3072,ck,18,0,22.7554,a8w8_blockscale_1x128x128_256x64x64x256_16x16_32x32_1x1_16x16x1_16x16x1_1x32x1x8_8_1x1_intrawave_v1,571.76,602.19,0.0
gfx950,256,1034,3072,6144,ck,0,0,46.6191,a8w8_blockscale_1x128x128_256x128x128x128_16x16_32x32_2x2_8x32x1_8x32x1_1x32x1x8_8_1x1_intrawave_v3,837.26,677.41,0.0
gfx950,256,1034,8192,3072,ck,0,0,60.4066,a8w8_blockscale_1x128x128_256x128x128x128_16x16_32x32_2x2_8x32x1_8x32x1_1x32x1x8_8_1x1_intrawave_v3,861.54,749.64,0.0
gfx950,256,10347,3072,3072,ck,0,0,155.8909,a8w8_blockscale_1x128x128_256x128x128x128_16x16_32x32_2x2_8x32x1_8x32x1_1x32x1x8_8_1x1_intrawave_v3,1252.75,672.23,0.0
gfx950,256,10347,4096,3072,ck,0,0,195.887,a8w8_blockscale_1x128x128_256x128x128x128_16x16_32x32_2x2_8x32x1_8x32x1_1x32x1x8_8_1x1_intrawave_v3,1329.29,659.21,0.0
gfx950,256,10349,2048,3072,ck,0,0,113.8629,a8w8_blockscale_1x128x128_256x128x128x128_16x16_32x32_2x2_8x32x1_8x32x1_1x32x1x8_8_1x1_intrawave_v3,1143.66,706.75,0.0
gfx950,256,10349,3072,3072,ck,0,0,153.3123,a8w8_blockscale_1x128x128_256x128x128x128_16x16_32x32_2x2_8x32x1_8x32x1_1x32x1x8_8_1x1_intrawave_v3,1274.07,683.66,0.0
gfx950,256,10349,4096,3072,ck,0,0,204.8203,a8w8_blockscale_1x128x128_256x128x128x128_16x16_32x32_2x2_8x32x1_8x32x1_1x32x1x8_8_1x1_intrawave_v3,1271.56,630.57,0.0
gfx950,256,10350,3072,3072,ck,0,0,151.0755,a8w8_blockscale_1x128x128_256x128x128x128_16x16_32x32_2x2_8x32x1_8x32x1_1x32x1x8_8_1x1_intrawave_v3,1293.06,693.84,0.0
gfx950,256,10350,4096,3072,ck,0,0,196.866,a8w8_blockscale_1x128x128_256x128x128x128_16x16_32x32_2x2_8x32x1_8x32x1_1x32x1x8_8_1x1_intrawave_v3,1323.06,656.11,0.0
gfx950,256,10351,2048,3072,ck,0,0,114.0239,a8w8_blockscale_1x128x128_256x128x128x128_16x16_32x32_2x2_8x32x1_8x32x1_1x32x1x8_8_1x1_intrawave_v3,1142.27,705.88,0.0
gfx950,256,10352,3072,3072,ck,0,0,156.0827,a8w8_blockscale_1x128x128_256x128x128x128_16x16_32x32_2x2_8x32x1_8x32x1_1x32x1x8_8_1x1_intrawave_v3,1251.82,671.7,0.0
gfx950,256,10352,4096,3072,ck,0,0,204.0533,a8w8_blockscale_1x128x128_256x128x128x128_16x16_32x32_2x2_8x32x1_8x32x1_1x32x1x8_8_1x1_intrawave_v3,1276.71,633.11,0.0
gfx950,256,10353,3072,3072,ck,0,0,153.5461,a8w8_blockscale_1x128x128_256x128x128x128_16x16_32x32_2x2_8x32x1_8x32x1_1x32x1x8_8_1x1_intrawave_v3,1272.62,682.86,0.0
gfx950,256,10353,4096,3072,ck,0,0,198.6622,a8w8_blockscale_1x128x128_256x128x128x128_16x16_32x32_2x2_8x32x1_8x32x1_1x32x1x8_8_1x1_intrawave_v3,1311.48,650.35,0.0
gfx950,256,10357,2048,3072,ck,0,0,112.8712,a8w8_blockscale_1x128x128_256x128x128x128_16x16_32x32_2x2_8x32x1_8x32x1_1x32x1x8_8_1x1_intrawave_v3,1154.6,713.47,0.0
gfx950,256,10357,3072,3072,ck,0,0,156.3876,a8w8_blockscale_1x128x128_256x128x128x128_16x16_32x32_2x2_8x32x1_8x32x1_1x32x1x8_8_1x1_intrawave_v3,1249.98,670.69,0.0
gfx950,256,10357,4096,3072,ck,0,0,204.2723,a8w8_blockscale_1x128x128_256x128x128x128_16x16_32x32_2x2_8x32x1_8x32x1_1x32x1x8_8_1x1_intrawave_v3,1275.96,632.71,0.0
gfx950,256,10358,3072,3072,ck,0,0,154.4071,a8w8_blockscale_1x128x128_256x128x128x128_16x16_32x32_2x2_8x32x1_8x32x1_1x32x1x8_8_1x1_intrawave_v3,1266.14,679.35,0.0
gfx950,256,10358,4096,3072,ck,0,0,205.0129,a8w8_blockscale_1x128x128_256x128x128x128_16x16_32x32_2x2_8x32x1_8x32x1_1x32x1x8_8_1x1_intrawave_v3,1271.47,630.47,0.0
gfx950,256,10359,2048,3072,ck,0,0,113.4486,a8w8_blockscale_1x128x128_256x128x128x128_16x16_32x32_2x2_8x32x1_8x32x1_1x32x1x8_8_1x1_intrawave_v3,1148.95,709.97,0.0
gfx950,256,10359,3072,3072,ck,0,0,152.5988,a8w8_blockscale_1x128x128_256x128x128x128_16x16_32x32_2x2_8x32x1_8x32x1_1x32x1x8_8_1x1_intrawave_v3,1281.27,687.46,0.0
gfx950,256,10359,4096,3072,ck,0,0,201.7449,a8w8_blockscale_1x128x128_256x128x128x128_16x16_32x32_2x2_8x32x1_8x32x1_1x32x1x8_8_1x1_intrawave_v3,1292.19,640.74,0.0
gfx950,256,10360,2048,3072,ck,0,0,113.653,a8w8_blockscale_1x128x128_256x128x128x128_16x16_32x32_2x2_8x32x1_8x32x1_1x32x1x8_8_1x1_intrawave_v3,1146.99,708.75,0.0
gfx950,256,10360,3072,3072,ck,0,0,155.4554,a8w8_blockscale_1x128x128_256x128x128x128_16x16_32x32_2x2_8x32x1_8x32x1_1x32x1x8_8_1x1_intrawave_v3,1257.84,674.89,0.0
gfx950,256,10360,4096,3072,ck,0,0,200.6889,a8w8_blockscale_1x128x128_256x128x128x128_16x16_32x32_2x2_8x32x1_8x32x1_1x32x1x8_8_1x1_intrawave_v3,1299.11,644.17,0.0
gfx950,256,10361,3072,3072,ck,0,0,153.9517,a8w8_blockscale_1x128x128_256x128x128x128_16x16_32x32_2x2_8x32x1_8x32x1_1x32x1x8_8_1x1_intrawave_v3,1270.25,681.54,0.0
gfx950,256,10361,4096,3072,ck,0,0,204.288,a8w8_blockscale_1x128x128_256x128x128x128_16x16_32x32_2x2_8x32x1_8x32x1_1x32x1x8_8_1x1_intrawave_v3,1276.35,632.88,0.0
gfx950,256,10364,2048,3072,ck,0,0,113.1396,a8w8_blockscale_1x128x128_256x128x128x128_16x16_32x32_2x2_8x32x1_8x32x1_1x32x1x8_8_1x1_intrawave_v3,1152.64,712.22,0.0
gfx950,256,10364,3072,3072,ck,0,0,154.5927,a8w8_blockscale_1x128x128_256x128x128x128_16x16_32x32_2x2_8x32x1_8x32x1_1x32x1x8_8_1x1_intrawave_v3,1265.35,678.89,0.0
gfx950,256,10364,4096,3072,ck,0,0,202.4587,a8w8_blockscale_1x128x128_256x128x128x128_16x16_32x32_2x2_8x32x1_8x32x1_1x32x1x8_8_1x1_intrawave_v3,1288.26,638.76,0.0
gfx950,256,10365,3072,3072,ck,0,0,153.6894,a8w8_blockscale_1x128x128_256x128x128x128_16x16_32x32_2x2_8x32x1_8x32x1_1x32x1x8_8_1x1_intrawave_v3,1272.91,682.94,0.0
gfx950,256,10365,4096,3072,ck,0,0,199.732,a8w8_blockscale_1x128x128_256x128x128x128_16x16_32x32_2x2_8x32x1_8x32x1_1x32x1x8_8_1x1_intrawave_v3,1305.97,647.54,0.0
gfx950,256,10368,2048,3072,ck,0,0,113.6358,a8w8_blockscale_1x128x128_256x128x128x128_16x16_32x32_2x2_8x32x1_8x32x1_1x32x1x8_8_1x1_intrawave_v3,1148.05,709.37,0.0
gfx950,256,10368,3072,3072,ck,0,0,151.9465,a8w8_blockscale_1x128x128_256x128x128x128_16x16_32x32_2x2_8x32x1_8x32x1_1x32x1x8_8_1x1_intrawave_v3,1287.88,690.96,0.0
gfx950,256,10368,3072,6144,ck,0,0,285.1158,a8w8_blockscale_1x128x128_256x128x128x128_16x16_32x32_2x2_8x32x1_8x32x1_1x32x1x8_8_1x1_intrawave_v3,1372.7,513.04,0.0
gfx950,256,10368,4096,3072,ck,0,0,194.1935,a8w8_blockscale_1x128x128_256x128x128x128_16x16_32x32_2x2_8x32x1_8x32x1_1x32x1x8_8_1x1_intrawave_v3,1343.6,666.18,0.0
gfx950,256,10368,8192,3072,ck,0,0,368.8914,a8w8_blockscale_1x128x128_256x128x128x128_16x16_32x32_2x2_8x32x1_8x32x1_1x32x1x8_8_1x1_intrawave_v3,1414.61,615.05,0.0
gfx950,256,1037,3072,3072,ck,0,0,26.7102,a8w8_blockscale_1x128x128_256x128x128x128_16x16_32x32_2x2_8x32x1_8x32x1_1x32x1x8_8_1x1_intrawave_v3,732.78,711.12,0.0
gfx950,256,1037,4096,3072,ck,18,0,35.7066,a8w8_blockscale_1x128x128_256x64x64x256_16x16_32x32_1x1_16x16x1_16x16x1_1x32x1x8_8_1x1_intrawave_v1,730.87,679.53,0.0
gfx950,256,10370,3072,3072,ck,0,0,154.2462,a8w8_blockscale_1x128x128_256x128x128x128_16x16_32x32_2x2_8x32x1_8x32x1_1x32x1x8_8_1x1_intrawave_v3,1268.93,680.78,0.0
gfx950,256,10370,4096,3072,ck,0,0,199.8246,a8w8_blockscale_1x128x128_256x128x128x128_16x16_32x32_2x2_8x32x1_8x32x1_1x32x1x8_8_1x1_intrawave_v3,1305.99,647.52,0.0
gfx950,256,10373,3072,3072,ck,0,0,156.7263,a8w8_blockscale_1x128x128_256x128x128x128_16x16_32x32_2x2_8x32x1_8x32x1_1x32x1x8_8_1x1_intrawave_v3,1249.21,670.18,0.0
gfx950,256,10373,4096,3072,ck,0,0,205.2445,a8w8_blockscale_1x128x128_256x128x128x128_16x16_32x32_2x2_8x32x1_8x32x1_1x32x1x8_8_1x1_intrawave_v3,1271.87,630.59,0.0
gfx950,256,10376,2048,3072,ck,0,0,114.1485,a8w8_blockscale_1x128x128_256x128x128x128_16x16_32x32_2x2_8x32x1_8x32x1_1x32x1x8_8_1x1_intrawave_v3,1143.78,706.68,0.0
gfx950,256,10379,3072,3072,ck,0,0,154.6753,a8w8_blockscale_1x128x128_256x128x128x128_16x16_32x32_2x2_8x32x1_8x32x1_1x32x1x8_8_1x1_intrawave_v3,1266.51,679.42,0.0
gfx950,256,10379,4096,3072,ck,0,0,204.6542,a8w8_blockscale_1x128x128_256x128x128x128_16x16_32x32_2x2_8x32x1_8x32x1_1x32x1x8_8_1x1_intrawave_v3,1276.28,632.74,0.0
gfx950,256,10381,2048,3072,ck,0,0,111.7281,a8w8_blockscale_1x128x128_256x128x128x128_16x16_32x32_2x2_8x32x1_8x32x1_1x32x1x8_8_1x1_intrawave_v3,1169.12,722.31,0.0
gfx950,256,10382,2048,3072,ck,0,0,111.7869,a8w8_blockscale_1x128x128_256x128x128x128_16x16_32x32_2x2_8x32x1_8x32x1_1x32x1x8_8_1x1_intrawave_v3,1168.61,722.0,0.0
gfx950,256,10382,3072,3072,ck,0,0,157.1601,a8w8_blockscale_1x128x128_256x128x128x128_16x16_32x32_2x2_8x32x1_8x32x1_1x32x1x8_8_1x1_intrawave_v3,1246.84,668.86,0.0
gfx950,256,10382,4096,3072,ck,0,0,199.7012,a8w8_blockscale_1x128x128_256x128x128x128_16x16_32x32_2x2_8x32x1_8x32x1_1x32x1x8_8_1x1_intrawave_v3,1308.31,648.6,0.0
gfx950,256,10383,2048,3072,ck,0,0,113.0686,a8w8_blockscale_1x128x128_256x128x128x128_16x16_32x32_2x2_8x32x1_8x32x1_1x32x1x8_8_1x1_intrawave_v3,1155.48,713.87,0.0
gfx950,256,10384,3072,3072,ck,0,0,155.315,a8w8_blockscale_1x128x128_256x128x128x128_16x16_32x32_2x2_8x32x1_8x32x1_1x32x1x8_8_1x1_intrawave_v3,1261.9,676.92,0.0
gfx950,256,10384,4096,3072,ck,0,0,201.1948,a8w8_blockscale_1x128x128_256x128x128x128_16x16_32x32_2x2_8x32x1_8x32x1_1x32x1x8_8_1x1_intrawave_v3,1298.85,643.89,0.0
gfx950,256,10385,2048,3072,ck,0,0,115.6263,a8w8_blockscale_1x128x128_256x128x128x128_16x16_32x32_2x2_8x32x1_8x32x1_1x32x1x8_8_1x1_intrawave_v3,1130.14,698.21,0.0
gfx950,256,10386,2048,3072,ck,0,0,113.9976,a8w8_blockscale_1x128x128_256x128x128x128_16x16_32x32_2x2_8x32x1_8x32x1_1x32x1x8_8_1x1_intrawave_v3,1146.39,708.25,0.0
gfx950,256,10386,3072,3072,ck,0,0,156.6182,a8w8_blockscale_1x128x128_256x128x128x128_16x16_32x32_2x2_8x32x1_8x32x1_1x32x1x8_8_1x1_intrawave_v3,1251.64,671.41,0.0
gfx950,256,10386,4096,3072,ck,0,0,205.1697,a8w8_blockscale_1x128x128_256x128x128x128_16x16_32x32_2x2_8x32x1_8x32x1_1x32x1x8_8_1x1_intrawave_v3,1273.93,631.53,0.0
gfx950,256,10389,2048,3072,ck,0,0,112.932,a8w8_blockscale_1x128x128_256x128x128x128_16x16_32x32_2x2_8x32x1_8x32x1_1x32x1x8_8_1x1_intrawave_v3,1157.55,715.12,0.0
gfx950,256,10389,3072,3072,ck,0,0,156.5931,a8w8_blockscale_1x128x128_256x128x128x128_16x16_32x32_2x2_8x32x1_8x32x1_1x32x1x8_8_1x1_intrawave_v3,1252.2,671.69,0.0
gfx950,256,10389,4096,3072,ck,0,0,206.1423,a8w8_blockscale_1x128x128_256x128x128x128_16x16_32x32_2x2_8x32x1_8x32x1_1x32x1x8_8_1x1_intrawave_v3,1268.29,628.71,0.0
gfx950,256,10390,2048,3072,ck,0,0,113.3694,a8w8_blockscale_1x128x128_256x128x128x128_16x16_32x32_2x2_8x32x1_8x32x1_1x32x1x8_8_1x1_intrawave_v3,1153.19,712.42,0.0
gfx950,256,10391,3072,3072,ck,0,0,156.274,a8w8_blockscale_1x128x128_256x128x128x128_16x16_32x32_2x2_8x32x1_8x32x1_1x32x1x8_8_1x1_intrawave_v3,1255.0,673.18,0.0
gfx950,256,10391,4096,3072,ck,0,0,199.0534,a8w8_blockscale_1x128x128_256x128x128x128_16x16_32x32_2x2_8x32x1_8x32x1_1x32x1x8_8_1x1_intrawave_v3,1313.71,651.22,0.0
gfx950,256,10392,2048,3072,ck,0,0,115.5533,a8w8_blockscale_1x128x128_256x128x128x128_16x16_32x32_2x2_8x32x1_8x32x1_1x32x1x8_8_1x1_intrawave_v3,1131.61,699.08,0.0
gfx950,256,10392,3072,3072,ck,0,0,156.796,a8w8_blockscale_1x128x128_256x128x128x128_16x16_32x32_2x2_8x32x1_8x32x1_1x32x1x8_8_1x1_intrawave_v3,1250.94,671.0,0.0
gfx950,256,10392,4096,3072,ck,0,0,199.0476,a8w8_blockscale_1x128x128_256x128x128x128_16x16_32x32_2x2_8x32x1_8x32x1_1x32x1x8_8_1x1_intrawave_v3,1313.87,651.29,0.0
gfx950,256,10393,3072,3072,ck,0,0,154.7905,a8w8_blockscale_1x128x128_256x128x128x128_16x16_32x32_2x2_8x32x1_8x32x1_1x32x1x8_8_1x1_intrawave_v3,1267.27,679.75,0.0
gfx950,256,10393,4096,3072,ck,0,0,204.1986,a8w8_blockscale_1x128x128_256x128x128x128_16x16_32x32_2x2_8x32x1_8x32x1_1x32x1x8_8_1x1_intrawave_v3,1280.85,634.92,0.0
gfx950,256,10394,3072,3072,ck,0,0,154.4667,a8w8_blockscale_1x128x128_256x128x128x128_16x16_32x32_2x2_8x32x1_8x32x1_1x32x1x8_8_1x1_intrawave_v3,1270.05,681.24,0.0
gfx950,256,10394,4096,3072,ck,0,0,206.532,a8w8_blockscale_1x128x128_256x128x128x128_16x16_32x32_2x2_8x32x1_8x32x1_1x32x1x8_8_1x1_intrawave_v3,1266.5,627.8,0.0
gfx950,256,10396,3072,6144,ck,0,0,286.9057,a8w8_blockscale_1x128x128_256x128x128x128_16x16_32x32_2x2_8x32x1_8x32x1_1x32x1x8_8_1x1_intrawave_v3,1367.82,511.04,0.0
gfx950,256,10396,8192,3072,ck,0,0,374.1809,a8w8_blockscale_1x128x128_256x128x128x128_16x16_32x32_2x2_8x32x1_8x32x1_1x32x1x8_8_1x1_intrawave_v3,1398.38,607.81,0.0
gfx950,256,10397,3072,6144,ck,0,0,285.966,a8w8_blockscale_1x128x128_256x128x128x128_16x16_32x32_2x2_8x32x1_8x32x1_1x32x1x8_8_1x1_intrawave_v3,1372.45,512.76,0.0
gfx950,256,10397,8192,3072,ck,0,0,372.4469,a8w8_blockscale_1x128x128_256x128x128x128_16x16_32x32_2x2_8x32x1_8x32x1_1x32x1x8_8_1x1_intrawave_v3,1405.03,610.69,0.0
gfx950,256,10398,3072,6144,ck,0,0,290.4319,a8w8_blockscale_1x128x128_256x128x128x128_16x16_32x32_2x2_8x32x1_8x32x1_1x32x1x8_8_1x1_intrawave_v3,1351.47,504.92,0.0
gfx950,256,10398,8192,3072,ck,0,0,373.6057,a8w8_blockscale_1x128x128_256x128x128x128_16x16_32x32_2x2_8x32x1_8x32x1_1x32x1x8_8_1x1_intrawave_v3,1400.8,608.85,0.0
gfx950,256,10399,3072,6144,ck,0,0,287.0369,a8w8_blockscale_1x128x128_256x128x128x128_16x16_32x32_2x2_8x32x1_8x32x1_1x32x1x8_8_1x1_intrawave_v3,1367.59,510.94,0.0
gfx950,256,10399,8192,3072,ck,0,0,371.8316,a8w8_blockscale_1x128x128_256x128x128x128_16x16_32x32_2x2_8x32x1_8x32x1_1x32x1x8_8_1x1_intrawave_v3,1407.62,611.81,0.0
gfx950,256,104,2048,3072,ck,8,2,10.1295,a8w8_blockscale_1x128x128_256x16x64x256_16x16_16x16_1x1_16x16x1_16x16x1_1x16x1x16_4_1x1_intrawave_v1,129.19,694.7,0.0
gfx950,256,104,3072,3072,ck,7,0,11.7407,a8w8_blockscale_1x128x128_256x16x128x256_16x16_16x16_1x2_16x16x1_16x16x1_1x16x1x16_8_1x2_intrawave_v1,167.19,885.44,0.0
gfx950,256,104,3072,6144,ck,18,0,19.3091,a8w8_blockscale_1x128x128_256x64x64x256_16x16_32x32_1x1_16x16x1_16x16x1_1x32x1x8_8_1x1_intrawave_v1,203.32,1043.67,0.0
gfx950,256,104,4096,3072,ck,7,0,11.8931,a8w8_blockscale_1x128x128_256x16x128x256_16x16_16x16_1x2_16x16x1_16x16x1_1x16x1x16_8_1x2_intrawave_v1,220.06,1156.5,0.0
gfx950,256,104,8192,3072,ck,18,0,12.0976,a8w8_blockscale_1x128x128_256x64x64x256_16x16_32x32_1x1_16x16x1_16x16x1_1x32x1x8_8_1x1_intrawave_v1,432.69,2247.49,0.0
gfx950,256,10400,3072,6144,ck,0,0,283.5183,a8w8_blockscale_1x128x128_256x128x128x128_16x16_32x32_2x2_8x32x1_8x32x1_1x32x1x8_8_1x1_intrawave_v3,1384.7,517.32,0.0
gfx950,256,10400,8192,3072,ck,0,0,375.9467,a8w8_blockscale_1x128x128_256x128x128x128_16x16_32x32_2x2_8x32x1_8x32x1_1x32x1x8_8_1x1_intrawave_v3,1392.35,605.16,0.0
gfx950,256,10401,2048,3072,ck,0,0,115.06,a8w8_blockscale_1x128x128_256x128x128x128_16x16_32x32_2x2_8x32x1_8x32x1_1x32x1x8_8_1x1_intrawave_v3,1137.45,702.64,0.0
gfx950,256,10401,3072,3072,ck,0,0,155.1883,a8w8_blockscale_1x128x128_256x128x128x128_16x16_32x32_2x2_8x32x1_8x32x1_1x32x1x8_8_1x1_intrawave_v3,1264.99,678.48,0.0
gfx950,256,10401,3072,6144,ck,0,0,285.2964,a8w8_blockscale_1x128x128_256x128x128x128_16x16_32x32_2x2_8x32x1_8x32x1_1x32x1x8_8_1x1_intrawave_v3,1376.2,514.14,0.0
gfx950,256,10401,4096,3072,ck,0,0,198.2135,a8w8_blockscale_1x128x128_256x128x128x128_16x16_32x32_2x2_8x32x1_8x32x1_1x32x1x8_8_1x1_intrawave_v3,1320.54,654.55,0.0
gfx950,256,10401,8192,3072,ck,0,0,366.2723,a8w8_blockscale_1x128x128_256x128x128x128_16x16_32x32_2x2_8x32x1_8x32x1_1x32x1x8_8_1x1_intrawave_v3,1429.26,621.2,0.0
gfx950,256,10402,2048,3072,ck,0,0,116.0803,a8w8_blockscale_1x128x128_256x128x128x128_16x16_32x32_2x2_8x32x1_8x32x1_1x32x1x8_8_1x1_intrawave_v3,1127.56,696.53,0.0
gfx950,256,10403,2048,3072,ck,0,0,113.9342,a8w8_blockscale_1x128x128_256x128x128x128_16x16_32x32_2x2_8x32x1_8x32x1_1x32x1x8_8_1x1_intrawave_v3,1148.91,709.71,0.0
gfx950,256,10404,3072,3072,ck,0,0,157.6909,a8w8_blockscale_1x128x128_256x128x128x128_16x16_32x32_2x2_8x32x1_8x32x1_1x32x1x8_8_1x1_intrawave_v3,1245.28,667.89,0.0
gfx950,256,10404,4096,3072,ck,0,0,203.049,a8w8_blockscale_1x128x128_256x128x128x128_16x16_32x32_2x2_8x32x1_8x32x1_1x32x1x8_8_1x1_intrawave_v3,1289.47,639.12,0.0
gfx950,256,10406,2048,3072,ck,0,0,113.053,a8w8_blockscale_1x128x128_256x128x128x128_16x16_32x32_2x2_8x32x1_8x32x1_1x32x1x8_8_1x1_intrawave_v3,1158.2,715.43,0.0
gfx950,256,10407,2048,3072,ck,0,0,112.2481,a8w8_blockscale_1x128x128_256x128x128x128_16x16_32x32_2x2_8x32x1_8x32x1_1x32x1x8_8_1x1_intrawave_v3,1166.62,720.63,0.0
gfx950,256,10408,2048,3072,ck,0,0,113.6849,a8w8_blockscale_1x128x128_256x128x128x128_16x16_32x32_2x2_8x32x1_8x32x1_1x32x1x8_8_1x1_intrawave_v3,1151.98,711.58,0.0
gfx950,256,10408,3072,3072,ck,0,0,157.0623,a8w8_blockscale_1x128x128_256x128x128x128_16x16_32x32_2x2_8x32x1_8x32x1_1x32x1x8_8_1x1_intrawave_v3,1250.74,670.8,0.0
gfx950,256,10408,4096,3072,ck,0,0,205.5193,a8w8_blockscale_1x128x128_256x128x128x128_16x16_32x32_2x2_8x32x1_8x32x1_1x32x1x8_8_1x1_intrawave_v3,1274.46,631.66,0.0
gfx950,256,10409,2048,3072,ck,0,0,112.2712,a8w8_blockscale_1x128x128_256x128x128x128_16x16_32x32_2x2_8x32x1_8x32x1_1x32x1x8_8_1x1_intrawave_v3,1166.6,720.6,0.0
gfx950,256,10409,3072,6144,ck,0,0,287.1151,a8w8_blockscale_1x128x128_256x128x128x128_16x16_32x32_2x2_8x32x1_8x32x1_1x32x1x8_8_1x1_intrawave_v3,1368.53,511.22,0.0
gfx950,256,10409,8192,3072,ck,0,0,372.9111,a8w8_blockscale_1x128x128_256x128x128x128_16x16_32x32_2x2_8x32x1_8x32x1_1x32x1x8_8_1x1_intrawave_v3,1404.9,610.56,0.0
gfx950,256,10410,2048,3072,ck,0,0,113.228,a8w8_blockscale_1x128x128_256x128x128x128_16x16_32x32_2x2_8x32x1_8x32x1_1x32x1x8_8_1x1_intrawave_v3,1156.85,714.58,0.0
gfx950,256,10410,3072,3072,ck,0,0,153.8821,a8w8_blockscale_1x128x128_256x128x128x128_16x16_32x32_2x2_8x32x1_8x32x1_1x32x1x8_8_1x1_intrawave_v3,1276.84,684.78,0.0
gfx950,256,10410,4096,3072,ck,0,0,202.7477,a8w8_blockscale_1x128x128_256x128x128x128_16x16_32x32_2x2_8x32x1_8x32x1_1x32x1x8_8_1x1_intrawave_v3,1292.13,640.41,0.0
gfx950,256,10411,3072,6144,ck,0,0,288.6905,a8w8_blockscale_1x128x128_256x128x128x128_16x16_32x32_2x2_8x32x1_8x32x1_1x32x1x8_8_1x1_intrawave_v3,1361.33,508.52,0.0
gfx950,256,10411,8192,3072,ck,0,0,373.3707,a8w8_blockscale_1x128x128_256x128x128x128_16x16_32x32_2x2_8x32x1_8x32x1_1x32x1x8_8_1x1_intrawave_v3,1403.44,609.91,0.0
gfx950,256,10413,2048,3072,ck,0,0,114.4809,a8w8_blockscale_1x128x128_256x128x128x128_16x16_32x32_2x2_8x32x1_8x32x1_1x32x1x8_8_1x1_intrawave_v3,1144.52,706.95,0.0
gfx950,256,10413,3072,3072,ck,0,0,157.9427,a8w8_blockscale_1x128x128_256x128x128x128_16x16_32x32_2x2_8x32x1_8x32x1_1x32x1x8_8_1x1_intrawave_v3,1244.37,667.35,0.0
gfx950,256,10413,4096,3072,ck,0,0,201.8546,a8w8_blockscale_1x128x128_256x128x128x128_16x16_32x32_2x2_8x32x1_8x32x1_1x32x1x8_8_1x1_intrawave_v3,1298.22,643.41,0.0
gfx950,256,10414,2048,3072,ck,0,0,114.2973,a8w8_blockscale_1x128x128_256x128x128x128_16x16_32x32_2x2_8x32x1_8x32x1_1x32x1x8_8_1x1_intrawave_v3,1146.47,708.14,0.0
gfx950,256,10415,2048,3072,ck,0,0,115.3157,a8w8_blockscale_1x128x128_256x128x128x128_16x16_32x32_2x2_8x32x1_8x32x1_1x32x1x8_8_1x1_intrawave_v3,1136.45,701.95,0.0
gfx950,256,10416,2048,3072,ck,0,0,114.9907,a8w8_blockscale_1x128x128_256x128x128x128_16x16_32x32_2x2_8x32x1_8x32x1_1x32x1x8_8_1x1_intrawave_v3,1139.78,704.0,0.0
gfx950,256,10416,3072,3072,ck,0,0,156.545,a8w8_blockscale_1x128x128_256x128x128x128_16x16_32x32_2x2_8x32x1_8x32x1_1x32x1x8_8_1x1_intrawave_v3,1255.84,673.49,0.0
gfx950,256,10416,4096,3072,ck,0,0,206.7167,a8w8_blockscale_1x128x128_256x128x128x128_16x16_32x32_2x2_8x32x1_8x32x1_1x32x1x8_8_1x1_intrawave_v3,1268.05,628.44,0.0
gfx950,256,10417,2048,3072,ck,0,0,111.9144,a8w8_blockscale_1x128x128_256x128x128x128_16x16_32x32_2x2_8x32x1_8x32x1_1x32x1x8_8_1x1_intrawave_v3,1171.22,723.41,0.0
gfx950,256,10418,3072,3072,ck,0,0,156.7021,a8w8_blockscale_1x128x128_256x128x128x128_16x16_32x32_2x2_8x32x1_8x32x1_1x32x1x8_8_1x1_intrawave_v3,1254.82,672.93,0.0
gfx950,256,10418,4096,3072,ck,0,0,206.7835,a8w8_blockscale_1x128x128_256x128x128x128_16x16_32x32_2x2_8x32x1_8x32x1_1x32x1x8_8_1x1_intrawave_v3,1267.88,628.34,0.0
gfx950,256,10419,3072,3072,ck,0,0,154.5767,a8w8_blockscale_1x128x128_256x128x128x128_16x16_32x32_2x2_8x32x1_8x32x1_1x32x1x8_8_1x1_intrawave_v3,1272.2,682.24,0.0
gfx950,256,10419,4096,3072,ck,0,0,206.4639,a8w8_blockscale_1x128x128_256x128x128x128_16x16_32x32_2x2_8x32x1_8x32x1_1x32x1x8_8_1x1_intrawave_v3,1269.97,629.37,0.0
gfx950,256,10420,3072,6144,ck,0,0,290.6504,a8w8_blockscale_1x128x128_256x128x128x128_16x16_32x32_2x2_8x32x1_8x32x1_1x32x1x8_8_1x1_intrawave_v3,1353.32,505.47,0.0
gfx950,256,10420,8192,3072,ck,0,0,378.4102,a8w8_blockscale_1x128x128_256x128x128x128_16x16_32x32_2x2_8x32x1_8x32x1_1x32x1x8_8_1x1_intrawave_v3,1385.95,602.25,0.0
gfx950,256,10421,3072,3072,ck,0,0,155.6623,a8w8_blockscale_1x128x128_256x128x128x128_16x16_32x32_2x2_8x32x1_8x32x1_1x32x1x8_8_1x1_intrawave_v3,1263.57,677.6,0.0
gfx950,256,10421,3072,6144,ck,0,0,286.7241,a8w8_blockscale_1x128x128_256x128x128x128_16x16_32x32_2x2_8x32x1_8x32x1_1x32x1x8_8_1x1_intrawave_v3,1371.98,512.44,0.0
gfx950,256,10421,4096,3072,ck,0,0,203.7586,a8w8_blockscale_1x128x128_256x128x128x128_16x16_32x32_2x2_8x32x1_8x32x1_1x32x1x8_8_1x1_intrawave_v3,1287.08,637.84,0.0
gfx950,256,10421,8192,3072,ck,0,0,372.1187,a8w8_blockscale_1x128x128_256x128x128x128_16x16_32x32_2x2_8x32x1_8x32x1_1x32x1x8_8_1x1_intrawave_v3,1409.51,612.48,0.0
gfx950,256,10423,2048,3072,ck,0,0,112.7867,a8w8_blockscale_1x128x128_256x128x128x128_16x16_32x32_2x2_8x32x1_8x32x1_1x32x1x8_8_1x1_intrawave_v3,1162.83,718.2,0.0
gfx950,256,10426,2048,3072,ck,0,0,114.8238,a8w8_blockscale_1x128x128_256x128x128x128_16x16_32x32_2x2_8x32x1_8x32x1_1x32x1x8_8_1x1_intrawave_v3,1142.53,705.65,0.0
gfx950,256,10426,3072,3072,ck,0,0,152.52,a8w8_blockscale_1x128x128_256x128x128x128_16x16_32x32_2x2_8x32x1_8x32x1_1x32x1x8_8_1x1_intrawave_v3,1290.22,691.86,0.0
gfx950,256,10426,4096,3072,ck,0,0,205.7282,a8w8_blockscale_1x128x128_256x128x128x128_16x16_32x32_2x2_8x32x1_8x32x1_1x32x1x8_8_1x1_intrawave_v3,1275.37,632.01,0.0
gfx950,256,10427,2048,3072,ck,0,0,114.3448,a8w8_blockscale_1x128x128_256x128x128x128_16x16_32x32_2x2_8x32x1_8x32x1_1x32x1x8_8_1x1_intrawave_v3,1147.42,708.67,0.0
gfx950,256,10428,3072,3072,ck,0,0,155.428,a8w8_blockscale_1x128x128_256x128x128x128_16x16_32x32_2x2_8x32x1_8x32x1_1x32x1x8_8_1x1_intrawave_v3,1266.32,679.04,0.0
gfx950,256,10428,4096,3072,ck,0,0,203.4489,a8w8_blockscale_1x128x128_256x128x128x128_16x16_32x32_2x2_8x32x1_8x32x1_1x32x1x8_8_1x1_intrawave_v3,1289.9,639.2,0.0
gfx950,256,10429,3072,3072,ck,0,0,158.2569,a8w8_blockscale_1x128x128_256x128x128x128_16x16_32x32_2x2_8x32x1_8x32x1_1x32x1x8_8_1x1_intrawave_v3,1243.81,666.96,0.0
gfx950,256,10429,4096,3072,ck,0,0,201.2031,a8w8_blockscale_1x128x128_256x128x128x128_16x16_32x32_2x2_8x32x1_8x32x1_1x32x1x8_8_1x1_intrawave_v3,1304.43,646.39,0.0
gfx950,256,10430,3072,3072,ck,0,0,152.4743,a8w8_blockscale_1x128x128_256x128x128x128_16x16_32x32_2x2_8x32x1_8x32x1_1x32x1x8_8_1x1_intrawave_v3,1291.1,692.31,0.0
gfx950,256,10430,4096,3072,ck,0,0,205.978,a8w8_blockscale_1x128x128_256x128x128x128_16x16_32x32_2x2_8x32x1_8x32x1_1x32x1x8_8_1x1_intrawave_v3,1274.31,631.46,0.0
gfx950,256,10432,3072,3072,ck,0,0,156.8374,a8w8_blockscale_1x128x128_256x128x128x128_16x16_32x32_2x2_8x32x1_8x32x1_1x32x1x8_8_1x1_intrawave_v3,1255.42,673.17,0.0
gfx950,256,10432,4096,3072,ck,0,0,202.5812,a8w8_blockscale_1x128x128_256x128x128x128_16x16_32x32_2x2_8x32x1_8x32x1_1x32x1x8_8_1x1_intrawave_v3,1295.92,642.16,0.0
gfx950,256,10433,3072,3072,ck,0,0,155.3715,a8w8_blockscale_1x128x128_256x128x128x128_16x16_32x32_2x2_8x32x1_8x32x1_1x32x1x8_8_1x1_intrawave_v3,1267.39,679.58,0.0
gfx950,256,10433,4096,3072,ck,0,0,200.7066,a8w8_blockscale_1x128x128_256x128x128x128_16x16_32x32_2x2_8x32x1_8x32x1_1x32x1x8_8_1x1_intrawave_v3,1308.15,648.21,0.0
gfx950,256,10435,2048,3072,ck,0,0,113.3025,a8w8_blockscale_1x128x128_256x128x128x128_16x16_32x32_2x2_8x32x1_8x32x1_1x32x1x8_8_1x1_intrawave_v3,1158.87,715.69,0.0
gfx950,256,10439,3072,3072,ck,0,0,156.7329,a8w8_blockscale_1x128x128_256x128x128x128_16x16_32x32_2x2_8x32x1_8x32x1_1x32x1x8_8_1x1_intrawave_v3,1257.1,674.03,0.0
gfx950,256,10439,4096,3072,ck,0,0,199.8019,a8w8_blockscale_1x128x128_256x128x128x128_16x16_32x32_2x2_8x32x1_8x32x1_1x32x1x8_8_1x1_intrawave_v3,1314.83,651.48,0.0
gfx950,256,1044,2048,3072,ck,18,0,22.5773,a8w8_blockscale_1x128x128_256x64x64x256_16x16_32x32_1x1_16x16x1_16x16x1_1x32x1x8_8_1x1_intrawave_v1,581.85,610.12,0.0
gfx950,256,10440,3072,6144,ck,0,0,301.1306,a8w8_blockscale_1x128x128_256x128x128x128_16x16_32x32_2x2_8x32x1_8x32x1_1x32x1x8_8_1x1_intrawave_v3,1308.72,488.7,0.0
gfx950,256,10440,8192,3072,ck,0,0,392.5758,a8w8_blockscale_1x128x128_256x128x128x128_16x16_32x32_2x2_8x32x1_8x32x1_1x32x1x8_8_1x1_intrawave_v3,1338.5,581.51,0.0
gfx950,256,10441,2048,3072,ck,0,0,121.6112,a8w8_blockscale_1x128x128_256x128x128x128_16x16_32x32_2x2_8x32x1_8x32x1_1x32x1x8_8_1x1_intrawave_v3,1080.31,667.15,0.0
gfx950,256,10442,2048,3072,ck,0,0,121.2518,a8w8_blockscale_1x128x128_256x128x128x128_16x16_32x32_2x2_8x32x1_8x32x1_1x32x1x8_8_1x1_intrawave_v3,1083.62,669.18,0.0
gfx950,256,10442,3072,3072,ck,0,0,164.101,a8w8_blockscale_1x128x128_256x128x128x128_16x16_32x32_2x2_8x32x1_8x32x1_1x32x1x8_8_1x1_intrawave_v3,1201.01,643.94,0.0
gfx950,256,10442,3072,6144,ck,0,0,304.3761,a8w8_blockscale_1x128x128_256x128x128x128_16x16_32x32_2x2_8x32x1_8x32x1_1x32x1x8_8_1x1_intrawave_v3,1295.02,483.57,0.0
gfx950,256,10442,4096,3072,ck,0,0,216.4467,a8w8_blockscale_1x128x128_256x128x128x128_16x16_32x32_2x2_8x32x1_8x32x1_1x32x1x8_8_1x1_intrawave_v3,1214.07,601.54,0.0
gfx950,256,10442,8192,3072,ck,0,0,396.4403,a8w8_blockscale_1x128x128_256x128x128x128_16x16_32x32_2x2_8x32x1_8x32x1_1x32x1x8_8_1x1_intrawave_v3,1325.71,575.94,0.0
gfx950,256,10443,2048,3072,ck,0,0,112.8176,a8w8_blockscale_1x128x128_256x128x128x128_16x16_32x32_2x2_8x32x1_8x32x1_1x32x1x8_8_1x1_intrawave_v3,1164.74,719.28,0.0
gfx950,256,10443,3072,6144,ck,0,0,289.0842,a8w8_blockscale_1x128x128_256x128x128x128_16x16_32x32_2x2_8x32x1_8x32x1_1x32x1x8_8_1x1_intrawave_v3,1363.65,509.19,0.0
gfx950,256,10443,8192,3072,ck,0,0,377.87,a8w8_blockscale_1x128x128_256x128x128x128_16x16_32x32_2x2_8x32x1_8x32x1_1x32x1x8_8_1x1_intrawave_v3,1390.99,604.29,0.0
gfx950,256,10444,2048,3072,ck,0,0,112.3257,a8w8_blockscale_1x128x128_256x128x128x128_16x16_32x32_2x2_8x32x1_8x32x1_1x32x1x8_8_1x1_intrawave_v3,1169.95,722.49,0.0
gfx950,256,10444,3072,3072,ck,0,0,158.1189,a8w8_blockscale_1x128x128_256x128x128x128_16x16_32x32_2x2_8x32x1_8x32x1_1x32x1x8_8_1x1_intrawave_v3,1246.68,668.42,0.0
gfx950,256,10444,3072,6144,ck,0,0,282.5897,a8w8_blockscale_1x128x128_256x128x128x128_16x16_32x32_2x2_8x32x1_8x32x1_1x32x1x8_8_1x1_intrawave_v3,1395.12,520.93,0.0
gfx950,256,10444,4096,3072,ck,0,0,204.6755,a8w8_blockscale_1x128x128_256x128x128x128_16x16_32x32_2x2_8x32x1_8x32x1_1x32x1x8_8_1x1_intrawave_v3,1284.14,636.25,0.0
gfx950,256,10444,8192,3072,ck,0,0,356.1037,a8w8_blockscale_1x128x128_256x128x128x128_16x16_32x32_2x2_8x32x1_8x32x1_1x32x1x8_8_1x1_intrawave_v3,1476.15,641.29,0.0
gfx950,256,10445,2048,3072,ck,0,0,112.833,a8w8_blockscale_1x128x128_256x128x128x128_16x16_32x32_2x2_8x32x1_8x32x1_1x32x1x8_8_1x1_intrawave_v3,1164.81,719.3,0.0
gfx950,256,10446,3072,6144,ck,0,0,289.24,a8w8_blockscale_1x128x128_256x128x128x128_16x16_32x32_2x2_8x32x1_8x32x1_1x32x1x8_8_1x1_intrawave_v3,1363.31,509.04,0.0
gfx950,256,10446,8192,3072,ck,0,0,371.4505,a8w8_blockscale_1x128x128_256x128x128x128_16x16_32x32_2x2_8x32x1_8x32x1_1x32x1x8_8_1x1_intrawave_v3,1415.44,614.9,0.0
gfx950,256,10448,2048,3072,ck,0,0,112.8915,a8w8_blockscale_1x128x128_256x128x128x128_16x16_32x32_2x2_8x32x1_8x32x1_1x32x1x8_8_1x1_intrawave_v3,1164.54,719.12,0.0
gfx950,256,10449,3072,3072,ck,0,0,156.9189,a8w8_blockscale_1x128x128_256x128x128x128_16x16_32x32_2x2_8x32x1_8x32x1_1x32x1x8_8_1x1_intrawave_v3,1256.82,673.82,0.0
gfx950,256,10449,4096,3072,ck,0,0,196.3013,a8w8_blockscale_1x128x128_256x128x128x128_16x16_32x32_2x2_8x32x1_8x32x1_1x32x1x8_8_1x1_intrawave_v3,1339.56,663.68,0.0
gfx950,256,10450,2048,3072,ck,0,0,111.388,a8w8_blockscale_1x128x128_256x128x128x128_16x16_32x32_2x2_8x32x1_8x32x1_1x32x1x8_8_1x1_intrawave_v3,1180.48,728.96,0.0
gfx950,256,10452,2048,3072,ck,0,0,113.0535,a8w8_blockscale_1x128x128_256x128x128x128_16x16_32x32_2x2_8x32x1_8x32x1_1x32x1x8_8_1x1_intrawave_v3,1163.31,718.34,0.0
gfx950,256,10453,3072,3072,ck,0,0,157.4949,a8w8_blockscale_1x128x128_256x128x128x128_16x16_32x32_2x2_8x32x1_8x32x1_1x32x1x8_8_1x1_intrawave_v3,1252.7,671.59,0.0
gfx950,256,10453,4096,3072,ck,0,0,204.9804,a8w8_blockscale_1x128x128_256x128x128x128_16x16_32x32_2x2_8x32x1_8x32x1_1x32x1x8_8_1x1_intrawave_v3,1283.33,635.79,0.0
gfx950,256,10456,3072,3072,ck,0,0,152.8808,a8w8_blockscale_1x128x128_256x128x128x128_16x16_32x32_2x2_8x32x1_8x32x1_1x32x1x8_8_1x1_intrawave_v3,1290.88,692.04,0.0
gfx950,256,10456,4096,3072,ck,0,0,203.7335,a8w8_blockscale_1x128x128_256x128x128x128_16x16_32x32_2x2_8x32x1_8x32x1_1x32x1x8_8_1x1_intrawave_v3,1291.56,639.85,0.0
gfx950,256,10457,2048,3072,ck,0,0,114.0055,a8w8_blockscale_1x128x128_256x128x128x128_16x16_32x32_2x2_8x32x1_8x32x1_1x32x1x8_8_1x1_intrawave_v3,1154.15,712.66,0.0
gfx950,256,10460,3072,3072,ck,0,0,154.77,a8w8_blockscale_1x128x128_256x128x128x128_16x16_32x32_2x2_8x32x1_8x32x1_1x32x1x8_8_1x1_intrawave_v3,1275.61,683.83,0.0
gfx950,256,10460,3072,6144,ck,0,0,289.7516,a8w8_blockscale_1x128x128_256x128x128x128_16x16_32x32_2x2_8x32x1_8x32x1_1x32x1x8_8_1x1_intrawave_v3,1362.73,508.74,0.0
gfx950,256,10460,4096,3072,ck,0,0,206.2547,a8w8_blockscale_1x128x128_256x128x128x128_16x16_32x32_2x2_8x32x1_8x32x1_1x32x1x8_8_1x1_intrawave_v3,1276.26,632.25,0.0
gfx950,256,10460,8192,3072,ck,0,0,366.5485,a8w8_blockscale_1x128x128_256x128x128x128_16x16_32x32_2x2_8x32x1_8x32x1_1x32x1x8_8_1x1_intrawave_v3,1436.29,623.86,0.0
gfx950,256,10461,3072,3072,ck,0,0,155.6568,a8w8_blockscale_1x128x128_256x128x128x128_16x16_32x32_2x2_8x32x1_8x32x1_1x32x1x8_8_1x1_intrawave_v3,1268.46,679.99,0.0
gfx950,256,10461,3072,6144,ck,0,0,289.9114,a8w8_blockscale_1x128x128_256x128x128x128_16x16_32x32_2x2_8x32x1_8x32x1_1x32x1x8_8_1x1_intrawave_v3,1362.1,508.5,0.0
gfx950,256,10461,4096,3072,ck,0,0,198.652,a8w8_blockscale_1x128x128_256x128x128x128_16x16_32x32_2x2_8x32x1_8x32x1_1x32x1x8_8_1x1_intrawave_v3,1325.23,656.5,0.0
gfx950,256,10461,8192,3072,ck,0,0,373.4012,a8w8_blockscale_1x128x128_256x128x128x128_16x16_32x32_2x2_8x32x1_8x32x1_1x32x1x8_8_1x1_intrawave_v3,1410.06,612.46,0.0
gfx950,256,10462,2048,3072,ck,0,0,114.0732,a8w8_blockscale_1x128x128_256x128x128x128_16x16_32x32_2x2_8x32x1_8x32x1_1x32x1x8_8_1x1_intrawave_v3,1154.02,712.55,0.0
gfx950,256,10462,3072,3072,ck,0,0,157.4579,a8w8_blockscale_1x128x128_256x128x128x128_16x16_32x32_2x2_8x32x1_8x32x1_1x32x1x8_8_1x1_intrawave_v3,1254.07,672.27,0.0
gfx950,256,10462,3072,6144,ck,0,0,285.7616,a8w8_blockscale_1x128x128_256x128x128x128_16x16_32x32_2x2_8x32x1_8x32x1_1x32x1x8_8_1x1_intrawave_v3,1382.02,515.92,0.0
gfx950,256,10462,4096,3072,ck,0,0,206.9781,a8w8_blockscale_1x128x128_256x128x128x128_16x16_32x32_2x2_8x32x1_8x32x1_1x32x1x8_8_1x1_intrawave_v3,1272.04,630.15,0.0
gfx950,256,10462,8192,3072,ck,0,0,375.4547,a8w8_blockscale_1x128x128_256x128x128x128_16x16_32x32_2x2_8x32x1_8x32x1_1x32x1x8_8_1x1_intrawave_v3,1402.49,609.17,0.0
gfx950,256,10463,3072,3072,ck,0,0,156.2027,a8w8_blockscale_1x128x128_256x128x128x128_16x16_32x32_2x2_8x32x1_8x32x1_1x32x1x8_8_1x1_intrawave_v3,1264.27,677.74,0.0
gfx950,256,10463,3072,6144,ck,0,0,290.2293,a8w8_blockscale_1x128x128_256x128x128x128_16x16_32x32_2x2_8x32x1_8x32x1_1x32x1x8_8_1x1_intrawave_v3,1360.87,508.02,0.0
gfx950,256,10463,4096,3072,ck,0,0,202.847,a8w8_blockscale_1x128x128_256x128x128x128_16x16_32x32_2x2_8x32x1_8x32x1_1x32x1x8_8_1x1_intrawave_v3,1298.07,643.04,0.0
gfx950,256,10463,8192,3072,ck,0,0,369.4,a8w8_blockscale_1x128x128_256x128x128x128_16x16_32x32_2x2_8x32x1_8x32x1_1x32x1x8_8_1x1_intrawave_v3,1425.61,619.2,0.0
gfx950,256,10464,3072,3072,ck,0,0,155.9241,a8w8_blockscale_1x128x128_256x128x128x128_16x16_32x32_2x2_8x32x1_8x32x1_1x32x1x8_8_1x1_intrawave_v3,1266.65,679.01,0.0
gfx950,256,10464,4096,3072,ck,0,0,201.2303,a8w8_blockscale_1x128x128_256x128x128x128_16x16_32x32_2x2_8x32x1_8x32x1_1x32x1x8_8_1x1_intrawave_v3,1308.63,648.26,0.0
gfx950,256,10465,2048,3072,ck,0,0,115.4777,a8w8_blockscale_1x128x128_256x128x128x128_16x16_32x32_2x2_8x32x1_8x32x1_1x32x1x8_8_1x1_intrawave_v3,1140.31,704.07,0.0
gfx950,256,10468,3072,3072,ck,0,0,156.4312,a8w8_blockscale_1x128x128_256x128x128x128_16x16_32x32_2x2_8x32x1_8x32x1_1x32x1x8_8_1x1_intrawave_v3,1263.03,677.04,0.0
gfx950,256,10468,4096,3072,ck,0,0,202.7725,a8w8_blockscale_1x128x128_256x128x128x128_16x16_32x32_2x2_8x32x1_8x32x1_1x32x1x8_8_1x1_intrawave_v3,1299.17,643.55,0.0
gfx950,256,10469,2048,3072,ck,0,0,113.7695,a8w8_blockscale_1x128x128_256x128x128x128_16x16_32x32_2x2_8x32x1_8x32x1_1x32x1x8_8_1x1_intrawave_v3,1157.87,714.9,0.0
gfx950,256,10469,3072,6144,ck,0,0,286.721,a8w8_blockscale_1x128x128_256x128x128x128_16x16_32x32_2x2_8x32x1_8x32x1_1x32x1x8_8_1x1_intrawave_v3,1378.31,514.5,0.0
gfx950,256,10469,8192,3072,ck,0,0,357.805,a8w8_blockscale_1x128x128_256x128x128x128_16x16_32x32_2x2_8x32x1_8x32x1_1x32x1x8_8_1x1_intrawave_v3,1472.65,639.6,0.0
gfx950,256,10470,3072,3072,ck,0,0,154.9757,a8w8_blockscale_1x128x128_256x128x128x128_16x16_32x32_2x2_8x32x1_8x32x1_1x32x1x8_8_1x1_intrawave_v3,1275.13,683.52,0.0
gfx950,256,10470,3072,6144,ck,0,0,286.7381,a8w8_blockscale_1x128x128_256x128x128x128_16x16_32x32_2x2_8x32x1_8x32x1_1x32x1x8_8_1x1_intrawave_v3,1378.36,514.51,0.0
gfx950,256,10470,4096,3072,ck,0,0,201.5258,a8w8_blockscale_1x128x128_256x128x128x128_16x16_32x32_2x2_8x32x1_8x32x1_1x32x1x8_8_1x1_intrawave_v3,1307.46,647.64,0.0
gfx950,256,10470,8192,3072,ck,0,0,366.0082,a8w8_blockscale_1x128x128_256x128x128x128_16x16_32x32_2x2_8x32x1_8x32x1_1x32x1x8_8_1x1_intrawave_v3,1439.78,625.31,0.0
gfx950,256,10471,2048,3072,ck,0,0,115.3362,a8w8_blockscale_1x128x128_256x128x128x128_16x16_32x32_2x2_8x32x1_8x32x1_1x32x1x8_8_1x1_intrawave_v3,1142.36,705.31,0.0
gfx950,256,10471,3072,6144,ck,0,0,288.8397,a8w8_blockscale_1x128x128_256x128x128x128_16x16_32x32_2x2_8x32x1_8x32x1_1x32x1x8_8_1x1_intrawave_v3,1368.46,510.81,0.0
gfx950,256,10471,8192,3072,ck,0,0,374.8845,a8w8_blockscale_1x128x128_256x128x128x128_16x16_32x32_2x2_8x32x1_8x32x1_1x32x1x8_8_1x1_intrawave_v3,1405.83,610.56,0.0
gfx950,256,10472,3072,6144,ck,0,0,287.4664,a8w8_blockscale_1x128x128_256x128x128x128_16x16_32x32_2x2_8x32x1_8x32x1_1x32x1x8_8_1x1_intrawave_v3,1375.13,513.29,0.0
gfx950,256,10472,8192,3072,ck,0,0,375.1918,a8w8_blockscale_1x128x128_256x128x128x128_16x16_32x32_2x2_8x32x1_8x32x1_1x32x1x8_8_1x1_intrawave_v3,1404.81,610.11,0.0
gfx950,256,10474,2048,3072,ck,0,0,113.1751,a8w8_blockscale_1x128x128_256x128x128x128_16x16_32x32_2x2_8x32x1_8x32x1_1x32x1x8_8_1x1_intrawave_v3,1164.51,718.97,0.0
gfx950,256,10476,2048,3072,ck,0,0,112.7609,a8w8_blockscale_1x128x128_256x128x128x128_16x16_32x32_2x2_8x32x1_8x32x1_1x32x1x8_8_1x1_intrawave_v3,1169.01,721.73,0.0
gfx950,256,10476,3072,3072,ck,0,0,155.0415,a8w8_blockscale_1x128x128_256x128x128x128_16x16_32x32_2x2_8x32x1_8x32x1_1x32x1x8_8_1x1_intrawave_v3,1275.32,683.58,0.0
gfx950,256,10476,3072,6144,ck,0,0,287.9977,a8w8_blockscale_1x128x128_256x128x128x128_16x16_32x32_2x2_8x32x1_8x32x1_1x32x1x8_8_1x1_intrawave_v3,1373.12,512.52,0.0
gfx950,256,10476,4096,3072,ck,0,0,204.3954,a8w8_blockscale_1x128x128_256x128x128x128_16x16_32x32_2x2_8x32x1_8x32x1_1x32x1x8_8_1x1_intrawave_v3,1289.84,638.88,0.0
gfx950,256,10476,8192,3072,ck,0,0,377.1493,a8w8_blockscale_1x128x128_256x128x128x128_16x16_32x32_2x2_8x32x1_8x32x1_1x32x1x8_8_1x1_intrawave_v3,1398.05,607.15,0.0
gfx950,256,10477,2048,3072,ck,0,0,115.3266,a8w8_blockscale_1x128x128_256x128x128x128_16x16_32x32_2x2_8x32x1_8x32x1_1x32x1x8_8_1x1_intrawave_v3,1143.11,705.74,0.0
gfx950,256,10477,3072,3072,ck,0,0,157.9634,a8w8_blockscale_1x128x128_256x128x128x128_16x16_32x32_2x2_8x32x1_8x32x1_1x32x1x8_8_1x1_intrawave_v3,1251.85,671.0,0.0
gfx950,256,10477,4096,3072,ck,0,0,203.2965,a8w8_blockscale_1x128x128_256x128x128x128_16x16_32x32_2x2_8x32x1_8x32x1_1x32x1x8_8_1x1_intrawave_v3,1296.93,642.39,0.0
gfx950,256,10479,2048,3072,ck,0,0,111.819,a8w8_blockscale_1x128x128_256x128x128x128_16x16_32x32_2x2_8x32x1_8x32x1_1x32x1x8_8_1x1_intrawave_v3,1179.19,728.01,0.0
gfx950,256,10479,3072,6144,ck,0,0,289.4118,a8w8_blockscale_1x128x128_256x128x128x128_16x16_32x32_2x2_8x32x1_8x32x1_1x32x1x8_8_1x1_intrawave_v3,1366.8,510.14,0.0
gfx950,256,10479,8192,3072,ck,0,0,356.3935,a8w8_blockscale_1x128x128_256x128x128x128_16x16_32x32_2x2_8x32x1_8x32x1_1x32x1x8_8_1x1_intrawave_v3,1479.9,642.68,0.0
gfx950,256,1048,2048,3072,ck,18,0,22.5795,a8w8_blockscale_1x128x128_256x64x64x256_16x16_32x32_1x1_16x16x1_16x16x1_1x32x1x8_8_1x1_intrawave_v1,584.02,611.33,0.0
gfx950,256,10481,2048,3072,ck,0,0,112.9648,a8w8_blockscale_1x128x128_256x128x128x128_16x16_32x32_2x2_8x32x1_8x32x1_1x32x1x8_8_1x1_intrawave_v3,1167.46,720.75,0.0
gfx950,256,10482,3072,3072,ck,0,0,155.8109,a8w8_blockscale_1x128x128_256x128x128x128_16x16_32x32_2x2_8x32x1_8x32x1_1x32x1x8_8_1x1_intrawave_v3,1269.75,680.56,0.0
gfx950,256,10482,4096,3072,ck,0,0,206.1099,a8w8_blockscale_1x128x128_256x128x128x128_16x16_32x32_2x2_8x32x1_8x32x1_1x32x1x8_8_1x1_intrawave_v3,1279.84,633.9,0.0
gfx950,256,10483,2048,3072,ck,0,0,114.2289,a8w8_blockscale_1x128x128_256x128x128x128_16x16_32x32_2x2_8x32x1_8x32x1_1x32x1x8_8_1x1_intrawave_v3,1154.76,712.9,0.0
gfx950,256,10484,3072,3072,ck,0,0,153.7849,a8w8_blockscale_1x128x128_256x128x128x128_16x16_32x32_2x2_8x32x1_8x32x1_1x32x1x8_8_1x1_intrawave_v3,1286.72,689.65,0.0
gfx950,256,10484,4096,3072,ck,0,0,204.3416,a8w8_blockscale_1x128x128_256x128x128x128_16x16_32x32_2x2_8x32x1_8x32x1_1x32x1x8_8_1x1_intrawave_v3,1291.16,639.49,0.0
gfx950,256,10485,3072,3072,ck,0,0,155.693,a8w8_blockscale_1x128x128_256x128x128x128_16x16_32x32_2x2_8x32x1_8x32x1_1x32x1x8_8_1x1_intrawave_v3,1271.08,681.26,0.0
gfx950,256,10485,4096,3072,ck,0,0,209.0649,a8w8_blockscale_1x128x128_256x128x128x128_16x16_32x32_2x2_8x32x1_8x32x1_1x32x1x8_8_1x1_intrawave_v3,1262.11,625.1,0.0
gfx950,256,10487,2048,3072,ck,0,0,114.1052,a8w8_blockscale_1x128x128_256x128x128x128_16x16_32x32_2x2_8x32x1_8x32x1_1x32x1x8_8_1x1_intrawave_v3,1156.45,713.92,0.0
gfx950,256,10489,3072,3072,ck,0,0,158.1247,a8w8_blockscale_1x128x128_256x128x128x128_16x16_32x32_2x2_8x32x1_8x32x1_1x32x1x8_8_1x1_intrawave_v3,1252.01,671.01,0.0
gfx950,256,10489,4096,3072,ck,0,0,200.8168,a8w8_blockscale_1x128x128_256x128x128x128_16x16_32x32_2x2_8x32x1_8x32x1_1x32x1x8_8_1x1_intrawave_v3,1314.45,651.0,0.0
gfx950,256,10491,2048,3072,ck,0,0,113.4397,a8w8_blockscale_1x128x128_256x128x128x128_16x16_32x32_2x2_8x32x1_8x32x1_1x32x1x8_8_1x1_intrawave_v3,1163.68,718.36,0.0
gfx950,256,10491,3072,3072,ck,0,0,154.5535,a8w8_blockscale_1x128x128_256x128x128x128_16x16_32x32_2x2_8x32x1_8x32x1_1x32x1x8_8_1x1_intrawave_v3,1281.18,686.64,0.0
gfx950,256,10491,4096,3072,ck,0,0,204.7013,a8w8_blockscale_1x128x128_256x128x128x128_16x16_32x32_2x2_8x32x1_8x32x1_1x32x1x8_8_1x1_intrawave_v3,1289.76,638.75,0.0
gfx950,256,10492,2048,3072,ck,0,0,113.0128,a8w8_blockscale_1x128x128_256x128x128x128_16x16_32x32_2x2_8x32x1_8x32x1_1x32x1x8_8_1x1_intrawave_v3,1168.19,721.14,0.0
gfx950,256,10493,2048,3072,ck,0,0,113.4665,a8w8_blockscale_1x128x128_256x128x128x128_16x16_32x32_2x2_8x32x1_8x32x1_1x32x1x8_8_1x1_intrawave_v3,1163.63,718.32,0.0
gfx950,256,10493,3072,3072,ck,0,0,157.444,a8w8_blockscale_1x128x128_256x128x128x128_16x16_32x32_2x2_8x32x1_8x32x1_1x32x1x8_8_1x1_intrawave_v3,1257.9,674.15,0.0
gfx950,256,10493,4096,3072,ck,0,0,207.7148,a8w8_blockscale_1x128x128_256x128x128x128_16x16_32x32_2x2_8x32x1_8x32x1_1x32x1x8_8_1x1_intrawave_v3,1271.29,629.59,0.0
gfx950,256,10495,2048,3072,ck,0,0,116.1929,a8w8_blockscale_1x128x128_256x128x128x128_16x16_32x32_2x2_8x32x1_8x32x1_1x32x1x8_8_1x1_intrawave_v3,1136.54,701.59,0.0
gfx950,256,10495,3072,3072,ck,0,0,155.3378,a8w8_blockscale_1x128x128_256x128x128x128_16x16_32x32_2x2_8x32x1_8x32x1_1x32x1x8_8_1x1_intrawave_v3,1275.2,683.41,0.0
gfx950,256,10495,4096,3072,ck,0,0,195.1644,a8w8_blockscale_1x128x128_256x128x128x128_16x16_32x32_2x2_8x32x1_8x32x1_1x32x1x8_8_1x1_intrawave_v3,1353.3,670.2,0.0
gfx950,256,10496,2048,3072,ck,0,0,113.6079,a8w8_blockscale_1x128x128_256x128x128x128_16x16_32x32_2x2_8x32x1_8x32x1_1x32x1x8_8_1x1_intrawave_v3,1162.51,717.62,0.0
gfx950,256,10496,3072,3072,ck,0,0,155.267,a8w8_blockscale_1x128x128_256x128x128x128_16x16_32x32_2x2_8x32x1_8x32x1_1x32x1x8_8_1x1_intrawave_v3,1275.9,683.78,0.0
gfx950,256,10496,3072,6144,ck,0,0,284.0612,a8w8_blockscale_1x128x128_256x128x128x128_16x16_32x32_2x2_8x32x1_8x32x1_1x32x1x8_8_1x1_intrawave_v3,1394.81,520.48,0.0
gfx950,256,10496,4096,3072,ck,0,0,202.0419,a8w8_blockscale_1x128x128_256x128x128x128_16x16_32x32_2x2_8x32x1_8x32x1_1x32x1x8_8_1x1_intrawave_v3,1307.36,647.44,0.0
gfx950,256,10496,8192,3072,ck,0,0,366.4324,a8w8_blockscale_1x128x128_256x128x128x128_16x16_32x32_2x2_8x32x1_8x32x1_1x32x1x8_8_1x1_intrawave_v3,1441.69,625.97,0.0
gfx950,256,10497,3072,6144,ck,0,0,291.9198,a8w8_blockscale_1x128x128_256x128x128x128_16x16_32x32_2x2_8x32x1_8x32x1_1x32x1x8_8_1x1_intrawave_v3,1357.39,506.51,0.0
gfx950,256,10497,8192,3072,ck,0,0,376.1245,a8w8_blockscale_1x128x128_256x128x128x128_16x16_32x32_2x2_8x32x1_8x32x1_1x32x1x8_8_1x1_intrawave_v3,1404.67,609.89,0.0
gfx950,256,10498,3072,3072,ck,0,0,155.5535,a8w8_blockscale_1x128x128_256x128x128x128_16x16_32x32_2x2_8x32x1_8x32x1_1x32x1x8_8_1x1_intrawave_v3,1273.79,682.64,0.0
gfx950,256,10498,4096,3072,ck,0,0,204.1227,a8w8_blockscale_1x128x128_256x128x128x128_16x16_32x32_2x2_8x32x1_8x32x1_1x32x1x8_8_1x1_intrawave_v3,1294.27,640.95,0.0
gfx950,256,10499,3072,3072,ck,0,0,153.8834,a8w8_blockscale_1x128x128_256x128x128x128_16x16_32x32_2x2_8x32x1_8x32x1_1x32x1x8_8_1x1_intrawave_v3,1287.74,690.11,0.0
gfx950,256,10499,4096,3072,ck,0,0,208.0661,a8w8_blockscale_1x128x128_256x128x128x128_16x16_32x32_2x2_8x32x1_8x32x1_1x32x1x8_8_1x1_intrawave_v3,1269.87,628.86,0.0
gfx950,256,10500,2048,3072,ck,0,0,114.0257,a8w8_blockscale_1x128x128_256x128x128x128_16x16_32x32_2x2_8x32x1_8x32x1_1x32x1x8_8_1x1_intrawave_v3,1158.69,715.24,0.0
gfx950,256,10501,2048,3072,ck,0,0,113.25,a8w8_blockscale_1x128x128_256x128x128x128_16x16_32x32_2x2_8x32x1_8x32x1_1x32x1x8_8_1x1_intrawave_v3,1166.74,720.2,0.0
gfx950,256,10502,3072,3072,ck,0,0,155.6807,a8w8_blockscale_1x128x128_256x128x128x128_16x16_32x32_2x2_8x32x1_8x32x1_1x32x1x8_8_1x1_intrawave_v3,1273.24,682.32,0.0
gfx950,256,10502,4096,3072,ck,0,0,204.8538,a8w8_blockscale_1x128x128_256x128x128x128_16x16_32x32_2x2_8x32x1_8x32x1_1x32x1x8_8_1x1_intrawave_v3,1290.15,638.88,0.0
gfx950,256,10505,2048,3072,ck,0,0,115.4855,a8w8_blockscale_1x128x128_256x128x128x128_16x16_32x32_2x2_8x32x1_8x32x1_1x32x1x8_8_1x1_intrawave_v3,1144.59,706.51,0.0
gfx950,256,10507,2048,3072,ck,0,0,112.6162,a8w8_blockscale_1x128x128_256x128x128x128_16x16_32x32_2x2_8x32x1_8x32x1_1x32x1x8_8_1x1_intrawave_v3,1173.98,724.63,0.0
gfx950,256,10508,3072,3072,ck,0,0,157.8668,a8w8_blockscale_1x128x128_256x128x128x128_16x16_32x32_2x2_8x32x1_8x32x1_1x32x1x8_8_1x1_intrawave_v3,1256.32,673.22,0.0
gfx950,256,10508,4096,3072,ck,0,0,207.1874,a8w8_blockscale_1x128x128_256x128x128x128_16x16_32x32_2x2_8x32x1_8x32x1_1x32x1x8_8_1x1_intrawave_v3,1276.34,632.01,0.0
gfx950,256,10509,2048,3072,ck,0,0,114.3498,a8w8_blockscale_1x128x128_256x128x128x128_16x16_32x32_2x2_8x32x1_8x32x1_1x32x1x8_8_1x1_intrawave_v3,1156.4,713.77,0.0
gfx950,256,10509,3072,6144,ck,0,0,291.692,a8w8_blockscale_1x128x128_256x128x128x128_16x16_32x32_2x2_8x32x1_8x32x1_1x32x1x8_8_1x1_intrawave_v3,1360.0,507.42,0.0
gfx950,256,10509,8192,3072,ck,0,0,374.8064,a8w8_blockscale_1x128x128_256x128x128x128_16x16_32x32_2x2_8x32x1_8x32x1_1x32x1x8_8_1x1_intrawave_v3,1411.22,612.66,0.0
gfx950,256,10510,3072,3072,ck,0,0,155.1106,a8w8_blockscale_1x128x128_256x128x128x128_16x16_32x32_2x2_8x32x1_8x32x1_1x32x1x8_8_1x1_intrawave_v3,1278.89,685.3,0.0
gfx950,256,10510,4096,3072,ck,0,0,207.0263,a8w8_blockscale_1x128x128_256x128x128x128_16x16_32x32_2x2_8x32x1_8x32x1_1x32x1x8_8_1x1_intrawave_v3,1277.58,632.61,0.0
gfx950,256,10511,2048,3072,ck,0,0,113.2642,a8w8_blockscale_1x128x128_256x128x128x128_16x16_32x32_2x2_8x32x1_8x32x1_1x32x1x8_8_1x1_intrawave_v3,1167.7,720.74,0.0
gfx950,256,10511,3072,3072,ck,0,0,156.136,a8w8_blockscale_1x128x128_256x128x128x128_16x16_32x32_2x2_8x32x1_8x32x1_1x32x1x8_8_1x1_intrawave_v3,1270.61,680.86,0.0
gfx950,256,10511,4096,3072,ck,0,0,207.4545,a8w8_blockscale_1x128x128_256x128x128x128_16x16_32x32_2x2_8x32x1_8x32x1_1x32x1x8_8_1x1_intrawave_v3,1275.07,631.36,0.0
gfx950,256,10512,3072,3072,ck,0,0,156.7497,a8w8_blockscale_1x128x128_256x128x128x128_16x16_32x32_2x2_8x32x1_8x32x1_1x32x1x8_8_1x1_intrawave_v3,1265.76,678.25,0.0
gfx950,256,10512,4096,3072,ck,0,0,201.0677,a8w8_blockscale_1x128x128_256x128x128x128_16x16_32x32_2x2_8x32x1_8x32x1_1x32x1x8_8_1x1_intrawave_v3,1315.69,651.47,0.0
gfx950,256,10513,2048,3072,ck,0,0,113.4482,a8w8_blockscale_1x128x128_256x128x128x128_16x16_32x32_2x2_8x32x1_8x32x1_1x32x1x8_8_1x1_intrawave_v3,1166.03,719.7,0.0
gfx950,256,10513,3072,3072,ck,0,0,158.2337,a8w8_blockscale_1x128x128_256x128x128x128_16x16_32x32_2x2_8x32x1_8x32x1_1x32x1x8_8_1x1_intrawave_v3,1254.01,671.95,0.0
gfx950,256,10513,3072,6144,ck,0,0,293.1578,a8w8_blockscale_1x128x128_256x128x128x128_16x16_32x32_2x2_8x32x1_8x32x1_1x32x1x8_8_1x1_intrawave_v3,1353.72,505.05,0.0
gfx950,256,10513,4096,3072,ck,0,0,208.1104,a8w8_blockscale_1x128x128_256x128x128x128_16x16_32x32_2x2_8x32x1_8x32x1_1x32x1x8_8_1x1_intrawave_v3,1271.29,629.48,0.0
gfx950,256,10513,8192,3072,ck,0,0,378.5722,a8w8_blockscale_1x128x128_256x128x128x128_16x16_32x32_2x2_8x32x1_8x32x1_1x32x1x8_8_1x1_intrawave_v3,1397.72,606.77,0.0
gfx950,256,10514,3072,3072,ck,0,0,155.6861,a8w8_blockscale_1x128x128_256x128x128x128_16x16_32x32_2x2_8x32x1_8x32x1_1x32x1x8_8_1x1_intrawave_v3,1274.65,683.0,0.0
gfx950,256,10514,3072,6144,ck,0,0,291.761,a8w8_blockscale_1x128x128_256x128x128x128_16x16_32x32_2x2_8x32x1_8x32x1_1x32x1x8_8_1x1_intrawave_v3,1360.33,507.51,0.0
gfx950,256,10514,4096,3072,ck,0,0,198.9258,a8w8_blockscale_1x128x128_256x128x128x128_16x16_32x32_2x2_8x32x1_8x32x1_1x32x1x8_8_1x1_intrawave_v3,1330.11,658.6,0.0
gfx950,256,10514,8192,3072,ck,0,0,374.8896,a8w8_blockscale_1x128x128_256x128x128x128_16x16_32x32_2x2_8x32x1_8x32x1_1x32x1x8_8_1x1_intrawave_v3,1411.58,612.78,0.0
gfx950,256,10515,3072,3072,ck,0,0,156.6034,a8w8_blockscale_1x128x128_256x128x128x128_16x16_32x32_2x2_8x32x1_8x32x1_1x32x1x8_8_1x1_intrawave_v3,1267.3,679.06,0.0
gfx950,256,10515,3072,6144,ck,0,0,289.7185,a8w8_blockscale_1x128x128_256x128x128x128_16x16_32x32_2x2_8x32x1_8x32x1_1x32x1x8_8_1x1_intrawave_v3,1370.05,511.13,0.0
gfx950,256,10515,4096,3072,ck,0,0,202.7206,a8w8_blockscale_1x128x128_256x128x128x128_16x16_32x32_2x2_8x32x1_8x32x1_1x32x1x8_8_1x1_intrawave_v3,1305.34,646.33,0.0
gfx950,256,10515,8192,3072,ck,0,0,375.7645,a8w8_blockscale_1x128x128_256x128x128x128_16x16_32x32_2x2_8x32x1_8x32x1_1x32x1x8_8_1x1_intrawave_v3,1408.43,611.41,0.0
gfx950,256,10516,3072,3072,ck,0,0,155.7827,a8w8_blockscale_1x128x128_256x128x128x128_16x16_32x32_2x2_8x32x1_8x32x1_1x32x1x8_8_1x1_intrawave_v3,1274.1,682.7,0.0
gfx950,256,10516,3072,6144,ck,0,0,288.2315,a8w8_blockscale_1x128x128_256x128x128x128_16x16_32x32_2x2_8x32x1_8x32x1_1x32x1x8_8_1x1_intrawave_v3,1377.25,513.81,0.0
gfx950,256,10516,4096,3072,ck,0,0,205.3633,a8w8_blockscale_1x128x128_256x128x128x128_16x16_32x32_2x2_8x32x1_8x32x1_1x32x1x8_8_1x1_intrawave_v3,1288.66,638.07,0.0
gfx950,256,10516,8192,3072,ck,0,0,370.9194,a8w8_blockscale_1x128x128_256x128x128x128_16x16_32x32_2x2_8x32x1_8x32x1_1x32x1x8_8_1x1_intrawave_v3,1426.96,619.45,0.0
gfx950,256,10517,2048,3072,ck,0,0,114.9918,a8w8_blockscale_1x128x128_256x128x128x128_16x16_32x32_2x2_8x32x1_8x32x1_1x32x1x8_8_1x1_intrawave_v3,1150.82,710.29,0.0
gfx950,256,10517,3072,3072,ck,0,0,157.2827,a8w8_blockscale_1x128x128_256x128x128x128_16x16_32x32_2x2_8x32x1_8x32x1_1x32x1x8_8_1x1_intrawave_v3,1262.07,676.25,0.0
gfx950,256,10517,4096,3072,ck,0,0,207.6255,a8w8_blockscale_1x128x128_256x128x128x128_16x16_32x32_2x2_8x32x1_8x32x1_1x32x1x8_8_1x1_intrawave_v3,1274.74,631.17,0.0
gfx950,256,10519,3072,3072,ck,0,0,155.193,a8w8_blockscale_1x128x128_256x128x128x128_16x16_32x32_2x2_8x32x1_8x32x1_1x32x1x8_8_1x1_intrawave_v3,1279.31,685.47,0.0
gfx950,256,10519,4096,3072,ck,0,0,203.3839,a8w8_blockscale_1x128x128_256x128x128x128_16x16_32x32_2x2_8x32x1_8x32x1_1x32x1x8_8_1x1_intrawave_v3,1301.57,644.44,0.0
gfx950,256,1052,3072,3072,ck,0,0,26.9313,a8w8_blockscale_1x128x128_256x128x128x128_16x16_32x32_2x2_8x32x1_8x32x1_1x32x1x8_8_1x1_intrawave_v3,737.28,710.42,0.0
gfx950,256,1052,4096,3072,ck,18,0,35.6673,a8w8_blockscale_1x128x128_256x64x64x256_16x16_32x32_1x1_16x16x1_16x16x1_1x32x1x8_8_1x1_intrawave_v1,742.26,685.02,0.0
gfx950,256,10520,2048,3072,ck,0,0,114.8919,a8w8_blockscale_1x128x128_256x128x128x128_16x16_32x32_2x2_8x32x1_8x32x1_1x32x1x8_8_1x1_intrawave_v3,1152.15,711.09,0.0
gfx950,256,10520,3072,6144,ck,0,0,287.2505,a8w8_blockscale_1x128x128_256x128x128x128_16x16_32x32_2x2_8x32x1_8x32x1_1x32x1x8_8_1x1_intrawave_v3,1382.48,515.73,0.0
gfx950,256,10520,8192,3072,ck,0,0,377.1049,a8w8_blockscale_1x128x128_256x128x128x128_16x16_32x32_2x2_8x32x1_8x32x1_1x32x1x8_8_1x1_intrawave_v3,1404.09,609.49,0.0
gfx950,256,10522,2048,3072,ck,0,0,114.0536,a8w8_blockscale_1x128x128_256x128x128x128_16x16_32x32_2x2_8x32x1_8x32x1_1x32x1x8_8_1x1_intrawave_v3,1160.83,716.45,0.0
gfx950,256,10522,3072,6144,ck,0,0,291.1952,a8w8_blockscale_1x128x128_256x128x128x128_16x16_32x32_2x2_8x32x1_8x32x1_1x32x1x8_8_1x1_intrawave_v3,1364.01,508.83,0.0
gfx950,256,10522,8192,3072,ck,0,0,373.5397,a8w8_blockscale_1x128x128_256x128x128x128_16x16_32x32_2x2_8x32x1_8x32x1_1x32x1x8_8_1x1_intrawave_v3,1417.76,615.41,0.0
gfx950,256,10523,2048,3072,ck,0,0,113.7859,a8w8_blockscale_1x128x128_256x128x128x128_16x16_32x32_2x2_8x32x1_8x32x1_1x32x1x8_8_1x1_intrawave_v3,1163.68,718.19,0.0
gfx950,256,10524,3072,3072,ck,0,0,156.0303,a8w8_blockscale_1x128x128_256x128x128x128_16x16_32x32_2x2_8x32x1_8x32x1_1x32x1x8_8_1x1_intrawave_v3,1273.05,682.09,0.0
gfx950,256,10524,3072,6144,ck,0,0,290.6552,a8w8_blockscale_1x128x128_256x128x128x128_16x16_32x32_2x2_8x32x1_8x32x1_1x32x1x8_8_1x1_intrawave_v3,1366.8,509.86,0.0
gfx950,256,10524,4096,3072,ck,0,0,206.1736,a8w8_blockscale_1x128x128_256x128x128x128_16x16_32x32_2x2_8x32x1_8x32x1_1x32x1x8_8_1x1_intrawave_v3,1284.57,635.99,0.0
gfx950,256,10524,8192,3072,ck,0,0,376.9525,a8w8_blockscale_1x128x128_256x128x128x128_16x16_32x32_2x2_8x32x1_8x32x1_1x32x1x8_8_1x1_intrawave_v3,1405.19,609.95,0.0
gfx950,256,10525,3072,3072,ck,0,0,157.8008,a8w8_blockscale_1x128x128_256x128x128x128_16x16_32x32_2x2_8x32x1_8x32x1_1x32x1x8_8_1x1_intrawave_v3,1258.88,674.49,0.0
gfx950,256,10525,4096,3072,ck,0,0,205.7912,a8w8_blockscale_1x128x128_256x128x128x128_16x16_32x32_2x2_8x32x1_8x32x1_1x32x1x8_8_1x1_intrawave_v3,1287.08,637.23,0.0
gfx950,256,10526,2048,3072,ck,0,0,114.6185,a8w8_blockscale_1x128x128_256x128x128x128_16x16_32x32_2x2_8x32x1_8x32x1_1x32x1x8_8_1x1_intrawave_v3,1155.55,713.16,0.0
gfx950,256,10526,3072,6144,ck,0,0,288.4575,a8w8_blockscale_1x128x128_256x128x128x128_16x16_32x32_2x2_8x32x1_8x32x1_1x32x1x8_8_1x1_intrawave_v3,1377.48,513.83,0.0
gfx950,256,10526,8192,3072,ck,0,0,373.254,a8w8_blockscale_1x128x128_256x128x128x128_16x16_32x32_2x2_8x32x1_8x32x1_1x32x1x8_8_1x1_intrawave_v3,1419.38,616.09,0.0
gfx950,256,10527,3072,6144,ck,0,0,288.4715,a8w8_blockscale_1x128x128_256x128x128x128_16x16_32x32_2x2_8x32x1_8x32x1_1x32x1x8_8_1x1_intrawave_v3,1377.54,513.85,0.0
gfx950,256,10527,8192,3072,ck,0,0,375.0928,a8w8_blockscale_1x128x128_256x128x128x128_16x16_32x32_2x2_8x32x1_8x32x1_1x32x1x8_8_1x1_intrawave_v3,1412.56,613.13,0.0
gfx950,256,10528,2048,3072,ck,0,0,113.8351,a8w8_blockscale_1x128x128_256x128x128x128_16x16_32x32_2x2_8x32x1_8x32x1_1x32x1x8_8_1x1_intrawave_v3,1163.73,718.2,0.0
gfx950,256,10532,3072,3072,ck,0,0,156.9954,a8w8_blockscale_1x128x128_256x128x128x128_16x16_32x32_2x2_8x32x1_8x32x1_1x32x1x8_8_1x1_intrawave_v3,1266.18,678.36,0.0
gfx950,256,10532,4096,3072,ck,0,0,198.0858,a8w8_blockscale_1x128x128_256x128x128x128_16x16_32x32_2x2_8x32x1_8x32x1_1x32x1x8_8_1x1_intrawave_v3,1338.04,662.42,0.0
gfx950,256,10534,2048,3072,ck,0,0,115.0603,a8w8_blockscale_1x128x128_256x128x128x128_16x16_32x32_2x2_8x32x1_8x32x1_1x32x1x8_8_1x1_intrawave_v3,1151.99,710.92,0.0
gfx950,256,10534,3072,3072,ck,0,0,156.0188,a8w8_blockscale_1x128x128_256x128x128x128_16x16_32x32_2x2_8x32x1_8x32x1_1x32x1x8_8_1x1_intrawave_v3,1274.35,682.73,0.0
gfx950,256,10534,4096,3072,ck,0,0,208.4,a8w8_blockscale_1x128x128_256x128x128x128_16x16_32x32_2x2_8x32x1_8x32x1_1x32x1x8_8_1x1_intrawave_v3,1272.06,629.74,0.0
gfx950,256,10535,2048,3072,ck,0,0,115.6665,a8w8_blockscale_1x128x128_256x128x128x128_16x16_32x32_2x2_8x32x1_8x32x1_1x32x1x8_8_1x1_intrawave_v3,1146.06,707.26,0.0
gfx950,256,10536,2048,3072,ck,0,0,113.99,a8w8_blockscale_1x128x128_256x128x128x128_16x16_32x32_2x2_8x32x1_8x32x1_1x32x1x8_8_1x1_intrawave_v3,1163.03,717.73,0.0
gfx950,256,10536,3072,3072,ck,0,0,157.569,a8w8_blockscale_1x128x128_256x128x128x128_16x16_32x32_2x2_8x32x1_8x32x1_1x32x1x8_8_1x1_intrawave_v3,1262.05,676.13,0.0
gfx950,256,10536,4096,3072,ck,0,0,204.002,a8w8_blockscale_1x128x128_256x128x128x128_16x16_32x32_2x2_8x32x1_8x32x1_1x32x1x8_8_1x1_intrawave_v3,1299.73,643.43,0.0
gfx950,256,10538,3072,3072,ck,0,0,157.8715,a8w8_blockscale_1x128x128_256x128x128x128_16x16_32x32_2x2_8x32x1_8x32x1_1x32x1x8_8_1x1_intrawave_v3,1259.87,674.95,0.0
gfx950,256,10538,4096,3072,ck,0,0,204.3783,a8w8_blockscale_1x128x128_256x128x128x128_16x16_32x32_2x2_8x32x1_8x32x1_1x32x1x8_8_1x1_intrawave_v3,1297.58,642.35,0.0
gfx950,256,10539,3072,3072,ck,0,0,155.8774,a8w8_blockscale_1x128x128_256x128x128x128_16x16_32x32_2x2_8x32x1_8x32x1_1x32x1x8_8_1x1_intrawave_v3,1276.11,683.64,0.0
gfx950,256,10539,4096,3072,ck,0,0,207.6348,a8w8_blockscale_1x128x128_256x128x128x128_16x16_32x32_2x2_8x32x1_8x32x1_1x32x1x8_8_1x1_intrawave_v3,1277.35,632.33,0.0
gfx950,256,10542,2048,3072,ck,0,0,113.8141,a8w8_blockscale_1x128x128_256x128x128x128_16x16_32x32_2x2_8x32x1_8x32x1_1x32x1x8_8_1x1_intrawave_v3,1165.49,719.21,0.0
gfx950,256,10542,3072,3072,ck,0,0,158.4656,a8w8_blockscale_1x128x128_256x128x128x128_16x16_32x32_2x2_8x32x1_8x32x1_1x32x1x8_8_1x1_intrawave_v3,1255.63,672.65,0.0
gfx950,256,10542,4096,3072,ck,0,0,207.3302,a8w8_blockscale_1x128x128_256x128x128x128_16x16_32x32_2x2_8x32x1_8x32x1_1x32x1x8_8_1x1_intrawave_v3,1279.59,633.42,0.0
gfx950,256,10543,2048,3072,ck,0,0,113.3528,a8w8_blockscale_1x128x128_256x128x128x128_16x16_32x32_2x2_8x32x1_8x32x1_1x32x1x8_8_1x1_intrawave_v3,1170.34,722.2,0.0
gfx950,256,10544,3072,3072,ck,0,0,153.6326,a8w8_blockscale_1x128x128_256x128x128x128_16x16_32x32_2x2_8x32x1_8x32x1_1x32x1x8_8_1x1_intrawave_v3,1295.37,693.93,0.0
gfx950,256,10544,4096,3072,ck,0,0,204.3161,a8w8_blockscale_1x128x128_256x128x128x128_16x16_32x32_2x2_8x32x1_8x32x1_1x32x1x8_8_1x1_intrawave_v3,1298.72,642.88,0.0
gfx950,256,10545,3072,3072,ck,0,0,157.7535,a8w8_blockscale_1x128x128_256x128x128x128_16x16_32x32_2x2_8x32x1_8x32x1_1x32x1x8_8_1x1_intrawave_v3,1261.65,675.86,0.0
gfx950,256,10545,4096,3072,ck,0,0,196.3149,a8w8_blockscale_1x128x128_256x128x128x128_16x16_32x32_2x2_8x32x1_8x32x1_1x32x1x8_8_1x1_intrawave_v3,1351.78,669.14,0.0
gfx950,256,10546,2048,3072,ck,0,0,112.4536,a8w8_blockscale_1x128x128_256x128x128x128_16x16_32x32_2x2_8x32x1_8x32x1_1x32x1x8_8_1x1_intrawave_v3,1180.04,728.17,0.0
gfx950,256,10547,3072,3072,ck,0,0,156.9025,a8w8_blockscale_1x128x128_256x128x128x128_16x16_32x32_2x2_8x32x1_8x32x1_1x32x1x8_8_1x1_intrawave_v3,1268.74,679.65,0.0
gfx950,256,10547,4096,3072,ck,0,0,203.5429,a8w8_blockscale_1x128x128_256x128x128x128_16x16_32x32_2x2_8x32x1_8x32x1_1x32x1x8_8_1x1_intrawave_v3,1304.02,645.49,0.0
gfx950,256,10548,2048,3072,ck,0,0,114.3793,a8w8_blockscale_1x128x128_256x128x128x128_16x16_32x32_2x2_8x32x1_8x32x1_1x32x1x8_8_1x1_intrawave_v3,1160.39,716.03,0.0
gfx950,256,10549,3072,3072,ck,0,0,156.1671,a8w8_blockscale_1x128x128_256x128x128x128_16x16_32x32_2x2_8x32x1_8x32x1_1x32x1x8_8_1x1_intrawave_v3,1274.95,682.97,0.0
gfx950,256,10549,4096,3072,ck,0,0,203.9962,a8w8_blockscale_1x128x128_256x128x128x128_16x16_32x32_2x2_8x32x1_8x32x1_1x32x1x8_8_1x1_intrawave_v3,1301.37,644.16,0.0
gfx950,256,10550,2048,3072,ck,0,0,115.2949,a8w8_blockscale_1x128x128_256x128x128x128_16x16_32x32_2x2_8x32x1_8x32x1_1x32x1x8_8_1x1_intrawave_v3,1151.39,710.47,0.0
gfx950,256,10550,3072,3072,ck,0,0,155.6401,a8w8_blockscale_1x128x128_256x128x128x128_16x16_32x32_2x2_8x32x1_8x32x1_1x32x1x8_8_1x1_intrawave_v3,1279.39,685.34,0.0
gfx950,256,10550,4096,3072,ck,0,0,203.4039,a8w8_blockscale_1x128x128_256x128x128x128_16x16_32x32_2x2_8x32x1_8x32x1_1x32x1x8_8_1x1_intrawave_v3,1305.28,646.09,0.0
gfx950,256,10551,2048,3072,ck,0,0,115.2062,a8w8_blockscale_1x128x128_256x128x128x128_16x16_32x32_2x2_8x32x1_8x32x1_1x32x1x8_8_1x1_intrawave_v3,1152.39,711.08,0.0
gfx950,256,10551,3072,3072,ck,0,0,158.0163,a8w8_blockscale_1x128x128_256x128x128x128_16x16_32x32_2x2_8x32x1_8x32x1_1x32x1x8_8_1x1_intrawave_v3,1260.27,675.09,0.0
gfx950,256,10551,4096,3072,ck,0,0,200.6051,a8w8_blockscale_1x128x128_256x128x128x128_16x16_32x32_2x2_8x32x1_8x32x1_1x32x1x8_8_1x1_intrawave_v3,1323.62,655.16,0.0
gfx950,256,10552,3072,3072,ck,0,0,156.9901,a8w8_blockscale_1x128x128_256x128x128x128_16x16_32x32_2x2_8x32x1_8x32x1_1x32x1x8_8_1x1_intrawave_v3,1268.63,679.56,0.0
gfx950,256,10552,4096,3072,ck,0,0,219.5722,a8w8_blockscale_1x128x128_256x128x128x128_16x16_32x32_2x2_8x32x1_8x32x1_1x32x1x8_8_1x1_intrawave_v3,1209.4,598.62,0.0
gfx950,256,10553,3072,6144,ck,0,0,300.9468,a8w8_blockscale_1x128x128_256x128x128x128_16x16_32x32_2x2_8x32x1_8x32x1_1x32x1x8_8_1x1_intrawave_v3,1323.7,493.61,0.0
gfx950,256,10553,8192,3072,ck,0,0,393.6219,a8w8_blockscale_1x128x128_256x128x128x128_16x16_32x32_2x2_8x32x1_8x32x1_1x32x1x8_8_1x1_intrawave_v3,1349.39,585.55,0.0
gfx950,256,10554,3072,3072,ck,0,0,165.7133,a8w8_blockscale_1x128x128_256x128x128x128_16x16_32x32_2x2_8x32x1_8x32x1_1x32x1x8_8_1x1_intrawave_v3,1202.08,643.9,0.0
gfx950,256,10554,4096,3072,ck,0,0,214.9146,a8w8_blockscale_1x128x128_256x128x128x128_16x16_32x32_2x2_8x32x1_8x32x1_1x32x1x8_8_1x1_intrawave_v3,1235.84,611.7,0.0
gfx950,256,10555,2048,3072,ck,0,0,120.8773,a8w8_blockscale_1x128x128_256x128x128x128_16x16_32x32_2x2_8x32x1_8x32x1_1x32x1x8_8_1x1_intrawave_v3,1098.74,677.96,0.0
gfx950,256,10556,2048,3072,ck,0,0,120.8994,a8w8_blockscale_1x128x128_256x128x128x128_16x16_32x32_2x2_8x32x1_8x32x1_1x32x1x8_8_1x1_intrawave_v3,1098.64,677.89,0.0
gfx950,256,10556,3072,3072,ck,0,0,166.9508,a8w8_blockscale_1x128x128_256x128x128x128_16x16_32x32_2x2_8x32x1_8x32x1_1x32x1x8_8_1x1_intrawave_v3,1193.39,639.24,0.0
gfx950,256,10556,4096,3072,ck,0,0,205.0328,a8w8_blockscale_1x128x128_256x128x128x128_16x16_32x32_2x2_8x32x1_8x32x1_1x32x1x8_8_1x1_intrawave_v3,1295.65,641.29,0.0
gfx950,256,10557,3072,3072,ck,0,0,157.4998,a8w8_blockscale_1x128x128_256x128x128x128_16x16_32x32_2x2_8x32x1_8x32x1_1x32x1x8_8_1x1_intrawave_v3,1265.12,677.65,0.0
gfx950,256,10557,4096,3072,ck,0,0,205.2606,a8w8_blockscale_1x128x128_256x128x128x128_16x16_32x32_2x2_8x32x1_8x32x1_1x32x1x8_8_1x1_intrawave_v3,1294.33,640.63,0.0
gfx950,256,10558,3072,3072,ck,0,0,152.4033,a8w8_blockscale_1x128x128_256x128x128x128_16x16_32x32_2x2_8x32x1_8x32x1_1x32x1x8_8_1x1_intrawave_v3,1307.55,700.38,0.0
gfx950,256,10558,4096,3072,ck,0,0,201.254,a8w8_blockscale_1x128x128_256x128x128x128_16x16_32x32_2x2_8x32x1_8x32x1_1x32x1x8_8_1x1_intrawave_v3,1320.23,653.44,0.0
gfx950,256,10559,2048,3072,ck,0,0,115.1137,a8w8_blockscale_1x128x128_256x128x128x128_16x16_32x32_2x2_8x32x1_8x32x1_1x32x1x8_8_1x1_intrawave_v3,1154.19,712.15,0.0
gfx950,256,10559,3072,3072,ck,0,0,156.7285,a8w8_blockscale_1x128x128_256x128x128x128_16x16_32x32_2x2_8x32x1_8x32x1_1x32x1x8_8_1x1_intrawave_v3,1271.59,681.11,0.0
gfx950,256,10559,4096,3072,ck,0,0,204.901,a8w8_blockscale_1x128x128_256x128x128x128_16x16_32x32_2x2_8x32x1_8x32x1_1x32x1x8_8_1x1_intrawave_v3,1296.85,641.87,0.0
gfx950,256,10560,2048,3072,ck,0,0,112.0357,a8w8_blockscale_1x128x128_256x128x128x128_16x16_32x32_2x2_8x32x1_8x32x1_1x32x1x8_8_1x1_intrawave_v3,1186.01,731.78,0.0
gfx950,256,10560,3072,3072,ck,0,0,155.7074,a8w8_blockscale_1x128x128_256x128x128x128_16x16_32x32_2x2_8x32x1_8x32x1_1x32x1x8_8_1x1_intrawave_v3,1280.05,685.63,0.0
gfx950,256,10560,4096,3072,ck,0,0,208.4216,a8w8_blockscale_1x128x128_256x128x128x128_16x16_32x32_2x2_8x32x1_8x32x1_1x32x1x8_8_1x1_intrawave_v3,1275.07,631.08,0.0
gfx950,256,10564,2048,3072,ck,0,0,115.2958,a8w8_blockscale_1x128x128_256x128x128x128_16x16_32x32_2x2_8x32x1_8x32x1_1x32x1x8_8_1x1_intrawave_v3,1152.91,711.34,0.0
gfx950,256,10565,3072,3072,ck,0,0,154.2046,a8w8_blockscale_1x128x128_256x128x128x128_16x16_32x32_2x2_8x32x1_8x32x1_1x32x1x8_8_1x1_intrawave_v3,1293.14,692.61,0.0
gfx950,256,10565,4096,3072,ck,0,0,197.4405,a8w8_blockscale_1x128x128_256x128x128x128_16x16_32x32_2x2_8x32x1_8x32x1_1x32x1x8_8_1x1_intrawave_v3,1346.62,666.46,0.0
gfx950,256,10568,2048,3072,ck,0,0,113.7643,a8w8_blockscale_1x128x128_256x128x128x128_16x16_32x32_2x2_8x32x1_8x32x1_1x32x1x8_8_1x1_intrawave_v3,1168.87,721.17,0.0
gfx950,256,10568,3072,3072,ck,0,0,158.0598,a8w8_blockscale_1x128x128_256x128x128x128_16x16_32x32_2x2_8x32x1_8x32x1_1x32x1x8_8_1x1_intrawave_v3,1261.95,675.9,0.0
gfx950,256,10568,4096,3072,ck,0,0,207.9446,a8w8_blockscale_1x128x128_256x128x128x128_16x16_32x32_2x2_8x32x1_8x32x1_1x32x1x8_8_1x1_intrawave_v3,1278.96,632.96,0.0
gfx950,256,10569,2048,3072,ck,0,0,114.279,a8w8_blockscale_1x128x128_256x128x128x128_16x16_32x32_2x2_8x32x1_8x32x1_1x32x1x8_8_1x1_intrawave_v3,1163.72,717.98,0.0
gfx950,256,10571,2048,3072,ck,0,0,114.0884,a8w8_blockscale_1x128x128_256x128x128x128_16x16_32x32_2x2_8x32x1_8x32x1_1x32x1x8_8_1x1_intrawave_v3,1165.89,719.31,0.0
gfx950,256,10571,3072,3072,ck,0,0,155.3804,a8w8_blockscale_1x128x128_256x128x128x128_16x16_32x32_2x2_8x32x1_8x32x1_1x32x1x8_8_1x1_intrawave_v3,1284.08,687.73,0.0
gfx950,256,10571,4096,3072,ck,0,0,206.0838,a8w8_blockscale_1x128x128_256x128x128x128_16x16_32x32_2x2_8x32x1_8x32x1_1x32x1x8_8_1x1_intrawave_v3,1290.87,638.84,0.0
gfx950,256,10572,2048,3072,ck,0,0,113.8153,a8w8_blockscale_1x128x128_256x128x128x128_16x16_32x32_2x2_8x32x1_8x32x1_1x32x1x8_8_1x1_intrawave_v3,1168.79,721.09,0.0
gfx950,256,10573,3072,3072,ck,0,0,157.0289,a8w8_blockscale_1x128x128_256x128x128x128_16x16_32x32_2x2_8x32x1_8x32x1_1x32x1x8_8_1x1_intrawave_v3,1270.84,680.63,0.0
gfx950,256,10573,4096,3072,ck,0,0,204.5792,a8w8_blockscale_1x128x128_256x128x128x128_16x16_32x32_2x2_8x32x1_8x32x1_1x32x1x8_8_1x1_intrawave_v3,1300.61,643.65,0.0
gfx950,256,10574,3072,3072,ck,0,0,157.9569,a8w8_blockscale_1x128x128_256x128x128x128_16x16_32x32_2x2_8x32x1_8x32x1_1x32x1x8_8_1x1_intrawave_v3,1263.49,676.69,0.0
gfx950,256,10574,4096,3072,ck,0,0,204.4663,a8w8_blockscale_1x128x128_256x128x128x128_16x16_32x32_2x2_8x32x1_8x32x1_1x32x1x8_8_1x1_intrawave_v3,1301.45,644.06,0.0
gfx950,256,10575,3072,3072,ck,0,0,158.7196,a8w8_blockscale_1x128x128_256x128x128x128_16x16_32x32_2x2_8x32x1_8x32x1_1x32x1x8_8_1x1_intrawave_v3,1257.54,673.49,0.0
gfx950,256,10575,4096,3072,ck,0,0,204.2646,a8w8_blockscale_1x128x128_256x128x128x128_16x16_32x32_2x2_8x32x1_8x32x1_1x32x1x8_8_1x1_intrawave_v3,1302.86,644.75,0.0
gfx950,256,10576,2048,3072,ck,0,0,113.848,a8w8_blockscale_1x128x128_256x128x128x128_16x16_32x32_2x2_8x32x1_8x32x1_1x32x1x8_8_1x1_intrawave_v3,1168.9,721.14,0.0
gfx950,256,10576,3072,3072,ck,0,0,156.3964,a8w8_blockscale_1x128x128_256x128x128x128_16x16_32x32_2x2_8x32x1_8x32x1_1x32x1x8_8_1x1_intrawave_v3,1276.34,683.56,0.0
gfx950,256,10576,4096,3072,ck,0,0,202.432,a8w8_blockscale_1x128x128_256x128x128x128_16x16_32x32_2x2_8x32x1_8x32x1_1x32x1x8_8_1x1_intrawave_v3,1314.78,650.64,0.0
gfx950,256,10578,3072,3072,ck,0,0,156.9304,a8w8_blockscale_1x128x128_256x128x128x128_16x16_32x32_2x2_8x32x1_8x32x1_1x32x1x8_8_1x1_intrawave_v3,1272.24,681.35,0.0
gfx950,256,10578,4096,3072,ck,0,0,204.1226,a8w8_blockscale_1x128x128_256x128x128x128_16x16_32x32_2x2_8x32x1_8x32x1_1x32x1x8_8_1x1_intrawave_v3,1304.14,645.36,0.0
gfx950,256,10579,3072,3072,ck,0,0,157.8911,a8w8_blockscale_1x128x128_256x128x128x128_16x16_32x32_2x2_8x32x1_8x32x1_1x32x1x8_8_1x1_intrawave_v3,1264.62,677.26,0.0
gfx950,256,10579,4096,3072,ck,0,0,205.3206,a8w8_blockscale_1x128x128_256x128x128x128_16x16_32x32_2x2_8x32x1_8x32x1_1x32x1x8_8_1x1_intrawave_v3,1296.65,641.65,0.0
gfx950,256,1058,2048,3072,ck,18,0,22.5876,a8w8_blockscale_1x128x128_256x64x64x256_16x16_32x32_1x1_16x16x1_16x16x1_1x32x1x8_8_1x1_intrawave_v1,589.38,614.28,0.0
gfx950,256,10580,3072,3072,ck,0,0,157.2502,a8w8_blockscale_1x128x128_256x128x128x128_16x16_32x32_2x2_8x32x1_8x32x1_1x32x1x8_8_1x1_intrawave_v3,1269.89,680.08,0.0
gfx950,256,10580,4096,3072,ck,0,0,200.6336,a8w8_blockscale_1x128x128_256x128x128x128_16x16_32x32_2x2_8x32x1_8x32x1_1x32x1x8_8_1x1_intrawave_v3,1327.07,656.7,0.0
gfx950,256,10581,2048,3072,ck,0,0,117.5412,a8w8_blockscale_1x128x128_256x128x128x128_16x16_32x32_2x2_8x32x1_8x32x1_1x32x1x8_8_1x1_intrawave_v3,1132.71,698.79,0.0
gfx950,256,10584,2048,3072,ck,0,0,114.3736,a8w8_blockscale_1x128x128_256x128x128x128_16x16_32x32_2x2_8x32x1_8x32x1_1x32x1x8_8_1x1_intrawave_v3,1164.41,718.33,0.0
gfx950,256,10585,2048,3072,ck,0,0,113.7247,a8w8_blockscale_1x128x128_256x128x128x128_16x16_32x32_2x2_8x32x1_8x32x1_1x32x1x8_8_1x1_intrawave_v3,1171.16,722.49,0.0
gfx950,256,10585,3072,6144,ck,0,0,292.4822,a8w8_blockscale_1x128x128_256x128x128x128_16x16_32x32_2x2_8x32x1_8x32x1_1x32x1x8_8_1x1_intrawave_v3,1366.14,509.24,0.0
gfx950,256,10585,8192,3072,ck,0,0,376.7022,a8w8_blockscale_1x128x128_256x128x128x128_16x16_32x32_2x2_8x32x1_8x32x1_1x32x1x8_8_1x1_intrawave_v3,1414.27,613.5,0.0
gfx950,256,10586,3072,3072,ck,0,0,158.2108,a8w8_blockscale_1x128x128_256x128x128x128_16x16_32x32_2x2_8x32x1_8x32x1_1x32x1x8_8_1x1_intrawave_v3,1262.9,676.3,0.0
gfx950,256,10586,4096,3072,ck,0,0,207.7919,a8w8_blockscale_1x128x128_256x128x128x128_16x16_32x32_2x2_8x32x1_8x32x1_1x32x1x8_8_1x1_intrawave_v3,1282.08,634.4,0.0
gfx950,256,10588,3072,3072,ck,0,0,154.6097,a8w8_blockscale_1x128x128_256x128x128x128_16x16_32x32_2x2_8x32x1_8x32x1_1x32x1x8_8_1x1_intrawave_v3,1292.56,692.17,0.0
gfx950,256,10588,4096,3072,ck,0,0,205.3108,a8w8_blockscale_1x128x128_256x128x128x128_16x16_32x32_2x2_8x32x1_8x32x1_1x32x1x8_8_1x1_intrawave_v3,1297.82,642.18,0.0
gfx950,256,10589,2048,3072,ck,0,0,114.3641,a8w8_blockscale_1x128x128_256x128x128x128_16x16_32x32_2x2_8x32x1_8x32x1_1x32x1x8_8_1x1_intrawave_v3,1165.05,718.7,0.0
gfx950,256,1059,2048,3072,ck,18,0,22.5579,a8w8_blockscale_1x128x128_256x64x64x256_16x16_32x32_1x1_16x16x1_16x16x1_1x32x1x8_8_1x1_intrawave_v1,590.72,615.41,0.0
gfx950,256,1059,3072,6144,ck,0,0,46.6202,a8w8_blockscale_1x128x128_256x128x128x128_16x16_32x32_2x2_8x32x1_8x32x1_1x32x1x8_8_1x1_intrawave_v3,857.48,683.98,0.0
gfx950,256,1059,8192,3072,ck,0,0,60.0832,a8w8_blockscale_1x128x128_256x128x128x128_16x16_32x32_2x2_8x32x1_8x32x1_1x32x1x8_8_1x1_intrawave_v3,887.12,761.77,0.0
gfx950,256,10591,3072,3072,ck,0,0,158.3401,a8w8_blockscale_1x128x128_256x128x128x128_16x16_32x32_2x2_8x32x1_8x32x1_1x32x1x8_8_1x1_intrawave_v3,1262.46,676.04,0.0
gfx950,256,10591,4096,3072,ck,0,0,206.6773,a8w8_blockscale_1x128x128_256x128x128x128_16x16_32x32_2x2_8x32x1_8x32x1_1x32x1x8_8_1x1_intrawave_v3,1289.6,638.1,0.0
gfx950,256,10592,3072,3072,ck,0,0,156.4907,a8w8_blockscale_1x128x128_256x128x128x128_16x16_32x32_2x2_8x32x1_8x32x1_1x32x1x8_8_1x1_intrawave_v3,1277.5,684.09,0.0
gfx950,256,10592,4096,3072,ck,0,0,204.5193,a8w8_blockscale_1x128x128_256x128x128x128_16x16_32x32_2x2_8x32x1_8x32x1_1x32x1x8_8_1x1_intrawave_v3,1303.33,644.88,0.0
gfx950,256,10593,2048,3072,ck,0,0,113.5783,a8w8_blockscale_1x128x128_256x128x128x128_16x16_32x32_2x2_8x32x1_8x32x1_1x32x1x8_8_1x1_intrawave_v3,1173.56,723.92,0.0
gfx950,256,10595,3072,3072,ck,0,0,156.8972,a8w8_blockscale_1x128x128_256x128x128x128_16x16_32x32_2x2_8x32x1_8x32x1_1x32x1x8_8_1x1_intrawave_v3,1274.55,682.49,0.0
gfx950,256,10595,4096,3072,ck,0,0,203.5505,a8w8_blockscale_1x128x128_256x128x128x128_16x16_32x32_2x2_8x32x1_8x32x1_1x32x1x8_8_1x1_intrawave_v3,1309.91,648.12,0.0
gfx950,256,10596,2048,3072,ck,0,0,114.6216,a8w8_blockscale_1x128x128_256x128x128x128_16x16_32x32_2x2_8x32x1_8x32x1_1x32x1x8_8_1x1_intrawave_v3,1163.21,717.52,0.0
gfx950,256,1060,2048,3072,ck,18,0,22.6494,a8w8_blockscale_1x128x128_256x64x64x256_16x16_32x32_1x1_16x16x1_16x16x1_1x32x1x8_8_1x1_intrawave_v1,588.88,613.24,0.0
gfx950,256,10601,2048,3072,ck,0,0,113.2091,a8w8_blockscale_1x128x128_256x128x128x128_16x16_32x32_2x2_8x32x1_8x32x1_1x32x1x8_8_1x1_intrawave_v3,1178.27,726.79,0.0
gfx950,256,10601,3072,3072,ck,0,0,158.8162,a8w8_blockscale_1x128x128_256x128x128x128_16x16_32x32_2x2_8x32x1_8x32x1_1x32x1x8_8_1x1_intrawave_v3,1259.87,674.59,0.0
gfx950,256,10601,4096,3072,ck,0,0,207.7882,a8w8_blockscale_1x128x128_256x128x128x128_16x16_32x32_2x2_8x32x1_8x32x1_1x32x1x8_8_1x1_intrawave_v3,1283.92,635.23,0.0
gfx950,256,10602,3072,3072,ck,0,0,157.7296,a8w8_blockscale_1x128x128_256x128x128x128_16x16_32x32_2x2_8x32x1_8x32x1_1x32x1x8_8_1x1_intrawave_v3,1268.67,679.3,0.0
gfx950,256,10602,4096,3072,ck,0,0,206.1916,a8w8_blockscale_1x128x128_256x128x128x128_16x16_32x32_2x2_8x32x1_8x32x1_1x32x1x8_8_1x1_intrawave_v3,1293.98,640.2,0.0
gfx950,256,10604,3072,3072,ck,0,0,156.7937,a8w8_blockscale_1x128x128_256x128x128x128_16x16_32x32_2x2_8x32x1_8x32x1_1x32x1x8_8_1x1_intrawave_v3,1276.48,683.47,0.0
gfx950,256,10604,4096,3072,ck,0,0,206.6253,a8w8_blockscale_1x128x128_256x128x128x128_16x16_32x32_2x2_8x32x1_8x32x1_1x32x1x8_8_1x1_intrawave_v3,1291.51,638.97,0.0
gfx950,256,10605,2048,3072,ck,0,0,114.8104,a8w8_blockscale_1x128x128_256x128x128x128_16x16_32x32_2x2_8x32x1_8x32x1_1x32x1x8_8_1x1_intrawave_v3,1162.28,716.9,0.0
gfx950,256,10605,3072,3072,ck,0,0,158.5087,a8w8_blockscale_1x128x128_256x128x128x128_16x16_32x32_2x2_8x32x1_8x32x1_1x32x1x8_8_1x1_intrawave_v3,1262.79,676.13,0.0
gfx950,256,10605,4096,3072,ck,0,0,207.5423,a8w8_blockscale_1x128x128_256x128x128x128_16x16_32x32_2x2_8x32x1_8x32x1_1x32x1x8_8_1x1_intrawave_v3,1285.92,636.2,0.0
gfx950,256,10607,3072,6144,ck,0,0,295.2099,a8w8_blockscale_1x128x128_256x128x128x128_16x16_32x32_2x2_8x32x1_8x32x1_1x32x1x8_8_1x1_intrawave_v3,1356.33,505.45,0.0
gfx950,256,10607,8192,3072,ck,0,0,375.774,a8w8_blockscale_1x128x128_256x128x128x128_16x16_32x32_2x2_8x32x1_8x32x1_1x32x1x8_8_1x1_intrawave_v3,1420.72,616.16,0.0
gfx950,256,10609,2048,3072,ck,0,0,112.616,a8w8_blockscale_1x128x128_256x128x128x128_16x16_32x32_2x2_8x32x1_8x32x1_1x32x1x8_8_1x1_intrawave_v3,1185.37,731.13,0.0
gfx950,256,10609,3072,3072,ck,0,0,156.5042,a8w8_blockscale_1x128x128_256x128x128x128_16x16_32x32_2x2_8x32x1_8x32x1_1x32x1x8_8_1x1_intrawave_v3,1279.44,685.03,0.0
gfx950,256,10609,4096,3072,ck,0,0,204.1651,a8w8_blockscale_1x128x128_256x128x128x128_16x16_32x32_2x2_8x32x1_8x32x1_1x32x1x8_8_1x1_intrawave_v3,1307.69,646.94,0.0
gfx950,256,1061,2048,3072,ck,18,0,22.7484,a8w8_blockscale_1x128x128_256x64x64x256_16x16_32x32_1x1_16x16x1_16x16x1_1x32x1x8_8_1x1_intrawave_v1,586.88,610.89,0.0
gfx950,256,10610,3072,3072,ck,0,0,156.5131,a8w8_blockscale_1x128x128_256x128x128x128_16x16_32x32_2x2_8x32x1_8x32x1_1x32x1x8_8_1x1_intrawave_v3,1279.49,685.05,0.0
gfx950,256,10610,4096,3072,ck,0,0,205.5416,a8w8_blockscale_1x128x128_256x128x128x128_16x16_32x32_2x2_8x32x1_8x32x1_1x32x1x8_8_1x1_intrawave_v3,1299.05,642.66,0.0
gfx950,256,10612,3072,3072,ck,0,0,157.6971,a8w8_blockscale_1x128x128_256x128x128x128_16x16_32x32_2x2_8x32x1_8x32x1_1x32x1x8_8_1x1_intrawave_v3,1270.12,680.02,0.0
gfx950,256,10612,4096,3072,ck,0,0,206.334,a8w8_blockscale_1x128x128_256x128x128x128_16x16_32x32_2x2_8x32x1_8x32x1_1x32x1x8_8_1x1_intrawave_v3,1294.31,640.3,0.0
gfx950,256,10613,2048,3072,ck,0,0,113.0906,a8w8_blockscale_1x128x128_256x128x128x128_16x16_32x32_2x2_8x32x1_8x32x1_1x32x1x8_8_1x1_intrawave_v3,1180.84,728.31,0.0
gfx950,256,10613,3072,3072,ck,0,0,157.1411,a8w8_blockscale_1x128x128_256x128x128x128_16x16_32x32_2x2_8x32x1_8x32x1_1x32x1x8_8_1x1_intrawave_v3,1274.74,682.49,0.0
gfx950,256,10613,4096,3072,ck,0,0,204.5213,a8w8_blockscale_1x128x128_256x128x128x128_16x16_32x32_2x2_8x32x1_8x32x1_1x32x1x8_8_1x1_intrawave_v3,1305.9,646.03,0.0
gfx950,256,10617,2048,3072,ck,0,0,115.0519,a8w8_blockscale_1x128x128_256x128x128x128_16x16_32x32_2x2_8x32x1_8x32x1_1x32x1x8_8_1x1_intrawave_v3,1161.15,716.15,0.0
gfx950,256,10617,3072,3072,ck,0,0,157.5975,a8w8_blockscale_1x128x128_256x128x128x128_16x16_32x32_2x2_8x32x1_8x32x1_1x32x1x8_8_1x1_intrawave_v3,1271.53,680.74,0.0
gfx950,256,10617,4096,3072,ck,0,0,202.5987,a8w8_blockscale_1x128x128_256x128x128x128_16x16_32x32_2x2_8x32x1_8x32x1_1x32x1x8_8_1x1_intrawave_v3,1318.79,652.39,0.0
gfx950,256,10618,3072,6144,ck,0,0,293.6422,a8w8_blockscale_1x128x128_256x128x128x128_16x16_32x32_2x2_8x32x1_8x32x1_1x32x1x8_8_1x1_intrawave_v3,1364.98,508.61,0.0
gfx950,256,10618,8192,3072,ck,0,0,366.3256,a8w8_blockscale_1x128x128_256x128x128x128_16x16_32x32_2x2_8x32x1_8x32x1_1x32x1x8_8_1x1_intrawave_v3,1458.87,632.63,0.0
gfx950,256,10619,2048,3072,ck,0,0,115.1035,a8w8_blockscale_1x128x128_256x128x128x128_16x16_32x32_2x2_8x32x1_8x32x1_1x32x1x8_8_1x1_intrawave_v3,1160.85,715.95,0.0
gfx950,256,10619,3072,3072,ck,0,0,156.0706,a8w8_blockscale_1x128x128_256x128x128x128_16x16_32x32_2x2_8x32x1_8x32x1_1x32x1x8_8_1x1_intrawave_v3,1284.21,687.52,0.0
gfx950,256,10619,4096,3072,ck,0,0,205.1543,a8w8_blockscale_1x128x128_256x128x128x128_16x16_32x32_2x2_8x32x1_8x32x1_1x32x1x8_8_1x1_intrawave_v3,1302.61,644.37,0.0
gfx950,256,1062,3072,3072,ck,0,0,26.8837,a8w8_blockscale_1x128x128_256x128x128x128_16x16_32x32_2x2_8x32x1_8x32x1_1x32x1x8_8_1x1_intrawave_v3,745.6,715.1,0.0
gfx950,256,1062,4096,3072,ck,18,0,35.6647,a8w8_blockscale_1x128x128_256x64x64x256_16x16_32x32_1x1_16x16x1_16x16x1_1x32x1x8_8_1x1_intrawave_v1,749.37,688.22,0.0
gfx950,256,10620,3072,3072,ck,0,0,154.7001,a8w8_blockscale_1x128x128_256x128x128x128_16x16_32x32_2x2_8x32x1_8x32x1_1x32x1x8_8_1x1_intrawave_v3,1295.71,693.67,0.0
gfx950,256,10620,4096,3072,ck,0,0,205.1266,a8w8_blockscale_1x128x128_256x128x128x128_16x16_32x32_2x2_8x32x1_8x32x1_1x32x1x8_8_1x1_intrawave_v3,1302.91,644.51,0.0
gfx950,256,10621,3072,3072,ck,0,0,157.8859,a8w8_blockscale_1x128x128_256x128x128x128_16x16_32x32_2x2_8x32x1_8x32x1_1x32x1x8_8_1x1_intrawave_v3,1269.68,679.73,0.0
gfx950,256,10621,4096,3072,ck,0,0,200.0082,a8w8_blockscale_1x128x128_256x128x128x128_16x16_32x32_2x2_8x32x1_8x32x1_1x32x1x8_8_1x1_intrawave_v3,1336.38,661.06,0.0
gfx950,256,10622,3072,3072,ck,0,0,155.8258,a8w8_blockscale_1x128x128_256x128x128x128_16x16_32x32_2x2_8x32x1_8x32x1_1x32x1x8_8_1x1_intrawave_v3,1286.59,688.78,0.0
gfx950,256,10622,4096,3072,ck,0,0,201.7099,a8w8_blockscale_1x128x128_256x128x128x128_16x16_32x32_2x2_8x32x1_8x32x1_1x32x1x8_8_1x1_intrawave_v3,1325.23,655.54,0.0
gfx950,256,10623,3072,3072,ck,0,0,158.5608,a8w8_blockscale_1x128x128_256x128x128x128_16x16_32x32_2x2_8x32x1_8x32x1_1x32x1x8_8_1x1_intrawave_v3,1264.51,676.96,0.0
gfx950,256,10623,4096,3072,ck,0,0,205.4878,a8w8_blockscale_1x128x128_256x128x128x128_16x16_32x32_2x2_8x32x1_8x32x1_1x32x1x8_8_1x1_intrawave_v3,1300.99,643.54,0.0
gfx950,256,10624,2048,3072,ck,0,0,114.6724,a8w8_blockscale_1x128x128_256x128x128x128_16x16_32x32_2x2_8x32x1_8x32x1_1x32x1x8_8_1x1_intrawave_v3,1165.76,718.95,0.0
gfx950,256,10624,3072,3072,ck,0,0,156.7127,a8w8_blockscale_1x128x128_256x128x128x128_16x16_32x32_2x2_8x32x1_8x32x1_1x32x1x8_8_1x1_intrawave_v3,1279.55,685.0,0.0
gfx950,256,10624,3072,6144,ck,0,0,287.2365,a8w8_blockscale_1x128x128_256x128x128x128_16x16_32x32_2x2_8x32x1_8x32x1_1x32x1x8_8_1x1_intrawave_v3,1396.21,520.21,0.0
gfx950,256,10624,4096,3072,ck,0,0,203.2451,a8w8_blockscale_1x128x128_256x128x128x128_16x16_32x32_2x2_8x32x1_8x32x1_1x32x1x8_8_1x1_intrawave_v3,1315.46,650.7,0.0
gfx950,256,10624,8192,3072,ck,0,0,373.3727,a8w8_blockscale_1x128x128_256x128x128x128_16x16_32x32_2x2_8x32x1_8x32x1_1x32x1x8_8_1x1_intrawave_v3,1432.14,621.01,0.0
gfx950,256,10626,2048,3072,ck,0,0,115.614,a8w8_blockscale_1x128x128_256x128x128x128_16x16_32x32_2x2_8x32x1_8x32x1_1x32x1x8_8_1x1_intrawave_v3,1156.49,713.22,0.0
gfx950,256,10628,3072,6144,ck,0,0,294.2848,a8w8_blockscale_1x128x128_256x128x128x128_16x16_32x32_2x2_8x32x1_8x32x1_1x32x1x8_8_1x1_intrawave_v3,1363.28,507.91,0.0
gfx950,256,10628,8192,3072,ck,0,0,377.654,a8w8_blockscale_1x128x128_256x128x128x128_16x16_32x32_2x2_8x32x1_8x32x1_1x32x1x8_8_1x1_intrawave_v3,1416.44,614.17,0.0
gfx950,256,1063,3072,6144,ck,0,0,46.6156,a8w8_blockscale_1x128x128_256x128x128x128_16x16_32x32_2x2_8x32x1_8x32x1_1x32x1x8_8_1x1_intrawave_v3,860.8,685.1,0.0
gfx950,256,1063,8192,3072,ck,0,0,59.9539,a8w8_blockscale_1x128x128_256x128x128x128_16x16_32x32_2x2_8x32x1_8x32x1_1x32x1x8_8_1x1_intrawave_v3,892.39,764.71,0.0
gfx950,256,10630,2048,3072,ck,0,0,114.2973,a8w8_blockscale_1x128x128_256x128x128x128_16x16_32x32_2x2_8x32x1_8x32x1_1x32x1x8_8_1x1_intrawave_v3,1170.25,721.69,0.0
gfx950,256,10635,3072,3072,ck,0,0,156.9376,a8w8_blockscale_1x128x128_256x128x128x128_16x16_32x32_2x2_8x32x1_8x32x1_1x32x1x8_8_1x1_intrawave_v3,1279.04,684.66,0.0
gfx950,256,10635,4096,3072,ck,0,0,207.9733,a8w8_blockscale_1x128x128_256x128x128x128_16x16_32x32_2x2_8x32x1_8x32x1_1x32x1x8_8_1x1_intrawave_v3,1286.89,636.5,0.0
gfx950,256,10637,3072,3072,ck,0,0,155.1917,a8w8_blockscale_1x128x128_256x128x128x128_16x16_32x32_2x2_8x32x1_8x32x1_1x32x1x8_8_1x1_intrawave_v3,1293.67,692.48,0.0
gfx950,256,10637,4096,3072,ck,0,0,208.918,a8w8_blockscale_1x128x128_256x128x128x128_16x16_32x32_2x2_8x32x1_8x32x1_1x32x1x8_8_1x1_intrawave_v3,1281.31,633.73,0.0
gfx950,256,10640,2048,3072,ck,0,0,114.6364,a8w8_blockscale_1x128x128_256x128x128x128_16x16_32x32_2x2_8x32x1_8x32x1_1x32x1x8_8_1x1_intrawave_v3,1167.89,720.18,0.0
gfx950,256,10642,3072,3072,ck,0,0,157.2193,a8w8_blockscale_1x128x128_256x128x128x128_16x16_32x32_2x2_8x32x1_8x32x1_1x32x1x8_8_1x1_intrawave_v3,1277.59,683.85,0.0
gfx950,256,10642,4096,3072,ck,0,0,205.5276,a8w8_blockscale_1x128x128_256x128x128x128_16x16_32x32_2x2_8x32x1_8x32x1_1x32x1x8_8_1x1_intrawave_v3,1303.06,644.46,0.0
gfx950,256,10643,3072,3072,ck,0,0,158.1653,a8w8_blockscale_1x128x128_256x128x128x128_16x16_32x32_2x2_8x32x1_8x32x1_1x32x1x8_8_1x1_intrawave_v3,1270.06,679.81,0.0
gfx950,256,10643,4096,3072,ck,0,0,209.1207,a8w8_blockscale_1x128x128_256x128x128x128_16x16_32x32_2x2_8x32x1_8x32x1_1x32x1x8_8_1x1_intrawave_v3,1280.79,633.44,0.0
gfx950,256,10644,2048,3072,ck,0,0,113.1628,a8w8_blockscale_1x128x128_256x128x128x128_16x16_32x32_2x2_8x32x1_8x32x1_1x32x1x8_8_1x1_intrawave_v3,1183.54,729.81,0.0
gfx950,256,10649,3072,6144,ck,0,0,296.4245,a8w8_blockscale_1x128x128_256x128x128x128_16x16_32x32_2x2_8x32x1_8x32x1_1x32x1x8_8_1x1_intrawave_v3,1356.12,505.12,0.0
gfx950,256,10649,8192,3072,ck,0,0,382.621,a8w8_blockscale_1x128x128_256x128x128x128_16x16_32x32_2x2_8x32x1_8x32x1_1x32x1x8_8_1x1_intrawave_v3,1400.82,607.27,0.0
gfx950,256,10652,3072,6144,ck,0,0,295.9617,a8w8_blockscale_1x128x128_256x128x128x128_16x16_32x32_2x2_8x32x1_8x32x1_1x32x1x8_8_1x1_intrawave_v3,1358.62,506.03,0.0
gfx950,256,10652,8192,3072,ck,0,0,382.1671,a8w8_blockscale_1x128x128_256x128x128x128_16x16_32x32_2x2_8x32x1_8x32x1_1x32x1x8_8_1x1_intrawave_v3,1402.88,608.14,0.0
gfx950,256,10654,3072,3072,ck,0,0,156.6562,a8w8_blockscale_1x128x128_256x128x128x128_16x16_32x32_2x2_8x32x1_8x32x1_1x32x1x8_8_1x1_intrawave_v3,1283.62,687.01,0.0
gfx950,256,10654,4096,3072,ck,0,0,202.9987,a8w8_blockscale_1x128x128_256x128x128x128_16x16_32x32_2x2_8x32x1_8x32x1_1x32x1x8_8_1x1_intrawave_v3,1320.78,653.15,0.0
gfx950,256,10655,2048,3072,ck,0,0,115.4054,a8w8_blockscale_1x128x128_256x128x128x128_16x16_32x32_2x2_8x32x1_8x32x1_1x32x1x8_8_1x1_intrawave_v3,1161.74,716.31,0.0
gfx950,256,10656,3072,3072,ck,0,0,155.6014,a8w8_blockscale_1x128x128_256x128x128x128_16x16_32x32_2x2_8x32x1_8x32x1_1x32x1x8_8_1x1_intrawave_v3,1292.57,691.79,0.0
gfx950,256,10656,4096,3072,ck,0,0,206.6073,a8w8_blockscale_1x128x128_256x128x128x128_16x16_32x32_2x2_8x32x1_8x32x1_1x32x1x8_8_1x1_intrawave_v3,1297.96,641.86,0.0
gfx950,256,10657,3072,3072,ck,0,0,158.8228,a8w8_blockscale_1x128x128_256x128x128x128_16x16_32x32_2x2_8x32x1_8x32x1_1x32x1x8_8_1x1_intrawave_v3,1266.47,677.81,0.0
gfx950,256,10657,4096,3072,ck,0,0,206.9166,a8w8_blockscale_1x128x128_256x128x128x128_16x16_32x32_2x2_8x32x1_8x32x1_1x32x1x8_8_1x1_intrawave_v3,1296.14,640.95,0.0
gfx950,256,10658,2048,3072,ck,0,0,116.4737,a8w8_blockscale_1x128x128_256x128x128x128_16x16_32x32_2x2_8x32x1_8x32x1_1x32x1x8_8_1x1_intrawave_v3,1151.41,709.93,0.0
gfx950,256,10659,2048,3072,ck,0,0,114.9327,a8w8_blockscale_1x128x128_256x128x128x128_16x16_32x32_2x2_8x32x1_8x32x1_1x32x1x8_8_1x1_intrawave_v3,1166.95,719.51,0.0
gfx950,256,10664,2048,3072,ck,0,0,113.7861,a8w8_blockscale_1x128x128_256x128x128x128_16x16_32x32_2x2_8x32x1_8x32x1_1x32x1x8_8_1x1_intrawave_v3,1179.27,727.07,0.0
gfx950,256,10669,3072,3072,ck,0,0,156.6883,a8w8_blockscale_1x128x128_256x128x128x128_16x16_32x32_2x2_8x32x1_8x32x1_1x32x1x8_8_1x1_intrawave_v3,1285.17,687.75,0.0
gfx950,256,10669,4096,3072,ck,0,0,202.0667,a8w8_blockscale_1x128x128_256x128x128x128_16x16_32x32_2x2_8x32x1_8x32x1_1x32x1x8_8_1x1_intrawave_v3,1328.74,657.0,0.0
gfx950,256,10670,3072,3072,ck,0,0,158.1111,a8w8_blockscale_1x128x128_256x128x128x128_16x16_32x32_2x2_8x32x1_8x32x1_1x32x1x8_8_1x1_intrawave_v3,1273.72,681.62,0.0
gfx950,256,10670,3072,6144,ck,0,0,293.8232,a8w8_blockscale_1x128x128_256x128x128x128_16x16_32x32_2x2_8x32x1_8x32x1_1x32x1x8_8_1x1_intrawave_v3,1370.82,510.47,0.0
gfx950,256,10670,4096,3072,ck,0,0,205.966,a8w8_blockscale_1x128x128_256x128x128x128_16x16_32x32_2x2_8x32x1_8x32x1_1x32x1x8_8_1x1_intrawave_v3,1303.71,644.62,0.0
gfx950,256,10670,8192,3072,ck,0,0,376.6286,a8w8_blockscale_1x128x128_256x128x128x128_16x16_32x32_2x2_8x32x1_8x32x1_1x32x1x8_8_1x1_intrawave_v3,1425.91,618.01,0.0
gfx950,256,10672,2048,3072,ck,0,0,112.5177,a8w8_blockscale_1x128x128_256x128x128x128_16x16_32x32_2x2_8x32x1_8x32x1_1x32x1x8_8_1x1_intrawave_v3,1193.46,735.78,0.0
gfx950,256,10672,3072,3072,ck,0,0,157.5131,a8w8_blockscale_1x128x128_256x128x128x128_16x16_32x32_2x2_8x32x1_8x32x1_1x32x1x8_8_1x1_intrawave_v3,1278.8,684.33,0.0
gfx950,256,10672,4096,3072,ck,0,0,206.8235,a8w8_blockscale_1x128x128_256x128x128x128_16x16_32x32_2x2_8x32x1_8x32x1_1x32x1x8_8_1x1_intrawave_v3,1298.55,642.06,0.0
gfx950,256,10675,3072,3072,ck,0,0,157.7227,a8w8_blockscale_1x128x128_256x128x128x128_16x16_32x32_2x2_8x32x1_8x32x1_1x32x1x8_8_1x1_intrawave_v3,1277.46,683.59,0.0
gfx950,256,10675,4096,3072,ck,0,0,208.1245,a8w8_blockscale_1x128x128_256x128x128x128_16x16_32x32_2x2_8x32x1_8x32x1_1x32x1x8_8_1x1_intrawave_v3,1290.79,638.21,0.0
gfx950,256,10676,2048,3072,ck,0,0,113.7422,a8w8_blockscale_1x128x128_256x128x128x128_16x16_32x32_2x2_8x32x1_8x32x1_1x32x1x8_8_1x1_intrawave_v3,1181.05,728.11,0.0
gfx950,256,10678,2048,3072,ck,0,0,114.3865,a8w8_blockscale_1x128x128_256x128x128x128_16x16_32x32_2x2_8x32x1_8x32x1_1x32x1x8_8_1x1_intrawave_v3,1174.62,724.14,0.0
gfx950,256,10678,3072,3072,ck,0,0,155.876,a8w8_blockscale_1x128x128_256x128x128x128_16x16_32x32_2x2_8x32x1_8x32x1_1x32x1x8_8_1x1_intrawave_v3,1292.95,691.87,0.0
gfx950,256,10678,4096,3072,ck,0,0,207.6531,a8w8_blockscale_1x128x128_256x128x128x128_16x16_32x32_2x2_8x32x1_8x32x1_1x32x1x8_8_1x1_intrawave_v3,1294.08,639.82,0.0
gfx950,256,1068,2048,3072,ck,18,0,22.4551,a8w8_blockscale_1x128x128_256x64x64x256_16x16_32x32_1x1_16x16x1_16x16x1_1x32x1x8_8_1x1_intrawave_v1,598.46,621.1,0.0
gfx950,256,10681,3072,3072,ck,0,0,157.2874,a8w8_blockscale_1x128x128_256x128x128x128_16x16_32x32_2x2_8x32x1_8x32x1_1x32x1x8_8_1x1_intrawave_v3,1281.71,685.84,0.0
gfx950,256,10681,4096,3072,ck,0,0,207.0246,a8w8_blockscale_1x128x128_256x128x128x128_16x16_32x32_2x2_8x32x1_8x32x1_1x32x1x8_8_1x1_intrawave_v3,1298.38,641.92,0.0
gfx950,256,10690,2048,3072,ck,0,0,116.6319,a8w8_blockscale_1x128x128_256x128x128x128_16x16_32x32_2x2_8x32x1_8x32x1_1x32x1x8_8_1x1_intrawave_v3,1153.3,710.93,0.0
gfx950,256,10691,2048,3072,ck,0,0,114.0376,a8w8_blockscale_1x128x128_256x128x128x128_16x16_32x32_2x2_8x32x1_8x32x1_1x32x1x8_8_1x1_intrawave_v3,1179.65,727.17,0.0
gfx950,256,10691,3072,3072,ck,0,0,156.313,a8w8_blockscale_1x128x128_256x128x128x128_16x16_32x32_2x2_8x32x1_8x32x1_1x32x1x8_8_1x1_intrawave_v3,1290.91,690.7,0.0
gfx950,256,10691,3072,6144,ck,0,0,295.7452,a8w8_blockscale_1x128x128_256x128x128x128_16x16_32x32_2x2_8x32x1_8x32x1_1x32x1x8_8_1x1_intrawave_v3,1364.59,508.02,0.0
gfx950,256,10691,4096,3072,ck,0,0,205.924,a8w8_blockscale_1x128x128_256x128x128x128_16x16_32x32_2x2_8x32x1_8x32x1_1x32x1x8_8_1x1_intrawave_v3,1306.54,645.9,0.0
gfx950,256,10691,8192,3072,ck,0,0,381.6013,a8w8_blockscale_1x128x128_256x128x128x128_16x16_32x32_2x2_8x32x1_8x32x1_1x32x1x8_8_1x1_intrawave_v3,1410.1,611.03,0.0
gfx950,256,10694,3072,6144,ck,0,0,296.9903,a8w8_blockscale_1x128x128_256x128x128x128_16x16_32x32_2x2_8x32x1_8x32x1_1x32x1x8_8_1x1_intrawave_v3,1359.25,506.02,0.0
gfx950,256,10694,8192,3072,ck,0,0,373.4025,a8w8_blockscale_1x128x128_256x128x128x128_16x16_32x32_2x2_8x32x1_8x32x1_1x32x1x8_8_1x1_intrawave_v3,1441.47,624.6,0.0
gfx950,256,10695,2048,3072,ck,0,0,114.6822,a8w8_blockscale_1x128x128_256x128x128x128_16x16_32x32_2x2_8x32x1_8x32x1_1x32x1x8_8_1x1_intrawave_v3,1173.45,723.33,0.0
gfx950,256,10697,2048,3072,ck,0,0,113.3499,a8w8_blockscale_1x128x128_256x128x128x128_16x16_32x32_2x2_8x32x1_8x32x1_1x32x1x8_8_1x1_intrawave_v3,1187.47,731.96,0.0
gfx950,256,1070,3072,3072,ck,0,0,26.8137,a8w8_blockscale_1x128x128_256x128x128x128_16x16_32x32_2x2_8x32x1_8x32x1_1x32x1x8_8_1x1_intrawave_v3,753.18,719.72,0.0
gfx950,256,1070,4096,3072,ck,18,0,35.4773,a8w8_blockscale_1x128x128_256x64x64x256_16x16_32x32_1x1_16x16x1_16x16x1_1x32x1x8_8_1x1_intrawave_v1,759.0,694.4,0.0
gfx950,256,10700,2048,3072,ck,0,0,115.5419,a8w8_blockscale_1x128x128_256x128x128x128_16x16_32x32_2x2_8x32x1_8x32x1_1x32x1x8_8_1x1_intrawave_v3,1165.27,718.26,0.0
gfx950,256,10702,3072,3072,ck,0,0,156.702,a8w8_blockscale_1x128x128_256x128x128x128_16x16_32x32_2x2_8x32x1_8x32x1_1x32x1x8_8_1x1_intrawave_v3,1289.03,689.63,0.0
gfx950,256,10702,4096,3072,ck,0,0,206.6953,a8w8_blockscale_1x128x128_256x128x128x128_16x16_32x32_2x2_8x32x1_8x32x1_1x32x1x8_8_1x1_intrawave_v3,1303.0,644.09,0.0
gfx950,256,10703,3072,3072,ck,0,0,158.8821,a8w8_blockscale_1x128x128_256x128x128x128_16x16_32x32_2x2_8x32x1_8x32x1_1x32x1x8_8_1x1_intrawave_v3,1271.46,680.23,0.0
gfx950,256,10703,3072,6144,ck,0,0,291.4797,a8w8_blockscale_1x128x128_256x128x128x128_16x16_32x32_2x2_8x32x1_8x32x1_1x32x1x8_8_1x1_intrawave_v3,1386.12,515.96,0.0
gfx950,256,10703,4096,3072,ck,0,0,206.2236,a8w8_blockscale_1x128x128_256x128x128x128_16x16_32x32_2x2_8x32x1_8x32x1_1x32x1x8_8_1x1_intrawave_v3,1306.11,645.62,0.0
gfx950,256,10703,8192,3072,ck,0,0,379.4699,a8w8_blockscale_1x128x128_256x128x128x128_16x16_32x32_2x2_8x32x1_8x32x1_1x32x1x8_8_1x1_intrawave_v3,1419.61,615.08,0.0
gfx950,256,10706,3072,6144,ck,0,0,295.5217,a8w8_blockscale_1x128x128_256x128x128x128_16x16_32x32_2x2_8x32x1_8x32x1_1x32x1x8_8_1x1_intrawave_v3,1367.54,509.03,0.0
gfx950,256,10706,8192,3072,ck,0,0,364.617,a8w8_blockscale_1x128x128_256x128x128x128_16x16_32x32_2x2_8x32x1_8x32x1_1x32x1x8_8_1x1_intrawave_v3,1477.85,640.29,0.0
gfx950,256,10707,3072,6144,ck,0,0,293.321,a8w8_blockscale_1x128x128_256x128x128x128_16x16_32x32_2x2_8x32x1_8x32x1_1x32x1x8_8_1x1_intrawave_v3,1377.93,512.89,0.0
gfx950,256,10707,8192,3072,ck,0,0,368.4983,a8w8_blockscale_1x128x128_256x128x128x128_16x16_32x32_2x2_8x32x1_8x32x1_1x32x1x8_8_1x1_intrawave_v3,1462.42,633.6,0.0
gfx950,256,10708,3072,6144,ck,0,0,291.0118,a8w8_blockscale_1x128x128_256x128x128x128_16x16_32x32_2x2_8x32x1_8x32x1_1x32x1x8_8_1x1_intrawave_v3,1388.99,517.0,0.0
gfx950,256,10708,8192,3072,ck,0,0,377.5124,a8w8_blockscale_1x128x128_256x128x128x128_16x16_32x32_2x2_8x32x1_8x32x1_1x32x1x8_8_1x1_intrawave_v3,1427.64,618.52,0.0
gfx950,256,10709,3072,6144,ck,0,0,289.915,a8w8_blockscale_1x128x128_256x128x128x128_16x16_32x32_2x2_8x32x1_8x32x1_1x32x1x8_8_1x1_intrawave_v3,1394.38,519.0,0.0
gfx950,256,10709,8192,3072,ck,0,0,383.3811,a8w8_blockscale_1x128x128_256x128x128x128_16x16_32x32_2x2_8x32x1_8x32x1_1x32x1x8_8_1x1_intrawave_v3,1405.92,609.11,0.0
gfx950,256,10710,3072,6144,ck,0,0,290.7775,a8w8_blockscale_1x128x128_256x128x128x128_16x16_32x32_2x2_8x32x1_8x32x1_1x32x1x8_8_1x1_intrawave_v3,1390.37,517.51,0.0
gfx950,256,10710,8192,3072,ck,0,0,376.6546,a8w8_blockscale_1x128x128_256x128x128x128_16x16_32x32_2x2_8x32x1_8x32x1_1x32x1x8_8_1x1_intrawave_v3,1431.16,620.04,0.0
gfx950,256,10711,2048,3072,ck,0,0,115.9506,a8w8_blockscale_1x128x128_256x128x128x128_16x16_32x32_2x2_8x32x1_8x32x1_1x32x1x8_8_1x1_intrawave_v3,1162.35,716.41,0.0
gfx950,256,10714,3072,6144,ck,0,0,291.0969,a8w8_blockscale_1x128x128_256x128x128x128_16x16_32x32_2x2_8x32x1_8x32x1_1x32x1x8_8_1x1_intrawave_v3,1389.37,517.11,0.0
gfx950,256,10714,8192,3072,ck,0,0,367.8666,a8w8_blockscale_1x128x128_256x128x128x128_16x16_32x32_2x2_8x32x1_8x32x1_1x32x1x8_8_1x1_intrawave_v3,1465.89,635.06,0.0
gfx950,256,10715,2048,3072,ck,0,0,114.4881,a8w8_blockscale_1x128x128_256x128x128x128_16x16_32x32_2x2_8x32x1_8x32x1_1x32x1x8_8_1x1_intrawave_v3,1177.64,725.81,0.0
gfx950,256,10716,3072,3072,ck,0,0,157.4468,a8w8_blockscale_1x128x128_256x128x128x128_16x16_32x32_2x2_8x32x1_8x32x1_1x32x1x8_8_1x1_intrawave_v3,1284.61,687.19,0.0
gfx950,256,10716,3072,6144,ck,0,0,294.0358,a8w8_blockscale_1x128x128_256x128x128x128_16x16_32x32_2x2_8x32x1_8x32x1_1x32x1x8_8_1x1_intrawave_v3,1375.74,512.02,0.0
gfx950,256,10716,4096,3072,ck,0,0,208.8033,a8w8_blockscale_1x128x128_256x128x128x128_16x16_32x32_2x2_8x32x1_8x32x1_1x32x1x8_8_1x1_intrawave_v3,1291.54,638.34,0.0
gfx950,256,10716,8192,3072,ck,0,0,377.5169,a8w8_blockscale_1x128x128_256x128x128x128_16x16_32x32_2x2_8x32x1_8x32x1_1x32x1x8_8_1x1_intrawave_v3,1428.69,618.93,0.0
gfx950,256,10717,3072,6144,ck,0,0,290.8118,a8w8_blockscale_1x128x128_256x128x128x128_16x16_32x32_2x2_8x32x1_8x32x1_1x32x1x8_8_1x1_intrawave_v3,1391.12,517.74,0.0
gfx950,256,10717,8192,3072,ck,0,0,378.233,a8w8_blockscale_1x128x128_256x128x128x128_16x16_32x32_2x2_8x32x1_8x32x1_1x32x1x8_8_1x1_intrawave_v3,1426.12,617.81,0.0
gfx950,256,10718,3072,6144,ck,0,0,288.0486,a8w8_blockscale_1x128x128_256x128x128x128_16x16_32x32_2x2_8x32x1_8x32x1_1x32x1x8_8_1x1_intrawave_v3,1404.59,522.75,0.0
gfx950,256,10718,8192,3072,ck,0,0,364.5529,a8w8_blockscale_1x128x128_256x128x128x128_16x16_32x32_2x2_8x32x1_8x32x1_1x32x1x8_8_1x1_intrawave_v3,1479.77,641.05,0.0
gfx950,256,10721,3072,6144,ck,0,0,295.062,a8w8_blockscale_1x128x128_256x128x128x128_16x16_32x32_2x2_8x32x1_8x32x1_1x32x1x8_8_1x1_intrawave_v3,1371.59,510.45,0.0
gfx950,256,10721,8192,3072,ck,0,0,371.5695,a8w8_blockscale_1x128x128_256x128x128x128_16x16_32x32_2x2_8x32x1_8x32x1_1x32x1x8_8_1x1_intrawave_v3,1452.23,629.1,0.0
gfx950,256,10724,2048,3072,ck,0,0,114.7538,a8w8_blockscale_1x128x128_256x128x128x128_16x16_32x32_2x2_8x32x1_8x32x1_1x32x1x8_8_1x1_intrawave_v3,1175.9,724.69,0.0
gfx950,256,10724,3072,6144,ck,0,0,295.7759,a8w8_blockscale_1x128x128_256x128x128x128_16x16_32x32_2x2_8x32x1_8x32x1_1x32x1x8_8_1x1_intrawave_v3,1368.66,509.34,0.0
gfx950,256,10724,8192,3072,ck,0,0,383.5753,a8w8_blockscale_1x128x128_256x128x128x128_16x16_32x32_2x2_8x32x1_8x32x1_1x32x1x8_8_1x1_intrawave_v3,1407.17,609.56,0.0
gfx950,256,10725,2048,3072,ck,0,0,116.1417,a8w8_blockscale_1x128x128_256x128x128x128_16x16_32x32_2x2_8x32x1_8x32x1_1x32x1x8_8_1x1_intrawave_v3,1161.96,716.09,0.0
gfx950,256,10733,2048,3072,ck,0,0,114.059,a8w8_blockscale_1x128x128_256x128x128x128_16x16_32x32_2x2_8x32x1_8x32x1_1x32x1x8_8_1x1_intrawave_v3,1184.06,729.67,0.0
gfx950,256,10737,2048,3072,ck,0,0,114.9157,a8w8_blockscale_1x128x128_256x128x128x128_16x16_32x32_2x2_8x32x1_8x32x1_1x32x1x8_8_1x1_intrawave_v3,1175.67,724.48,0.0
gfx950,256,10742,3072,3072,ck,0,0,159.1272,a8w8_blockscale_1x128x128_256x128x128x128_16x16_32x32_2x2_8x32x1_8x32x1_1x32x1x8_8_1x1_intrawave_v3,1274.13,681.44,0.0
gfx950,256,10742,3072,6144,ck,0,0,294.288,a8w8_blockscale_1x128x128_256x128x128x128_16x16_32x32_2x2_8x32x1_8x32x1_1x32x1x8_8_1x1_intrawave_v3,1377.89,512.67,0.0
gfx950,256,10742,4096,3072,ck,0,0,219.9405,a8w8_blockscale_1x128x128_256x128x128x128_16x16_32x32_2x2_8x32x1_8x32x1_1x32x1x8_8_1x1_intrawave_v3,1229.11,607.35,0.0
gfx950,256,10742,8192,3072,ck,0,0,395.043,a8w8_blockscale_1x128x128_256x128x128x128_16x16_32x32_2x2_8x32x1_8x32x1_1x32x1x8_8_1x1_intrawave_v3,1368.62,592.75,0.0
gfx950,256,10747,3072,6144,ck,0,0,302.171,a8w8_blockscale_1x128x128_256x128x128x128_16x16_32x32_2x2_8x32x1_8x32x1_1x32x1x8_8_1x1_intrawave_v3,1342.57,499.5,0.0
gfx950,256,10747,8192,3072,ck,0,0,398.6735,a8w8_blockscale_1x128x128_256x128x128x128_16x16_32x32_2x2_8x32x1_8x32x1_1x32x1x8_8_1x1_intrawave_v3,1356.78,587.6,0.0
gfx950,256,10749,3072,3072,ck,0,0,166.0518,a8w8_blockscale_1x128x128_256x128x128x128_16x16_32x32_2x2_8x32x1_8x32x1_1x32x1x8_8_1x1_intrawave_v3,1221.79,653.41,0.0
gfx950,256,10749,4096,3072,ck,0,0,219.5832,a8w8_blockscale_1x128x128_256x128x128x128_16x16_32x32_2x2_8x32x1_8x32x1_1x32x1x8_8_1x1_intrawave_v3,1231.91,608.7,0.0
gfx950,256,10751,2048,3072,ck,0,0,123.4295,a8w8_blockscale_1x128x128_256x128x128x128_16x16_32x32_2x2_8x32x1_8x32x1_1x32x1x8_8_1x1_intrawave_v3,1096.0,675.32,0.0
gfx950,256,10751,3072,3072,ck,0,0,168.8077,a8w8_blockscale_1x128x128_256x128x128x128_16x16_32x32_2x2_8x32x1_8x32x1_1x32x1x8_8_1x1_intrawave_v3,1202.07,642.85,0.0
gfx950,256,10751,4096,3072,ck,0,0,206.8354,a8w8_blockscale_1x128x128_256x128x128x128_16x16_32x32_2x2_8x32x1_8x32x1_1x32x1x8_8_1x1_intrawave_v3,1308.08,646.32,0.0
gfx950,256,10752,2048,3072,ck,0,0,113.0822,a8w8_blockscale_1x128x128_256x128x128x128_16x16_32x32_2x2_8x32x1_8x32x1_1x32x1x8_8_1x1_intrawave_v3,1196.4,737.18,0.0
gfx950,256,10752,3072,3072,ck,0,0,155.5519,a8w8_blockscale_1x128x128_256x128x128x128_16x16_32x32_2x2_8x32x1_8x32x1_1x32x1x8_8_1x1_intrawave_v3,1304.63,697.69,0.0
gfx950,256,10752,3072,6144,ck,0,0,290.8512,a8w8_blockscale_1x128x128_256x128x128x128_16x16_32x32_2x2_8x32x1_8x32x1_1x32x1x8_8_1x1_intrawave_v3,1395.47,519.15,0.0
gfx950,256,10752,4096,3072,ck,0,0,204.816,a8w8_blockscale_1x128x128_256x128x128x128_16x16_32x32_2x2_8x32x1_8x32x1_1x32x1x8_8_1x1_intrawave_v3,1321.1,652.75,0.0
gfx950,256,10752,8192,3072,ck,0,0,381.4928,a8w8_blockscale_1x128x128_256x128x128x128_16x16_32x32_2x2_8x32x1_8x32x1_1x32x1x8_8_1x1_intrawave_v3,1418.55,614.31,0.0
gfx950,256,10754,3072,3072,ck,0,0,157.9779,a8w8_blockscale_1x128x128_256x128x128x128_16x16_32x32_2x2_8x32x1_8x32x1_1x32x1x8_8_1x1_intrawave_v3,1284.83,687.1,0.0
gfx950,256,10754,4096,3072,ck,0,0,204.5859,a8w8_blockscale_1x128x128_256x128x128x128_16x16_32x32_2x2_8x32x1_8x32x1_1x32x1x8_8_1x1_intrawave_v3,1322.83,653.59,0.0
gfx950,256,10755,3072,3072,ck,0,0,156.2655,a8w8_blockscale_1x128x128_256x128x128x128_16x16_32x32_2x2_8x32x1_8x32x1_1x32x1x8_8_1x1_intrawave_v3,1299.03,694.68,0.0
gfx950,256,10755,4096,3072,ck,0,0,208.3962,a8w8_blockscale_1x128x128_256x128x128x128_16x16_32x32_2x2_8x32x1_8x32x1_1x32x1x8_8_1x1_intrawave_v3,1298.77,641.7,0.0
gfx950,256,10756,3072,3072,ck,0,0,158.4485,a8w8_blockscale_1x128x128_256x128x128x128_16x16_32x32_2x2_8x32x1_8x32x1_1x32x1x8_8_1x1_intrawave_v3,1281.25,685.17,0.0
gfx950,256,10756,4096,3072,ck,0,0,208.0065,a8w8_blockscale_1x128x128_256x128x128x128_16x16_32x32_2x2_8x32x1_8x32x1_1x32x1x8_8_1x1_intrawave_v3,1301.32,642.95,0.0
gfx950,256,10758,2048,3072,ck,0,0,117.2213,a8w8_blockscale_1x128x128_256x128x128x128_16x16_32x32_2x2_8x32x1_8x32x1_1x32x1x8_8_1x1_intrawave_v3,1154.8,711.52,0.0
gfx950,256,10759,3072,3072,ck,0,0,158.0234,a8w8_blockscale_1x128x128_256x128x128x128_16x16_32x32_2x2_8x32x1_8x32x1_1x32x1x8_8_1x1_intrawave_v3,1285.06,687.19,0.0
gfx950,256,10759,4096,3072,ck,0,0,208.792,a8w8_blockscale_1x128x128_256x128x128x128_16x16_32x32_2x2_8x32x1_8x32x1_1x32x1x8_8_1x1_intrawave_v3,1296.79,640.7,0.0
gfx950,256,10760,2048,3072,ck,0,0,114.9552,a8w8_blockscale_1x128x128_256x128x128x128_16x16_32x32_2x2_8x32x1_8x32x1_1x32x1x8_8_1x1_intrawave_v3,1177.78,725.67,0.0
gfx950,256,10760,3072,3072,ck,0,0,156.3027,a8w8_blockscale_1x128x128_256x128x128x128_16x16_32x32_2x2_8x32x1_8x32x1_1x32x1x8_8_1x1_intrawave_v3,1299.33,694.81,0.0
gfx950,256,10760,4096,3072,ck,0,0,207.2813,a8w8_blockscale_1x128x128_256x128x128x128_16x16_32x32_2x2_8x32x1_8x32x1_1x32x1x8_8_1x1_intrawave_v3,1306.36,645.42,0.0
gfx950,256,10762,2048,3072,ck,0,0,115.1124,a8w8_blockscale_1x128x128_256x128x128x128_16x16_32x32_2x2_8x32x1_8x32x1_1x32x1x8_8_1x1_intrawave_v3,1176.39,724.8,0.0
gfx950,256,10763,2048,3072,ck,0,0,116.9717,a8w8_blockscale_1x128x128_256x128x128x128_16x16_32x32_2x2_8x32x1_8x32x1_1x32x1x8_8_1x1_intrawave_v3,1157.8,713.34,0.0
gfx950,256,10767,3072,6144,ck,0,0,299.7553,a8w8_blockscale_1x128x128_256x128x128x128_16x16_32x32_2x2_8x32x1_8x32x1_1x32x1x8_8_1x1_intrawave_v3,1355.91,504.34,0.0
gfx950,256,10767,8192,3072,ck,0,0,387.0357,a8w8_blockscale_1x128x128_256x128x128x128_16x16_32x32_2x2_8x32x1_8x32x1_1x32x1x8_8_1x1_intrawave_v3,1400.18,606.27,0.0
gfx950,256,1077,2048,3072,ck,18,0,22.7878,a8w8_blockscale_1x128x128_256x64x64x256_16x16_32x32_1x1_16x16x1_16x16x1_1x32x1x8_8_1x1_intrawave_v1,594.7,614.86,0.0
gfx950,256,10774,2048,3072,ck,0,0,114.5647,a8w8_blockscale_1x128x128_256x128x128x128_16x16_32x32_2x2_8x32x1_8x32x1_1x32x1x8_8_1x1_intrawave_v3,1183.33,729.02,0.0
gfx950,256,10775,2048,3072,ck,0,0,114.8358,a8w8_blockscale_1x128x128_256x128x128x128_16x16_32x32_2x2_8x32x1_8x32x1_1x32x1x8_8_1x1_intrawave_v3,1180.65,727.36,0.0
gfx950,256,10776,3072,3072,ck,0,0,157.1379,a8w8_blockscale_1x128x128_256x128x128x128_16x16_32x32_2x2_8x32x1_8x32x1_1x32x1x8_8_1x1_intrawave_v3,1294.34,692.06,0.0
gfx950,256,10776,4096,3072,ck,0,0,207.9351,a8w8_blockscale_1x128x128_256x128x128x128_16x16_32x32_2x2_8x32x1_8x32x1_1x32x1x8_8_1x1_intrawave_v3,1304.19,644.26,0.0
gfx950,256,10777,2048,3072,ck,0,0,115.1766,a8w8_blockscale_1x128x128_256x128x128x128_16x16_32x32_2x2_8x32x1_8x32x1_1x32x1x8_8_1x1_intrawave_v3,1177.37,725.33,0.0
gfx950,256,10778,2048,3072,ck,0,0,115.4267,a8w8_blockscale_1x128x128_256x128x128x128_16x16_32x32_2x2_8x32x1_8x32x1_1x32x1x8_8_1x1_intrawave_v3,1174.93,723.82,0.0
gfx950,256,10779,2048,3072,ck,0,0,114.4879,a8w8_blockscale_1x128x128_256x128x128x128_16x16_32x32_2x2_8x32x1_8x32x1_1x32x1x8_8_1x1_intrawave_v3,1184.68,729.82,0.0
gfx950,256,10780,3072,3072,ck,0,0,158.9906,a8w8_blockscale_1x128x128_256x128x128x128_16x16_32x32_2x2_8x32x1_8x32x1_1x32x1x8_8_1x1_intrawave_v3,1279.73,684.23,0.0
gfx950,256,10780,4096,3072,ck,0,0,208.3039,a8w8_blockscale_1x128x128_256x128x128x128_16x16_32x32_2x2_8x32x1_8x32x1_1x32x1x8_8_1x1_intrawave_v3,1302.36,643.33,0.0
gfx950,256,10782,2048,3072,ck,0,0,116.3083,a8w8_blockscale_1x128x128_256x128x128x128_16x16_32x32_2x2_8x32x1_8x32x1_1x32x1x8_8_1x1_intrawave_v3,1166.46,718.58,0.0
gfx950,256,10782,3072,3072,ck,0,0,156.6128,a8w8_blockscale_1x128x128_256x128x128x128_16x16_32x32_2x2_8x32x1_8x32x1_1x32x1x8_8_1x1_intrawave_v3,1299.4,694.73,0.0
gfx950,256,10782,3072,6144,ck,0,0,297.9217,a8w8_blockscale_1x128x128_256x128x128x128_16x16_32x32_2x2_8x32x1_8x32x1_1x32x1x8_8_1x1_intrawave_v3,1366.15,508.06,0.0
gfx950,256,10782,4096,3072,ck,0,0,208.143,a8w8_blockscale_1x128x128_256x128x128x128_16x16_32x32_2x2_8x32x1_8x32x1_1x32x1x8_8_1x1_intrawave_v3,1303.61,643.94,0.0
gfx950,256,10782,8192,3072,ck,0,0,389.2573,a8w8_blockscale_1x128x128_256x128x128x128_16x16_32x32_2x2_8x32x1_8x32x1_1x32x1x8_8_1x1_intrawave_v3,1394.13,603.56,0.0
gfx950,256,10783,3072,6144,ck,0,0,297.1617,a8w8_blockscale_1x128x128_256x128x128x128_16x16_32x32_2x2_8x32x1_8x32x1_1x32x1x8_8_1x1_intrawave_v3,1369.77,509.41,0.0
gfx950,256,10783,8192,3072,ck,0,0,388.9393,a8w8_blockscale_1x128x128_256x128x128x128_16x16_32x32_2x2_8x32x1_8x32x1_1x32x1x8_8_1x1_intrawave_v3,1395.4,604.1,0.0
gfx950,256,10784,3072,6144,ck,0,0,300.323,a8w8_blockscale_1x128x128_256x128x128x128_16x16_32x32_2x2_8x32x1_8x32x1_1x32x1x8_8_1x1_intrawave_v3,1355.48,504.08,0.0
gfx950,256,10784,8192,3072,ck,0,0,381.0636,a8w8_blockscale_1x128x128_256x128x128x128_16x16_32x32_2x2_8x32x1_8x32x1_1x32x1x8_8_1x1_intrawave_v3,1424.37,616.64,0.0
gfx950,256,10785,3072,6144,ck,0,0,293.749,a8w8_blockscale_1x128x128_256x128x128x128_16x16_32x32_2x2_8x32x1_8x32x1_1x32x1x8_8_1x1_intrawave_v3,1385.95,515.41,0.0
gfx950,256,10785,8192,3072,ck,0,0,384.9297,a8w8_blockscale_1x128x128_256x128x128x128_16x16_32x32_2x2_8x32x1_8x32x1_1x32x1x8_8_1x1_intrawave_v3,1410.2,610.5,0.0
gfx950,256,10786,2048,3072,ck,0,0,115.641,a8w8_blockscale_1x128x128_256x128x128x128_16x16_32x32_2x2_8x32x1_8x32x1_1x32x1x8_8_1x1_intrawave_v3,1173.63,722.97,0.0
gfx950,256,10788,2048,3072,ck,0,0,116.6213,a8w8_blockscale_1x128x128_256x128x128x128_16x16_32x32_2x2_8x32x1_8x32x1_1x32x1x8_8_1x1_intrawave_v3,1163.98,717.02,0.0
gfx950,256,10789,3072,3072,ck,0,0,158.6848,a8w8_blockscale_1x128x128_256x128x128x128_16x16_32x32_2x2_8x32x1_8x32x1_1x32x1x8_8_1x1_intrawave_v3,1283.27,686.07,0.0
gfx950,256,10789,4096,3072,ck,0,0,202.7013,a8w8_blockscale_1x128x128_256x128x128x128_16x16_32x32_2x2_8x32x1_8x32x1_1x32x1x8_8_1x1_intrawave_v3,1339.48,661.61,0.0
gfx950,256,10792,3072,3072,ck,0,0,157.8822,a8w8_blockscale_1x128x128_256x128x128x128_16x16_32x32_2x2_8x32x1_8x32x1_1x32x1x8_8_1x1_intrawave_v3,1290.15,689.73,0.0
gfx950,256,10792,4096,3072,ck,0,0,208.2407,a8w8_blockscale_1x128x128_256x128x128x128_16x16_32x32_2x2_8x32x1_8x32x1_1x32x1x8_8_1x1_intrawave_v3,1304.21,644.18,0.0
gfx950,256,10793,3072,3072,ck,0,0,158.6747,a8w8_blockscale_1x128x128_256x128x128x128_16x16_32x32_2x2_8x32x1_8x32x1_1x32x1x8_8_1x1_intrawave_v3,1283.83,686.34,0.0
gfx950,256,10793,4096,3072,ck,0,0,209.9114,a8w8_blockscale_1x128x128_256x128x128x128_16x16_32x32_2x2_8x32x1_8x32x1_1x32x1x8_8_1x1_intrawave_v3,1293.95,639.1,0.0
gfx950,256,1080,3072,3072,ck,0,0,27.1935,a8w8_blockscale_1x128x128_256x128x128x128_16x16_32x32_2x2_8x32x1_8x32x1_1x32x1x8_8_1x1_intrawave_v3,749.6,713.06,0.0
gfx950,256,1080,4096,3072,ck,18,0,35.6552,a8w8_blockscale_1x128x128_256x64x64x256_16x16_32x32_1x1_16x16x1_16x16x1_1x32x1x8_8_1x1_intrawave_v1,762.28,694.09,0.0
gfx950,256,10800,3072,3072,ck,0,0,155.7298,a8w8_blockscale_1x128x128_256x128x128x128_16x16_32x32_2x2_8x32x1_8x32x1_1x32x1x8_8_1x1_intrawave_v3,1308.95,699.74,0.0
gfx950,256,10800,4096,3072,ck,0,0,209.0955,a8w8_blockscale_1x128x128_256x128x128x128_16x16_32x32_2x2_8x32x1_8x32x1_1x32x1x8_8_1x1_intrawave_v3,1299.84,641.98,0.0
gfx950,256,10801,2048,3072,ck,0,0,115.8256,a8w8_blockscale_1x128x128_256x128x128x128_16x16_32x32_2x2_8x32x1_8x32x1_1x32x1x8_8_1x1_intrawave_v3,1173.39,722.75,0.0
gfx950,256,10802,3072,6144,ck,0,0,291.6429,a8w8_blockscale_1x128x128_256x128x128x128_16x16_32x32_2x2_8x32x1_8x32x1_1x32x1x8_8_1x1_intrawave_v3,1398.15,519.85,0.0
gfx950,256,10802,8192,3072,ck,0,0,391.7507,a8w8_blockscale_1x128x128_256x128x128x128_16x16_32x32_2x2_8x32x1_8x32x1_1x32x1x8_8_1x1_intrawave_v3,1387.83,600.71,0.0
gfx950,256,10803,2048,3072,ck,0,0,116.481,a8w8_blockscale_1x128x128_256x128x128x128_16x16_32x32_2x2_8x32x1_8x32x1_1x32x1x8_8_1x1_intrawave_v3,1167.0,718.81,0.0
gfx950,256,10803,3072,3072,ck,0,0,159.4654,a8w8_blockscale_1x128x128_256x128x128x128_16x16_32x32_2x2_8x32x1_8x32x1_1x32x1x8_8_1x1_intrawave_v3,1278.65,683.52,0.0
gfx950,256,10803,3072,6144,ck,0,0,299.2159,a8w8_blockscale_1x128x128_256x128x128x128_16x16_32x32_2x2_8x32x1_8x32x1_1x32x1x8_8_1x1_intrawave_v3,1362.89,506.73,0.0
gfx950,256,10803,4096,3072,ck,0,0,207.0242,a8w8_blockscale_1x128x128_256x128x128x128_16x16_32x32_2x2_8x32x1_8x32x1_1x32x1x8_8_1x1_intrawave_v3,1313.21,648.56,0.0
gfx950,256,10803,8192,3072,ck,0,0,388.8193,a8w8_blockscale_1x128x128_256x128x128x128_16x16_32x32_2x2_8x32x1_8x32x1_1x32x1x8_8_1x1_intrawave_v3,1398.42,605.29,0.0
gfx950,256,10804,2048,3072,ck,0,0,113.9576,a8w8_blockscale_1x128x128_256x128x128x128_16x16_32x32_2x2_8x32x1_8x32x1_1x32x1x8_8_1x1_intrawave_v3,1192.95,734.79,0.0
gfx950,256,10804,3072,3072,ck,0,0,159.1221,a8w8_blockscale_1x128x128_256x128x128x128_16x16_32x32_2x2_8x32x1_8x32x1_1x32x1x8_8_1x1_intrawave_v3,1281.52,685.05,0.0
gfx950,256,10804,4096,3072,ck,0,0,209.2519,a8w8_blockscale_1x128x128_256x128x128x128_16x16_32x32_2x2_8x32x1_8x32x1_1x32x1x8_8_1x1_intrawave_v3,1299.35,641.71,0.0
gfx950,256,10806,3072,6144,ck,0,0,296.4733,a8w8_blockscale_1x128x128_256x128x128x128_16x16_32x32_2x2_8x32x1_8x32x1_1x32x1x8_8_1x1_intrawave_v3,1375.88,511.54,0.0
gfx950,256,10806,8192,3072,ck,0,0,387.6973,a8w8_blockscale_1x128x128_256x128x128x128_16x16_32x32_2x2_8x32x1_8x32x1_1x32x1x8_8_1x1_intrawave_v3,1402.86,607.19,0.0
gfx950,256,10807,3072,6144,ck,0,0,299.5384,a8w8_blockscale_1x128x128_256x128x128x128_16x16_32x32_2x2_8x32x1_8x32x1_1x32x1x8_8_1x1_intrawave_v3,1361.93,506.35,0.0
gfx950,256,10807,8192,3072,ck,0,0,391.8104,a8w8_blockscale_1x128x128_256x128x128x128_16x16_32x32_2x2_8x32x1_8x32x1_1x32x1x8_8_1x1_intrawave_v3,1388.26,600.87,0.0
gfx950,256,10808,3072,6144,ck,0,0,293.1288,a8w8_blockscale_1x128x128_256x128x128x128_16x16_32x32_2x2_8x32x1_8x32x1_1x32x1x8_8_1x1_intrawave_v3,1391.84,517.46,0.0
gfx950,256,10808,8192,3072,ck,0,0,389.6586,a8w8_blockscale_1x128x128_256x128x128x128_16x16_32x32_2x2_8x32x1_8x32x1_1x32x1x8_8_1x1_intrawave_v3,1396.05,604.24,0.0
gfx950,256,10813,3072,3072,ck,0,0,159.2513,a8w8_blockscale_1x128x128_256x128x128x128_16x16_32x32_2x2_8x32x1_8x32x1_1x32x1x8_8_1x1_intrawave_v3,1281.55,685.02,0.0
gfx950,256,10813,4096,3072,ck,0,0,202.5796,a8w8_blockscale_1x128x128_256x128x128x128_16x16_32x32_2x2_8x32x1_8x32x1_1x32x1x8_8_1x1_intrawave_v3,1343.26,663.35,0.0
gfx950,256,10818,2048,3072,ck,0,0,115.779,a8w8_blockscale_1x128x128_256x128x128x128_16x16_32x32_2x2_8x32x1_8x32x1_1x32x1x8_8_1x1_intrawave_v3,1175.7,724.09,0.0
gfx950,256,10819,2048,3072,ck,0,0,117.5673,a8w8_blockscale_1x128x128_256x128x128x128_16x16_32x32_2x2_8x32x1_8x32x1_1x32x1x8_8_1x1_intrawave_v3,1157.93,713.14,0.0
gfx950,256,1082,3072,6144,ck,0,0,46.5033,a8w8_blockscale_1x128x128_256x128x128x128_16x16_32x32_2x2_8x32x1_8x32x1_1x32x1x8_8_1x1_intrawave_v3,878.31,691.78,0.0
gfx950,256,1082,8192,3072,ck,0,0,60.311,a8w8_blockscale_1x128x128_256x128x128x128_16x16_32x32_2x2_8x32x1_8x32x1_1x32x1x8_8_1x1_intrawave_v3,902.97,766.31,0.0
gfx950,256,10821,3072,3072,ck,0,0,158.4408,a8w8_blockscale_1x128x128_256x128x128x128_16x16_32x32_2x2_8x32x1_8x32x1_1x32x1x8_8_1x1_intrawave_v3,1289.06,688.99,0.0
gfx950,256,10821,4096,3072,ck,0,0,208.0833,a8w8_blockscale_1x128x128_256x128x128x128_16x16_32x32_2x2_8x32x1_8x32x1_1x32x1x8_8_1x1_intrawave_v3,1308.7,646.23,0.0
gfx950,256,10828,3072,3072,ck,0,0,158.2781,a8w8_blockscale_1x128x128_256x128x128x128_16x16_32x32_2x2_8x32x1_8x32x1_1x32x1x8_8_1x1_intrawave_v3,1291.22,690.1,0.0
gfx950,256,10828,4096,3072,ck,0,0,210.5975,a8w8_blockscale_1x128x128_256x128x128x128_16x16_32x32_2x2_8x32x1_8x32x1_1x32x1x8_8_1x1_intrawave_v3,1293.92,638.89,0.0
gfx950,256,10831,3072,6144,ck,0,0,294.5623,a8w8_blockscale_1x128x128_256x128x128x128_16x16_32x32_2x2_8x32x1_8x32x1_1x32x1x8_8_1x1_intrawave_v3,1388.01,515.9,0.0
gfx950,256,10831,8192,3072,ck,0,0,379.9322,a8w8_blockscale_1x128x128_256x128x128x128_16x16_32x32_2x2_8x32x1_8x32x1_1x32x1x8_8_1x1_intrawave_v3,1434.84,620.88,0.0
gfx950,256,10839,3072,3072,ck,0,0,158.2892,a8w8_blockscale_1x128x128_256x128x128x128_16x16_32x32_2x2_8x32x1_8x32x1_1x32x1x8_8_1x1_intrawave_v3,1292.44,690.69,0.0
gfx950,256,10839,4096,3072,ck,0,0,210.1188,a8w8_blockscale_1x128x128_256x128x128x128_16x16_32x32_2x2_8x32x1_8x32x1_1x32x1x8_8_1x1_intrawave_v3,1298.18,640.94,0.0
gfx950,256,10840,2048,3072,ck,0,0,113.8403,a8w8_blockscale_1x128x128_256x128x128x128_16x16_32x32_2x2_8x32x1_8x32x1_1x32x1x8_8_1x1_intrawave_v3,1198.16,737.81,0.0
gfx950,256,10840,3072,3072,ck,0,0,157.9285,a8w8_blockscale_1x128x128_256x128x128x128_16x16_32x32_2x2_8x32x1_8x32x1_1x32x1x8_8_1x1_intrawave_v3,1295.51,692.33,0.0
gfx950,256,10840,4096,3072,ck,0,0,207.042,a8w8_blockscale_1x128x128_256x128x128x128_16x16_32x32_2x2_8x32x1_8x32x1_1x32x1x8_8_1x1_intrawave_v3,1317.6,650.52,0.0
gfx950,256,10841,2048,3072,ck,0,0,116.6752,a8w8_blockscale_1x128x128_256x128x128x128_16x16_32x32_2x2_8x32x1_8x32x1_1x32x1x8_8_1x1_intrawave_v3,1169.15,719.95,0.0
gfx950,256,10841,3072,3072,ck,0,0,158.5818,a8w8_blockscale_1x128x128_256x128x128x128_16x16_32x32_2x2_8x32x1_8x32x1_1x32x1x8_8_1x1_intrawave_v3,1290.29,689.54,0.0
gfx950,256,10841,4096,3072,ck,0,0,208.116,a8w8_blockscale_1x128x128_256x128x128x128_16x16_32x32_2x2_8x32x1_8x32x1_1x32x1x8_8_1x1_intrawave_v3,1310.92,647.22,0.0
gfx950,256,10843,3072,3072,ck,0,0,159.706,a8w8_blockscale_1x128x128_256x128x128x128_16x16_32x32_2x2_8x32x1_8x32x1_1x32x1x8_8_1x1_intrawave_v3,1281.45,684.8,0.0
gfx950,256,10843,3072,6144,ck,0,0,298.4481,a8w8_blockscale_1x128x128_256x128x128x128_16x16_32x32_2x2_8x32x1_8x32x1_1x32x1x8_8_1x1_intrawave_v3,1371.46,509.68,0.0
gfx950,256,10843,4096,3072,ck,0,0,207.2051,a8w8_blockscale_1x128x128_256x128x128x128_16x16_32x32_2x2_8x32x1_8x32x1_1x32x1x8_8_1x1_intrawave_v3,1316.92,650.17,0.0
gfx950,256,10843,8192,3072,ck,0,0,390.6269,a8w8_blockscale_1x128x128_256x128x128x128_16x16_32x32_2x2_8x32x1_8x32x1_1x32x1x8_8_1x1_intrawave_v3,1397.1,604.48,0.0
gfx950,256,10844,3072,6144,ck,0,0,295.1455,a8w8_blockscale_1x128x128_256x128x128x128_16x16_32x32_2x2_8x32x1_8x32x1_1x32x1x8_8_1x1_intrawave_v3,1386.93,515.43,0.0
gfx950,256,10844,8192,3072,ck,0,0,372.8051,a8w8_blockscale_1x128x128_256x128x128x128_16x16_32x32_2x2_8x32x1_8x32x1_1x32x1x8_8_1x1_intrawave_v3,1464.03,633.43,0.0
gfx950,256,10845,3072,6144,ck,0,0,299.2887,a8w8_blockscale_1x128x128_256x128x128x128_16x16_32x32_2x2_8x32x1_8x32x1_1x32x1x8_8_1x1_intrawave_v3,1367.86,508.33,0.0
gfx950,256,10845,8192,3072,ck,0,0,391.5158,a8w8_blockscale_1x128x128_256x128x128x128_16x16_32x32_2x2_8x32x1_8x32x1_1x32x1x8_8_1x1_intrawave_v3,1394.19,603.21,0.0
gfx950,256,10846,3072,6144,ck,0,0,297.2397,a8w8_blockscale_1x128x128_256x128x128x128_16x16_32x32_2x2_8x32x1_8x32x1_1x32x1x8_8_1x1_intrawave_v3,1377.42,511.88,0.0
gfx950,256,10846,8192,3072,ck,0,0,390.7742,a8w8_blockscale_1x128x128_256x128x128x128_16x16_32x32_2x2_8x32x1_8x32x1_1x32x1x8_8_1x1_intrawave_v3,1396.96,604.4,0.0
gfx950,256,10847,3072,6144,ck,0,0,298.4011,a8w8_blockscale_1x128x128_256x128x128x128_16x16_32x32_2x2_8x32x1_8x32x1_1x32x1x8_8_1x1_intrawave_v3,1372.18,509.93,0.0
gfx950,256,10847,8192,3072,ck,0,0,385.4795,a8w8_blockscale_1x128x128_256x128x128x128_16x16_32x32_2x2_8x32x1_8x32x1_1x32x1x8_8_1x1_intrawave_v3,1416.28,612.76,0.0
gfx950,256,10850,2048,3072,ck,0,0,117.9279,a8w8_blockscale_1x128x128_256x128x128x128_16x16_32x32_2x2_8x32x1_8x32x1_1x32x1x8_8_1x1_intrawave_v3,1157.7,712.84,0.0
gfx950,256,10855,3072,3072,ck,0,0,159.5582,a8w8_blockscale_1x128x128_256x128x128x128_16x16_32x32_2x2_8x32x1_8x32x1_1x32x1x8_8_1x1_intrawave_v3,1284.05,686.12,0.0
gfx950,256,10855,4096,3072,ck,0,0,207.1071,a8w8_blockscale_1x128x128_256x128x128x128_16x16_32x32_2x2_8x32x1_8x32x1_1x32x1x8_8_1x1_intrawave_v3,1319.0,651.13,0.0
gfx950,256,10858,2048,3072,ck,0,0,117.1288,a8w8_blockscale_1x128x128_256x128x128x128_16x16_32x32_2x2_8x32x1_8x32x1_1x32x1x8_8_1x1_intrawave_v3,1166.45,718.2,0.0
gfx950,256,10858,3072,3072,ck,0,0,159.3368,a8w8_blockscale_1x128x128_256x128x128x128_16x16_32x32_2x2_8x32x1_8x32x1_1x32x1x8_8_1x1_intrawave_v3,1286.19,687.25,0.0
gfx950,256,10858,4096,3072,ck,0,0,208.9607,a8w8_blockscale_1x128x128_256x128x128x128_16x16_32x32_2x2_8x32x1_8x32x1_1x32x1x8_8_1x1_intrawave_v3,1307.66,645.52,0.0
gfx950,256,10860,3072,3072,ck,0,0,158.2701,a8w8_blockscale_1x128x128_256x128x128x128_16x16_32x32_2x2_8x32x1_8x32x1_1x32x1x8_8_1x1_intrawave_v3,1295.1,692.0,0.0
gfx950,256,10860,4096,3072,ck,0,0,206.5475,a8w8_blockscale_1x128x128_256x128x128x128_16x16_32x32_2x2_8x32x1_8x32x1_1x32x1x8_8_1x1_intrawave_v3,1323.19,653.17,0.0
gfx950,256,10863,2048,3072,ck,0,0,116.6148,a8w8_blockscale_1x128x128_256x128x128x128_16x16_32x32_2x2_8x32x1_8x32x1_1x32x1x8_8_1x1_intrawave_v3,1172.13,721.67,0.0
gfx950,256,10864,2048,3072,ck,0,0,116.9794,a8w8_blockscale_1x128x128_256x128x128x128_16x16_32x32_2x2_8x32x1_8x32x1_1x32x1x8_8_1x1_intrawave_v3,1168.59,719.48,0.0
gfx950,256,10864,3072,3072,ck,0,0,156.9536,a8w8_blockscale_1x128x128_256x128x128x128_16x16_32x32_2x2_8x32x1_8x32x1_1x32x1x8_8_1x1_intrawave_v3,1306.44,698.04,0.0
gfx950,256,10864,4096,3072,ck,0,0,210.8992,a8w8_blockscale_1x128x128_256x128x128x128_16x16_32x32_2x2_8x32x1_8x32x1_1x32x1x8_8_1x1_intrawave_v3,1296.36,639.9,0.0
gfx950,256,10868,2048,3072,ck,0,0,115.2869,a8w8_blockscale_1x128x128_256x128x128x128_16x16_32x32_2x2_8x32x1_8x32x1_1x32x1x8_8_1x1_intrawave_v3,1186.18,730.29,0.0
gfx950,256,10872,3072,3072,ck,0,0,158.2611,a8w8_blockscale_1x128x128_256x128x128x128_16x16_32x32_2x2_8x32x1_8x32x1_1x32x1x8_8_1x1_intrawave_v3,1296.6,692.74,0.0
gfx950,256,10872,4096,3072,ck,0,0,203.986,a8w8_blockscale_1x128x128_256x128x128x128_16x16_32x32_2x2_8x32x1_8x32x1_1x32x1x8_8_1x1_intrawave_v3,1341.28,662.03,0.0
gfx950,256,10873,3072,3072,ck,0,0,158.8111,a8w8_blockscale_1x128x128_256x128x128x128_16x16_32x32_2x2_8x32x1_8x32x1_1x32x1x8_8_1x1_intrawave_v3,1292.23,690.4,0.0
gfx950,256,10873,3072,6144,ck,0,0,299.2104,a8w8_blockscale_1x128x128_256x128x128x128_16x16_32x32_2x2_8x32x1_8x32x1_1x32x1x8_8_1x1_intrawave_v3,1371.75,509.61,0.0
gfx950,256,10873,4096,3072,ck,0,0,203.1035,a8w8_blockscale_1x128x128_256x128x128x128_16x16_32x32_2x2_8x32x1_8x32x1_1x32x1x8_8_1x1_intrawave_v3,1347.23,664.96,0.0
gfx950,256,10873,8192,3072,ck,0,0,390.0993,a8w8_blockscale_1x128x128_256x128x128x128_16x16_32x32_2x2_8x32x1_8x32x1_1x32x1x8_8_1x1_intrawave_v3,1402.86,606.8,0.0
gfx950,256,10875,2048,3072,ck,0,0,114.3291,a8w8_blockscale_1x128x128_256x128x128x128_16x16_32x32_2x2_8x32x1_8x32x1_1x32x1x8_8_1x1_intrawave_v3,1196.89,736.85,0.0
gfx950,256,10877,3072,6144,ck,0,0,299.7059,a8w8_blockscale_1x128x128_256x128x128x128_16x16_32x32_2x2_8x32x1_8x32x1_1x32x1x8_8_1x1_intrawave_v3,1369.99,508.94,0.0
gfx950,256,10877,8192,3072,ck,0,0,388.6592,a8w8_blockscale_1x128x128_256x128x128x128_16x16_32x32_2x2_8x32x1_8x32x1_1x32x1x8_8_1x1_intrawave_v3,1408.58,609.25,0.0
gfx950,256,10880,2048,3072,ck,0,0,114.8525,a8w8_blockscale_1x128x128_256x128x128x128_16x16_32x32_2x2_8x32x1_8x32x1_1x32x1x8_8_1x1_intrawave_v3,1191.98,733.8,0.0
gfx950,256,10880,3072,3072,ck,0,0,158.2961,a8w8_blockscale_1x128x128_256x128x128x128_16x16_32x32_2x2_8x32x1_8x32x1_1x32x1x8_8_1x1_intrawave_v3,1297.27,693.05,0.0
gfx950,256,10880,3072,6144,ck,0,0,295.2184,a8w8_blockscale_1x128x128_256x128x128x128_16x16_32x32_2x2_8x32x1_8x32x1_1x32x1x8_8_1x1_intrawave_v3,1391.19,516.8,0.0
gfx950,256,10880,4096,3072,ck,0,0,206.5213,a8w8_blockscale_1x128x128_256x128x128x128_16x16_32x32_2x2_8x32x1_8x32x1_1x32x1x8_8_1x1_intrawave_v3,1325.79,654.34,0.0
gfx950,256,10880,8192,3072,ck,0,0,379.3404,a8w8_blockscale_1x128x128_256x128x128x128_16x16_32x32_2x2_8x32x1_8x32x1_1x32x1x8_8_1x1_intrawave_v3,1443.58,624.37,0.0
gfx950,256,10885,3072,3072,ck,0,0,164.6307,a8w8_blockscale_1x128x128_256x128x128x128_16x16_32x32_2x2_8x32x1_8x32x1_1x32x1x8_8_1x1_intrawave_v3,1247.93,666.66,0.0
gfx950,256,10885,4096,3072,ck,0,0,210.4233,a8w8_blockscale_1x128x128_256x128x128x128_16x16_32x32_2x2_8x32x1_8x32x1_1x32x1x8_8_1x1_intrawave_v3,1301.8,642.47,0.0
gfx950,256,10890,2048,3072,ck,0,0,119.5432,a8w8_blockscale_1x128x128_256x128x128x128_16x16_32x32_2x2_8x32x1_8x32x1_1x32x1x8_8_1x1_intrawave_v3,1146.26,705.61,0.0
gfx950,256,10894,2048,3072,ck,0,0,116.2913,a8w8_blockscale_1x128x128_256x128x128x128_16x16_32x32_2x2_8x32x1_8x32x1_1x32x1x8_8_1x1_intrawave_v3,1178.75,725.59,0.0
gfx950,256,1090,2048,3072,ck,18,0,22.563,a8w8_blockscale_1x128x128_256x64x64x256_16x16_32x32_1x1_16x16x1_16x16x1_1x32x1x8_8_1x1_intrawave_v1,607.87,625.12,0.0
gfx950,256,1090,3072,6144,ck,0,0,46.7028,a8w8_blockscale_1x128x128_256x128x128x128_16x16_32x32_2x2_8x32x1_8x32x1_1x32x1x8_8_1x1_intrawave_v3,881.02,690.93,0.0
gfx950,256,1090,8192,3072,ck,0,0,60.7962,a8w8_blockscale_1x128x128_256x128x128x128_16x16_32x32_2x2_8x32x1_8x32x1_1x32x1x8_8_1x1_intrawave_v3,902.38,762.76,0.0
gfx950,256,10902,3072,3072,ck,0,0,164.9697,a8w8_blockscale_1x128x128_256x128x128x128_16x16_32x32_2x2_8x32x1_8x32x1_1x32x1x8_8_1x1_intrawave_v3,1247.31,666.24,0.0
gfx950,256,10902,4096,3072,ck,0,0,210.0287,a8w8_blockscale_1x128x128_256x128x128x128_16x16_32x32_2x2_8x32x1_8x32x1_1x32x1x8_8_1x1_intrawave_v3,1306.29,644.59,0.0
gfx950,256,10903,3072,3072,ck,0,0,168.86,a8w8_blockscale_1x128x128_256x128x128x128_16x16_32x32_2x2_8x32x1_8x32x1_1x32x1x8_8_1x1_intrawave_v3,1218.69,650.95,0.0
gfx950,256,10903,4096,3072,ck,0,0,209.6833,a8w8_blockscale_1x128x128_256x128x128x128_16x16_32x32_2x2_8x32x1_8x32x1_1x32x1x8_8_1x1_intrawave_v3,1308.56,645.71,0.0
gfx950,256,10905,3072,3072,ck,0,0,165.8117,a8w8_blockscale_1x128x128_256x128x128x128_16x16_32x32_2x2_8x32x1_8x32x1_1x32x1x8_8_1x1_intrawave_v3,1241.32,663.03,0.0
gfx950,256,10905,4096,3072,ck,0,0,209.8594,a8w8_blockscale_1x128x128_256x128x128x128_16x16_32x32_2x2_8x32x1_8x32x1_1x32x1x8_8_1x1_intrawave_v3,1307.7,645.27,0.0
gfx950,256,10906,3072,3072,ck,0,0,166.9293,a8w8_blockscale_1x128x128_256x128x128x128_16x16_32x32_2x2_8x32x1_8x32x1_1x32x1x8_8_1x1_intrawave_v3,1233.12,658.64,0.0
gfx950,256,10906,4096,3072,ck,0,0,209.9923,a8w8_blockscale_1x128x128_256x128x128x128_16x16_32x32_2x2_8x32x1_8x32x1_1x32x1x8_8_1x1_intrawave_v3,1306.99,644.92,0.0
gfx950,256,10908,3072,3072,ck,0,0,167.3329,a8w8_blockscale_1x128x128_256x128x128x128_16x16_32x32_2x2_8x32x1_8x32x1_1x32x1x8_8_1x1_intrawave_v3,1230.37,657.16,0.0
gfx950,256,10908,4096,3072,ck,0,0,210.0723,a8w8_blockscale_1x128x128_256x128x128x128_16x16_32x32_2x2_8x32x1_8x32x1_1x32x1x8_8_1x1_intrawave_v3,1306.73,644.78,0.0
gfx950,256,10909,2048,3072,ck,0,0,115.1274,a8w8_blockscale_1x128x128_256x128x128x128_16x16_32x32_2x2_8x32x1_8x32x1_1x32x1x8_8_1x1_intrawave_v3,1192.31,733.86,0.0
gfx950,256,10910,2048,3072,ck,0,0,118.0879,a8w8_blockscale_1x128x128_256x128x128x128_16x16_32x32_2x2_8x32x1_8x32x1_1x32x1x8_8_1x1_intrawave_v3,1162.52,715.52,0.0
gfx950,256,10915,2048,3072,ck,0,0,117.5061,a8w8_blockscale_1x128x128_256x128x128x128_16x16_32x32_2x2_8x32x1_8x32x1_1x32x1x8_8_1x1_intrawave_v3,1168.81,719.37,0.0
gfx950,256,1092,2048,3072,ck,18,0,22.5738,a8w8_blockscale_1x128x128_256x64x64x256_16x16_32x32_1x1_16x16x1_16x16x1_1x32x1x8_8_1x1_intrawave_v1,608.69,625.46,0.0
gfx950,256,10924,3072,3072,ck,0,0,168.1216,a8w8_blockscale_1x128x128_256x128x128x128_16x16_32x32_2x2_8x32x1_8x32x1_1x32x1x8_8_1x1_intrawave_v3,1226.4,654.96,0.0
gfx950,256,10924,4096,3072,ck,0,0,205.7986,a8w8_blockscale_1x128x128_256x128x128x128_16x16_32x32_2x2_8x32x1_8x32x1_1x32x1x8_8_1x1_intrawave_v3,1335.83,659.05,0.0
gfx950,256,10925,2048,3072,ck,0,0,115.4886,a8w8_blockscale_1x128x128_256x128x128x128_16x16_32x32_2x2_8x32x1_8x32x1_1x32x1x8_8_1x1_intrawave_v3,1190.32,732.56,0.0
gfx950,256,10925,3072,3072,ck,0,0,169.993,a8w8_blockscale_1x128x128_256x128x128x128_16x16_32x32_2x2_8x32x1_8x32x1_1x32x1x8_8_1x1_intrawave_v3,1213.01,647.8,0.0
gfx950,256,10925,4096,3072,ck,0,0,213.375,a8w8_blockscale_1x128x128_256x128x128x128_16x16_32x32_2x2_8x32x1_8x32x1_1x32x1x8_8_1x1_intrawave_v3,1288.51,635.7,0.0
gfx950,256,10926,3072,3072,ck,0,0,164.7915,a8w8_blockscale_1x128x128_256x128x128x128_16x16_32x32_2x2_8x32x1_8x32x1_1x32x1x8_8_1x1_intrawave_v3,1251.41,668.31,0.0
gfx950,256,10926,4096,3072,ck,0,0,212.7633,a8w8_blockscale_1x128x128_256x128x128x128_16x16_32x32_2x2_8x32x1_8x32x1_1x32x1x8_8_1x1_intrawave_v3,1292.34,637.58,0.0
gfx950,256,10927,3072,3072,ck,0,0,163.8161,a8w8_blockscale_1x128x128_256x128x128x128_16x16_32x32_2x2_8x32x1_8x32x1_1x32x1x8_8_1x1_intrawave_v3,1258.97,672.34,0.0
gfx950,256,10927,4096,3072,ck,0,0,206.5226,a8w8_blockscale_1x128x128_256x128x128x128_16x16_32x32_2x2_8x32x1_8x32x1_1x32x1x8_8_1x1_intrawave_v3,1331.51,656.9,0.0
gfx950,256,10928,3072,3072,ck,0,0,164.8777,a8w8_blockscale_1x128x128_256x128x128x128_16x16_32x32_2x2_8x32x1_8x32x1_1x32x1x8_8_1x1_intrawave_v3,1250.98,668.07,0.0
gfx950,256,10928,4096,3072,ck,0,0,205.3385,a8w8_blockscale_1x128x128_256x128x128x128_16x16_32x32_2x2_8x32x1_8x32x1_1x32x1x8_8_1x1_intrawave_v3,1339.31,660.74,0.0
gfx950,256,10929,3072,3072,ck,0,0,162.4176,a8w8_blockscale_1x128x128_256x128x128x128_16x16_32x32_2x2_8x32x1_8x32x1_1x32x1x8_8_1x1_intrawave_v3,1270.05,678.24,0.0
gfx950,256,10929,4096,3072,ck,0,0,208.7613,a8w8_blockscale_1x128x128_256x128x128x128_16x16_32x32_2x2_8x32x1_8x32x1_1x32x1x8_8_1x1_intrawave_v3,1317.47,649.96,0.0
gfx950,256,10934,3072,3072,ck,0,0,162.4796,a8w8_blockscale_1x128x128_256x128x128x128_16x16_32x32_2x2_8x32x1_8x32x1_1x32x1x8_8_1x1_intrawave_v3,1270.14,678.27,0.0
gfx950,256,10934,4096,3072,ck,0,0,208.6896,a8w8_blockscale_1x128x128_256x128x128x128_16x16_32x32_2x2_8x32x1_8x32x1_1x32x1x8_8_1x1_intrawave_v3,1318.53,650.46,0.0
gfx950,256,10936,2048,3072,ck,0,0,117.0523,a8w8_blockscale_1x128x128_256x128x128x128_16x16_32x32_2x2_8x32x1_8x32x1_1x32x1x8_8_1x1_intrawave_v3,1175.6,723.44,0.0
gfx950,256,1094,2048,3072,ck,18,0,22.565,a8w8_blockscale_1x128x128_256x64x64x256_16x16_32x32_1x1_16x16x1_16x16x1_1x32x1x8_8_1x1_intrawave_v1,610.05,626.33,0.0
gfx950,256,10944,2048,3072,ck,0,0,115.1939,a8w8_blockscale_1x128x128_256x128x128x128_16x16_32x32_2x2_8x32x1_8x32x1_1x32x1x8_8_1x1_intrawave_v3,1195.44,735.61,0.0
gfx950,256,10947,3072,3072,ck,0,0,164.1507,a8w8_blockscale_1x128x128_256x128x128x128_16x16_32x32_2x2_8x32x1_8x32x1_1x32x1x8_8_1x1_intrawave_v3,1258.71,672.09,0.0
gfx950,256,10947,4096,3072,ck,0,0,211.0827,a8w8_blockscale_1x128x128_256x128x128x128_16x16_32x32_2x2_8x32x1_8x32x1_1x32x1x8_8_1x1_intrawave_v3,1305.13,643.78,0.0
gfx950,256,1095,2048,3072,ck,18,0,22.5103,a8w8_blockscale_1x128x128_256x64x64x256_16x16_32x32_1x1_16x16x1_16x16x1_1x32x1x8_8_1x1_intrawave_v1,612.09,628.18,0.0
gfx950,256,1095,3072,6144,ck,0,0,46.921,a8w8_blockscale_1x128x128_256x128x128x128_16x16_32x32_2x2_8x32x1_8x32x1_1x32x1x8_8_1x1_intrawave_v3,880.95,689.02,0.0
gfx950,256,1095,8192,3072,ck,0,0,60.3711,a8w8_blockscale_1x128x128_256x128x128x128_16x16_32x32_2x2_8x32x1_8x32x1_1x32x1x8_8_1x1_intrawave_v3,912.91,769.74,0.0
gfx950,256,10956,3072,3072,ck,0,0,166.2015,a8w8_blockscale_1x128x128_256x128x128x128_16x16_32x32_2x2_8x32x1_8x32x1_1x32x1x8_8_1x1_intrawave_v3,1244.2,664.3,0.0
gfx950,256,10956,4096,3072,ck,0,0,212.4407,a8w8_blockscale_1x128x128_256x128x128x128_16x16_32x32_2x2_8x32x1_8x32x1_1x32x1x8_8_1x1_intrawave_v3,1297.85,640.14,0.0
gfx950,256,1096,2048,3072,ck,18,0,22.6276,a8w8_blockscale_1x128x128_256x64x64x256_16x16_32x32_1x1_16x16x1_16x16x1_1x32x1x8_8_1x1_intrawave_v1,609.47,625.24,0.0
gfx950,256,10960,3072,6144,ck,0,0,311.6076,a8w8_blockscale_1x128x128_256x128x128x128_16x16_32x32_2x2_8x32x1_8x32x1_1x32x1x8_8_1x1_intrawave_v3,1327.72,492.77,0.0
gfx950,256,10960,8192,3072,ck,0,0,389.2681,a8w8_blockscale_1x128x128_256x128x128x128_16x16_32x32_2x2_8x32x1_8x32x1_1x32x1x8_8_1x1_intrawave_v3,1417.11,612.44,0.0
gfx950,256,10961,3072,6144,ck,0,0,312.8122,a8w8_blockscale_1x128x128_256x128x128x128_16x16_32x32_2x2_8x32x1_8x32x1_1x32x1x8_8_1x1_intrawave_v3,1322.72,490.91,0.0
gfx950,256,10961,8192,3072,ck,0,0,392.058,a8w8_blockscale_1x128x128_256x128x128x128_16x16_32x32_2x2_8x32x1_8x32x1_1x32x1x8_8_1x1_intrawave_v3,1407.15,608.13,0.0
gfx950,256,10962,3072,6144,ck,0,0,308.9415,a8w8_blockscale_1x128x128_256x128x128x128_16x16_32x32_2x2_8x32x1_8x32x1_1x32x1x8_8_1x1_intrawave_v3,1339.42,497.1,0.0
gfx950,256,10962,8192,3072,ck,0,0,386.1278,a8w8_blockscale_1x128x128_256x128x128x128_16x16_32x32_2x2_8x32x1_8x32x1_1x32x1x8_8_1x1_intrawave_v3,1428.89,617.52,0.0
gfx950,256,10963,3072,6144,ck,0,0,309.3942,a8w8_blockscale_1x128x128_256x128x128x128_16x16_32x32_2x2_8x32x1_8x32x1_1x32x1x8_8_1x1_intrawave_v3,1337.58,496.41,0.0
gfx950,256,10963,8192,3072,ck,0,0,389.4631,a8w8_blockscale_1x128x128_256x128x128x128_16x16_32x32_2x2_8x32x1_8x32x1_1x32x1x8_8_1x1_intrawave_v3,1416.79,612.28,0.0
gfx950,256,10966,2048,3072,ck,0,0,115.4713,a8w8_blockscale_1x128x128_256x128x128x128_16x16_32x32_2x2_8x32x1_8x32x1_1x32x1x8_8_1x1_intrawave_v3,1194.97,735.21,0.0
gfx950,256,10967,3072,3072,ck,0,0,163.6428,a8w8_blockscale_1x128x128_256x128x128x128_16x16_32x32_2x2_8x32x1_8x32x1_1x32x1x8_8_1x1_intrawave_v3,1264.92,675.31,0.0
gfx950,256,10967,4096,3072,ck,0,0,209.5053,a8w8_blockscale_1x128x128_256x128x128x128_16x16_32x32_2x2_8x32x1_8x32x1_1x32x1x8_8_1x1_intrawave_v3,1317.36,649.7,0.0
gfx950,256,10969,3072,3072,ck,0,0,163.8542,a8w8_blockscale_1x128x128_256x128x128x128_16x16_32x32_2x2_8x32x1_8x32x1_1x32x1x8_8_1x1_intrawave_v3,1263.52,674.55,0.0
gfx950,256,10969,4096,3072,ck,0,0,209.8827,a8w8_blockscale_1x128x128_256x128x128x128_16x16_32x32_2x2_8x32x1_8x32x1_1x32x1x8_8_1x1_intrawave_v3,1315.23,648.64,0.0
gfx950,256,10970,2048,3072,ck,0,0,116.1521,a8w8_blockscale_1x128x128_256x128x128x128_16x16_32x32_2x2_8x32x1_8x32x1_1x32x1x8_8_1x1_intrawave_v3,1188.39,731.15,0.0
gfx950,256,10973,2048,3072,ck,0,0,117.907,a8w8_blockscale_1x128x128_256x128x128x128_16x16_32x32_2x2_8x32x1_8x32x1_1x32x1x8_8_1x1_intrawave_v3,1171.03,720.45,0.0
gfx950,256,10974,3072,3072,ck,0,0,163.3247,a8w8_blockscale_1x128x128_256x128x128x128_16x16_32x32_2x2_8x32x1_8x32x1_1x32x1x8_8_1x1_intrawave_v3,1268.19,677.02,0.0
gfx950,256,10974,4096,3072,ck,0,0,206.3062,a8w8_blockscale_1x128x128_256x128x128x128_16x16_32x32_2x2_8x32x1_8x32x1_1x32x1x8_8_1x1_intrawave_v3,1338.64,660.15,0.0
gfx950,256,10989,2048,3072,ck,0,0,115.9448,a8w8_blockscale_1x128x128_256x128x128x128_16x16_32x32_2x2_8x32x1_8x32x1_1x32x1x8_8_1x1_intrawave_v3,1192.58,733.63,0.0
gfx950,256,1099,2048,3072,ck,18,0,22.5811,a8w8_blockscale_1x128x128_256x64x64x256_16x16_32x32_1x1_16x16x1_16x16x1_1x32x1x8_8_1x1_intrawave_v1,612.4,627.48,0.0
gfx950,256,10992,3072,3072,ck,0,0,164.5636,a8w8_blockscale_1x128x128_256x128x128x128_16x16_32x32_2x2_8x32x1_8x32x1_1x32x1x8_8_1x1_intrawave_v3,1260.71,672.93,0.0
gfx950,256,10992,4096,3072,ck,0,0,209.5135,a8w8_blockscale_1x128x128_256x128x128x128_16x16_32x32_2x2_8x32x1_8x32x1_1x32x1x8_8_1x1_intrawave_v3,1320.31,651.02,0.0
gfx950,256,10995,2048,3072,ck,0,0,118.3414,a8w8_blockscale_1x128x128_256x128x128x128_16x16_32x32_2x2_8x32x1_8x32x1_1x32x1x8_8_1x1_intrawave_v3,1169.07,719.14,0.0
gfx950,256,10997,2048,3072,ck,0,0,116.46,a8w8_blockscale_1x128x128_256x128x128x128_16x16_32x32_2x2_8x32x1_8x32x1_1x32x1x8_8_1x1_intrawave_v3,1188.17,730.88,0.0
gfx950,256,10997,3072,3072,ck,0,0,163.035,a8w8_blockscale_1x128x128_256x128x128x128_16x16_32x32_2x2_8x32x1_8x32x1_1x32x1x8_8_1x1_intrawave_v3,1273.11,679.52,0.0
gfx950,256,10997,4096,3072,ck,0,0,208.0058,a8w8_blockscale_1x128x128_256x128x128x128_16x16_32x32_2x2_8x32x1_8x32x1_1x32x1x8_8_1x1_intrawave_v3,1330.48,656.01,0.0
gfx950,256,11001,3072,3072,ck,0,0,170.9713,a8w8_blockscale_1x128x128_256x128x128x128_16x16_32x32_2x2_8x32x1_8x32x1_1x32x1x8_8_1x1_intrawave_v3,1214.45,648.19,0.0
gfx950,256,11001,4096,3072,ck,0,0,212.3862,a8w8_blockscale_1x128x128_256x128x128x128_16x16_32x32_2x2_8x32x1_8x32x1_1x32x1x8_8_1x1_intrawave_v3,1303.52,642.69,0.0
gfx950,256,11003,2048,3072,ck,0,0,116.4042,a8w8_blockscale_1x128x128_256x128x128x128_16x16_32x32_2x2_8x32x1_8x32x1_1x32x1x8_8_1x1_intrawave_v3,1189.39,731.6,0.0
gfx950,256,11004,3072,3072,ck,0,0,164.335,a8w8_blockscale_1x128x128_256x128x128x128_16x16_32x32_2x2_8x32x1_8x32x1_1x32x1x8_8_1x1_intrawave_v3,1263.84,674.54,0.0
gfx950,256,11004,3072,6144,ck,0,0,326.9313,a8w8_blockscale_1x128x128_256x128x128x128_16x16_32x32_2x2_8x32x1_8x32x1_1x32x1x8_8_1x1_intrawave_v3,1270.56,471.33,0.0
gfx950,256,11004,4096,3072,ck,0,0,221.822,a8w8_blockscale_1x128x128_256x128x128x128_16x16_32x32_2x2_8x32x1_8x32x1_1x32x1x8_8_1x1_intrawave_v3,1248.41,615.5,0.0
gfx950,256,11004,8192,3072,ck,0,0,410.2833,a8w8_blockscale_1x128x128_256x128x128x128_16x16_32x32_2x2_8x32x1_8x32x1_1x32x1x8_8_1x1_intrawave_v3,1349.92,583.16,0.0
gfx950,256,11005,2048,3072,ck,0,0,123.9903,a8w8_blockscale_1x128x128_256x128x128x128_16x16_32x32_2x2_8x32x1_8x32x1_1x32x1x8_8_1x1_intrawave_v3,1116.82,686.95,0.0
gfx950,256,11005,3072,3072,ck,0,0,178.0126,a8w8_blockscale_1x128x128_256x128x128x128_16x16_32x32_2x2_8x32x1_8x32x1_1x32x1x8_8_1x1_intrawave_v3,1166.84,622.76,0.0
gfx950,256,11005,4096,3072,ck,0,0,220.9616,a8w8_blockscale_1x128x128_256x128x128x128_16x16_32x32_2x2_8x32x1_8x32x1_1x32x1x8_8_1x1_intrawave_v3,1253.38,617.95,0.0
gfx950,256,11007,2048,3072,ck,0,0,123.9789,a8w8_blockscale_1x128x128_256x128x128x128_16x16_32x32_2x2_8x32x1_8x32x1_1x32x1x8_8_1x1_intrawave_v3,1117.13,687.13,0.0
gfx950,256,11008,2048,3072,ck,0,0,124.8827,a8w8_blockscale_1x128x128_256x128x128x128_16x16_32x32_2x2_8x32x1_8x32x1_1x32x1x8_8_1x1_intrawave_v3,1109.14,682.21,0.0
gfx950,256,11008,3072,3072,ck,0,0,163.7028,a8w8_blockscale_1x128x128_256x128x128x128_16x16_32x32_2x2_8x32x1_8x32x1_1x32x1x8_8_1x1_intrawave_v3,1269.18,677.37,0.0
gfx950,256,11008,3072,6144,ck,0,0,311.4966,a8w8_blockscale_1x128x128_256x128x128x128_16x16_32x32_2x2_8x32x1_8x32x1_1x32x1x8_8_1x1_intrawave_v3,1334.01,494.84,0.0
gfx950,256,11008,4096,3072,ck,0,0,206.992,a8w8_blockscale_1x128x128_256x128x128x128_16x16_32x32_2x2_8x32x1_8x32x1_1x32x1x8_8_1x1_intrawave_v3,1338.34,659.82,0.0
gfx950,256,11008,8192,3072,ck,0,0,388.7921,a8w8_blockscale_1x128x128_256x128x128x128_16x16_32x32_2x2_8x32x1_8x32x1_1x32x1x8_8_1x1_intrawave_v3,1425.06,615.59,0.0
gfx950,256,11009,3072,3072,ck,0,0,165.7073,a8w8_blockscale_1x128x128_256x128x128x128_16x16_32x32_2x2_8x32x1_8x32x1_1x32x1x8_8_1x1_intrawave_v3,1253.95,669.23,0.0
gfx950,256,11009,4096,3072,ck,0,0,210.6987,a8w8_blockscale_1x128x128_256x128x128x128_16x16_32x32_2x2_8x32x1_8x32x1_1x32x1x8_8_1x1_intrawave_v3,1314.91,648.26,0.0
gfx950,256,1101,2048,3072,ck,18,0,22.3808,a8w8_blockscale_1x128x128_256x64x64x256_16x16_32x32_1x1_16x16x1_16x16x1_1x32x1x8_8_1x1_intrawave_v1,619.0,633.73,0.0
gfx950,256,11010,3072,3072,ck,0,0,170.1545,a8w8_blockscale_1x128x128_256x128x128x128_16x16_32x32_2x2_8x32x1_8x32x1_1x32x1x8_8_1x1_intrawave_v3,1221.28,651.79,0.0
gfx950,256,11010,4096,3072,ck,0,0,209.8491,a8w8_blockscale_1x128x128_256x128x128x128_16x16_32x32_2x2_8x32x1_8x32x1_1x32x1x8_8_1x1_intrawave_v3,1320.36,650.94,0.0
gfx950,256,11011,3072,3072,ck,0,0,164.8363,a8w8_blockscale_1x128x128_256x128x128x128_16x16_32x32_2x2_8x32x1_8x32x1_1x32x1x8_8_1x1_intrawave_v3,1260.8,672.88,0.0
gfx950,256,11011,4096,3072,ck,0,0,209.2315,a8w8_blockscale_1x128x128_256x128x128x128_16x16_32x32_2x2_8x32x1_8x32x1_1x32x1x8_8_1x1_intrawave_v3,1324.37,652.92,0.0
gfx950,256,11012,3072,3072,ck,0,0,167.068,a8w8_blockscale_1x128x128_256x128x128x128_16x16_32x32_2x2_8x32x1_8x32x1_1x32x1x8_8_1x1_intrawave_v3,1244.07,663.94,0.0
gfx950,256,11012,4096,3072,ck,0,0,212.8223,a8w8_blockscale_1x128x128_256x128x128x128_16x16_32x32_2x2_8x32x1_8x32x1_1x32x1x8_8_1x1_intrawave_v3,1302.15,641.95,0.0
gfx950,256,11013,3072,3072,ck,0,0,167.6796,a8w8_blockscale_1x128x128_256x128x128x128_16x16_32x32_2x2_8x32x1_8x32x1_1x32x1x8_8_1x1_intrawave_v3,1239.65,661.58,0.0
gfx950,256,11013,4096,3072,ck,0,0,213.0922,a8w8_blockscale_1x128x128_256x128x128x128_16x16_32x32_2x2_8x32x1_8x32x1_1x32x1x8_8_1x1_intrawave_v3,1300.62,641.19,0.0
gfx950,256,11014,3072,3072,ck,0,0,164.4635,a8w8_blockscale_1x128x128_256x128x128x128_16x16_32x32_2x2_8x32x1_8x32x1_1x32x1x8_8_1x1_intrawave_v3,1264.0,674.57,0.0
gfx950,256,11014,4096,3072,ck,0,0,208.9048,a8w8_blockscale_1x128x128_256x128x128x128_16x16_32x32_2x2_8x32x1_8x32x1_1x32x1x8_8_1x1_intrawave_v3,1326.81,654.1,0.0
gfx950,256,11015,3072,3072,ck,0,0,166.7438,a8w8_blockscale_1x128x128_256x128x128x128_16x16_32x32_2x2_8x32x1_8x32x1_1x32x1x8_8_1x1_intrawave_v3,1246.83,665.4,0.0
gfx950,256,11015,4096,3072,ck,0,0,211.9049,a8w8_blockscale_1x128x128_256x128x128x128_16x16_32x32_2x2_8x32x1_8x32x1_1x32x1x8_8_1x1_intrawave_v3,1308.14,644.89,0.0
gfx950,256,1102,2048,3072,ck,18,0,22.6354,a8w8_blockscale_1x128x128_256x64x64x256_16x16_32x32_1x1_16x16x1_16x16x1_1x32x1x8_8_1x1_intrawave_v1,612.6,626.92,0.0
gfx950,256,11021,2048,3072,ck,0,0,115.4977,a8w8_blockscale_1x128x128_256x128x128x128_16x16_32x32_2x2_8x32x1_8x32x1_1x32x1x8_8_1x1_intrawave_v3,1200.68,738.46,0.0
gfx950,256,11021,3072,3072,ck,0,0,167.9146,a8w8_blockscale_1x128x128_256x128x128x128_16x16_32x32_2x2_8x32x1_8x32x1_1x32x1x8_8_1x1_intrawave_v3,1238.81,661.09,0.0
gfx950,256,11021,4096,3072,ck,0,0,210.4524,a8w8_blockscale_1x128x128_256x128x128x128_16x16_32x32_2x2_8x32x1_8x32x1_1x32x1x8_8_1x1_intrawave_v3,1317.89,649.66,0.0
gfx950,256,11023,3072,3072,ck,0,0,170.0758,a8w8_blockscale_1x128x128_256x128x128x128_16x16_32x32_2x2_8x32x1_8x32x1_1x32x1x8_8_1x1_intrawave_v3,1223.29,652.8,0.0
gfx950,256,11023,4096,3072,ck,0,0,209.8224,a8w8_blockscale_1x128x128_256x128x128x128_16x16_32x32_2x2_8x32x1_8x32x1_1x32x1x8_8_1x1_intrawave_v3,1322.08,651.72,0.0
gfx950,256,11024,2048,3072,ck,0,0,117.2384,a8w8_blockscale_1x128x128_256x128x128x128_16x16_32x32_2x2_8x32x1_8x32x1_1x32x1x8_8_1x1_intrawave_v3,1183.18,727.68,0.0
gfx950,256,11025,2048,3072,ck,0,0,118.6558,a8w8_blockscale_1x128x128_256x128x128x128_16x16_32x32_2x2_8x32x1_8x32x1_1x32x1x8_8_1x1_intrawave_v3,1169.15,719.04,0.0
gfx950,256,11028,2048,3072,ck,0,0,118.1538,a8w8_blockscale_1x128x128_256x128x128x128_16x16_32x32_2x2_8x32x1_8x32x1_1x32x1x8_8_1x1_intrawave_v3,1174.44,722.28,0.0
gfx950,256,11030,2048,3072,ck,0,0,116.3301,a8w8_blockscale_1x128x128_256x128x128x128_16x16_32x32_2x2_8x32x1_8x32x1_1x32x1x8_8_1x1_intrawave_v3,1193.07,733.73,0.0
gfx950,256,11030,3072,3072,ck,0,0,164.0558,a8w8_blockscale_1x128x128_256x128x128x128_16x16_32x32_2x2_8x32x1_8x32x1_1x32x1x8_8_1x1_intrawave_v3,1268.98,677.15,0.0
gfx950,256,11030,4096,3072,ck,0,0,211.2307,a8w8_blockscale_1x128x128_256x128x128x128_16x16_32x32_2x2_8x32x1_8x32x1_1x32x1x8_8_1x1_intrawave_v3,1314.1,647.75,0.0
gfx950,256,11033,2048,3072,ck,0,0,116.3039,a8w8_blockscale_1x128x128_256x128x128x128_16x16_32x32_2x2_8x32x1_8x32x1_1x32x1x8_8_1x1_intrawave_v3,1193.66,734.08,0.0
gfx950,256,11035,3072,3072,ck,0,0,164.3669,a8w8_blockscale_1x128x128_256x128x128x128_16x16_32x32_2x2_8x32x1_8x32x1_1x32x1x8_8_1x1_intrawave_v3,1267.16,676.14,0.0
gfx950,256,11035,4096,3072,ck,0,0,213.1316,a8w8_blockscale_1x128x128_256x128x128x128_16x16_32x32_2x2_8x32x1_8x32x1_1x32x1x8_8_1x1_intrawave_v3,1302.97,642.24,0.0
gfx950,256,11037,2048,3072,ck,0,0,116.7692,a8w8_blockscale_1x128x128_256x128x128x128_16x16_32x32_2x2_8x32x1_8x32x1_1x32x1x8_8_1x1_intrawave_v3,1189.33,731.4,0.0
gfx950,256,11038,2048,3072,ck,0,0,118.2265,a8w8_blockscale_1x128x128_256x128x128x128_16x16_32x32_2x2_8x32x1_8x32x1_1x32x1x8_8_1x1_intrawave_v3,1174.78,722.44,0.0
gfx950,256,11041,2048,3072,ck,0,0,116.4233,a8w8_blockscale_1x128x128_256x128x128x128_16x16_32x32_2x2_8x32x1_8x32x1_1x32x1x8_8_1x1_intrawave_v3,1193.3,733.82,0.0
gfx950,256,11046,3072,3072,ck,0,0,168.6921,a8w8_blockscale_1x128x128_256x128x128x128_16x16_32x32_2x2_8x32x1_8x32x1_1x32x1x8_8_1x1_intrawave_v3,1235.9,659.41,0.0
gfx950,256,11046,4096,3072,ck,0,0,213.094,a8w8_blockscale_1x128x128_256x128x128x128_16x16_32x32_2x2_8x32x1_8x32x1_1x32x1x8_8_1x1_intrawave_v3,1304.5,642.93,0.0
gfx950,256,1106,2048,3072,ck,18,0,22.547,a8w8_blockscale_1x128x128_256x64x64x256_16x16_32x32_1x1_16x16x1_16x16x1_1x32x1x8_8_1x1_intrawave_v1,617.23,630.65,0.0
gfx950,256,11060,2048,3072,ck,0,0,118.4701,a8w8_blockscale_1x128x128_256x128x128x128_16x16_32x32_2x2_8x32x1_8x32x1_1x32x1x8_8_1x1_intrawave_v3,1174.7,722.29,0.0
gfx950,256,11060,3072,3072,ck,0,0,165.5474,a8w8_blockscale_1x128x128_256x128x128x128_16x16_32x32_2x2_8x32x1_8x32x1_1x32x1x8_8_1x1_intrawave_v3,1260.97,672.71,0.0
gfx950,256,11060,4096,3072,ck,0,0,212.5215,a8w8_blockscale_1x128x128_256x128x128x128_16x16_32x32_2x2_8x32x1_8x32x1_1x32x1x8_8_1x1_intrawave_v3,1309.67,645.41,0.0
gfx950,256,11061,2048,3072,ck,0,0,117.4033,a8w8_blockscale_1x128x128_256x128x128x128_16x16_32x32_2x2_8x32x1_8x32x1_1x32x1x8_8_1x1_intrawave_v3,1185.48,728.91,0.0
gfx950,256,11061,3072,3072,ck,0,0,169.4334,a8w8_blockscale_1x128x128_256x128x128x128_16x16_32x32_2x2_8x32x1_8x32x1_1x32x1x8_8_1x1_intrawave_v3,1232.16,657.34,0.0
gfx950,256,11061,4096,3072,ck,0,0,208.7015,a8w8_blockscale_1x128x128_256x128x128x128_16x16_32x32_2x2_8x32x1_8x32x1_1x32x1x8_8_1x1_intrawave_v3,1333.77,657.27,0.0
gfx950,256,11063,2048,3072,ck,0,0,117.9571,a8w8_blockscale_1x128x128_256x128x128x128_16x16_32x32_2x2_8x32x1_8x32x1_1x32x1x8_8_1x1_intrawave_v3,1180.13,725.61,0.0
gfx950,256,1107,2048,3072,ck,18,0,22.4767,a8w8_blockscale_1x128x128_256x64x64x256_16x16_32x32_1x1_16x16x1_16x16x1_1x32x1x8_8_1x1_intrawave_v1,619.72,632.94,0.0
gfx950,256,11074,3072,3072,ck,0,0,171.1334,a8w8_blockscale_1x128x128_256x128x128x128_16x16_32x32_2x2_8x32x1_8x32x1_1x32x1x8_8_1x1_intrawave_v3,1221.36,651.51,0.0
gfx950,256,11074,4096,3072,ck,0,0,211.5652,a8w8_blockscale_1x128x128_256x128x128x128_16x16_32x32_2x2_8x32x1_8x32x1_1x32x1x8_8_1x1_intrawave_v3,1317.26,649.07,0.0
gfx950,256,11079,2048,3072,ck,0,0,118.2042,a8w8_blockscale_1x128x128_256x128x128x128_16x16_32x32_2x2_8x32x1_8x32x1_1x32x1x8_8_1x1_intrawave_v3,1179.37,725.06,0.0
gfx950,256,11079,3072,3072,ck,0,0,165.4351,a8w8_blockscale_1x128x128_256x128x128x128_16x16_32x32_2x2_8x32x1_8x32x1_1x32x1x8_8_1x1_intrawave_v3,1263.99,674.23,0.0
gfx950,256,11079,4096,3072,ck,0,0,210.9424,a8w8_blockscale_1x128x128_256x128x128x128_16x16_32x32_2x2_8x32x1_8x32x1_1x32x1x8_8_1x1_intrawave_v3,1321.75,651.25,0.0
gfx950,256,1108,3072,6144,ck,0,0,47.1432,a8w8_blockscale_1x128x128_256x128x128x128_16x16_32x32_2x2_8x32x1_8x32x1_1x32x1x8_8_1x1_intrawave_v3,887.2,689.17,0.0
gfx950,256,1108,8192,3072,ck,0,0,61.326,a8w8_blockscale_1x128x128_256x128x128x128_16x16_32x32_2x2_8x32x1_8x32x1_1x32x1x8_8_1x1_intrawave_v3,909.36,761.88,0.0
gfx950,256,11080,3072,3072,ck,0,0,164.9456,a8w8_blockscale_1x128x128_256x128x128x128_16x16_32x32_2x2_8x32x1_8x32x1_1x32x1x8_8_1x1_intrawave_v3,1267.86,676.29,0.0
gfx950,256,11080,4096,3072,ck,0,0,213.9516,a8w8_blockscale_1x128x128_256x128x128x128_16x16_32x32_2x2_8x32x1_8x32x1_1x32x1x8_8_1x1_intrawave_v3,1303.27,642.15,0.0
gfx950,256,11083,2048,3072,ck,0,0,117.1689,a8w8_blockscale_1x128x128_256x128x128x128_16x16_32x32_2x2_8x32x1_8x32x1_1x32x1x8_8_1x1_intrawave_v3,1190.22,731.72,0.0
gfx950,256,11083,3072,3072,ck,0,0,167.8182,a8w8_blockscale_1x128x128_256x128x128x128_16x16_32x32_2x2_8x32x1_8x32x1_1x32x1x8_8_1x1_intrawave_v3,1246.5,664.87,0.0
gfx950,256,11083,4096,3072,ck,0,0,213.3014,a8w8_blockscale_1x128x128_256x128x128x128_16x16_32x32_2x2_8x32x1_8x32x1_1x32x1x8_8_1x1_intrawave_v3,1307.6,644.26,0.0
gfx950,256,11087,2048,3072,ck,0,0,116.9855,a8w8_blockscale_1x128x128_256x128x128x128_16x16_32x32_2x2_8x32x1_8x32x1_1x32x1x8_8_1x1_intrawave_v3,1192.51,733.11,0.0
gfx950,256,11099,3072,3072,ck,0,0,164.0048,a8w8_blockscale_1x128x128_256x128x128x128_16x16_32x32_2x2_8x32x1_8x32x1_1x32x1x8_8_1x1_intrawave_v3,1277.32,681.23,0.0
gfx950,256,11099,4096,3072,ck,0,0,214.0014,a8w8_blockscale_1x128x128_256x128x128x128_16x16_32x32_2x2_8x32x1_8x32x1_1x32x1x8_8_1x1_intrawave_v3,1305.2,643.0,0.0
gfx950,256,11102,2048,3072,ck,0,0,117.7971,a8w8_blockscale_1x128x128_256x128x128x128_16x16_32x32_2x2_8x32x1_8x32x1_1x32x1x8_8_1x1_intrawave_v3,1185.9,728.97,0.0
gfx950,256,11102,3072,3072,ck,0,0,170.0491,a8w8_blockscale_1x128x128_256x128x128x128_16x16_32x32_2x2_8x32x1_8x32x1_1x32x1x8_8_1x1_intrawave_v3,1232.25,657.18,0.0
gfx950,256,11102,4096,3072,ck,0,0,212.2347,a8w8_blockscale_1x128x128_256x128x128x128_16x16_32x32_2x2_8x32x1_8x32x1_1x32x1x8_8_1x1_intrawave_v3,1316.42,648.51,0.0
gfx950,256,11107,3072,3072,ck,0,0,165.4282,a8w8_blockscale_1x128x128_256x128x128x128_16x16_32x32_2x2_8x32x1_8x32x1_1x32x1x8_8_1x1_intrawave_v3,1267.24,675.82,0.0
gfx950,256,11107,4096,3072,ck,0,0,210.8607,a8w8_blockscale_1x128x128_256x128x128x128_16x16_32x32_2x2_8x32x1_8x32x1_1x32x1x8_8_1x1_intrawave_v3,1325.6,653.0,0.0
gfx950,256,11108,3072,3072,ck,0,0,168.8501,a8w8_blockscale_1x128x128_256x128x128x128_16x16_32x32_2x2_8x32x1_8x32x1_1x32x1x8_8_1x1_intrawave_v3,1241.67,662.18,0.0
gfx950,256,11108,4096,3072,ck,0,0,213.0338,a8w8_blockscale_1x128x128_256x128x128x128_16x16_32x32_2x2_8x32x1_8x32x1_1x32x1x8_8_1x1_intrawave_v3,1312.2,646.39,0.0
gfx950,256,11112,2048,3072,ck,0,0,117.3906,a8w8_blockscale_1x128x128_256x128x128x128_16x16_32x32_2x2_8x32x1_8x32x1_1x32x1x8_8_1x1_intrawave_v3,1191.08,732.11,0.0
gfx950,256,11113,2048,3072,ck,0,0,117.5794,a8w8_blockscale_1x128x128_256x128x128x128_16x16_32x32_2x2_8x32x1_8x32x1_1x32x1x8_8_1x1_intrawave_v3,1189.27,730.99,0.0
gfx950,256,11117,3072,3072,ck,0,0,168.659,a8w8_blockscale_1x128x128_256x128x128x128_16x16_32x32_2x2_8x32x1_8x32x1_1x32x1x8_8_1x1_intrawave_v3,1244.09,663.42,0.0
gfx950,256,11117,4096,3072,ck,0,0,212.3456,a8w8_blockscale_1x128x128_256x128x128x128_16x16_32x32_2x2_8x32x1_8x32x1_1x32x1x8_8_1x1_intrawave_v3,1317.51,648.96,0.0
gfx950,256,11118,3072,3072,ck,0,0,168.1634,a8w8_blockscale_1x128x128_256x128x128x128_16x16_32x32_2x2_8x32x1_8x32x1_1x32x1x8_8_1x1_intrawave_v3,1247.87,665.43,0.0
gfx950,256,11118,4096,3072,ck,0,0,213.6807,a8w8_blockscale_1x128x128_256x128x128x128_16x16_32x32_2x2_8x32x1_8x32x1_1x32x1x8_8_1x1_intrawave_v3,1309.4,644.96,0.0
gfx950,256,11119,3072,3072,ck,0,0,169.2777,a8w8_blockscale_1x128x128_256x128x128x128_16x16_32x32_2x2_8x32x1_8x32x1_1x32x1x8_8_1x1_intrawave_v3,1239.76,661.1,0.0
gfx950,256,11119,4096,3072,ck,0,0,209.7233,a8w8_blockscale_1x128x128_256x128x128x128_16x16_32x32_2x2_8x32x1_8x32x1_1x32x1x8_8_1x1_intrawave_v3,1334.23,657.19,0.0
gfx950,256,11122,2048,3072,ck,0,0,118.3946,a8w8_blockscale_1x128x128_256x128x128x128_16x16_32x32_2x2_8x32x1_8x32x1_1x32x1x8_8_1x1_intrawave_v3,1182.04,726.5,0.0
gfx950,256,11123,3072,3072,ck,0,0,164.4618,a8w8_blockscale_1x128x128_256x128x128x128_16x16_32x32_2x2_8x32x1_8x32x1_1x32x1x8_8_1x1_intrawave_v3,1276.52,680.69,0.0
gfx950,256,11123,4096,3072,ck,0,0,213.7627,a8w8_blockscale_1x128x128_256x128x128x128_16x16_32x32_2x2_8x32x1_8x32x1_1x32x1x8_8_1x1_intrawave_v3,1309.49,644.98,0.0
gfx950,256,11124,3072,3072,ck,0,0,167.6706,a8w8_blockscale_1x128x128_256x128x128x128_16x16_32x32_2x2_8x32x1_8x32x1_1x32x1x8_8_1x1_intrawave_v3,1252.21,667.71,0.0
gfx950,256,11124,4096,3072,ck,0,0,209.274,a8w8_blockscale_1x128x128_256x128x128x128_16x16_32x32_2x2_8x32x1_8x32x1_1x32x1x8_8_1x1_intrawave_v3,1337.69,658.87,0.0
gfx950,256,11126,3072,3072,ck,0,0,167.7799,a8w8_blockscale_1x128x128_256x128x128x128_16x16_32x32_2x2_8x32x1_8x32x1_1x32x1x8_8_1x1_intrawave_v3,1251.62,667.39,0.0
gfx950,256,11126,4096,3072,ck,0,0,213.1994,a8w8_blockscale_1x128x128_256x128x128x128_16x16_32x32_2x2_8x32x1_8x32x1_1x32x1x8_8_1x1_intrawave_v3,1313.3,646.84,0.0
gfx950,256,11127,2048,3072,ck,0,0,115.9571,a8w8_blockscale_1x128x128_256x128x128x128_16x16_32x32_2x2_8x32x1_8x32x1_1x32x1x8_8_1x1_intrawave_v3,1207.43,742.08,0.0
gfx950,256,1113,3072,6144,ck,0,0,47.2944,a8w8_blockscale_1x128x128_256x128x128x128_16x16_32x32_2x2_8x32x1_8x32x1_1x32x1x8_8_1x1_intrawave_v3,888.36,688.26,0.0
gfx950,256,1113,8192,3072,ck,0,0,60.3727,a8w8_blockscale_1x128x128_256x128x128x128_16x16_32x32_2x2_8x32x1_8x32x1_1x32x1x8_8_1x1_intrawave_v3,927.89,775.52,0.0
gfx950,256,11136,2048,3072,ck,0,0,116.1959,a8w8_blockscale_1x128x128_256x128x128x128_16x16_32x32_2x2_8x32x1_8x32x1_1x32x1x8_8_1x1_intrawave_v3,1205.92,741.11,0.0
gfx950,256,11136,3072,3072,ck,0,0,163.3879,a8w8_blockscale_1x128x128_256x128x128x128_16x16_32x32_2x2_8x32x1_8x32x1_1x32x1x8_8_1x1_intrawave_v3,1286.42,685.89,0.0
gfx950,256,11136,3072,6144,ck,0,0,312.9898,a8w8_blockscale_1x128x128_256x128x128x128_16x16_32x32_2x2_8x32x1_8x32x1_1x32x1x8_8_1x1_intrawave_v3,1343.08,497.5,0.0
gfx950,256,11136,4096,3072,ck,0,0,208.3994,a8w8_blockscale_1x128x128_256x128x128x128_16x16_32x32_2x2_8x32x1_8x32x1_1x32x1x8_8_1x1_intrawave_v3,1344.76,662.28,0.0
gfx950,256,11136,8192,3072,ck,0,0,390.9609,a8w8_blockscale_1x128x128_256x128x128x128_16x16_32x32_2x2_8x32x1_8x32x1_1x32x1x8_8_1x1_intrawave_v3,1433.63,618.55,0.0
gfx950,256,11137,2048,3072,ck,0,0,117.5768,a8w8_blockscale_1x128x128_256x128x128x128_16x16_32x32_2x2_8x32x1_8x32x1_1x32x1x8_8_1x1_intrawave_v3,1191.87,732.47,0.0
gfx950,256,11147,2048,3072,ck,0,0,117.0158,a8w8_blockscale_1x128x128_256x128x128x128_16x16_32x32_2x2_8x32x1_8x32x1_1x32x1x8_8_1x1_intrawave_v3,1198.66,736.59,0.0
gfx950,256,11151,2048,3072,ck,0,0,117.3771,a8w8_blockscale_1x128x128_256x128x128x128_16x16_32x32_2x2_8x32x1_8x32x1_1x32x1x8_8_1x1_intrawave_v3,1195.4,734.57,0.0
gfx950,256,11152,3072,3072,ck,0,0,168.7493,a8w8_blockscale_1x128x128_256x128x128x128_16x16_32x32_2x2_8x32x1_8x32x1_1x32x1x8_8_1x1_intrawave_v3,1247.34,664.97,0.0
gfx950,256,11152,4096,3072,ck,0,0,210.693,a8w8_blockscale_1x128x128_256x128x128x128_16x16_32x32_2x2_8x32x1_8x32x1_1x32x1x8_8_1x1_intrawave_v3,1332.03,655.93,0.0
gfx950,256,11154,2048,3072,ck,0,0,118.055,a8w8_blockscale_1x128x128_256x128x128x128_16x16_32x32_2x2_8x32x1_8x32x1_1x32x1x8_8_1x1_intrawave_v3,1188.85,730.54,0.0
gfx950,256,11155,2048,3072,ck,0,0,117.949,a8w8_blockscale_1x128x128_256x128x128x128_16x16_32x32_2x2_8x32x1_8x32x1_1x32x1x8_8_1x1_intrawave_v3,1190.03,731.25,0.0
gfx950,256,11156,2048,3072,ck,0,0,117.6718,a8w8_blockscale_1x128x128_256x128x128x128_16x16_32x32_2x2_8x32x1_8x32x1_1x32x1x8_8_1x1_intrawave_v3,1192.94,733.04,0.0
gfx950,256,11159,3072,3072,ck,0,0,166.6088,a8w8_blockscale_1x128x128_256x128x128x128_16x16_32x32_2x2_8x32x1_8x32x1_1x32x1x8_8_1x1_intrawave_v3,1264.15,673.91,0.0
gfx950,256,11159,4096,3072,ck,0,0,213.7855,a8w8_blockscale_1x128x128_256x128x128x128_16x16_32x32_2x2_8x32x1_8x32x1_1x32x1x8_8_1x1_intrawave_v3,1313.59,646.81,0.0
gfx950,256,1116,2048,3072,ck,18,0,22.6602,a8w8_blockscale_1x128x128_256x64x64x256_16x16_32x32_1x1_16x16x1_16x16x1_1x32x1x8_8_1x1_intrawave_v1,619.7,630.66,0.0
gfx950,256,11160,2048,3072,ck,0,0,119.6067,a8w8_blockscale_1x128x128_256x128x128x128_16x16_32x32_2x2_8x32x1_8x32x1_1x32x1x8_8_1x1_intrawave_v3,1174.06,721.42,0.0
gfx950,256,11160,3072,3072,ck,0,0,165.8218,a8w8_blockscale_1x128x128_256x128x128x128_16x16_32x32_2x2_8x32x1_8x32x1_1x32x1x8_8_1x1_intrawave_v3,1270.27,677.16,0.0
gfx950,256,11160,4096,3072,ck,0,0,213.4517,a8w8_blockscale_1x128x128_256x128x128x128_16x16_32x32_2x2_8x32x1_8x32x1_1x32x1x8_8_1x1_intrawave_v3,1315.76,647.87,0.0
gfx950,256,11162,2048,3072,ck,0,0,117.2305,a8w8_blockscale_1x128x128_256x128x128x128_16x16_32x32_2x2_8x32x1_8x32x1_1x32x1x8_8_1x1_intrawave_v3,1198.07,736.16,0.0
gfx950,256,11165,2048,3072,ck,0,0,117.1676,a8w8_blockscale_1x128x128_256x128x128x128_16x16_32x32_2x2_8x32x1_8x32x1_1x32x1x8_8_1x1_intrawave_v3,1199.04,736.74,0.0
gfx950,256,11171,2048,3072,ck,0,0,119.1564,a8w8_blockscale_1x128x128_256x128x128x128_16x16_32x32_2x2_8x32x1_8x32x1_1x32x1x8_8_1x1_intrawave_v3,1179.66,724.81,0.0
gfx950,256,11172,2048,3072,ck,0,0,118.1765,a8w8_blockscale_1x128x128_256x128x128x128_16x16_32x32_2x2_8x32x1_8x32x1_1x32x1x8_8_1x1_intrawave_v3,1189.55,730.88,0.0
gfx950,256,11187,2048,3072,ck,0,0,117.7629,a8w8_blockscale_1x128x128_256x128x128x128_16x16_32x32_2x2_8x32x1_8x32x1_1x32x1x8_8_1x1_intrawave_v3,1195.33,734.36,0.0
gfx950,256,11188,2048,3072,ck,0,0,117.4481,a8w8_blockscale_1x128x128_256x128x128x128_16x16_32x32_2x2_8x32x1_8x32x1_1x32x1x8_8_1x1_intrawave_v3,1198.64,736.39,0.0
gfx950,256,11189,2048,3072,ck,0,0,118.3161,a8w8_blockscale_1x128x128_256x128x128x128_16x16_32x32_2x2_8x32x1_8x32x1_1x32x1x8_8_1x1_intrawave_v3,1189.95,731.04,0.0
gfx950,256,11195,2048,3072,ck,0,0,118.0089,a8w8_blockscale_1x128x128_256x128x128x128_16x16_32x32_2x2_8x32x1_8x32x1_1x32x1x8_8_1x1_intrawave_v3,1193.69,733.31,0.0
gfx950,256,112,2048,3072,ck,8,0,10.5868,a8w8_blockscale_1x128x128_256x16x64x256_16x16_16x16_1x1_16x16x1_16x16x1_1x16x1x16_4_1x1_intrawave_v1,133.12,670.11,0.0
gfx950,256,112,3072,3072,ck,8,0,11.8791,a8w8_blockscale_1x128x128_256x16x64x256_16x16_16x16_1x1_16x16x1_16x16x1_1x16x1x16_4_1x1_intrawave_v1,177.95,881.33,0.0
gfx950,256,112,3072,6144,ck,18,1,19.3198,a8w8_blockscale_1x128x128_256x64x64x256_16x16_32x32_1x1_16x16x1_16x16x1_1x32x1x8_8_1x1_intrawave_v1,218.84,1048.18,0.0
gfx950,256,112,4096,3072,ck,7,0,11.667,a8w8_blockscale_1x128x128_256x16x128x256_16x16_16x16_1x2_16x16x1_16x16x1_1x16x1x16_8_1x2_intrawave_v1,241.59,1186.64,0.0
gfx950,256,112,8192,3072,ck,18,0,12.067,a8w8_blockscale_1x128x128_256x64x64x256_16x16_32x32_1x1_16x16x1_16x16x1_1x32x1x8_8_1x1_intrawave_v1,467.15,2266.09,0.0
gfx950,256,1121,2048,3072,ck,18,0,22.6805,a8w8_blockscale_1x128x128_256x64x64x256_16x16_32x32_1x1_16x16x1_16x16x1_1x32x1x8_8_1x1_intrawave_v1,621.92,631.68,0.0
gfx950,256,11219,2048,3072,ck,0,0,117.9997,a8w8_blockscale_1x128x128_256x128x128x128_16x16_32x32_2x2_8x32x1_8x32x1_1x32x1x8_8_1x1_intrawave_v3,1196.34,734.83,0.0
gfx950,256,1122,2048,3072,ck,18,0,22.5522,a8w8_blockscale_1x128x128_256x64x64x256_16x16_32x32_1x1_16x16x1_16x16x1_1x32x1x8_8_1x1_intrawave_v1,626.02,635.59,0.0
gfx950,256,1122,3072,3072,ck,0,0,27.3459,a8w8_blockscale_1x128x128_256x128x128x128_16x16_32x32_2x2_8x32x1_8x32x1_1x32x1x8_8_1x1_intrawave_v3,774.41,723.24,0.0
gfx950,256,1122,4096,3072,ck,18,0,35.607,a8w8_blockscale_1x128x128_256x64x64x256_16x16_32x32_1x1_16x16x1_16x16x1_1x32x1x8_8_1x1_intrawave_v1,792.99,708.32,0.0
gfx950,256,11221,2048,3072,ck,0,0,117.9407,a8w8_blockscale_1x128x128_256x128x128x128_16x16_32x32_2x2_8x32x1_8x32x1_1x32x1x8_8_1x1_intrawave_v3,1197.15,735.32,0.0
gfx950,256,1123,2048,3072,ck,18,0,22.7795,a8w8_blockscale_1x128x128_256x64x64x256_16x16_32x32_1x1_16x16x1_16x16x1_1x32x1x8_8_1x1_intrawave_v1,620.32,629.56,0.0
gfx950,256,1123,3072,3072,ck,0,0,27.2065,a8w8_blockscale_1x128x128_256x128x128x128_16x16_32x32_2x2_8x32x1_8x32x1_1x32x1x8_8_1x1_intrawave_v3,779.08,727.28,0.0
gfx950,256,1123,4096,3072,ck,18,0,35.2419,a8w8_blockscale_1x128x128_256x64x64x256_16x16_32x32_1x1_16x16x1_16x16x1_1x32x1x8_8_1x1_intrawave_v1,801.92,715.98,0.0
gfx950,256,11234,2048,3072,ck,0,0,118.1712,a8w8_blockscale_1x128x128_256x128x128x128_16x16_32x32_2x2_8x32x1_8x32x1_1x32x1x8_8_1x1_intrawave_v3,1196.2,734.67,0.0
gfx950,256,11238,2048,3072,ck,0,0,119.5654,a8w8_blockscale_1x128x128_256x128x128x128_16x16_32x32_2x2_8x32x1_8x32x1_1x32x1x8_8_1x1_intrawave_v3,1182.67,726.34,0.0
gfx950,256,1124,2048,3072,ck,18,0,22.6887,a8w8_blockscale_1x128x128_256x64x64x256_16x16_32x32_1x1_16x16x1_16x16x1_1x32x1x8_8_1x1_intrawave_v1,623.36,632.4,0.0
gfx950,256,1125,2048,3072,ck,18,0,22.5453,a8w8_blockscale_1x128x128_256x64x64x256_16x16_32x32_1x1_16x16x1_16x16x1_1x32x1x8_8_1x1_intrawave_v1,627.88,636.74,0.0
gfx950,256,11254,2048,3072,ck,0,0,118.5165,a8w8_blockscale_1x128x128_256x128x128x128_16x16_32x32_2x2_8x32x1_8x32x1_1x32x1x8_8_1x1_intrawave_v3,1194.84,733.74,0.0
gfx950,256,1126,2048,3072,ck,18,0,22.8043,a8w8_blockscale_1x128x128_256x64x64x256_16x16_32x32_1x1_16x16x1_16x16x1_1x32x1x8_8_1x1_intrawave_v1,621.3,629.82,0.0
gfx950,256,11264,2048,3072,ck,0,0,116.9032,a8w8_blockscale_1x128x128_256x128x128x128_16x16_32x32_2x2_8x32x1_8x32x1_1x32x1x8_8_1x1_intrawave_v3,1212.4,744.48,0.0
gfx950,256,11264,3072,3072,ck,0,0,168.9984,a8w8_blockscale_1x128x128_256x128x128x128_16x16_32x32_2x2_8x32x1_8x32x1_1x32x1x8_8_1x1_intrawave_v3,1258.01,670.1,0.0
gfx950,256,11264,3072,6144,ck,0,0,311.4109,a8w8_blockscale_1x128x128_256x128x128x128_16x16_32x32_2x2_8x32x1_8x32x1_1x32x1x8_8_1x1_intrawave_v3,1365.4,505.08,0.0
gfx950,256,11264,4096,3072,ck,0,0,207.8486,a8w8_blockscale_1x128x128_256x128x128x128_16x16_32x32_2x2_8x32x1_8x32x1_1x32x1x8_8_1x1_intrawave_v3,1363.82,670.97,0.0
gfx950,256,11264,8192,3072,ck,0,0,394.0885,a8w8_blockscale_1x128x128_256x128x128x128_16x16_32x32_2x2_8x32x1_8x32x1_1x32x1x8_8_1x1_intrawave_v3,1438.6,619.96,0.0
gfx950,256,1127,2048,3072,ck,18,0,22.6417,a8w8_blockscale_1x128x128_256x64x64x256_16x16_32x32_1x1_16x16x1_16x16x1_1x32x1x8_8_1x1_intrawave_v1,626.32,634.66,0.0
gfx950,256,11274,2048,3072,ck,0,0,118.1306,a8w8_blockscale_1x128x128_256x128x128x128_16x16_32x32_2x2_8x32x1_8x32x1_1x32x1x8_8_1x1_intrawave_v3,1200.87,737.35,0.0
gfx950,256,1128,3072,3072,ck,0,0,27.0793,a8w8_blockscale_1x128x128_256x128x128x128_16x16_32x32_2x2_8x32x1_8x32x1_1x32x1x8_8_1x1_intrawave_v3,786.22,732.4,0.0
gfx950,256,1128,4096,3072,ck,18,0,35.8946,a8w8_blockscale_1x128x128_256x64x64x256_16x16_32x32_1x1_16x16x1_16x16x1_1x32x1x8_8_1x1_intrawave_v1,790.84,704.53,0.0
gfx950,256,11284,2048,3072,ck,0,0,120.0816,a8w8_blockscale_1x128x128_256x128x128x128_16x16_32x32_2x2_8x32x1_8x32x1_1x32x1x8_8_1x1_intrawave_v3,1182.41,725.97,0.0
gfx950,256,11296,2048,3072,ck,0,0,120.3829,a8w8_blockscale_1x128x128_256x128x128x128_16x16_32x32_2x2_8x32x1_8x32x1_1x32x1x8_8_1x1_intrawave_v3,1180.7,724.86,0.0
gfx950,256,11302,2048,3072,ck,0,0,119.2636,a8w8_blockscale_1x128x128_256x128x128x128_16x16_32x32_2x2_8x32x1_8x32x1_1x32x1x8_8_1x1_intrawave_v3,1192.42,732.03,0.0
gfx950,256,11304,3072,6144,ck,0,0,319.0705,a8w8_blockscale_1x128x128_256x128x128x128_16x16_32x32_2x2_8x32x1_8x32x1_1x32x1x8_8_1x1_intrawave_v3,1337.36,494.49,0.0
gfx950,256,11304,8192,3072,ck,0,0,404.2112,a8w8_blockscale_1x128x128_256x128x128x128_16x16_32x32_2x2_8x32x1_8x32x1_1x32x1x8_8_1x1_intrawave_v3,1407.55,606.36,0.0
gfx950,256,1131,2048,3072,ck,18,0,22.6589,a8w8_blockscale_1x128x128_256x64x64x256_16x16_32x32_1x1_16x16x1_16x16x1_1x32x1x8_8_1x1_intrawave_v1,628.07,635.44,0.0
gfx950,256,11313,2048,3072,ck,0,0,118.0702,a8w8_blockscale_1x128x128_256x128x128x128_16x16_32x32_2x2_8x32x1_8x32x1_1x32x1x8_8_1x1_intrawave_v3,1205.64,740.09,0.0
gfx950,256,11322,2048,3072,ck,0,0,119.0436,a8w8_blockscale_1x128x128_256x128x128x128_16x16_32x32_2x2_8x32x1_8x32x1_1x32x1x8_8_1x1_intrawave_v3,1196.74,734.58,0.0
gfx950,256,11339,2048,3072,ck,0,0,118.6449,a8w8_blockscale_1x128x128_256x128x128x128_16x16_32x32_2x2_8x32x1_8x32x1_1x32x1x8_8_1x1_intrawave_v3,1202.56,738.08,0.0
gfx950,256,1134,2048,3072,ck,18,0,22.5902,a8w8_blockscale_1x128x128_256x64x64x256_16x16_32x32_1x1_16x16x1_16x16x1_1x32x1x8_8_1x1_intrawave_v1,631.65,638.33,0.0
gfx950,256,11342,3072,6144,ck,0,0,318.3797,a8w8_blockscale_1x128x128_256x128x128x128_16x16_32x32_2x2_8x32x1_8x32x1_1x32x1x8_8_1x1_intrawave_v3,1344.77,497.03,0.0
gfx950,256,11342,8192,3072,ck,0,0,405.0029,a8w8_blockscale_1x128x128_256x128x128x128_16x16_32x32_2x2_8x32x1_8x32x1_1x32x1x8_8_1x1_intrawave_v3,1409.52,607.0,0.0
gfx950,256,1135,2048,3072,ck,18,0,22.796,a8w8_blockscale_1x128x128_256x64x64x256_16x16_32x32_1x1_16x16x1_16x16x1_1x32x1x8_8_1x1_intrawave_v1,626.5,632.88,0.0
gfx950,256,1136,2048,3072,ck,18,0,22.6849,a8w8_blockscale_1x128x128_256x64x64x256_16x16_32x32_1x1_16x16x1_16x16x1_1x32x1x8_8_1x1_intrawave_v1,630.12,636.3,0.0
gfx950,256,11366,2048,3072,ck,0,0,119.6588,a8w8_blockscale_1x128x128_256x128x128x128_16x16_32x32_2x2_8x32x1_8x32x1_1x32x1x8_8_1x1_intrawave_v3,1195.21,733.44,0.0
gfx950,256,1139,2048,3072,ck,18,0,22.6973,a8w8_blockscale_1x128x128_256x64x64x256_16x16_32x32_1x1_16x16x1_16x16x1_1x32x1x8_8_1x1_intrawave_v1,631.44,636.9,0.0
gfx950,256,11391,2048,3072,ck,0,0,119.8365,a8w8_blockscale_1x128x128_256x128x128x128_16x16_32x32_2x2_8x32x1_8x32x1_1x32x1x8_8_1x1_intrawave_v3,1196.06,733.85,0.0
gfx950,256,11392,2048,3072,ck,0,0,117.9361,a8w8_blockscale_1x128x128_256x128x128x128_16x16_32x32_2x2_8x32x1_8x32x1_1x32x1x8_8_1x1_intrawave_v3,1215.44,745.74,0.0
gfx950,256,11392,3072,3072,ck,0,0,169.6336,a8w8_blockscale_1x128x128_256x128x128x128_16x16_32x32_2x2_8x32x1_8x32x1_1x32x1x8_8_1x1_intrawave_v3,1267.54,674.55,0.0
gfx950,256,11392,3072,6144,ck,0,0,310.8946,a8w8_blockscale_1x128x128_256x128x128x128_16x16_32x32_2x2_8x32x1_8x32x1_1x32x1x8_8_1x1_intrawave_v3,1383.21,510.97,0.0
gfx950,256,11392,4096,3072,ck,0,0,219.3679,a8w8_blockscale_1x128x128_256x128x128x128_16x16_32x32_2x2_8x32x1_8x32x1_1x32x1x8_8_1x1_intrawave_v3,1306.89,642.31,0.0
gfx950,256,11392,8192,3072,ck,0,0,404.8258,a8w8_blockscale_1x128x128_256x128x128x128_16x16_32x32_2x2_8x32x1_8x32x1_1x32x1x8_8_1x1_intrawave_v3,1416.36,609.67,0.0
gfx950,256,1140,2048,3072,ck,18,0,22.6976,a8w8_blockscale_1x128x128_256x64x64x256_16x16_32x32_1x1_16x16x1_16x16x1_1x32x1x8_8_1x1_intrawave_v1,631.98,637.2,0.0
gfx950,256,11401,2048,3072,ck,0,0,120.5423,a8w8_blockscale_1x128x128_256x128x128x128_16x16_32x32_2x2_8x32x1_8x32x1_1x32x1x8_8_1x1_intrawave_v3,1190.1,730.15,0.0
gfx950,256,11402,2048,3072,ck,0,0,119.8562,a8w8_blockscale_1x128x128_256x128x128x128_16x16_32x32_2x2_8x32x1_8x32x1_1x32x1x8_8_1x1_intrawave_v3,1197.02,734.39,0.0
gfx950,256,11407,2048,3072,ck,0,0,118.178,a8w8_blockscale_1x128x128_256x128x128x128_16x16_32x32_2x2_8x32x1_8x32x1_1x32x1x8_8_1x1_intrawave_v3,1214.55,745.12,0.0
gfx950,256,11418,2048,3072,ck,0,0,118.651,a8w8_blockscale_1x128x128_256x128x128x128_16x16_32x32_2x2_8x32x1_8x32x1_1x32x1x8_8_1x1_intrawave_v3,1210.88,742.81,0.0
gfx950,256,11419,3072,3072,ck,0,0,169.957,a8w8_blockscale_1x128x128_256x128x128x128_16x16_32x32_2x2_8x32x1_8x32x1_1x32x1x8_8_1x1_intrawave_v3,1268.12,674.73,0.0
gfx950,256,11419,4096,3072,ck,0,0,220.8036,a8w8_blockscale_1x128x128_256x128x128x128_16x16_32x32_2x2_8x32x1_8x32x1_1x32x1x8_8_1x1_intrawave_v3,1301.47,639.51,0.0
gfx950,256,1142,2048,3072,ck,18,0,22.598,a8w8_blockscale_1x128x128_256x64x64x256_16x16_32x32_1x1_16x16x1_16x16x1_1x32x1x8_8_1x1_intrawave_v1,635.88,640.65,0.0
gfx950,256,11427,2048,3072,ck,0,0,119.763,a8w8_blockscale_1x128x128_256x128x128x128_16x16_32x32_2x2_8x32x1_8x32x1_1x32x1x8_8_1x1_intrawave_v3,1200.58,736.46,0.0
gfx950,256,11428,2048,3072,ck,0,0,120.0996,a8w8_blockscale_1x128x128_256x128x128x128_16x16_32x32_2x2_8x32x1_8x32x1_1x32x1x8_8_1x1_intrawave_v3,1197.32,734.45,0.0
gfx950,256,11430,2048,3072,ck,0,0,119.9934,a8w8_blockscale_1x128x128_256x128x128x128_16x16_32x32_2x2_8x32x1_8x32x1_1x32x1x8_8_1x1_intrawave_v3,1198.59,735.22,0.0
gfx950,256,11436,2048,3072,ck,0,0,119.7261,a8w8_blockscale_1x128x128_256x128x128x128_16x16_32x32_2x2_8x32x1_8x32x1_1x32x1x8_8_1x1_intrawave_v3,1201.89,737.22,0.0
gfx950,256,1144,2048,3072,ck,18,0,22.7764,a8w8_blockscale_1x128x128_256x64x64x256_16x16_32x32_1x1_16x16x1_16x16x1_1x32x1x8_8_1x1_intrawave_v1,632.01,636.26,0.0
gfx950,256,11443,2048,3072,ck,0,0,119.5711,a8w8_blockscale_1x128x128_256x128x128x128_16x16_32x32_2x2_8x32x1_8x32x1_1x32x1x8_8_1x1_intrawave_v3,1204.19,738.6,0.0
gfx950,256,11444,2048,3072,ck,0,0,120.8455,a8w8_blockscale_1x128x128_256x128x128x128_16x16_32x32_2x2_8x32x1_8x32x1_1x32x1x8_8_1x1_intrawave_v3,1191.59,730.87,0.0
gfx950,256,1146,2048,3072,ck,18,0,22.575,a8w8_blockscale_1x128x128_256x64x64x256_16x16_32x32_1x1_16x16x1_16x16x1_1x32x1x8_8_1x1_intrawave_v1,638.76,642.57,0.0
gfx950,256,11465,2048,3072,ck,0,0,119.0823,a8w8_blockscale_1x128x128_256x128x128x128_16x16_32x32_2x2_8x32x1_8x32x1_1x32x1x8_8_1x1_intrawave_v3,1211.46,742.95,0.0
gfx950,256,1147,2048,3072,ck,18,0,22.7097,a8w8_blockscale_1x128x128_256x64x64x256_16x16_32x32_1x1_16x16x1_16x16x1_1x32x1x8_8_1x1_intrawave_v1,635.53,639.07,0.0
gfx950,256,11475,2048,3072,ck,0,0,120.7731,a8w8_blockscale_1x128x128_256x128x128x128_16x16_32x32_2x2_8x32x1_8x32x1_1x32x1x8_8_1x1_intrawave_v3,1195.54,733.15,0.0
gfx950,256,1148,2048,3072,ck,18,0,22.6684,a8w8_blockscale_1x128x128_256x64x64x256_16x16_32x32_1x1_16x16x1_16x16x1_1x32x1x8_8_1x1_intrawave_v1,637.24,640.55,0.0
gfx950,256,1149,2048,3072,ck,18,0,22.7571,a8w8_blockscale_1x128x128_256x64x64x256_16x16_32x32_1x1_16x16x1_16x16x1_1x32x1x8_8_1x1_intrawave_v1,635.31,638.37,0.0
gfx950,256,11496,3072,3072,ck,0,0,171.0783,a8w8_blockscale_1x128x128_256x128x128x128_16x16_32x32_2x2_8x32x1_8x32x1_1x32x1x8_8_1x1_intrawave_v3,1268.31,674.45,0.0
gfx950,256,11496,4096,3072,ck,0,0,225.3095,a8w8_blockscale_1x128x128_256x128x128x128_16x16_32x32_2x2_8x32x1_8x32x1_1x32x1x8_8_1x1_intrawave_v3,1284.04,630.57,0.0
gfx950,256,1150,2048,3072,ck,18,0,22.7902,a8w8_blockscale_1x128x128_256x64x64x256_16x16_32x32_1x1_16x16x1_16x16x1_1x32x1x8_8_1x1_intrawave_v1,634.94,637.76,0.0
gfx950,256,11505,2048,3072,ck,0,0,118.119,a8w8_blockscale_1x128x128_256x128x128x128_16x16_32x32_2x2_8x32x1_8x32x1_1x32x1x8_8_1x1_intrawave_v3,1225.6,751.44,0.0
gfx950,256,11509,2048,3072,ck,0,0,119.5378,a8w8_blockscale_1x128x128_256x128x128x128_16x16_32x32_2x2_8x32x1_8x32x1_1x32x1x8_8_1x1_intrawave_v3,1211.47,742.76,0.0
gfx950,256,1151,2048,3072,ck,18,0,22.7446,a8w8_blockscale_1x128x128_256x64x64x256_16x16_32x32_1x1_16x16x1_16x16x1_1x32x1x8_8_1x1_intrawave_v1,636.76,639.35,0.0
gfx950,256,1152,2048,3072,ck,18,0,22.3897,a8w8_blockscale_1x128x128_256x64x64x256_16x16_32x32_1x1_16x16x1_16x16x1_1x32x1x8_8_1x1_intrawave_v1,647.42,649.81,0.0
gfx950,256,1152,3072,3072,ck,0,0,26.8618,a8w8_blockscale_1x128x128_256x128x128x128_16x16_32x32_2x2_8x32x1_8x32x1_1x32x1x8_8_1x1_intrawave_v3,809.45,746.56,0.0
gfx950,256,1152,3072,6144,ck,0,0,47.3265,a8w8_blockscale_1x128x128_256x128x128x128_16x16_32x32_2x2_8x32x1_8x32x1_1x32x1x8_8_1x1_intrawave_v3,918.86,697.92,0.0
gfx950,256,1152,4096,3072,ck,18,0,35.2633,a8w8_blockscale_1x128x128_256x64x64x256_16x16_32x32_1x1_16x16x1_16x16x1_1x32x1x8_8_1x1_intrawave_v1,822.13,724.81,0.0
gfx950,256,1152,8192,3072,ck,0,0,61.3098,a8w8_blockscale_1x128x128_256x128x128x128_16x16_32x32_2x2_8x32x1_8x32x1_1x32x1x8_8_1x1_intrawave_v3,945.72,776.04,0.0
gfx950,256,11520,2048,3072,ck,0,0,118.3829,a8w8_blockscale_1x128x128_256x128x128x128_16x16_32x32_2x2_8x32x1_8x32x1_1x32x1x8_8_1x1_intrawave_v3,1224.46,750.67,0.0
gfx950,256,11520,3072,3072,ck,0,0,168.7564,a8w8_blockscale_1x128x128_256x128x128x128_16x16_32x32_2x2_8x32x1_8x32x1_1x32x1x8_8_1x1_intrawave_v3,1288.44,685.04,0.0
gfx950,256,11520,3072,6144,ck,0,0,313.8444,a8w8_blockscale_1x128x128_256x128x128x128_16x16_32x32_2x2_8x32x1_8x32x1_1x32x1x8_8_1x1_intrawave_v3,1385.61,511.18,0.0
gfx950,256,11520,4096,3072,ck,0,0,222.8898,a8w8_blockscale_1x128x128_256x128x128x128_16x16_32x32_2x2_8x32x1_8x32x1_1x32x1x8_8_1x1_intrawave_v3,1300.69,638.63,0.0
gfx950,256,11520,8192,3072,ck,0,0,404.3623,a8w8_blockscale_1x128x128_256x128x128x128_16x16_32x32_2x2_8x32x1_8x32x1_1x32x1x8_8_1x1_intrawave_v3,1433.91,616.52,0.0
gfx950,256,1154,2048,3072,ck,18,0,22.7961,a8w8_blockscale_1x128x128_256x64x64x256_16x16_32x32_1x1_16x16x1_16x16x1_1x32x1x8_8_1x1_intrawave_v1,636.98,638.85,0.0
gfx950,256,11557,2048,3072,ck,0,0,121.141,a8w8_blockscale_1x128x128_256x128x128x128_16x16_32x32_2x2_8x32x1_8x32x1_1x32x1x8_8_1x1_intrawave_v3,1200.43,735.77,0.0
gfx950,256,1156,2048,3072,ck,18,0,22.7276,a8w8_blockscale_1x128x128_256x64x64x256_16x16_32x32_1x1_16x16x1_16x16x1_1x32x1x8_8_1x1_intrawave_v1,640.01,641.41,0.0
gfx950,256,11572,2048,3072,ck,0,0,120.4993,a8w8_blockscale_1x128x128_256x128x128x128_16x16_32x32_2x2_8x32x1_8x32x1_1x32x1x8_8_1x1_intrawave_v3,1208.38,740.58,0.0
gfx950,256,1158,2048,3072,ck,18,0,22.7313,a8w8_blockscale_1x128x128_256x64x64x256_16x16_32x32_1x1_16x16x1_16x16x1_1x32x1x8_8_1x1_intrawave_v1,641.01,641.93,0.0
gfx950,256,1159,2048,3072,ck,18,0,22.6999,a8w8_blockscale_1x128x128_256x64x64x256_16x16_32x32_1x1_16x16x1_16x16x1_1x32x1x8_8_1x1_intrawave_v1,642.45,643.14,0.0
gfx950,256,11593,2048,3072,ck,0,0,121.862,a8w8_blockscale_1x128x128_256x128x128x128_16x16_32x32_2x2_8x32x1_8x32x1_1x32x1x8_8_1x1_intrawave_v3,1197.04,733.54,0.0
gfx950,256,11607,3072,6144,ck,0,0,316.5302,a8w8_blockscale_1x128x128_256x128x128x128_16x16_32x32_2x2_8x32x1_8x32x1_1x32x1x8_8_1x1_intrawave_v3,1384.23,510.22,0.0
gfx950,256,11607,8192,3072,ck,0,0,404.0861,a8w8_blockscale_1x128x128_256x128x128x128_16x16_32x32_2x2_8x32x1_8x32x1_1x32x1x8_8_1x1_intrawave_v3,1445.73,621.13,0.0
gfx950,256,1163,2048,3072,ck,18,0,22.8437,a8w8_blockscale_1x128x128_256x64x64x256_16x16_32x32_1x1_16x16x1_16x16x1_1x32x1x8_8_1x1_intrawave_v1,640.61,640.34,0.0
gfx950,256,11648,2048,3072,ck,0,0,120.5778,a8w8_blockscale_1x128x128_256x128x128x128_16x16_32x32_2x2_8x32x1_8x32x1_1x32x1x8_8_1x1_intrawave_v3,1215.53,744.62,0.0
gfx950,256,11648,3072,3072,ck,0,0,173.5944,a8w8_blockscale_1x128x128_256x128x128x128_16x16_32x32_2x2_8x32x1_8x32x1_1x32x1x8_8_1x1_intrawave_v3,1266.45,672.75,0.0
gfx950,256,11648,3072,6144,ck,0,0,318.5423,a8w8_blockscale_1x128x128_256x128x128x128_16x16_32x32_2x2_8x32x1_8x32x1_1x32x1x8_8_1x1_intrawave_v3,1380.34,508.58,0.0
gfx950,256,11648,4096,3072,ck,0,0,223.1641,a8w8_blockscale_1x128x128_256x128x128x128_16x16_32x32_2x2_8x32x1_8x32x1_1x32x1x8_8_1x1_intrawave_v3,1313.52,644.31,0.0
gfx950,256,11648,8192,3072,ck,0,0,403.4163,a8w8_blockscale_1x128x128_256x128x128x128_16x16_32x32_2x2_8x32x1_8x32x1_1x32x1x8_8_1x1_intrawave_v3,1453.25,624.14,0.0
gfx950,256,11668,3072,3072,ck,0,0,174.641,a8w8_blockscale_1x128x128_256x128x128x128_16x16_32x32_2x2_8x32x1_8x32x1_1x32x1x8_8_1x1_intrawave_v3,1261.02,669.77,0.0
gfx950,256,11668,4096,3072,ck,0,0,223.759,a8w8_blockscale_1x128x128_256x128x128x128_16x16_32x32_2x2_8x32x1_8x32x1_1x32x1x8_8_1x1_intrawave_v3,1312.28,643.6,0.0
gfx950,256,1169,2048,3072,ck,18,0,22.7681,a8w8_blockscale_1x128x128_256x64x64x256_16x16_32x32_1x1_16x16x1_16x16x1_1x32x1x8_8_1x1_intrawave_v1,646.05,644.36,0.0
gfx950,256,1170,2048,3072,ck,18,0,22.7334,a8w8_blockscale_1x128x128_256x64x64x256_16x16_32x32_1x1_16x16x1_16x16x1_1x32x1x8_8_1x1_intrawave_v1,647.59,645.66,0.0
gfx950,256,11714,3072,3072,ck,0,0,173.667,a8w8_blockscale_1x128x128_256x128x128x128_16x16_32x32_2x2_8x32x1_8x32x1_1x32x1x8_8_1x1_intrawave_v3,1273.09,675.97,0.0
gfx950,256,11714,4096,3072,ck,0,0,223.273,a8w8_blockscale_1x128x128_256x128x128x128_16x16_32x32_2x2_8x32x1_8x32x1_1x32x1x8_8_1x1_intrawave_v3,1320.32,647.32,0.0
gfx950,256,11734,2048,3072,ck,0,0,120.568,a8w8_blockscale_1x128x128_256x128x128x128_16x16_32x32_2x2_8x32x1_8x32x1_1x32x1x8_8_1x1_intrawave_v3,1224.6,749.79,0.0
gfx950,256,11734,3072,6144,ck,0,0,320.5175,a8w8_blockscale_1x128x128_256x128x128x128_16x16_32x32_2x2_8x32x1_8x32x1_1x32x1x8_8_1x1_intrawave_v3,1381.96,508.75,0.0
gfx950,256,11734,8192,3072,ck,0,0,411.2322,a8w8_blockscale_1x128x128_256x128x128x128_16x16_32x32_2x2_8x32x1_8x32x1_1x32x1x8_8_1x1_intrawave_v3,1436.15,616.35,0.0
gfx950,256,1174,2048,3072,ck,18,0,22.8367,a8w8_blockscale_1x128x128_256x64x64x256_16x16_32x32_1x1_16x16x1_16x16x1_1x32x1x8_8_1x1_intrawave_v1,646.87,643.99,0.0
gfx950,256,11749,3072,6144,ck,0,0,312.4844,a8w8_blockscale_1x128x128_256x128x128x128_16x16_32x32_2x2_8x32x1_8x32x1_1x32x1x8_8_1x1_intrawave_v3,1419.3,522.41,0.0
gfx950,256,11749,8192,3072,ck,0,0,412.5484,a8w8_blockscale_1x128x128_256x128x128x128_16x16_32x32_2x2_8x32x1_8x32x1_1x32x1x8_8_1x1_intrawave_v3,1433.4,615.09,0.0
gfx950,256,11759,2048,3072,ck,0,0,121.7171,a8w8_blockscale_1x128x128_256x128x128x128_16x16_32x32_2x2_8x32x1_8x32x1_1x32x1x8_8_1x1_intrawave_v3,1215.63,744.18,0.0
gfx950,256,11774,2048,3072,ck,0,0,120.5391,a8w8_blockscale_1x128x128_256x128x128x128_16x16_32x32_2x2_8x32x1_8x32x1_1x32x1x8_8_1x1_intrawave_v3,1229.07,752.35,0.0
gfx950,256,11776,2048,3072,ck,0,0,119.0565,a8w8_blockscale_1x128x128_256x128x128x128_16x16_32x32_2x2_8x32x1_8x32x1_1x32x1x8_8_1x1_intrawave_v3,1244.59,761.84,0.0
gfx950,256,11776,3072,3072,ck,0,0,169.1912,a8w8_blockscale_1x128x128_256x128x128x128_16x16_32x32_2x2_8x32x1_8x32x1_1x32x1x8_8_1x1_intrawave_v3,1313.69,697.23,0.0
gfx950,256,11776,3072,6144,ck,0,0,316.5835,a8w8_blockscale_1x128x128_256x128x128x128_16x16_32x32_2x2_8x32x1_8x32x1_1x32x1x8_8_1x1_intrawave_v3,1404.14,516.7,0.0
gfx950,256,11776,4096,3072,ck,0,0,225.4203,a8w8_blockscale_1x128x128_256x128x128x128_16x16_32x32_2x2_8x32x1_8x32x1_1x32x1x8_8_1x1_intrawave_v3,1314.67,644.25,0.0
gfx950,256,11776,8192,3072,ck,0,0,409.704,a8w8_blockscale_1x128x128_256x128x128x128_16x16_32x32_2x2_8x32x1_8x32x1_1x32x1x8_8_1x1_intrawave_v3,1446.67,620.64,0.0
gfx950,256,1179,2048,3072,ck,18,0,22.7579,a8w8_blockscale_1x128x128_256x64x64x256_16x16_32x32_1x1_16x16x1_16x16x1_1x32x1x8_8_1x1_intrawave_v1,651.87,647.8,0.0
gfx950,256,11818,3072,3072,ck,0,0,177.0308,a8w8_blockscale_1x128x128_256x128x128x128_16x16_32x32_2x2_8x32x1_8x32x1_1x32x1x8_8_1x1_intrawave_v3,1259.99,668.54,0.0
gfx950,256,11818,4096,3072,ck,0,0,219.1272,a8w8_blockscale_1x128x128_256x128x128x128_16x16_32x32_2x2_8x32x1_8x32x1_1x32x1x8_8_1x1_intrawave_v3,1357.25,664.91,0.0
gfx950,256,11820,2048,3072,ck,0,0,121.5836,a8w8_blockscale_1x128x128_256x128x128x128_16x16_32x32_2x2_8x32x1_8x32x1_1x32x1x8_8_1x1_intrawave_v3,1223.27,748.6,0.0
gfx950,256,11825,3072,6144,ck,0,0,320.3233,a8w8_blockscale_1x128x128_256x128x128x128_16x16_32x32_2x2_8x32x1_8x32x1_1x32x1x8_8_1x1_intrawave_v3,1393.53,512.54,0.0
gfx950,256,11825,8192,3072,ck,0,0,424.4571,a8w8_blockscale_1x128x128_256x128x128x128_16x16_32x32_2x2_8x32x1_8x32x1_1x32x1x8_8_1x1_intrawave_v3,1402.2,601.32,0.0
gfx950,256,11833,2048,3072,ck,0,0,121.0982,a8w8_blockscale_1x128x128_256x128x128x128_16x16_32x32_2x2_8x32x1_8x32x1_1x32x1x8_8_1x1_intrawave_v3,1229.53,752.37,0.0
gfx950,256,1185,2048,3072,ck,18,0,22.9084,a8w8_blockscale_1x128x128_256x64x64x256_16x16_32x32_1x1_16x16x1_16x16x1_1x32x1x8_8_1x1_intrawave_v1,650.89,645.42,0.0
gfx950,256,11873,2048,3072,ck,0,0,122.1378,a8w8_blockscale_1x128x128_256x128x128x128_16x16_32x32_2x2_8x32x1_8x32x1_1x32x1x8_8_1x1_intrawave_v3,1223.18,748.31,0.0
gfx950,256,11894,2048,3072,ck,0,0,122.4918,a8w8_blockscale_1x128x128_256x128x128x128_16x16_32x32_2x2_8x32x1_8x32x1_1x32x1x8_8_1x1_intrawave_v3,1221.81,747.38,0.0
gfx950,256,11904,2048,3072,ck,0,0,121.1343,a8w8_blockscale_1x128x128_256x128x128x128_16x16_32x32_2x2_8x32x1_8x32x1_1x32x1x8_8_1x1_intrawave_v3,1236.54,756.35,0.0
gfx950,256,11904,3072,3072,ck,0,0,185.533,a8w8_blockscale_1x128x128_256x128x128x128_16x16_32x32_2x2_8x32x1_8x32x1_1x32x1x8_8_1x1_intrawave_v3,1211.0,642.17,0.0
gfx950,256,11904,3072,6144,ck,0,0,333.4147,a8w8_blockscale_1x128x128_256x128x128x128_16x16_32x32_2x2_8x32x1_8x32x1_1x32x1x8_8_1x1_intrawave_v3,1347.75,495.33,0.0
gfx950,256,11904,4096,3072,ck,0,0,238.975,a8w8_blockscale_1x128x128_256x128x128x128_16x16_32x32_2x2_8x32x1_8x32x1_1x32x1x8_8_1x1_intrawave_v3,1253.58,613.74,0.0
gfx950,256,11904,8192,3072,ck,0,0,439.9868,a8w8_blockscale_1x128x128_256x128x128x128_16x16_32x32_2x2_8x32x1_8x32x1_1x32x1x8_8_1x1_intrawave_v3,1361.74,583.59,0.0
gfx950,256,11972,3072,3072,ck,0,0,186.052,a8w8_blockscale_1x128x128_256x128x128x128_16x16_32x32_2x2_8x32x1_8x32x1_1x32x1x8_8_1x1_intrawave_v3,1214.52,643.75,0.0
gfx950,256,11972,4096,3072,ck,0,0,240.8277,a8w8_blockscale_1x128x128_256x128x128x128_16x16_32x32_2x2_8x32x1_8x32x1_1x32x1x8_8_1x1_intrawave_v3,1251.04,612.2,0.0
gfx950,256,11984,2048,3072,ck,0,0,130.9312,a8w8_blockscale_1x128x128_256x128x128x128_16x16_32x32_2x2_8x32x1_8x32x1_1x32x1x8_8_1x1_intrawave_v3,1151.7,704.13,0.0
gfx950,256,120,2048,3072,ck,7,0,11.6247,a8w8_blockscale_1x128x128_256x16x128x256_16x16_16x16_1x2_16x16x1_16x16x1_1x16x1x16_8_1x2_intrawave_v1,129.89,615.21,0.0
gfx950,256,120,3072,3072,ck,7,0,11.6308,a8w8_blockscale_1x128x128_256x16x128x256_16x16_16x16_1x2_16x16x1_16x16x1_1x16x1x16_8_1x2_intrawave_v1,194.74,906.48,0.0
gfx950,256,120,3072,6144,ck,7,0,19.4678,a8w8_blockscale_1x128x128_256x16x128x256_16x16_16x16_1x2_16x16x1_16x16x1_1x16x1x16_8_1x2_intrawave_v1,232.68,1045.26,0.0
gfx950,256,120,4096,3072,ck,7,0,11.7394,a8w8_blockscale_1x128x128_256x16x128x256_16x16_16x16_1x2_16x16x1_16x16x1_1x16x1x16_8_1x2_intrawave_v1,257.24,1186.99,0.0
gfx950,256,120,8192,3072,ck,18,0,12.1887,a8w8_blockscale_1x128x128_256x64x64x256_16x16_32x32_1x1_16x16x1_16x16x1_1x32x1x8_8_1x1_intrawave_v1,495.52,2256.23,0.0
gfx950,256,12001,3072,3072,ck,0,0,188.5092,a8w8_blockscale_1x128x128_256x128x128x128_16x16_32x32_2x2_8x32x1_8x32x1_1x32x1x8_8_1x1_intrawave_v3,1201.59,636.78,0.0
gfx950,256,12001,4096,3072,ck,0,0,226.6409,a8w8_blockscale_1x128x128_256x128x128x128_16x16_32x32_2x2_8x32x1_8x32x1_1x32x1x8_8_1x1_intrawave_v3,1332.57,651.97,0.0
gfx950,256,12002,3072,3072,ck,0,0,177.3861,a8w8_blockscale_1x128x128_256x128x128x128_16x16_32x32_2x2_8x32x1_8x32x1_1x32x1x8_8_1x1_intrawave_v3,1277.05,676.76,0.0
gfx950,256,12002,4096,3072,ck,0,0,225.3015,a8w8_blockscale_1x128x128_256x128x128x128_16x16_32x32_2x2_8x32x1_8x32x1_1x32x1x8_8_1x1_intrawave_v3,1340.6,655.89,0.0
gfx950,256,12003,2048,3072,ck,0,0,120.502,a8w8_blockscale_1x128x128_256x128x128x128_16x16_32x32_2x2_8x32x1_8x32x1_1x32x1x8_8_1x1_intrawave_v3,1253.36,766.2,0.0
gfx950,256,12004,2048,3072,ck,0,0,120.7346,a8w8_blockscale_1x128x128_256x128x128x128_16x16_32x32_2x2_8x32x1_8x32x1_1x32x1x8_8_1x1_intrawave_v3,1251.05,764.79,0.0
gfx950,256,12004,3072,3072,ck,0,0,175.2068,a8w8_blockscale_1x128x128_256x128x128x128_16x16_32x32_2x2_8x32x1_8x32x1_1x32x1x8_8_1x1_intrawave_v3,1293.15,685.28,0.0
gfx950,256,12004,3072,6144,ck,0,0,325.304,a8w8_blockscale_1x128x128_256x128x128x128_16x16_32x32_2x2_8x32x1_8x32x1_1x32x1x8_8_1x1_intrawave_v3,1392.96,511.46,0.0
gfx950,256,12004,4096,3072,ck,0,0,229.4002,a8w8_blockscale_1x128x128_256x128x128x128_16x16_32x32_2x2_8x32x1_8x32x1_1x32x1x8_8_1x1_intrawave_v3,1316.87,644.27,0.0
gfx950,256,12004,8192,3072,ck,0,0,425.4901,a8w8_blockscale_1x128x128_256x128x128x128_16x16_32x32_2x2_8x32x1_8x32x1_1x32x1x8_8_1x1_intrawave_v3,1419.97,608.04,0.0
gfx950,256,12016,3072,3072,ck,0,0,176.1609,a8w8_blockscale_1x128x128_256x128x128x128_16x16_32x32_2x2_8x32x1_8x32x1_1x32x1x8_8_1x1_intrawave_v3,1287.43,682.2,0.0
gfx950,256,12016,4096,3072,ck,0,0,222.5488,a8w8_blockscale_1x128x128_256x128x128x128_16x16_32x32_2x2_8x32x1_8x32x1_1x32x1x8_8_1x1_intrawave_v3,1358.77,664.71,0.0
gfx950,256,12020,2048,3072,ck,0,0,120.6965,a8w8_blockscale_1x128x128_256x128x128x128_16x16_32x32_2x2_8x32x1_8x32x1_1x32x1x8_8_1x1_intrawave_v3,1253.12,765.98,0.0
gfx950,256,12020,3072,3072,ck,0,0,174.7003,a8w8_blockscale_1x128x128_256x128x128x128_16x16_32x32_2x2_8x32x1_8x32x1_1x32x1x8_8_1x1_intrawave_v3,1298.62,688.11,0.0
gfx950,256,12020,4096,3072,ck,0,0,221.5118,a8w8_blockscale_1x128x128_256x128x128x128_16x16_32x32_2x2_8x32x1_8x32x1_1x32x1x8_8_1x1_intrawave_v3,1365.59,668.03,0.0
gfx950,256,12022,3072,3072,ck,0,0,174.829,a8w8_blockscale_1x128x128_256x128x128x128_16x16_32x32_2x2_8x32x1_8x32x1_1x32x1x8_8_1x1_intrawave_v3,1297.88,687.71,0.0
gfx950,256,12022,4096,3072,ck,0,0,229.1609,a8w8_blockscale_1x128x128_256x128x128x128_16x16_32x32_2x2_8x32x1_8x32x1_1x32x1x8_8_1x1_intrawave_v3,1320.22,645.83,0.0
gfx950,256,12023,3072,3072,ck,0,0,177.2022,a8w8_blockscale_1x128x128_256x128x128x128_16x16_32x32_2x2_8x32x1_8x32x1_1x32x1x8_8_1x1_intrawave_v3,1280.61,678.55,0.0
gfx950,256,12023,4096,3072,ck,0,0,225.044,a8w8_blockscale_1x128x128_256x128x128x128_16x16_32x32_2x2_8x32x1_8x32x1_1x32x1x8_8_1x1_intrawave_v3,1344.49,657.69,0.0
gfx950,256,12032,2048,3072,ck,0,0,121.9381,a8w8_blockscale_1x128x128_256x128x128x128_16x16_32x32_2x2_8x32x1_8x32x1_1x32x1x8_8_1x1_intrawave_v3,1241.59,758.88,0.0
gfx950,256,12032,3072,3072,ck,0,0,173.35,a8w8_blockscale_1x128x128_256x128x128x128_16x16_32x32_2x2_8x32x1_8x32x1_1x32x1x8_8_1x1_intrawave_v3,1310.05,694.11,0.0
gfx950,256,12032,3072,6144,ck,0,0,319.8761,a8w8_blockscale_1x128x128_256x128x128x128_16x16_32x32_2x2_8x32x1_8x32x1_1x32x1x8_8_1x1_intrawave_v3,1419.9,521.21,0.0
gfx950,256,12032,4096,3072,ck,0,0,223.6777,a8w8_blockscale_1x128x128_256x128x128x128_16x16_32x32_2x2_8x32x1_8x32x1_1x32x1x8_8_1x1_intrawave_v3,1353.71,662.16,0.0
gfx950,256,12032,8192,3072,ck,0,0,421.9554,a8w8_blockscale_1x128x128_256x128x128x128_16x16_32x32_2x2_8x32x1_8x32x1_1x32x1x8_8_1x1_intrawave_v3,1435.2,614.43,0.0
gfx950,256,12088,2048,3072,ck,0,0,123.0239,a8w8_blockscale_1x128x128_256x128x128x128_16x16_32x32_2x2_8x32x1_8x32x1_1x32x1x8_8_1x1_intrawave_v3,1236.36,755.45,0.0
gfx950,256,1209,3072,3072,ck,0,0,27.5307,a8w8_blockscale_1x128x128_256x128x128x128_16x16_32x32_2x2_8x32x1_8x32x1_1x32x1x8_8_1x1_intrawave_v3,828.86,747.5,0.0
gfx950,256,1209,4096,3072,ck,18,0,35.8987,a8w8_blockscale_1x128x128_256x64x64x256_16x16_32x32_1x1_16x16x1_16x16x1_1x32x1x8_8_1x1_intrawave_v1,847.54,729.86,0.0
gfx950,256,12108,3072,3072,ck,0,0,177.0365,a8w8_blockscale_1x128x128_256x128x128x128_16x16_32x32_2x2_8x32x1_8x32x1_1x32x1x8_8_1x1_intrawave_v3,1290.87,683.61,0.0
gfx950,256,12108,4096,3072,ck,0,0,228.8789,a8w8_blockscale_1x128x128_256x128x128x128_16x16_32x32_2x2_8x32x1_8x32x1_1x32x1x8_8_1x1_intrawave_v3,1331.31,650.86,0.0
gfx950,256,1211,3072,6144,ck,0,0,47.3715,a8w8_blockscale_1x128x128_256x128x128x128_16x16_32x32_2x2_8x32x1_8x32x1_1x32x1x8_8_1x1_intrawave_v3,965.0,712.56,0.0
gfx950,256,1211,8192,3072,ck,0,0,61.9091,a8w8_blockscale_1x128x128_256x128x128x128_16x16_32x32_2x2_8x32x1_8x32x1_1x32x1x8_8_1x1_intrawave_v3,984.53,787.07,0.0
gfx950,256,1212,3072,6144,ck,0,0,47.5906,a8w8_blockscale_1x128x128_256x128x128x128_16x16_32x32_2x2_8x32x1_8x32x1_1x32x1x8_8_1x1_intrawave_v3,961.36,709.54,0.0
gfx950,256,1212,8192,3072,ck,0,0,62.0396,a8w8_blockscale_1x128x128_256x128x128x128_16x16_32x32_2x2_8x32x1_8x32x1_1x32x1x8_8_1x1_intrawave_v3,983.27,785.73,0.0
gfx950,256,1214,3072,6144,ck,0,0,48.021,a8w8_blockscale_1x128x128_256x128x128x128_16x16_32x32_2x2_8x32x1_8x32x1_1x32x1x8_8_1x1_intrawave_v3,954.31,703.69,0.0
gfx950,256,1214,8192,3072,ck,0,0,61.8936,a8w8_blockscale_1x128x128_256x128x128x128_16x16_32x32_2x2_8x32x1_8x32x1_1x32x1x8_8_1x1_intrawave_v3,987.22,788.21,0.0
gfx950,256,12159,3072,3072,ck,0,0,177.5216,a8w8_blockscale_1x128x128_256x128x128x128_16x16_32x32_2x2_8x32x1_8x32x1_1x32x1x8_8_1x1_intrawave_v3,1292.76,684.39,0.0
gfx950,256,12159,4096,3072,ck,0,0,227.0841,a8w8_blockscale_1x128x128_256x128x128x128_16x16_32x32_2x2_8x32x1_8x32x1_1x32x1x8_8_1x1_intrawave_v3,1347.48,658.53,0.0
gfx950,256,1216,3072,6144,ck,0,0,48.0088,a8w8_blockscale_1x128x128_256x128x128x128_16x16_32x32_2x2_8x32x1_8x32x1_1x32x1x8_8_1x1_intrawave_v3,956.13,704.38,0.0
gfx950,256,1216,8192,3072,ck,0,0,61.3519,a8w8_blockscale_1x128x128_256x128x128x128_16x16_32x32_2x2_8x32x1_8x32x1_1x32x1x8_8_1x1_intrawave_v3,997.58,795.81,0.0
gfx950,256,12160,2048,3072,ck,0,0,122.8036,a8w8_blockscale_1x128x128_256x128x128x128_16x16_32x32_2x2_8x32x1_8x32x1_1x32x1x8_8_1x1_intrawave_v3,1245.96,761.01,0.0
gfx950,256,12160,3072,3072,ck,0,0,174.8751,a8w8_blockscale_1x128x128_256x128x128x128_16x16_32x32_2x2_8x32x1_8x32x1_1x32x1x8_8_1x1_intrawave_v3,1312.44,694.8,0.0
gfx950,256,12160,3072,6144,ck,0,0,323.3626,a8w8_blockscale_1x128x128_256x128x128x128_16x16_32x32_2x2_8x32x1_8x32x1_1x32x1x8_8_1x1_intrawave_v3,1419.54,520.46,0.0
gfx950,256,12160,4096,3072,ck,0,0,226.4809,a8w8_blockscale_1x128x128_256x128x128x128_16x16_32x32_2x2_8x32x1_8x32x1_1x32x1x8_8_1x1_intrawave_v3,1351.18,660.33,0.0
gfx950,256,12160,8192,3072,ck,0,0,417.8023,a8w8_blockscale_1x128x128_256x128x128x128_16x16_32x32_2x2_8x32x1_8x32x1_1x32x1x8_8_1x1_intrawave_v3,1464.89,626.49,0.0
gfx950,256,12163,3072,3072,ck,0,0,176.8994,a8w8_blockscale_1x128x128_256x128x128x128_16x16_32x32_2x2_8x32x1_8x32x1_1x32x1x8_8_1x1_intrawave_v3,1297.74,687.01,0.0
gfx950,256,12163,4096,3072,ck,0,0,227.712,a8w8_blockscale_1x128x128_256x128x128x128_16x16_32x32_2x2_8x32x1_8x32x1_1x32x1x8_8_1x1_intrawave_v3,1344.21,656.91,0.0
gfx950,256,1217,3072,6144,ck,0,0,47.3172,a8w8_blockscale_1x128x128_256x128x128x128_16x16_32x32_2x2_8x32x1_8x32x1_1x32x1x8_8_1x1_intrawave_v3,970.9,714.94,0.0
gfx950,256,1217,8192,3072,ck,0,0,62.3755,a8w8_blockscale_1x128x128_256x128x128x128_16x16_32x32_2x2_8x32x1_8x32x1_1x32x1x8_8_1x1_intrawave_v3,982.01,783.06,0.0
gfx950,256,1218,3072,6144,ck,0,0,47.4809,a8w8_blockscale_1x128x128_256x128x128x128_16x16_32x32_2x2_8x32x1_8x32x1_1x32x1x8_8_1x1_intrawave_v3,968.35,712.73,0.0
gfx950,256,1218,8192,3072,ck,0,0,62.061,a8w8_blockscale_1x128x128_256x128x128x128_16x16_32x32_2x2_8x32x1_8x32x1_1x32x1x8_8_1x1_intrawave_v3,987.8,787.34,0.0
gfx950,256,1219,3072,6144,ck,0,0,47.2452,a8w8_blockscale_1x128x128_256x128x128x128_16x16_32x32_2x2_8x32x1_8x32x1_1x32x1x8_8_1x1_intrawave_v3,973.98,716.55,0.0
gfx950,256,1219,8192,3072,ck,0,0,61.9372,a8w8_blockscale_1x128x128_256x128x128x128_16x16_32x32_2x2_8x32x1_8x32x1_1x32x1x8_8_1x1_intrawave_v3,990.59,789.23,0.0
gfx950,256,1220,3072,6144,ck,0,0,47.1484,a8w8_blockscale_1x128x128_256x128x128x128_16x16_32x32_2x2_8x32x1_8x32x1_1x32x1x8_8_1x1_intrawave_v3,976.78,718.28,0.0
gfx950,256,1220,8192,3072,ck,0,0,62.0802,a8w8_blockscale_1x128x128_256x128x128x128_16x16_32x32_2x2_8x32x1_8x32x1_1x32x1x8_8_1x1_intrawave_v3,989.12,787.73,0.0
gfx950,256,1221,3072,6144,ck,0,0,47.6322,a8w8_blockscale_1x128x128_256x128x128x128_16x16_32x32_2x2_8x32x1_8x32x1_1x32x1x8_8_1x1_intrawave_v3,967.65,711.24,0.0
gfx950,256,1221,8192,3072,ck,0,0,62.4091,a8w8_blockscale_1x128x128_256x128x128x128_16x16_32x32_2x2_8x32x1_8x32x1_1x32x1x8_8_1x1_intrawave_v3,984.71,783.89,0.0
gfx950,256,1222,3072,6144,ck,0,0,47.1248,a8w8_blockscale_1x128x128_256x128x128x128_16x16_32x32_2x2_8x32x1_8x32x1_1x32x1x8_8_1x1_intrawave_v3,978.87,719.16,0.0
gfx950,256,1222,8192,3072,ck,0,0,61.6578,a8w8_blockscale_1x128x128_256x128x128x128_16x16_32x32_2x2_8x32x1_8x32x1_1x32x1x8_8_1x1_intrawave_v3,997.53,793.75,0.0
gfx950,256,1223,2048,3072,ck,18,0,22.8849,a8w8_blockscale_1x128x128_256x64x64x256_16x16_32x32_1x1_16x16x1_16x16x1_1x32x1x8_8_1x1_intrawave_v1,672.45,657.98,0.0
gfx950,256,1223,3072,6144,ck,0,0,47.9767,a8w8_blockscale_1x128x128_256x128x128x128_16x16_32x32_2x2_8x32x1_8x32x1_1x32x1x8_8_1x1_intrawave_v3,962.27,706.65,0.0
gfx950,256,1223,8192,3072,ck,0,0,62.3906,a8w8_blockscale_1x128x128_256x128x128x128_16x16_32x32_2x2_8x32x1_8x32x1_1x32x1x8_8_1x1_intrawave_v3,986.62,784.74,0.0
gfx950,256,12233,2048,3072,ck,0,0,124.0076,a8w8_blockscale_1x128x128_256x128x128x128_16x16_32x32_2x2_8x32x1_8x32x1_1x32x1x8_8_1x1_intrawave_v3,1241.27,757.84,0.0
gfx950,256,1224,3072,6144,ck,0,0,47.1283,a8w8_blockscale_1x128x128_256x128x128x128_16x16_32x32_2x2_8x32x1_8x32x1_1x32x1x8_8_1x1_intrawave_v3,980.4,719.63,0.0
gfx950,256,1224,8192,3072,ck,0,0,62.806,a8w8_blockscale_1x128x128_256x128x128x128_16x16_32x32_2x2_8x32x1_8x32x1_1x32x1x8_8_1x1_intrawave_v3,980.89,779.86,0.0
gfx950,256,1225,3072,6144,ck,0,0,47.4491,a8w8_blockscale_1x128x128_256x128x128x128_16x16_32x32_2x2_8x32x1_8x32x1_1x32x1x8_8_1x1_intrawave_v3,974.56,715.02,0.0
gfx950,256,1225,8192,3072,ck,0,0,61.9583,a8w8_blockscale_1x128x128_256x128x128x128_16x16_32x32_2x2_8x32x1_8x32x1_1x32x1x8_8_1x1_intrawave_v3,995.13,790.85,0.0
gfx950,256,12250,2048,3072,ck,0,0,123.7623,a8w8_blockscale_1x128x128_256x128x128x128_16x16_32x32_2x2_8x32x1_8x32x1_1x32x1x8_8_1x1_intrawave_v3,1245.46,760.32,0.0
gfx950,256,12252,2048,3072,ck,0,0,124.9283,a8w8_blockscale_1x128x128_256x128x128x128_16x16_32x32_2x2_8x32x1_8x32x1_1x32x1x8_8_1x1_intrawave_v3,1234.03,753.34,0.0
gfx950,256,1226,3072,6144,ck,0,0,47.6605,a8w8_blockscale_1x128x128_256x128x128x128_16x16_32x32_2x2_8x32x1_8x32x1_1x32x1x8_8_1x1_intrawave_v3,971.03,712.11,0.0
gfx950,256,1226,8192,3072,ck,0,0,62.8212,a8w8_blockscale_1x128x128_256x128x128x128_16x16_32x32_2x2_8x32x1_8x32x1_1x32x1x8_8_1x1_intrawave_v3,982.26,780.29,0.0
gfx950,256,12265,2048,3072,ck,0,0,123.0569,a8w8_blockscale_1x128x128_256x128x128x128_16x16_32x32_2x2_8x32x1_8x32x1_1x32x1x8_8_1x1_intrawave_v3,1254.13,765.56,0.0
gfx950,256,1227,3072,6144,ck,0,0,47.7659,a8w8_blockscale_1x128x128_256x128x128x128_16x16_32x32_2x2_8x32x1_8x32x1_1x32x1x8_8_1x1_intrawave_v3,969.68,710.79,0.0
gfx950,256,1227,8192,3072,ck,0,0,61.1539,a8w8_blockscale_1x128x128_256x128x128x128_16x16_32x32_2x2_8x32x1_8x32x1_1x32x1x8_8_1x1_intrawave_v3,1009.86,801.88,0.0
gfx950,256,12277,2048,3072,ck,0,0,124.1165,a8w8_blockscale_1x128x128_256x128x128x128_16x16_32x32_2x2_8x32x1_8x32x1_1x32x1x8_8_1x1_intrawave_v3,1244.64,759.71,0.0
gfx950,256,1228,3072,6144,ck,0,0,47.655,a8w8_blockscale_1x128x128_256x128x128x128_16x16_32x32_2x2_8x32x1_8x32x1_1x32x1x8_8_1x1_intrawave_v3,972.73,712.71,0.0
gfx950,256,1228,8192,3072,ck,0,0,62.1938,a8w8_blockscale_1x128x128_256x128x128x128_16x16_32x32_2x2_8x32x1_8x32x1_1x32x1x8_8_1x1_intrawave_v3,993.78,788.79,0.0
gfx950,256,12286,3072,6144,ck,0,0,334.2053,a8w8_blockscale_1x128x128_256x128x128x128_16x16_32x32_2x2_8x32x1_8x32x1_1x32x1x8_8_1x1_intrawave_v3,1387.71,508.2,0.0
gfx950,256,12286,8192,3072,ck,0,0,430.8736,a8w8_blockscale_1x128x128_256x128x128x128_16x16_32x32_2x2_8x32x1_8x32x1_1x32x1x8_8_1x1_intrawave_v3,1435.16,613.18,0.0
gfx950,256,12288,2048,3072,ck,0,0,123.3571,a8w8_blockscale_1x128x128_256x128x128x128_16x16_32x32_2x2_8x32x1_8x32x1_1x32x1x8_8_1x1_intrawave_v3,1253.42,765.03,0.0
gfx950,256,12288,3072,3072,ck,0,0,173.4429,a8w8_blockscale_1x128x128_256x128x128x128_16x16_32x32_2x2_8x32x1_8x32x1_1x32x1x8_8_1x1_intrawave_v3,1337.2,707.34,0.0
gfx950,256,12288,3072,6144,ck,0,0,328.2941,a8w8_blockscale_1x128x128_256x128x128x128_16x16_32x32_2x2_8x32x1_8x32x1_1x32x1x8_8_1x1_intrawave_v3,1412.93,517.43,0.0
gfx950,256,12288,4096,3072,ck,0,0,231.0924,a8w8_blockscale_1x128x128_256x128x128x128_16x16_32x32_2x2_8x32x1_8x32x1_1x32x1x8_8_1x1_intrawave_v3,1338.16,653.4,0.0
gfx950,256,12288,8192,3072,ck,0,0,425.3263,a8w8_blockscale_1x128x128_256x128x128x128_16x16_32x32_2x2_8x32x1_8x32x1_1x32x1x8_8_1x1_intrawave_v3,1454.12,621.27,0.0
gfx950,256,1229,3072,6144,ck,0,0,47.2794,a8w8_blockscale_1x128x128_256x128x128x128_16x16_32x32_2x2_8x32x1_8x32x1_1x32x1x8_8_1x1_intrawave_v3,981.26,718.63,0.0
gfx950,256,1229,8192,3072,ck,0,0,61.6003,a8w8_blockscale_1x128x128_256x128x128x128_16x16_32x32_2x2_8x32x1_8x32x1_1x32x1x8_8_1x1_intrawave_v3,1004.18,796.7,0.0
gfx950,256,1230,3072,6144,ck,0,0,47.3084,a8w8_blockscale_1x128x128_256x128x128x128_16x16_32x32_2x2_8x32x1_8x32x1_1x32x1x8_8_1x1_intrawave_v3,981.45,718.45,0.0
gfx950,256,1230,8192,3072,ck,0,0,62.0726,a8w8_blockscale_1x128x128_256x128x128x128_16x16_32x32_2x2_8x32x1_8x32x1_1x32x1x8_8_1x1_intrawave_v3,997.35,790.96,0.0
gfx950,256,1231,3072,6144,ck,0,0,47.5938,a8w8_blockscale_1x128x128_256x128x128x128_16x16_32x32_2x2_8x32x1_8x32x1_1x32x1x8_8_1x1_intrawave_v3,976.36,714.4,0.0
gfx950,256,1231,8192,3072,ck,0,0,61.7703,a8w8_blockscale_1x128x128_256x128x128x128_16x16_32x32_2x2_8x32x1_8x32x1_1x32x1x8_8_1x1_intrawave_v3,1003.04,795.14,0.0
gfx950,256,12315,2048,3072,ck,0,0,132.5082,a8w8_blockscale_1x128x128_256x128x128x128_16x16_32x32_2x2_8x32x1_8x32x1_1x32x1x8_8_1x1_intrawave_v3,1169.43,713.66,0.0
gfx950,256,1232,3072,6144,ck,0,0,47.6502,a8w8_blockscale_1x128x128_256x128x128x128_16x16_32x32_2x2_8x32x1_8x32x1_1x32x1x8_8_1x1_intrawave_v3,976.0,713.81,0.0
gfx950,256,1232,8192,3072,ck,0,0,61.9754,a8w8_blockscale_1x128x128_256x128x128x128_16x16_32x32_2x2_8x32x1_8x32x1_1x32x1x8_8_1x1_intrawave_v3,1000.54,792.82,0.0
gfx950,256,1233,3072,6144,ck,0,0,47.951,a8w8_blockscale_1x128x128_256x128x128x128_16x16_32x32_2x2_8x32x1_8x32x1_1x32x1x8_8_1x1_intrawave_v3,970.66,709.59,0.0
gfx950,256,1233,8192,3072,ck,0,0,60.9267,a8w8_blockscale_1x128x128_256x128x128x128_16x16_32x32_2x2_8x32x1_8x32x1_1x32x1x8_8_1x1_intrawave_v3,1018.58,806.79,0.0
gfx950,256,1235,3072,6144,ck,0,0,47.2976,a8w8_blockscale_1x128x128_256x128x128x128_16x16_32x32_2x2_8x32x1_8x32x1_1x32x1x8_8_1x1_intrawave_v3,985.67,719.91,0.0
