aiter/ops/triton/configs/gemm/gfx1250-GEMM-A16W16-N=256-K=7168.json
{
    "M_LEQ_64": {
        "BLOCK_M": 16,
        "BLOCK_N": 32,
        "BLOCK_K": 256,
        "NUM_BUFFERS": 6,
        "num_warps": 2,
        "L2_PREFETCH_DISTANCE": 0,
        "NUM_KSPLIT": 8
    },
    "M_LEQ_512": {
        "BLOCK_M": 16,
        "BLOCK_N": 32,
        "BLOCK_K": 256,
        "NUM_BUFFERS": 6,
        "num_warps": 2,
        "L2_PREFETCH_DISTANCE": 0,
        "KERNEL_TYPE": "warp_priority"
    },
    "any": {
        "BLOCK_M": 128,
        "BLOCK_N": 128,
        "BLOCK_K": 64,
        "NUM_BUFFERS": 3,
        "num_warps": 8,
        "L2_PREFETCH_DISTANCE": 0
    }
}
