aiter/ops/triton/configs/gemm/gfx1201-BATCHED_GEMM-A16W16.json
{
    "M_GEQ_4096": {
        "BLOCK_SIZE_M": 256,
        "BLOCK_SIZE_N": 256,
        "BLOCK_SIZE_K": 64,
        "GROUP_SIZE_M": 4,
        "num_warps": 8,
        "num_stages": 2,
        "waves_per_eu": 2,
        "matrix_instr_nonkdim": 16,
        "NUM_KSPLIT": 1
    },
    "M_LEQ_128": {
        "BLOCK_SIZE_M": 64,
        "BLOCK_SIZE_N": 64,
        "BLOCK_SIZE_K": 128,
        "GROUP_SIZE_M": 4,
        "num_warps": 8,
        "num_stages": 3,
        "waves_per_eu": 4,
        "matrix_instr_nonkdim": 16,
        "NUM_KSPLIT": 1
    },
    "any": {
        "BLOCK_SIZE_M": 128,
        "BLOCK_SIZE_N": 128,
        "BLOCK_SIZE_K": 64,
        "GROUP_SIZE_M": 8,
        "num_warps": 8,
        "num_stages": 3,
        "waves_per_eu": 2,
        "matrix_instr_nonkdim": 16,
        "NUM_KSPLIT": 1
    }
}